,NonStopwordsQuoteText,Topic,Topic_Prob,TopicWords,Batch
2084,וברוכים הבאים לפניות הציבור התחבורה הציבורית לכותל המערבי שריד מקדשנו מקיימים מהיר לבקשתו מלכיאלי הרביעי בסדרה ישיבות ההגעה לכותל המערבי סיור בכותל מצעדי גבר כוננו העיתוי נותן משמעות לנושא,תחבורה,0.80481756,"('0.024*""התחבורה"" + 0.012*""הציבורית"" + 0.006*""בשבת"" + 0.005*""נקרא"" + 0.004*""קיבלתי"" + 0.004*""בחודש"" + 0.004*""בתחבורה"" + 0.004*""ציבורית"" + 0.004*""המיסים"" + 0.003*""לעבוד""',)",3
8956,התחלנו הבחנה וגילינו קשישים בפרויקטים התחדשות עירונית בפינוי ובינוי ועשינו דיונים אחדים נושאים עובדים עליהם המסים ומול ביטוח לאומי לייצר פתרונות,דיור,0.8046318,"('0.016*""ערך"" + 0.011*""שירותים"" + 0.008*""ניירות"" + 0.008*""פיננסיים"" + 0.008*""דירות"" + 0.007*""הבנקים"" + 0.007*""ציבורי"" + 0.007*""דירה"" + 0.006*""הפיקוח"" + 0.006*""דיור""',)",3
1337,יודעות שאמנה תעקור תמגר התופעה הרצון הפוליטי המוצהר להדק המאבקים וכן לחתום ולהיות מוכנים שתבוא בעתיד שנצטרך לחתום מעיד רצון פונה לשרים ופונה לכבוד החוץ יאיר לפיד בכוונתכם בכוונת המשרד מבחינת האמנה אמנת איסטנבול קונוטציה לאיסטנבול שדיברנו עליה בשבועיים האחרונים איסטנבול וזאת אמנה השר,עולים,0.80444306,"('0.027*""העלייה"" + 0.018*""הקליטה"" + 0.014*""מנכל"" + 0.013*""מר"" + 0.010*""מוגבלות"" + 0.010*""והקליטה"" + 0.008*""והתפוצות"" + 0.007*""לישראל"" + 0.007*""לאנשים"" + 0.006*""זכויות""',)",3
7850,רכז תחבורה ציבורית באגף התקציבים ברשותכם אתאר בקצרה החשיבות ואיך התגלגלנו לנקודה ירצו שנזדרז בתהליך בשמחה,תחבורה,0.80386156,"('0.024*""התחבורה"" + 0.012*""הציבורית"" + 0.006*""בשבת"" + 0.005*""נקרא"" + 0.004*""קיבלתי"" + 0.004*""בחודש"" + 0.004*""בתחבורה"" + 0.004*""ציבורית"" + 0.004*""המיסים"" + 0.003*""לעבוד""',)",3
9466,ברוך לשבת דממה באולם והדיון טעון מיסודו אהסס להוציא מיידית משתתף יצא מיידית בקריאה יצא בשלוש קריאות מהר 25,בטחון,0.8034339,"('0.007*""חיילים"" + 0.004*""וביטחון"" + 0.004*""ועדות"" + 0.004*""משוחררים"" + 0.004*""יושב-ראש"" + 0.004*""חודשים"" + 0.003*""בודדים"" + 0.003*""ומתן"" + 0.003*""משפחה"" + 0.003*""לקח""',)",3
4187,הולכים היערכות החינוך לפתיחת הלימודים במגזר הערבי דגש התוכניות הייחודיות למגזר הערבי שתי סוגיות שהן מרכזיות החלטת 922 הולכים העקרונות היישום החל משנת הלימודים תשעז והסוגיה נתייחס אליה סוגיית בינוי כיתות לימוד בהתייחס להחלטת שהיתה לאחרונה בנייה 17 אלף כיתות לימוד תוך חמש כיצד נערכים במגזר הערבי ליישום התוכנית,חינוך,0.8032093,"('0.112*""החינוך"" + 0.033*""התרבות"" + 0.028*""והספורט"" + 0.015*""חינוך"" + 0.013*""בסעיף"" + 0.010*""במערכת"" + 0.010*""הלימודים"" + 0.009*""מוסדות"" + 0.008*""שנת"" + 0.007*""מערכת""',)",3
907,החלטנו לבוא שאמרתי המעקב חייב שההרגשה ההתחלתית בחששות גדולים לקחו עצמם משימות החולים רציתי שכבר פתח המנהל והרופאה המחוזית דר כהן הבריאות שנמצאים ומנהלת שארגנה הכול,עולים,0.80307084,"('0.011*""אתיופיה"" + 0.008*""יוצאי"" + 0.007*""הנוער"" + 0.007*""נוער"" + 0.007*""הארץ"" + 0.006*""פערים"" + 0.006*""הגבוהה"" + 0.005*""הסטודנטים"" + 0.005*""ההשכלה"" + 0.005*""הפריפריה""',)",3
7724,למשרד האוצר קמפיין ופיתחו אתר נהדר ליידע הציבור החשבונות שקיימים בידיו בקופות השונות אתר מצוין ממליצה לחפש ולבדוק החשבונות הנתונים שנמצאים באתר מדויקים מבינים מפניות הציבור שלפעמים קופות חסרות מידע חסר שהאתר מציין הסכומים החסרים הסכומים האבודים לבחון לחפש,עולים,0.80235153,"('0.011*""אתיופיה"" + 0.008*""יוצאי"" + 0.007*""הנוער"" + 0.007*""נוער"" + 0.007*""הארץ"" + 0.006*""פערים"" + 0.006*""הגבוהה"" + 0.005*""הסטודנטים"" + 0.005*""ההשכלה"" + 0.005*""הפריפריה""',)",3
9355,חברים נעבוד ליושבת לקידום מעמד האישה עאידה תומא סלימאן,נשים,0.8021621,"('0.025*""המשפטי"" + 0.018*""מעמד"" + 0.018*""לקידום"" + 0.017*""האישה"" + 0.013*""היועץ"" + 0.011*""מגדרי"" + 0.009*""ולשוויון"" + 0.008*""פותחת"" + 0.007*""שינויים"" + 0.007*""לממשלה""',)",3
5830,בימים ולפני קיימנו הקמפיין Me Too אומרות יכולות יכולות לספר הסיפורים סיפורים נשלה עצמנו מבינינו שהזמן מתאים להן מבינינו שעדיין הגיע שיספרו הסיפור האישי מצד נשים יגיע שיספרו הסיפור שלהן שלהן נגדעו 17 נשים נרצחו 17 נשים הפכו לעוד סטטיסטיקה הרב,נשים,0.8020992,"('0.054*""נשים"" + 0.018*""אלימות"" + 0.017*""פנים"" + 0.015*""הנשים"" + 0.012*""לביטחון"" + 0.011*""מינית"" + 0.010*""למאבק"" + 0.008*""האלימות"" + 0.007*""שלהן"" + 0.007*""לנשים""',)",3
4328,בכייה לדורות מניפולציה ממשלתית ממסדית הליך פרלמנטרי תקין רביזיה,בריאות,0.8014092,"('0.032*""הבריאות"" + 0.028*""החולים"" + 0.017*""חולים"" + 0.007*""בתי"" + 0.007*""קופות"" + 0.005*""התקנות"" + 0.005*""בריאות"" + 0.005*""למשרד"" + 0.004*""לבתי"" + 0.004*""העורף""',)",3
4160,המשותפת לחוק הכללת אמצעי זיהוי ביומטריים הכללת אמצעי זיהוי ביומטריים ונתוני זיהוי ביומטריים במסמכי זיהוי ובמאגר מידע והוראת התשעז-2016,נשים,0.8009891,"('0.054*""נשים"" + 0.018*""אלימות"" + 0.017*""פנים"" + 0.015*""הנשים"" + 0.012*""לביטחון"" + 0.011*""מינית"" + 0.010*""למאבק"" + 0.008*""האלימות"" + 0.007*""שלהן"" + 0.007*""לנשים""',)",3
5742,והכול במפה שעל-פי החלטת וקריטריונים מדויקים המקומות דא עקא קבענו בחקיקה שהלשכה המרכזית לסטטיסטיקה תיתן המדד הפריפריאלי פר יישוב מביא הדוגמה מטה אשר שהצפון קרוב לגדר ליישובי גדר העלו חברים איל ראובן העלה מהיר והיישוב הדרומי במטה אשר בעמק יזרעאל רחוק מהגבול מרחק רב מרכז הארץ,בטחון,0.8009008,"('0.026*""החוקה"" + 0.022*""הביטחון"" + 0.022*""החוץ"" + 0.020*""לוועדת"" + 0.020*""ומשפט"" + 0.016*""המשותפת"" + 0.014*""ועדה"" + 0.013*""והביטחון"" + 0.010*""משותפת"" + 0.009*""המקומי""',)",3
3159,יתקיים העברת הטיפול בהתמכרויות לקופות החולים הזמנו מומחים אשר יבואו וידברו איתנו ויספרו לעומק אמנם מהצעת הפרק אמנם יעבור לחקיקה שנמצאת בהתהוות ועדה לגביה חייבים להבין העניין שהעלו רופאים העניין טיפול בהתמכרויות מטופל שצריך מרכזים תורים חודשים מדברת חומרים קשים שעלולים לגרום למוות מדברת קנאביס לקנאביס תלות נפשית ודיברו וצריך מתמודדים עניין ההתמכרות הנפשית בהתמכרויות לתרופות מרשמים ולחומרים מסוכנים פורנוגרפיה משחקי וידאו שההתמכרות חייהם ואין,חינוך,0.8008117,"('0.013*""גבוהה"" + 0.007*""להשכלה"" + 0.006*""בתחום"" + 0.006*""אילן"" + 0.005*""המשרד"" + 0.005*""מחקר"" + 0.004*""הבאה"" + 0.004*""החינוך"" + 0.004*""ברמה"" + 0.004*""רבים""',)",3
9078,מציינים היובל לשחרורה ולאיחודה ירושלים הזיכרון ליהודי אתיופיה שנספו בדרכם לירושלים במשך אלפי חלמו יהודי אתיופיה לירושלים ולעתים שילמו היקר למענה משום מציינים ירושלים הזיכרון לגיבורים הציונים זכו חזונם החיבור ירושלים המציין שחרורה ואיחודה ירושלים לבין הזיכרון הממלכתי ליהודי אתיופיה שנספו בדרכם לישראל מסמל הקשר ההדוק ורצונם יהודי אתיופיה לירושלים הגיבורים שהקריבו הכול אהבת ארץ ואהבת ציון וירושלים היינו מצליחים להדק אחיזתנו הקודש ובירתנו ירושלים זוכרים הגיבורים הללו בלב גאה ובראש מורכן גאים שזכינו חלומם ולממש צוואתם,נשים,0.8006061,"('0.054*""נשים"" + 0.018*""אלימות"" + 0.017*""פנים"" + 0.015*""הנשים"" + 0.012*""לביטחון"" + 0.011*""מינית"" + 0.010*""למאבק"" + 0.008*""האלימות"" + 0.007*""שלהן"" + 0.007*""לנשים""',)",3
8702,מודה יתום מגיל ארבע תשע עשרה אימא מדהימה שהתגלתה ענקית 38 ואחריות כוללת עשרה הסכימה לוותר סמכויות מוחלטות אצלה נלחמה הרבנות בפאס במרוקו ודרשה אפוטרופוס ילדיה כשרבנים בגישתם הפתוחה יחסית הציעו האח הגיס שיבואו גבר יכנס לביתי גידלה עשרה ודאי אצלנו ובנכדים עשרות בוגרי הרווארד בוגרי פוליטיקלי ובוגרי טכניון ובוגרי מונטריאול הקשת האדירה ההשכלה הגבוהה התחומים בריאות ופיננסים המדהים שאפשרה דחפה בדבר התפשרה הכול ביצה שלמה ומספיק ומספיק העיקר לימודים חינוך תעשו הכול תלמדו,חינוך,0.8003515,"('0.112*""החינוך"" + 0.033*""התרבות"" + 0.028*""והספורט"" + 0.015*""חינוך"" + 0.013*""בסעיף"" + 0.010*""במערכת"" + 0.010*""הלימודים"" + 0.009*""מוסדות"" + 0.008*""שנת"" + 0.007*""מערכת""',)",3
5029,במקביל ערים לכך טענת המציע שמספר הסטודנטים והאקדמאים בתחום ההנדסה ומתמעט שנמצא במצב סטטי נשען פניותיהם תעשיינים רבים ננסה לקדם פני הרעה שידינו מגעת שתאמרו כצעקתה ושבשנים האחרונות המגמות השתנו 2011 המגמות מעודדות מבשרות טובות בתחום מקצועות ההנדסה נציג החינוך ואחר נעלה ההשכלה הגבוהה גדיים תיישים החינוך בתחום החינוך הטכנולוגי תן סקירה,חינוך,0.7997697,"('0.013*""גבוהה"" + 0.007*""להשכלה"" + 0.006*""בתחום"" + 0.006*""אילן"" + 0.005*""המשרד"" + 0.005*""מחקר"" + 0.004*""הבאה"" + 0.004*""החינוך"" + 0.004*""ברמה"" + 0.004*""רבים""',)",3
2797,הצוות מתאריך 26 במאי שמענו בחוץ לארץ שמענו בחוץ לארץ ושמענו בחוץ לארץ,דיור,0.7995915,"('0.016*""ערך"" + 0.011*""שירותים"" + 0.008*""ניירות"" + 0.008*""פיננסיים"" + 0.008*""דירות"" + 0.007*""הבנקים"" + 0.007*""ציבורי"" + 0.007*""דירה"" + 0.006*""הפיקוח"" + 0.006*""דיור""',)",3
10511,ולכולן פותחת לקידום מעמד האישה ולשוויון מגדרי 20 ליולי,נשים,0.79934573,"('0.025*""המשפטי"" + 0.018*""מעמד"" + 0.018*""לקידום"" + 0.017*""האישה"" + 0.013*""היועץ"" + 0.011*""מגדרי"" + 0.009*""ולשוויון"" + 0.008*""פותחת"" + 0.007*""שינויים"" + 0.007*""לממשלה""',)",3
9563,מעקב העדר תפקוד התלונות פסיכולוגים במשרד הבריאות והיום מבחינתי היות ובנושא דנו ארוכות הקודם סוגיית טיפולי ההמרה מתפרצים מסכימים שנאמר קצר כשעה ובשעה 1200 נסיים בעשרה ל-1200 אסכם להשתדל קונקרטי להסתובב מסביב,בטחון,0.7993127,"('0.026*""החוקה"" + 0.022*""הביטחון"" + 0.022*""החוץ"" + 0.020*""לוועדת"" + 0.020*""ומשפט"" + 0.016*""המשותפת"" + 0.014*""ועדה"" + 0.013*""והביטחון"" + 0.010*""משותפת"" + 0.009*""המקומי""',)",3
7121,הפנים מהיום טז בטבת תשעו עסוקים מועצת בתי העלמין תל רגב הכותרת טיפול המשטרה בהתנכלות ליושב המועצה נתעסק במשטרה נתעסק במכלול המכלול למיטב הבנתי ממה שעברתי החומר מתנהל בשני מישורים האחד קורה העלמין ושתיים קורה יושב מועצת בתי העלמין והאיומים אישי נלך בשני צירים ציר הציר המבצעי שאפשר לפרט ונצטרך להתרשם המשטרה מערכת הביטחון לטפל והמישור המישור הכספי אמור לשלם סוגיית האבטחה העלמין ויותר יושב המועצה ליושב המועצה בתמונת המצב מהזווית נתקדם,קורונה,0.799238,"('0.017*""הקורונה"" + 0.012*""משבר"" + 0.006*""צהל"" + 0.005*""העוני"" + 0.005*""המשבר"" + 0.004*""צריכים"" + 0.004*""לסייע"" + 0.004*""בתקופה"" + 0.003*""הביטחון"" + 0.003*""הנחיות""',)",3
8300,שמי הווארד פולינר עורך דין במשרד המשפטים אשכול דיני קניין רוחני העיצובים הוכנה במשרד המשפטים ונועדה להחליף פקודת הפטנטים המדגמים משנת 1924 ביחס למדגמים מאז חקיקת הפטנטים בשנת 1967 הפקודה בתוקף פטנטים עיקרי ומטרותיה ייסקרו עורכת הדין נעמה דניאל ממחלקת ייעוץ וחקיקה שהובילה בשנים האחרונות אחריה הפטנטים אסא קלינג יציג מידע פעילות הפטנטים וניהול מרשם המדגמים והעיצובים ובחינת העיצובים והמדגמים,כלכלי,0.7987892,"('0.013*""האוצר"" + 0.008*""הכנסה"" + 0.007*""עסקים"" + 0.007*""הכספים"" + 0.006*""המשפטית"" + 0.006*""קטנים"" + 0.006*""ציבורית"" + 0.005*""לדון"" + 0.005*""האשראי"" + 0.004*""לחוק""',)",3
3086,בכללי המקום ידידי החולצה הלבנה מכללי המקום הנוהג שיתחילו שהגישו ההצעות מהיר האחרים אשתדל לכמה שנספיק מצד המתמחים אשאיר לאנשי הלשכה תשובה,בטחון,0.79874945,"('0.026*""החוקה"" + 0.022*""הביטחון"" + 0.022*""החוץ"" + 0.020*""לוועדת"" + 0.020*""ומשפט"" + 0.016*""המשותפת"" + 0.014*""ועדה"" + 0.013*""והביטחון"" + 0.010*""משותפת"" + 0.009*""המקומי""',)",3
728,דנים לפניות הציבור טיסות בערבי שבת בעקבות האירוע שבועות טיסת יצאה מניו יורק לישראל בשעה שהמטוס מסיבות שונות ומגוונות השבת נחת באתונה סבל רב לאלה שהיו באתונה בניו יורק נותנים לרדת לנוסעים האחרים,דיור,0.7986522,"('0.016*""ערך"" + 0.011*""שירותים"" + 0.008*""ניירות"" + 0.008*""פיננסיים"" + 0.008*""דירות"" + 0.007*""הבנקים"" + 0.007*""ציבורי"" + 0.007*""דירה"" + 0.006*""הפיקוח"" + 0.006*""דיור""',)",3
8507,מחליף המתכונת רישיון מיוחד לביצוע פעולות ומתן שירותים ההיתר הכללי נקבע מכוח 4א1 לחוק התקשורת לראשונה נקבע ב-2016 נקבע מודולרית היתר כללי ותוספות שמסדירות אספקת שירותים שונים השירותים שמוסדרים באמצעות ההיתר הכללי שירותי גישה לאינטרנט כוונה בהמשך לקבוע תוספות נוספות שיסדירו הספקה שירותים,בטחון,0.79819167,"('0.026*""החוקה"" + 0.022*""הביטחון"" + 0.022*""החוץ"" + 0.020*""לוועדת"" + 0.020*""ומשפט"" + 0.016*""המשותפת"" + 0.014*""ועדה"" + 0.013*""והביטחון"" + 0.010*""משותפת"" + 0.009*""המקומי""',)",3
1157,שכחתי נקודה ששכנעה להישאר 10 באוגוסט שהבנתי שדווקא הפיצוי לאולמות ולמגזרים הללו הפיצוי הגיע אליהם לחשבונות הבנק אמור בימים הקרובים נאשר המקסימום יכולים לאשר פי התקנות שקיימות פוגעים בהם פגיעה אנושה חכם בהמשך לדברים נאשר ה-10 ונכתוב שהתקנות הבאות יופיעו יגיעו ענפית בתיאום המשפטים ומשרד האוצר וכמובן הבנקים יצטרכו למצוא הדרך להוציא לפועל,נשים,0.79803777,"('0.025*""המשפטי"" + 0.018*""מעמד"" + 0.018*""לקידום"" + 0.017*""האישה"" + 0.013*""היועץ"" + 0.011*""מגדרי"" + 0.009*""ולשוויון"" + 0.008*""פותחת"" + 0.007*""שינויים"" + 0.007*""לממשלה""',)",3
9764,לצדק חלוקתי ושוויון חברתי בחינת הטענות לקיפוח והפקעת מחירי הטיסה לחסידי ברסלב לאזרחים חסידים שנוסעים לאומן בראש נוסע לאומן בראש בראש חודש אלול זוכה למחיר הוגן נוסע שעדיין הפקעת המחירים,חינוך,0.7973834,"('0.013*""גבוהה"" + 0.007*""להשכלה"" + 0.006*""בתחום"" + 0.006*""אילן"" + 0.005*""המשרד"" + 0.005*""מחקר"" + 0.004*""הבאה"" + 0.004*""החינוך"" + 0.004*""ברמה"" + 0.004*""רבים""',)",3
5480,ממתינים לכך הדברים מסביב יבשילו ויקרו עוקבים המתקדמת הפנים הבנה מהתנאים ההיקפיים שנדרשו המשרד לביטחון פנים לקיומו המתווה להשתמש להסיר חסמים עדכון לערוך מעקב שהבטחנו בקיץ ביולי ולעשות ככל יכולתנו לקדם חשיבות לתחום כללי לתחום הכלכלי מדעי טכנולוגי חקלאי,חינוך,0.79737633,"('0.013*""גבוהה"" + 0.007*""להשכלה"" + 0.006*""בתחום"" + 0.006*""אילן"" + 0.005*""המשרד"" + 0.005*""מחקר"" + 0.004*""הבאה"" + 0.004*""החינוך"" + 0.004*""ברמה"" + 0.004*""רבים""',)",3
5081,פותחת זכויות הילד בציון הבינלאומי לזכויות הילד מקדישים אתך בשבילכם אגלה בסוד ועדה בשבילכם מיוחד מסתכלת מסביבי מוקפים בהרבה משמח ומרגש,נשים,0.79737186,"('0.025*""המשפטי"" + 0.018*""מעמד"" + 0.018*""לקידום"" + 0.017*""האישה"" + 0.013*""היועץ"" + 0.011*""מגדרי"" + 0.009*""ולשוויון"" + 0.008*""פותחת"" + 0.007*""שינויים"" + 0.007*""לממשלה""',)",3
2105,ודאי שלמי שיושב מניח מפתיעים מחדשים בכותרת הדברים בטכנולוגיה יישומית מתקדמת במהירות נקרא טכנולוגיה בדיונית טכנולוגיה יישומית ומעשית ומוטמעת בהרבה מקומות בטכנולוגיה בחדשנות הטכנולוגיה חכם עיר חכמה תחבורה חכמה רפואה חכמה שורה שכולם נכנסים להגדרה האינטרנט הדברים קוראים בכותרת בעברית IOT שטכנולוגיה חדשנית טכנולוגיה מעולה טכנולוגיה מהפכנית תועלת יכולים להתעלם מתופעות והשלכות לטכנולוגיה ושאנחנו צריכים חייבים להתמודד איתה ולהגן מפניה ככל יכולים,חינוך,0.7972817,"('0.013*""גבוהה"" + 0.007*""להשכלה"" + 0.006*""בתחום"" + 0.006*""אילן"" + 0.005*""המשרד"" + 0.005*""מחקר"" + 0.004*""הבאה"" + 0.004*""החינוך"" + 0.004*""ברמה"" + 0.004*""רבים""',)",3
717,בתחום הבריאות ובסקטור הרפואה נעשתה ענקית תקצוב מיוחד ואילו חייב שמשרד הרווחה שאחראי מצא לנכון בדיקה יסודית לבדוק המצב לנקוט בצעדים מעשיים צעדים תקציביים לשמור העובדים הסוציאליים כאילו תחום שמותר להשתולל,עולים,0.7970553,"('0.027*""העלייה"" + 0.018*""הקליטה"" + 0.014*""מנכל"" + 0.013*""מר"" + 0.010*""מוגבלות"" + 0.010*""והקליטה"" + 0.008*""והתפוצות"" + 0.007*""לישראל"" + 0.007*""לאנשים"" + 0.006*""זכויות""',)",3
7794,כשאתה מאבד 360 בשנה מנכלים להתכנס שרים להקים קבינט לנושא בטיחות בדרכים קבינט בטחוני מתייחסים לנושא הטרור צריכים להתייחס לנושא תאונות הדרכים,עולים,0.7970494,"('0.005*""בישראל"" + 0.004*""המשטרה"" + 0.004*""התפוצות"" + 0.004*""העולים"" + 0.004*""הרב"" + 0.004*""דרכים"" + 0.003*""החדשים"" + 0.003*""הדיווח"" + 0.003*""מקרים"" + 0.003*""מלחמה""',)",3
4002,וברוכים הבאים לכנסת בטו בשבט הולדתה והכנסת למעשה פותחת שעריה לעם והנה הראיה אליעזר ששלח לוועדת החוקה רעיון ששווה בהחלט שנעשה במהלך הקרובה נדון ברעיון ונראה ישים ישים הבעד הנגד ואליעזר,נשים,0.7968704,"('0.025*""המשפטי"" + 0.018*""מעמד"" + 0.018*""לקידום"" + 0.017*""האישה"" + 0.013*""היועץ"" + 0.011*""מגדרי"" + 0.009*""ולשוויון"" + 0.008*""פותחת"" + 0.007*""שינויים"" + 0.007*""לממשלה""',)",3
455,החינוך התרבות והספורט השלישית ומספר 565 מתחילת הקדנציה 19 בפברואר באדר התשעח נשים באומנות הרצאתו דר דורון לוריא פתיחת התערוכה מירי קדמיאל לציון האישה הבינלאומי,חינוך,0.79664034,"('0.112*""החינוך"" + 0.033*""התרבות"" + 0.028*""והספורט"" + 0.015*""חינוך"" + 0.013*""בסעיף"" + 0.010*""במערכת"" + 0.010*""הלימודים"" + 0.009*""מוסדות"" + 0.008*""שנת"" + 0.007*""מערכת""',)",3
4035,ניגש הדברים הסעיף שנפנה תשומת 2 העקרונות המנחים לאסדרה אפנה תשומת לבנו למספר עניינים ראשית בסעיף 22 השפעות כלכליות חברתיות סביבתיות ומגדריות מציינים לפנינו שיג ושיח סביב העניין סביבתיות הסכמה מגדריות רצון לטייב ולהבין הביטוי,עולים,0.79643613,"('0.005*""בישראל"" + 0.004*""המשטרה"" + 0.004*""התפוצות"" + 0.004*""העולים"" + 0.004*""הרב"" + 0.004*""דרכים"" + 0.003*""החדשים"" + 0.003*""הדיווח"" + 0.003*""מקרים"" + 0.003*""מלחמה""',)",3
3852,מבין הכעס האולמות מבין גישה שאומרת ממני הזוגות אצלך האירוע התקיים שהצעת שהוגשה ושופצה באמצעות ההתייעצויות שהיו המשפטים נותנת מענה מאוזן מובן מאליו מתכתבת המציאות חריגה מתפשרת האולמות מביאה איזשהו מתווה שתהיה נחיתה רכה שהזוגות יבינו שהמתווה משלמים במתווה מצילים כספם וכך,קורונה,0.79579175,"('0.037*""הקורונה"" + 0.029*""שקלים"" + 0.024*""הוראת"" + 0.024*""מיליון"" + 0.022*""נגיף"" + 0.016*""סמכויות"" + 0.013*""מיוחדות"" + 0.013*""להתמודדות"" + 0.012*""שקל"" + 0.011*""פעילות""',)",3
3867,הכספים רכוש וקרן פיצויים שיעור ההפרשה לקרן פיצויים הוראת התשעח-2017,בטחון,0.79550123,"('0.026*""החוקה"" + 0.022*""הביטחון"" + 0.022*""החוץ"" + 0.020*""לוועדת"" + 0.020*""ומשפט"" + 0.016*""המשותפת"" + 0.014*""ועדה"" + 0.013*""והביטחון"" + 0.010*""משותפת"" + 0.009*""המקומי""',)",3
