,NonStopwordsQuoteText,Topic,Topic_Prob,TopicWords,Batch
18839,העלייה הקליטה והתפוצות הכרה שקילה ורישוי תארים אקדמיים בתחומי הרפואה עולים ממדינות צפון אמריקה קיימנו אחיות ובאופן כללי ועכשיו מקיימים העולים מצפון אמריקה,עולים,0.58679086,"('0.016*""העלייה"" + 0.015*""עולים"" + 0.013*""הקליטה"" + 0.011*""אתיופיה"" + 0.010*""יוצאי"" + 0.009*""העולים"" + 0.007*""חדשים"" + 0.007*""חברתי"" + 0.006*""והקליטה"" + 0.005*""מקיימים""',)",6
8560,מקדישים שבעיני חגיגי נבחן השירותים שניתנים לצד החגיגיות נדרוש מהממשלה הומאנית ובאמת הסיוע שצריך לדאוג בסופו לשפות גופים לצורך העניין במקרה בתי החולים שנותנים השירותים בשמה וצריכים התקציב צריכים כיסוי בסופו ניגע,עולים,0.5866749,"('0.016*""העלייה"" + 0.015*""עולים"" + 0.013*""הקליטה"" + 0.011*""אתיופיה"" + 0.010*""יוצאי"" + 0.009*""העולים"" + 0.007*""חדשים"" + 0.007*""חברתי"" + 0.006*""והקליטה"" + 0.005*""מקיימים""',)",6
2798,הנוכחים לספורט שרצינו ספורט הנשים תמונת המצב הספורט שקרוב ללבי עסקתי בכך בהתנדבות כיושב קבוצת כדורסל כחבר איגוד הכדורסל וכממונה הספורט בעיריית קריית גת כסגן העיר והכרתי מקרוב מהו ספורט נשים,נשים,0.5866709,"('0.024*""נשים"" + 0.007*""ציבור"" + 0.006*""אלימות"" + 0.006*""הכנסה"" + 0.005*""מוסדות"" + 0.005*""הנשים"" + 0.004*""לנשים"" + 0.003*""חייבת"" + 0.003*""במשפחה"" + 0.003*""רשימה""',)",6
3482,פתוח 120 ברוכים הבאים הנמצאים כשמונה חודשים לערך הפעם הראשונה שנגענו בחשמל ביהודה ושומרון לעתים בהיבט הטקטי המקומי כשמונה חודשים כשנה לערך התחלנו ונושא להסתכל קדימה רחב בעקבות לזרז מזורזים מינהל אזרחי מתאם פעולות שטחים ואחרים רשויות להסתכל קדימה תכניות אב משום יהודה ושומרון גדלים באוכלוסיות מתחיל מהניסיון להעריך סטטיסטית תושבים ערבים פלסטינים יהודים ודרך לכמה יצטרכו לדאוג לחשמל למים לתשתיות כבישים לאנרגיה חלופית לביוב תשתית אב,קורונה,0.58660346,"('0.029*""הקורונה"" + 0.021*""הוראת"" + 0.014*""נגיף"" + 0.011*""סמכויות"" + 0.008*""להתמודדות"" + 0.008*""לחוק"" + 0.008*""מיוחדות"" + 0.008*""1"" + 0.007*""2"" + 0.007*""התקנות""',)",6
4105,בשנה האחרונה בעקבות בגצ הצפיפות נקט שירות בתי סוהר בצעדים להפחתת צפיפות הכליאה הוצאת מיטות שאינן בשימוש ושחרורים מינהליים מנתוני שבס שדווחו הקודם מולאו דרישות בגצ למתן מרחב ארבעה מטרים מרובע אסיר בתנאים הקשים האובייקטיביים צריכים לזכור שבימים בתי הכלא הנם רגיש להפצת הקורונה בשל הצפיפות ותחלופת התגלו שלושה עצורים מאומתים לנגיף המעצר בתל מבינים הסכנה סגור ובצפיפות סיכוי להתפשטות המגפה,בריאות,0.5864259,"('0.022*""החולים"" + 0.022*""בתי"" + 0.017*""הספר"" + 0.010*""הבריאות"" + 0.010*""בבתי"" + 0.010*""חולים"" + 0.005*""השואה"" + 0.005*""לבתי"" + 0.004*""קופות"" + 0.004*""ניצולי""',)",6
5060,ברשותכם מילים חבל שנציג האוצר הגיע לשיטתי ולגישתי איזושהי נקודתית לרשות שדות התעופה שדות התעופה גובה אגרות התפיסה גביית האגרה מדברת פועלים באיזה סוג משק סגור שמהמשק הסגור הרשות אמורה לפתח ענייני התעופה לסוגיהם שנמצא בתחום הטיפול מוצאים עצמנו שקופתה שדות התעופה מתמלאת האוצר שולח יד תוך הכיס הרשות ולוקח הכסף עבור,עולים,0.5864144,"('0.016*""העלייה"" + 0.015*""עולים"" + 0.013*""הקליטה"" + 0.011*""אתיופיה"" + 0.010*""יוצאי"" + 0.009*""העולים"" + 0.007*""חדשים"" + 0.007*""חברתי"" + 0.006*""והקליטה"" + 0.005*""מקיימים""',)",6
2783,אתן הרקע הפרוצדורלי הוגשה הקודמת במסגרתה הוקמה הידועה בכינויה למתחמים מועדפים לדיור שיושב מכבד אותנו בנוכחותו ערן ניצן הקודמת אישרה עיקר שעסק בהקמת ובהליכי התכנון והחליטה לפצל החלק העוסק בהליך הנוגע לפדיון קרקע הנוכחית החילה דין רציפות החלק לבקשת בהכנת שנייה ושלישית שהממשלה תציג נתייחס לפרטים,כלכלי,0.5861714,"('0.004*""הדברים"" + 0.004*""האוצר"" + 0.003*""גופים"" + 0.003*""הביטחון"" + 0.003*""להגנת"" + 0.003*""שוק"" + 0.003*""הרשות"" + 0.003*""המשרד"" + 0.003*""ההון"" + 0.003*""הגופים""',)",6
9892,נקרא השיר שירת העשבים שנכתב על-ידי נעמי שמר בשנת 1976 ומתבסס שלוש אמרות רבי נחמן מברסלב ונהגו לשיר בסדרי טו בשבט,קורונה,0.586056,"('0.029*""הקורונה"" + 0.021*""הוראת"" + 0.014*""נגיף"" + 0.011*""סמכויות"" + 0.008*""להתמודדות"" + 0.008*""לחוק"" + 0.008*""מיוחדות"" + 0.008*""1"" + 0.007*""2"" + 0.007*""התקנות""',)",6
17421,הגענו 14 14 הצענו שנדלג 15 שנוגע לתעודה השלמת השירות נוגע לשם השירות,קורונה,0.58537024,"('0.029*""הקורונה"" + 0.021*""הוראת"" + 0.014*""נגיף"" + 0.011*""סמכויות"" + 0.008*""להתמודדות"" + 0.008*""לחוק"" + 0.008*""מיוחדות"" + 0.008*""1"" + 0.007*""2"" + 0.007*""התקנות""',)",6
3290,תרשו רשמי יא בכסלו התשעט דנים ההוצאה לפועל 58 חייב המשלם הוראה לתשלום בשיעורים התשעח-2018 מהיוזמים מרגיש חזק,בריאות,0.5852324,"('0.022*""החולים"" + 0.022*""בתי"" + 0.017*""הספר"" + 0.010*""הבריאות"" + 0.010*""בבתי"" + 0.010*""חולים"" + 0.005*""השואה"" + 0.005*""לבתי"" + 0.004*""קופות"" + 0.004*""ניצולי""',)",6
7764,שהצעת ביטוי לרצון לשפר תנאי העובדים ולאפשר איכות לעצמם ולמשפחתם לייעל התרומה למעסיקים עובד ששמח בחלקו שעושה לטובת המעסיק הרוח אינטגרלי מהיכולת ולעשות,נשים,0.58467615,"('0.024*""נשים"" + 0.007*""ציבור"" + 0.006*""אלימות"" + 0.006*""הכנסה"" + 0.005*""מוסדות"" + 0.005*""הנשים"" + 0.004*""לנשים"" + 0.003*""חייבת"" + 0.003*""במשפחה"" + 0.003*""רשימה""',)",6
5703,נתחיל בסדר אקטואלי מכוון לאנשי המשטרה קיבלתי מכתב מזעזע קבוצה שהייתה בשבת האחרונה במירון אצל רבי שמעון יוחאי קבוצת אברכים מקריית צאנז בנתניה הרב הדיין והיה אדמור וגדול לפרוטוקול מירושלים,חינוך,0.58462644,"('0.076*""החינוך"" + 0.020*""התרבות"" + 0.017*""והספורט"" + 0.012*""חינוך"" + 0.011*""הלימודים"" + 0.009*""במערכת"" + 0.008*""שנת"" + 0.008*""בחינוך"" + 0.007*""מערכת"" + 0.007*""הספורט""',)",6
4900,יושבת הראש גדעון זעירא מרכז המחקר והמידע שאמרת בהמשך לדיונים קודמים ותופעה שזוהתה בארצות הברית התבקשנו נתונים היקף ההתמכרות לתרופות מרשם בישראל נקודת המוצא שבישראל מסד נתונים ארצי היקף תופעת השימוש המזיק והתלות בתרופות מרשם והעניין המחלקה לטיפול בהתמכרויות במשרד הבריאות נדרש לשם קבלת החלטות,נשים,0.5845362,"('0.016*""מעמד"" + 0.015*""האישה"" + 0.014*""לקידום"" + 0.010*""מגדרי"" + 0.009*""נשים"" + 0.008*""ולשוויון"" + 0.007*""פותחת"" + 0.004*""הנשים"" + 0.003*""מינית"" + 0.003*""שמחה""',)",6
2886,אמרתי לשר לידי ביטוי בדיונים שמבחינתה בגדול מבלי עניין הדברים עין בעין במובן לנכון לקדם במהירות האפשרית כשהשורה התחתונה המבחן האמיתי והגדול שבסופו עניין אזרחי מדינת יזכו סוף-סוף לרכוש רכב במחירים אירופה במחירים רחוקים כאילו אירופה במאדים ארצות-הברית מעבר למאדים,בריאות,0.584195,"('0.022*""החולים"" + 0.022*""בתי"" + 0.017*""הספר"" + 0.010*""הבריאות"" + 0.010*""בבתי"" + 0.010*""חולים"" + 0.005*""השואה"" + 0.005*""לבתי"" + 0.004*""קופות"" + 0.004*""ניצולי""',)",6
9856,קיבלנו מהאוצר נוסח מציעים לאפשר הזכאות שסגר עסקו לציבור בשל הגבלות סמכויות מיוחדות להתמודדות נגיף הקורונה הוראת התשפא-2020 לתקופה שלושה חודשים בשנת בשנת,קורונה,0.5839787,"('0.029*""הקורונה"" + 0.021*""הוראת"" + 0.014*""נגיף"" + 0.011*""סמכויות"" + 0.008*""להתמודדות"" + 0.008*""לחוק"" + 0.008*""מיוחדות"" + 0.008*""1"" + 0.007*""2"" + 0.007*""התקנות""',)",6
7016,שהאופן שבו התקבל הפטור בישיבה הקודמת בלתי ראוי בעליל שאמרת שישי יאמר מילה בקושי מילה ואי-אפשר להבין בסדר,נשים,0.5838367,"('0.016*""מעמד"" + 0.015*""האישה"" + 0.014*""לקידום"" + 0.010*""מגדרי"" + 0.009*""נשים"" + 0.008*""ולשוויון"" + 0.007*""פותחת"" + 0.004*""הנשים"" + 0.003*""מינית"" + 0.003*""שמחה""',)",6
2721,מחרתיים בעוד 48 מעכשיו ניכנס לסגר קורונה ויהיו נשים שחייהן יעמדו בסכנה כפולה ומכופלת בזמן בזמן שכולנו נחגוג ונהיה שאמור הבטוח והמוגן נשים שבדיוק ייכנסו לסכנה מיוחדת סכנת אלימות לסכנת פגיעה ואולי לסכנת אובדן התופעה הקבועה רוצות להניח בסיגרה בימים מקבלת משנה חשיבות ומשנה תוקף,חינוך,0.58351195,"('0.076*""החינוך"" + 0.020*""התרבות"" + 0.017*""והספורט"" + 0.012*""חינוך"" + 0.011*""הלימודים"" + 0.009*""במערכת"" + 0.008*""שנת"" + 0.008*""בחינוך"" + 0.007*""מערכת"" + 0.007*""הספורט""',)",6
17499,מחדש ממשיכים בהמשך אישור הארכת תוקף התקנות שקשורות לעזרה בבתי הספר,קורונה,0.5832818,"('0.029*""הקורונה"" + 0.021*""הוראת"" + 0.014*""נגיף"" + 0.011*""סמכויות"" + 0.008*""להתמודדות"" + 0.008*""לחוק"" + 0.008*""מיוחדות"" + 0.008*""1"" + 0.007*""2"" + 0.007*""התקנות""',)",6
15528,שעד 473 מבנים נגישים אומרת תכנון וביצוע ב-31 בדצמבר יוכלו,חינוך,0.5827782,"('0.007*""החינוך"" + 0.007*""גבוהה"" + 0.006*""הגבוהה"" + 0.006*""להשכלה"" + 0.004*""ההשכלה"" + 0.004*""במוסדות"" + 0.004*""מודה"" + 0.004*""התרבות"" + 0.004*""החשמל"" + 0.004*""האנרגיה""',)",6
5107,פנים התהליך בעיניי תהליך פסול אסור ואמרה הרפרנטיות אומרת מחכים לרגע האחרון להלחיץ אותנו וכדי שהמשרדים יוכלו לנהל דיונים המציאות שבה מנהלים משא ומתן המשרדים חיוניים נדחים לרגע האחרון וברגע האחרון חייבים לאשר וזהו,נשים,0.58264077,"('0.016*""מעמד"" + 0.015*""האישה"" + 0.014*""לקידום"" + 0.010*""מגדרי"" + 0.009*""נשים"" + 0.008*""ולשוויון"" + 0.007*""פותחת"" + 0.004*""הנשים"" + 0.003*""מינית"" + 0.003*""שמחה""',)",6
4770,המועצה המייעצת לחינוך הערבי בחירתי לכנסת התחלתי לקדם איוש המועצה המייעצת שבמשך ארוכות אוישה נתקלתי בשיתוף פעולה מצד השר השר בנט הגשתי בגץ לחייב החינוך לאייש המועצה בגץ קיבל העתירה וכששר החינוך רצה לאייש ולמנות המועצה המייעצת התפרקה ומאז בתקופת בחירות בחודשים האחרונים תקופת בחירות השר הנוכחי אייש המועצה תלוי ועומד נרצה התייחסות המשרד לנושא,חינוך,0.5823867,"('0.007*""החינוך"" + 0.007*""גבוהה"" + 0.006*""הגבוהה"" + 0.006*""להשכלה"" + 0.004*""ההשכלה"" + 0.004*""במוסדות"" + 0.004*""מודה"" + 0.004*""התרבות"" + 0.004*""החשמל"" + 0.004*""האנרגיה""',)",6
6661,נכנסה אחזור המשפט שהתחלתי עוסקים בכמה נושאים שבהם פיקוח נפש הסיפור זבוטינסקי הזכרתי שמשרד התחבורה הבין שחייבים לסגור בלתי אפשרי ובלתי מוסרי כביש אמצע שטסים אוטובוסים וכשאנשים צריכים להתנקז אליו הולכי בזבוטינסקי הבנתם בכביש גולדה מאיר הבינו שכונה נבנית אזור מגורים צפוף עשרות אלפי ואנשים קשישים בגיל צריכים להיהרג כשעוברים הכביש מבוגר לעבור הכביש במהירות,נשים,0.5820773,"('0.024*""נשים"" + 0.007*""ציבור"" + 0.006*""אלימות"" + 0.006*""הכנסה"" + 0.005*""מוסדות"" + 0.005*""הנשים"" + 0.004*""לנשים"" + 0.003*""חייבת"" + 0.003*""במשפחה"" + 0.003*""רשימה""',)",6
11887,המשותפת החוץ והביטחון וועדת הפנים והגנת הסביבה השם המלא 5 לחוק האזרחות והכניסה לישראל הוראת תשסג–2003 נדון בהארכת תוקף בצו באישור ה-16 ביוני וזאת פי בקשת פי החלטת מיום 6 במאי,קורונה,0.58148754,"('0.029*""הקורונה"" + 0.021*""הוראת"" + 0.014*""נגיף"" + 0.011*""סמכויות"" + 0.008*""להתמודדות"" + 0.008*""לחוק"" + 0.008*""מיוחדות"" + 0.008*""1"" + 0.007*""2"" + 0.007*""התקנות""',)",6
9326,הממשלתית מכירים יתמקד בהצעה שהנחנו לפניכם מטעם יושב-ראש כוללת למעשה מינוי שלושה שרים מייד אתייחס מדוע שלושה שרים והשלמת המספר הטוענות הרבניות לשתיים ליצור ההלימה לשכת עורכי הדין הפרופסיה המקצועית שעומדים בפני הדיינים,כלכלי,0.58129406,"('0.004*""הדברים"" + 0.004*""האוצר"" + 0.003*""גופים"" + 0.003*""הביטחון"" + 0.003*""להגנת"" + 0.003*""שוק"" + 0.003*""הרשות"" + 0.003*""המשרד"" + 0.003*""ההון"" + 0.003*""הגופים""',)",6
12105,לכולכם לצוות המשפטי שעבדו נוספות במשך התקופה הנוסח המתוקן הונח בפני הושקעו,כלכלי,0.58110094,"('0.004*""הדברים"" + 0.004*""האוצר"" + 0.003*""גופים"" + 0.003*""הביטחון"" + 0.003*""להגנת"" + 0.003*""שוק"" + 0.003*""הרשות"" + 0.003*""המשרד"" + 0.003*""ההון"" + 0.003*""הגופים""',)",6
9700,איתנו בחדר עורכת הדין מוריה כהן בקשי עורך הדין איגי פז מהאפוטרופוס הכללי המשפטים עורכת הדין גלי גרוס ייעוץ וחקיקה איתנו,תחבורה,0.58087164,"('0.018*""התחבורה"" + 0.017*""הדין"" + 0.016*""המדע"" + 0.014*""הציבורית"" + 0.014*""והטכנולוגיה"" + 0.013*""ציבורית"" + 0.007*""עורכת"" + 0.007*""תחבורה"" + 0.006*""המקומי"" + 0.005*""העיר""',)",6
13260,נדון הבנקים הנושאים שעלו ההשקעות והלוואות חברתיות מעמד הבנקים כתוב מחריג הבנקים הבנקים תחת ביקשתי מבנק להבהיר הפער לבין המעמד הבנקים מבקשת שתחזרו במילים קצרות ואחר נפתח העניין,כלכלי,0.58086157,"('0.004*""הדברים"" + 0.004*""האוצר"" + 0.003*""גופים"" + 0.003*""הביטחון"" + 0.003*""להגנת"" + 0.003*""שוק"" + 0.003*""הרשות"" + 0.003*""המשרד"" + 0.003*""ההון"" + 0.003*""הגופים""',)",6
1993,אזכיר עקרוניים הקודם התחלנו הסעיפים קראנו ההגדרה עניין אזרחי מזכיר עניין אזרחי מרכזיות הנושאים שבהם הדין מוסמך לדון כבורר בנוסח שמונח בפניכם נוסח שמוסכם ומתואם בתי הדין הרבניים המשפטים והמציעים שישה עניין אזרחי מוגדר השלילה הדברים המנויים בהגדרות עניין אזרחי בהקשר התחיל כשבדיון הקודם כייעוץ המשפטי הערנו שלושה עניינים האחד עניין ניסוחי ההגדרה עניין מנהלי אכנס אליו הנקודה השניה שנעשה משמעותי מהדיון בפסקה 4,בריאות,0.5807477,"('0.022*""החולים"" + 0.022*""בתי"" + 0.017*""הספר"" + 0.010*""הבריאות"" + 0.010*""בבתי"" + 0.010*""חולים"" + 0.005*""השואה"" + 0.005*""לבתי"" + 0.004*""קופות"" + 0.004*""ניצולי""',)",6
5438,הקודם הפרישה לנשים בתאריך 15 לספטמבר שונה מהדיון שהוועדה חשפה בפנינו ההמלצות לקראת סיכום ההמלצות בתהליכים והיה לקיים עומדים ולאן פני מופנים כיום ההמלצות נמצאות שמסביר תהליך החשיבה והמסקנות נקיים שהתוצאות וההמלצות נחשפו בתקשורת כשישבנו ידענו עליהם מהדיווחים בתקשורת והתייחסנו אליהן בסיכום הערות והמלצות ששלחנו שעכשיו יתייחסו להערות שהיו וששלחנו,חינוך,0.58072525,"('0.076*""החינוך"" + 0.020*""התרבות"" + 0.017*""והספורט"" + 0.012*""חינוך"" + 0.011*""הלימודים"" + 0.009*""במערכת"" + 0.008*""שנת"" + 0.008*""בחינוך"" + 0.007*""מערכת"" + 0.007*""הספורט""',)",6
1963,פותחת לקידום מעמד האישה ולשוויון מגדרי ה-1 באוגוסט מדברות אפליית שכר בקרב נשים חרדיות עובדות הייטק,נשים,0.5805153,"('0.016*""מעמד"" + 0.015*""האישה"" + 0.014*""לקידום"" + 0.010*""מגדרי"" + 0.009*""נשים"" + 0.008*""ולשוויון"" + 0.007*""פותחת"" + 0.004*""הנשים"" + 0.003*""מינית"" + 0.003*""שמחה""',)",6
6160,החינוך התרבות והספורט ה-10 במאי יד באייר התשעז בלוח העברי פסח אלפי תלמידים בדואים מסגרות חינוכיות מוצע פתרון מהיר טלב אבו עראר המשך שהבטחנו ערב יציאתנו לפגרת חג הפסח,חינוך,0.5801976,"('0.007*""החינוך"" + 0.007*""גבוהה"" + 0.006*""הגבוהה"" + 0.006*""להשכלה"" + 0.004*""ההשכלה"" + 0.004*""במוסדות"" + 0.004*""מודה"" + 0.004*""התרבות"" + 0.004*""החשמל"" + 0.004*""האנרגיה""',)",6
4401,נתחיל ואבקש ממירב פלג גבאי עבודת המממ שבוצעה הנתונים שהמשרדים הכינו הצגת המצב להיום ונשמע הדברים שנשמע איתנו בזום להתייחס לכתוב הבקשה המממ,נשים,0.5799159,"('0.024*""נשים"" + 0.007*""ציבור"" + 0.006*""אלימות"" + 0.006*""הכנסה"" + 0.005*""מוסדות"" + 0.005*""הנשים"" + 0.004*""לנשים"" + 0.003*""חייבת"" + 0.003*""במשפחה"" + 0.003*""רשימה""',)",6
330,שתסבירו החוקים שנמצאים שעולה מחר השר לדחיית מועדי תשלומי מסים במליאת ברוב 70 היית התומכים ויכוח האוצר היחיד שנשאר בוויכוח רכישה מיותר תדע להצביע מחר חשובה עמדתך,בריאות,0.57973063,"('0.013*""הרווחה"" + 0.011*""בריאות"" + 0.009*""הנפש"" + 0.008*""אלאלוף"" + 0.007*""העבודה"" + 0.007*""מזון"" + 0.007*""אלי"" + 0.005*""לבריאות"" + 0.004*""המזון"" + 0.004*""הבריאות""',)",6
19086,בישיבה הקודמת שאלנו שאלות שאלת תעלה הנקודה אוסיף השאלות,כלכלי,0.57856333,"('0.003*""צריכים"" + 0.003*""מעונות"" + 0.003*""לעסקים"" + 0.002*""ימים"" + 0.002*""מצד"" + 0.002*""מדינה"" + 0.002*""הכלכלה"" + 0.002*""עליה"" + 0.002*""כפולה"" + 0.002*""לומדים""',)",6
16603,החינוך התרבות והספורט הרביעית במניין ה-399 מתחילת לוח חופשות תלמידים במערכת החינוך והחופשה בלג בעומר יזמתי וקבעתי להתעלם מהקולות סביב סוגיית החופשות במערכת החינוך והתאמתן לציבור למשק ולחברה בעטיו שינוי שיזם החינוך בעקבות פנייתו הרב הרב דוד לאו לשר החינוך לדחות החופשה לג בעומר,חינוך,0.57854086,"('0.076*""החינוך"" + 0.020*""התרבות"" + 0.017*""והספורט"" + 0.012*""חינוך"" + 0.011*""הלימודים"" + 0.009*""במערכת"" + 0.008*""שנת"" + 0.008*""בחינוך"" + 0.007*""מערכת"" + 0.007*""הספורט""',)",6
133,לכולן פותחת לקידום מעמד האישה ולשוויון מגדרי ה-19122017 והנושא מגן נפגעות תקיפה מינית בהליך הפלילי,נשים,0.5783074,"('0.016*""מעמד"" + 0.015*""האישה"" + 0.014*""לקידום"" + 0.010*""מגדרי"" + 0.009*""נשים"" + 0.008*""ולשוויון"" + 0.007*""פותחת"" + 0.004*""הנשים"" + 0.003*""מינית"" + 0.003*""שמחה""',)",6
2004,לברך ולהודות בלתי רגילה ההיענות הכול מהירה לקיים החשוב לאור תיארת המשוגע בימים האחרונים המושב,נשים,0.57779044,"('0.016*""מעמד"" + 0.015*""האישה"" + 0.014*""לקידום"" + 0.010*""מגדרי"" + 0.009*""נשים"" + 0.008*""ולשוויון"" + 0.007*""פותחת"" + 0.004*""הנשים"" + 0.003*""מינית"" + 0.003*""שמחה""',)",6
3749,שאמרתי מתמקד במספר נושאים שנושקים ריכזנו נפתח בהחלטת החלטה 324 שנושאה מדיניות חברתית מתכללת לשילובם וקידומם אזרחי יוצאי אתיופיה בחברה הישראלית החלטה שהתקבלה וקיבלה תוקף ב-31715 החלטה שאמורה להשיג יעד מרכזי שילובים שאמרתי אזרחי יוצאי אתיופיה בחברה הישראלית השילוב יעשה באספקת שירותים משלב מבדל מדגיש נדון,חינוך,0.57771546,"('0.076*""החינוך"" + 0.020*""התרבות"" + 0.017*""והספורט"" + 0.012*""חינוך"" + 0.011*""הלימודים"" + 0.009*""במערכת"" + 0.008*""שנת"" + 0.008*""בחינוך"" + 0.007*""מערכת"" + 0.007*""הספורט""',)",6
4151,לוקחים בקלות ממה שאנשים בחוץ חושבים היינו לוקחים להחזיק מעמד לציין רבים בדאגה ובאחריות לאזרחים והאזרחיות הוותיקים,בריאות,0.5774947,"('0.013*""הרווחה"" + 0.011*""בריאות"" + 0.009*""הנפש"" + 0.008*""אלאלוף"" + 0.007*""העבודה"" + 0.007*""מזון"" + 0.007*""אלי"" + 0.005*""לבריאות"" + 0.004*""המזון"" + 0.004*""הבריאות""',)",6
4510,מגיעים לפה התמיכה המלאה חוזר ואומר תכנון במליאה ותומך ומתחייב להמשיך יביא הקצבה לשכר מינימום פי התחייבות שנתן לשר תמיכה נוספת חשובה האוצר תמיכה בלתי רגילה והתחייבות ומחויבות אישית בלתי רגילה העבודה הרווחה והשירותים החברתיים הממונה הביטוח הלאומי ליכוד כוחות ולמען קצבאות,נשים,0.5771303,"('0.024*""נשים"" + 0.007*""ציבור"" + 0.006*""אלימות"" + 0.006*""הכנסה"" + 0.005*""מוסדות"" + 0.005*""הנשים"" + 0.004*""לנשים"" + 0.003*""חייבת"" + 0.003*""במשפחה"" + 0.003*""רשימה""',)",6
