,NonStopwordsQuoteText,Topic,Topic_Prob,TopicWords,Batch
1675,מתי רביבי ממינהל הבטיחות מרכז תחום הבטיחות בבנייה אירוע נפגע נפגע מסוכן מסוכן מוגדר ברשימה מקרים מסוכנים מדווח לפיקוח אזורית וצריך להיחקר חייב תשובה לבדוק הסטטוס החקירה האירוע אעביר בכתב לוועדה כלומר ששאלת חקר מתי חקר המסקנות שאלות שנשאלו הפורמט אעביר בתשובה מסודרת לוועדה,נשים,0.8411234,"('0.024*""נשים"" + 0.007*""ציבור"" + 0.006*""אלימות"" + 0.006*""הכנסה"" + 0.005*""מוסדות"" + 0.005*""הנשים"" + 0.004*""לנשים"" + 0.003*""חייבת"" + 0.003*""במשפחה"" + 0.003*""רשימה""',)",6
5475,גודש להמשיך המקום שעצרנו בפעם הקודמת ברקע חייב שעדיין פערים האוצר ומשרד התחבורה בסוגיות שקשורות לסעיפי זקיפת הטבה לעובדים המוניות המפה מבין שמופיעה נגיע לשם ונראה מתמודדים איתה להמשיך ההקראה לוודא שבתוכן עצמה פערים ואין בעיות,כלכלי,0.8409614,"('0.003*""צריכים"" + 0.003*""מעונות"" + 0.003*""לעסקים"" + 0.002*""ימים"" + 0.002*""מצד"" + 0.002*""מדינה"" + 0.002*""הכלכלה"" + 0.002*""עליה"" + 0.002*""כפולה"" + 0.002*""לומדים""',)",6
2727,ברוכים הבאים משפחת לזר מבקשת לשתף בשני קצרים האחד חוויית ילדות כשהייתי יסודי הקפדתי העברית המקריאה בכיתה סיפור קרה שיעור שהמורה הגיע שמשהו השתבש רצים לספרייה מביאים מספרי תמר מקריאה הסיפורים הידועים אישי,עולים,0.8408244,"('0.016*""העלייה"" + 0.015*""עולים"" + 0.013*""הקליטה"" + 0.011*""אתיופיה"" + 0.010*""יוצאי"" + 0.009*""העולים"" + 0.007*""חדשים"" + 0.007*""חברתי"" + 0.006*""והקליטה"" + 0.005*""מקיימים""',)",6
8566,החלטת 4869 מפברואר מטילה הפנים להמשיך לבחון ולאשר לחוק הכניסה לישראל כניסתם מועמדים העומדים התנאים המצטברים המפורטים בסעיף 2 בהחלטה ועונים הקריטריונים שכלולים בסעיף 1 לאותה החלטה 1911 החלטה מ-2016 ושלא אושרה כניסתם לישראל ורק משום שתמה המכסה שנקבעה במסגרת החלטה 1911 מ-2016 החלטה אמורים 398 מועמדים שכניסתם תאושר כניסתם המועמדים החלטה תחל בהקדם האפשרי ותושלם יאוחר מסוף שנת,עולים,0.8407952,"('0.016*""העלייה"" + 0.015*""עולים"" + 0.013*""הקליטה"" + 0.011*""אתיופיה"" + 0.010*""יוצאי"" + 0.009*""העולים"" + 0.007*""חדשים"" + 0.007*""חברתי"" + 0.006*""והקליטה"" + 0.005*""מקיימים""',)",6
9869,שאמרתי אקוסטיקה חודשים התפרסם תקן ישראלי שעוסק אקוסטיקה ולאו בהיבט הספציפי התאמות נגישות לאנשים מוגבלות תי 1918 בכללותו המגמה שגיבשנו סופית ככל הנראה להפנות לתקן תקן כללי הגיוני כהפניה אקוסטיקה נדרשת לאנשים מוגבלות,כלכלי,0.8406842,"('0.004*""הדברים"" + 0.004*""האוצר"" + 0.003*""גופים"" + 0.003*""הביטחון"" + 0.003*""להגנת"" + 0.003*""שוק"" + 0.003*""הרשות"" + 0.003*""המשרד"" + 0.003*""ההון"" + 0.003*""הגופים""',)",6
2586,בכאב מדינת יחד הציבור משקיעה משאבים רבים בחינוך ותוצאות אַיִן תוצאות שואל עצמי כיור החינוך הרי היינו מודדים תפוקות אומרים תלמידי מאשימים מאשימים צלע שתיים החברה בישראל ואיפה ארגוני המורים טענה יישמע ביקורת מכליל זורק הכול המורים שעל לבי שנתיים יושב החינוך התרבות והספורט 305 ולצערי הרב לספור היד הפעמים שארגוני המורים השתתפו בדיונים ארגוני המורים יעצבו מערכת החינוך יחד החינוך ויחד נבחרי הציבור ויחד אנשי המקצוע,חינוך,0.8405222,"('0.076*""החינוך"" + 0.020*""התרבות"" + 0.017*""והספורט"" + 0.012*""חינוך"" + 0.011*""הלימודים"" + 0.009*""במערכת"" + 0.008*""שנת"" + 0.008*""בחינוך"" + 0.007*""מערכת"" + 0.007*""הספורט""',)",6
12087,פותחת לקידום מעמד האישה ולשוויון מגדרי יחסה מערכת המשפט לנפגעות תקיפה מינית,נשים,0.8404727,"('0.016*""מעמד"" + 0.015*""האישה"" + 0.014*""לקידום"" + 0.010*""מגדרי"" + 0.009*""נשים"" + 0.008*""ולשוויון"" + 0.007*""פותחת"" + 0.004*""הנשים"" + 0.003*""מינית"" + 0.003*""שמחה""',)",6
5919,קרובים לשנה שבה אמורות הולוגרמות שמופיעות השולחן ופשוט מציגות המצגת מסתבכים בלהעלות מצגות מקרן,כלכלי,0.8401811,"('0.003*""צריכים"" + 0.003*""מעונות"" + 0.003*""לעסקים"" + 0.002*""ימים"" + 0.002*""מצד"" + 0.002*""מדינה"" + 0.002*""הכלכלה"" + 0.002*""עליה"" + 0.002*""כפולה"" + 0.002*""לומדים""',)",6
3765,מסתכלים ימינה ושמאלה ושואלים השאלות מצליח בביטחון שהתאריך המתבקש תאריך סופי וישים גבול מהקואליציה מוכן רחוק בחקיקה בחקיקה,כלכלי,0.83989686,"('0.004*""הדברים"" + 0.004*""האוצר"" + 0.003*""גופים"" + 0.003*""הביטחון"" + 0.003*""להגנת"" + 0.003*""שוק"" + 0.003*""הרשות"" + 0.003*""המשרד"" + 0.003*""ההון"" + 0.003*""הגופים""',)",6
5426,איתנו גב גוסטי יהושע-ברוורמן ראשת המחלקה לפעילות בתפוצות בהסתדרות הציונית העולמית המחלקה לפעילות בתפוצות פועלת לחיזוק הזהות הציונית וחיזוק הזיקה יהדות התפוצות למדינת מקיימים פעילות מרשימה סמינרים ואירועים שמנגישים המסרים הציוניים העכשוויים לקהל הרחב ולדור הצעיר בפרט ידוע עובדים סטודנטים בקמפוסים קהילות ישראליות בחול קהילות יהודיות וכמו הפדרציות הציוניות ברחבי לחיזוק הזהות הציונית והקשר למדינת,תחבורה,0.83936906,"('0.018*""התחבורה"" + 0.017*""הדין"" + 0.016*""המדע"" + 0.014*""הציבורית"" + 0.014*""והטכנולוגיה"" + 0.013*""ציבורית"" + 0.007*""עורכת"" + 0.007*""תחבורה"" + 0.006*""המקומי"" + 0.005*""העיר""',)",6
4212,אתן תזכורת זוכר הקודם אפשרנו סבב התייחסויות הנוגעים בדבר שעוסק ושלחנו הנציגים להידבר ולהגיע להסכמות לנוסח מוסכם הגיעו לנוסח מוסכם יחשבו שנגיע למאה אחוז הסכמות מגילת אסתר כתוב מרדכי היהודי ומרדכי היהודי רצוי לרוב אחיו מאה אחוז מאה אחוז במדינות טוטליטריות מצביעים בקלפי 95% 95% ליצור תקריות דיפלומטיות אנקוב בשמות המדינות הללו לדוגמה ילין הגיע מאחת המדינות ארגנטינה,כלכלי,0.8385861,"('0.004*""הדברים"" + 0.004*""האוצר"" + 0.003*""גופים"" + 0.003*""הביטחון"" + 0.003*""להגנת"" + 0.003*""שוק"" + 0.003*""הרשות"" + 0.003*""המשרד"" + 0.003*""ההון"" + 0.003*""הגופים""',)",6
8221,מקובל עליכם להגיב זכותכם ודאי שתגיבו מיד פשוטה תלכו תארגנו תמצאו הפשרות הנדרשות להתכנס חזרה מידית לעבור נגיע לפיצול מקובל,עולים,0.8381216,"('0.016*""העלייה"" + 0.015*""עולים"" + 0.013*""הקליטה"" + 0.011*""אתיופיה"" + 0.010*""יוצאי"" + 0.009*""העולים"" + 0.007*""חדשים"" + 0.007*""חברתי"" + 0.006*""והקליטה"" + 0.005*""מקיימים""',)",6
8552,חייב שממשלת התגייסה ועושה פעולות אופרטיביות נכונות בהיבט הגיאופוליטי בהיבט הסיוע נשלח סיוע הומניטרי חייב לציין עובדי החוץ עובדי נתיב עובדי הסוכנות שתוך סיכון ממשיכים לעבוד עבדו חלקם עובדים הגבול פותחים נקודות חדשות הקהל יכולים תוך סיכון להציל הישראלים שנמצאים היהודים שרוצים לעלות לישראל,עולים,0.83786654,"('0.016*""העלייה"" + 0.015*""עולים"" + 0.013*""הקליטה"" + 0.011*""אתיופיה"" + 0.010*""יוצאי"" + 0.009*""העולים"" + 0.007*""חדשים"" + 0.007*""חברתי"" + 0.006*""והקליטה"" + 0.005*""מקיימים""',)",6
1469,לכולכם ברשותכם לימודי אנגלית בבתי הספר היסודיים צמצום פערים וגיל התחלתי ללימוד השפה אתן רקע התכנסנו ולמה להעלות יומה להפריז בחשיבות לימוד השפה האנגלית בטח בטח בשיח שבו הפיכת המערכת לרלבנטית הכלים והמיומנויות נדרשים להעניק בעידן הנוכחי יכולים לסקור התייחסויות לימוד השפה האנגלית בבתי הספר השיח הפרקטיקה הלימוד ליכולת התלמידים שיוצאים מהמערכת השפה נבחנים ברמה גבוהה ארבע וחמש יחידות ומוציאים ציונים יפים מסוגלים לנהל השיח שאותו בפרקטיקה עצמה שאיתו יצאו,כלכלי,0.837552,"('0.003*""צריכים"" + 0.003*""מעונות"" + 0.003*""לעסקים"" + 0.002*""ימים"" + 0.002*""מצד"" + 0.002*""מדינה"" + 0.002*""הכלכלה"" + 0.002*""עליה"" + 0.002*""כפולה"" + 0.002*""לומדים""',)",6
5279,שלומית תקני טועה; הלשכה המשפטית רצינו שוועדת תקבל החלטה הרי עוסקים בשרים ושאיריהם ונשיא וכו ביקשנו שוועדת תקבל החלטה הסכימה רצתה שנקבל החלטה קיבלנו החלטה וקבענו מעבירים לנושא הגמלאות זהו,נשים,0.83647555,"('0.016*""מעמד"" + 0.015*""האישה"" + 0.014*""לקידום"" + 0.010*""מגדרי"" + 0.009*""נשים"" + 0.008*""ולשוויון"" + 0.007*""פותחת"" + 0.004*""הנשים"" + 0.003*""מינית"" + 0.003*""שמחה""',)",6
1984,ייתן דברו מנע שיועצים משפטיים וכולי שבועיים לחקיקה שאפשר לציין השר בנפש חפצה תהליך שקול תהליך מסודר מהיר ההרגשה מהיר מחטף הפעילות יושב-ראש והיושב-ראש הקבוע שהוביל נדון בציר מצומצם,כלכלי,0.8359371,"('0.004*""הדברים"" + 0.004*""האוצר"" + 0.003*""גופים"" + 0.003*""הביטחון"" + 0.003*""להגנת"" + 0.003*""שוק"" + 0.003*""הרשות"" + 0.003*""המשרד"" + 0.003*""ההון"" + 0.003*""הגופים""',)",6
7215,מהסוכנות היהודית למדתי ישנה ייחודית לרופאי שיניים מברזיל מכיוון לומדים ארבע לתואר לעומת חמש ספק יימצא פתרון יהווה חסם משמעותי לעלייה,כלכלי,0.8351984,"('0.003*""צריכים"" + 0.003*""מעונות"" + 0.003*""לעסקים"" + 0.002*""ימים"" + 0.002*""מצד"" + 0.002*""מדינה"" + 0.002*""הכלכלה"" + 0.002*""עליה"" + 0.002*""כפולה"" + 0.002*""לומדים""',)",6
6432,אדע המיטב לנסות בנסיבות לקדם הדברים אינני מעבר לשיחות ואחרות מהאנשים שנמצאים וחלק אינני מהדברים שביקשתי אכן מוצג בפניי מכתב קיבלתי חתום סבתא זכרונה לברכה הגיע הדברים העיניים,כלכלי,0.83501416,"('0.004*""הדברים"" + 0.004*""האוצר"" + 0.003*""גופים"" + 0.003*""הביטחון"" + 0.003*""להגנת"" + 0.003*""שוק"" + 0.003*""הרשות"" + 0.003*""המשרד"" + 0.003*""ההון"" + 0.003*""הגופים""',)",6
5805,מביאים ברמה האישית להבהיר שהחוק להחליף הפיקוח המעונות הפיקוח המעונות שחשוב לעמוד בנוסף ברגע שהחוק יגיע בינואר הרי מבינים שהמעונות יעברו ממשרד הרווחה ממשרד העבודה ממשרד הכלכלה למשרד החינוך שבו צריכים יקרה בינואר נעשה רפורמה שקשור לפיקוח המעונות להכשרה הסייעות להכשרה הגננות להחליף הפיקוח המעונות סיוע ועזרה להקל גנים באיזשהו תהליך כפוי שמנסים להעביר המטרה להקל הגנים ככל שניתן מנת שיוכלו לעסוק שהכי חינוך,כלכלי,0.8349048,"('0.004*""הדברים"" + 0.004*""האוצר"" + 0.003*""גופים"" + 0.003*""הביטחון"" + 0.003*""להגנת"" + 0.003*""שוק"" + 0.003*""הרשות"" + 0.003*""המשרד"" + 0.003*""ההון"" + 0.003*""הגופים""',)",6
9146,ב-2018 נחקק 4 לחוק שיפוט בתי דין רבניים שהרחיב חריגה הסמכות בתי הדין מענה לתופעה שהכנסת חשבה הצדקה לסמכות להתיר במקרים עגינות זוגות יהודיים שנישאו בחוץ-לארץ כדת משה וישראל מיני סיבות שבגללן לאכוף הגט הגט דין מושבם התייצבות,כלכלי,0.8343182,"('0.004*""הדברים"" + 0.004*""האוצר"" + 0.003*""גופים"" + 0.003*""הביטחון"" + 0.003*""להגנת"" + 0.003*""שוק"" + 0.003*""הרשות"" + 0.003*""המשרד"" + 0.003*""ההון"" + 0.003*""הגופים""',)",6
1764,פותחים המיוחדת למיגור הפשיעה והאלימות שלישי 27 באוקטובר ט בחשוון התשפא,קורונה,0.83419573,"('0.029*""הקורונה"" + 0.021*""הוראת"" + 0.014*""נגיף"" + 0.011*""סמכויות"" + 0.008*""להתמודדות"" + 0.008*""לחוק"" + 0.008*""מיוחדות"" + 0.008*""1"" + 0.007*""2"" + 0.007*""התקנות""',)",6
6352,סליחה האיחור הקל מצאנו עצמנו מתבלבלים הקומות משום העבירו מהחדר הקבוע קבוע מקיימים פיקוח על-פי המועד חובת הדיווח,בריאות,0.8340505,"('0.022*""החולים"" + 0.022*""בתי"" + 0.017*""הספר"" + 0.010*""הבריאות"" + 0.010*""בבתי"" + 0.010*""חולים"" + 0.005*""השואה"" + 0.005*""לבתי"" + 0.004*""קופות"" + 0.004*""ניצולי""',)",6
3843,מלווים מאז שנת שלישית נעים חובה ושליחות מבחינתנו ללוות הדחוקים ואחד הנעלמים מעין רלוונטי לחיי וזו קלישאה וזו מליצה חיי שידבר בשמם העבודות החשובות שהבית עבור שאינם יכולים לובי ואין קבוצות לחץ וכולי במרכזי הגמילה ובכלא בתחושת אחריות מקדישה המיוחד שהכנסת מציינת אתן רזבוזוב בתור יוזם נפתח,עולים,0.83352566,"('0.016*""העלייה"" + 0.015*""עולים"" + 0.013*""הקליטה"" + 0.011*""אתיופיה"" + 0.010*""יוצאי"" + 0.009*""העולים"" + 0.007*""חדשים"" + 0.007*""חברתי"" + 0.006*""והקליטה"" + 0.005*""מקיימים""',)",6
5835,צהריים שלישי ז בשבט תשעח 23118 אמרתי שישבתי הכלכלה היושב שלישי שנכפל פעמיים ירצה שלוש אמרתי שלישי מיוחד נוהגים פרשת המן סגולה לפרנסה שלישי מיוחד בחרתם שנכפל פעמיים שלוש,קורונה,0.8333004,"('0.029*""הקורונה"" + 0.021*""הוראת"" + 0.014*""נגיף"" + 0.011*""סמכויות"" + 0.008*""להתמודדות"" + 0.008*""לחוק"" + 0.008*""מיוחדות"" + 0.008*""1"" + 0.007*""2"" + 0.007*""התקנות""',)",6
7992,עופר שפירא מייצג בעל מקצוע פרטי בתחום הערה כללית ברוח הדברים שנאמרו שזו הזדמנות להסתכל המטרות שהרבה מהוות נימוק למהות כזו רוח ההסכמה קונצנזוס היושבים שיקום החייב כערך לנגד העיניים ברגע שנכתב חל חייבים מהסוג ומנסים להשתמש באותה צורה שהחייבים נקרא הפשוטים הזדמנות שבאותה מסננת שיקום גבייה נכנסים מקרים שאולי מובהק צריכים גבייה והסתכלות האינטרסים הנושים ופחות הסתכלות שיקום החייב המקרה המקרה ה-100,כלכלי,0.83326674,"('0.004*""הדברים"" + 0.004*""האוצר"" + 0.003*""גופים"" + 0.003*""הביטחון"" + 0.003*""להגנת"" + 0.003*""שוק"" + 0.003*""הרשות"" + 0.003*""המשרד"" + 0.003*""ההון"" + 0.003*""הגופים""',)",6
8606,שבחר הכותרת חבל קישוט שאמרתי 37 מאז התחלתי לכהן כיושב ספרתי המקרים ואמרתי 37 שהלוואי ונציגי הסתדרות המורים וארגון המורים שותפים לעיצוב דמותה מערכת החינוך בדיונים שהיו 255 בקדנציה וכי נפקד מושבם ומקומם מועצת התלמידים והנוער הארצית מייחס חשיבות לנוכחות לדברים לעצות לאמירות קישוט לשים כוועדת קישוט בשבילכם מהותה החינוך לפקח עבודת המשרד עבודת סוגיית חינוך ילדי קישוט בטח,חינוך,0.8327557,"('0.076*""החינוך"" + 0.020*""התרבות"" + 0.017*""והספורט"" + 0.012*""חינוך"" + 0.011*""הלימודים"" + 0.009*""במערכת"" + 0.008*""שנת"" + 0.008*""בחינוך"" + 0.007*""מערכת"" + 0.007*""הספורט""',)",6
5256,וברוכים הבאים לפניות הציבור התחבורה הציבורית לכותל המערבי שריד מקדשנו מקיימים מהיר לבקשתו מלכיאלי הרביעי בסדרה ישיבות ההגעה לכותל המערבי סיור בכותל מצעדי גבר כוננו העיתוי נותן משמעות לנושא,תחבורה,0.83069986,"('0.018*""התחבורה"" + 0.017*""הדין"" + 0.016*""המדע"" + 0.014*""הציבורית"" + 0.014*""והטכנולוגיה"" + 0.013*""ציבורית"" + 0.007*""עורכת"" + 0.007*""תחבורה"" + 0.006*""המקומי"" + 0.005*""העיר""',)",6
6840,רבותי מברכים כול החכים מניח לנוח לבוא במלוא הכוח מייצג החכים,בריאות,0.82899743,"('0.013*""הרווחה"" + 0.011*""בריאות"" + 0.009*""הנפש"" + 0.008*""אלאלוף"" + 0.007*""העבודה"" + 0.007*""מזון"" + 0.007*""אלי"" + 0.005*""לבריאות"" + 0.004*""המזון"" + 0.004*""הבריאות""',)",6
1193,התקנות הצורה שבה הקריטריונים שלפיהם יחולק התקציב עומדות תוך משבועיים ולשם נדרשים דיונים אינטנסיביים ומהירים לעומק הבעיה ולהגיש המלצות למליאת למשרד התרבות והספורט סימון המשימה פשוטה ובאמת עומד המאזניים הספורט הישראלי משום הקריטריונים יישארו נוכל להמליץ הדברים שצריך לתמוך בהם אמרו איגודים הולכים לפשוט הרגל יסגרו והמשמעות סגירת ענפי ספורט שנמצא המאזניים סומכת עליך במשימה מאחלת,נשים,0.8285904,"('0.016*""מעמד"" + 0.015*""האישה"" + 0.014*""לקידום"" + 0.010*""מגדרי"" + 0.009*""נשים"" + 0.008*""ולשוויון"" + 0.007*""פותחת"" + 0.004*""הנשים"" + 0.003*""מינית"" + 0.003*""שמחה""',)",6
15,מקדישים לענף ההיי-טק ענף שמצד מהווה בייצוא הישראלי ומצד איזו תחושה ציבורית שההיי-טק מסודר ההנחה שההיי-טק הישראלי מסודר וכאילו אקסטריטוריאלי לחיים הישראלים ענף שמתנהל שעון קליפורניה והכסף ממקורות זרים והמשכורות גבוהות ואנשים מובטחים שברגיל יעלה הסתם מהדוח תציגו עומד רגליים חלקן נמצאות בסכנה מסוימת בימים כתיקונים וכמה בעידן הקורונה המגפה עצמה העובדה ההשקעות בהיי-טק עולם גלובלי וכשהכלכלה הגלובלית עומדת להיכנס נכנסה לעידן מיתון ישפיע הנכונות להשקעות הנכונות לרכישות בישראל וכן הלאה,נשים,0.8284915,"('0.016*""מעמד"" + 0.015*""האישה"" + 0.014*""לקידום"" + 0.010*""מגדרי"" + 0.009*""נשים"" + 0.008*""ולשוויון"" + 0.007*""פותחת"" + 0.004*""הנשים"" + 0.003*""מינית"" + 0.003*""שמחה""',)",6
3841,חסמים החסם הפסיכולוגי ימים אמרתי למישהו שים מכרז תיגש אתקבל לשם כאילו חסם פנימי שבפסיכולוגיה אי-אפשר להתקבל למשרות בכירות בשירות חייבים לשבור,נשים,0.8281195,"('0.016*""מעמד"" + 0.015*""האישה"" + 0.014*""לקידום"" + 0.010*""מגדרי"" + 0.009*""נשים"" + 0.008*""ולשוויון"" + 0.007*""פותחת"" + 0.004*""הנשים"" + 0.003*""מינית"" + 0.003*""שמחה""',)",6
896,שנעבור לסעיפים החדשים עליהם שתי נקודות שבישיבה הקודמת פנייה למשרד המשפטים לערוך לגביהן בדיקה 20 שעוסק בסעד הזמני סיימנו האפשרות מידע כחלק מהסעד הזמני הנוסף בהגדרת חוב עבר להסיר מהחלופה החמישית המילים למועד פירעונו,חינוך,0.82799894,"('0.007*""החינוך"" + 0.007*""גבוהה"" + 0.006*""הגבוהה"" + 0.006*""להשכלה"" + 0.004*""ההשכלה"" + 0.004*""במוסדות"" + 0.004*""מודה"" + 0.004*""התרבות"" + 0.004*""החשמל"" + 0.004*""האנרגיה""',)",6
8006,מהפרשיות שהתפרסמו פרסומים חיילים מתחילה בפרשיות נעסוק בתלונות והטרדות מיניות הארגון כלומר אנשי ונשות הארגון כלפי כלפי נחקרים ונחקרות ואזרחים שבאים במגע אנשי המדים פרסומים חיילים שהטרידו מינית פגעו וסחטו נשים במחסומים ובעצם עוברים חקירה טועה הוגשו נגדם כתבי אישום סיפור פלסטינית שהתלוננה נחשף שעברה התלונה ותיקה התלוננה נאנסה תחנת משטרה שוטר ונמצאה בפוליגרף דוברת אמת יכולנו לקיים באמצע הערר והיום מבינים שהתיק נסגר בפעם השנייה,עולים,0.82794946,"('0.016*""העלייה"" + 0.015*""עולים"" + 0.013*""הקליטה"" + 0.011*""אתיופיה"" + 0.010*""יוצאי"" + 0.009*""העולים"" + 0.007*""חדשים"" + 0.007*""חברתי"" + 0.006*""והקליטה"" + 0.005*""מקיימים""',)",6
3272,צוהריים מהכנסת בישיבה המיוחדת היערכות מערכת החינוך ישיבה שנייה תימשך בראשותי תלוי בקואליציה מבזבזים מקיימים יעסוק החינוך המקוון,חינוך,0.8279139,"('0.076*""החינוך"" + 0.020*""התרבות"" + 0.017*""והספורט"" + 0.012*""חינוך"" + 0.011*""הלימודים"" + 0.009*""במערכת"" + 0.008*""שנת"" + 0.008*""בחינוך"" + 0.007*""מערכת"" + 0.007*""הספורט""',)",6
7142,צהרים היושב-ראש תפקוד סיטי פס בירושלים מרכזי בחשיבותו בשל העובדה מהווה עורק תחבורתי מרכזי בעיר הבירה העניין לתושבי ירושלים לכולנו כנציגי ציבור,עולים,0.8276579,"('0.016*""העלייה"" + 0.015*""עולים"" + 0.013*""הקליטה"" + 0.011*""אתיופיה"" + 0.010*""יוצאי"" + 0.009*""העולים"" + 0.007*""חדשים"" + 0.007*""חברתי"" + 0.006*""והקליטה"" + 0.005*""מקיימים""',)",6
6797,נשים שמתמודדות מצד קושי אמיתי לכלכל ומהצד האחר לדאוג לקורת גג מציאות אלימה זורקת לתחתית ולקצה השוליים החברתיים והן עומדות בפני דילמה מוסרית בעייתית לדאוג לקורת גג ולהפוך קורבן לטרף שמחזיקים העתיד האלו בידיים ואומרים אחראי לכך קורת גג הראש פתחנו בתערוכה,כלכלי,0.8275112,"('0.003*""צריכים"" + 0.003*""מעונות"" + 0.003*""לעסקים"" + 0.002*""ימים"" + 0.002*""מצד"" + 0.002*""מדינה"" + 0.002*""הכלכלה"" + 0.002*""עליה"" + 0.002*""כפולה"" + 0.002*""לומדים""',)",6
