,NonStopwordsQuoteText,Topic,Topic_Prob,TopicWords,Batch
21819,החוקה ומשפט הכרזת סמכויות מיוחדות להתמודדות נגיף הקורונה הוראת בידוד שנכנס לישראל בנסיבות מיוחדות התשפא-2020 קיבלנו מכתב מזכיר ב-7 בינואר בפגרת בחירות לנכון לקיים תוצאה החלטות בתקנות המגיעים מחול לחייב החוזרים מכול המדינות להיכנס לבידוד במלוניות ממדינות מסוימות אבקש מנציגת הבריאות להסביר ההכרזה,קורונה,0.5490949,"('0.018*""הפנים"" + 0.018*""הקורונה"" + 0.017*""הוראת"" + 0.014*""הסביבה"" + 0.013*""והגנת"" + 0.012*""נגיף"" + 0.011*""החוקה"" + 0.010*""המשפטי"" + 0.010*""לחוק"" + 0.010*""סמכויות""',)",1
588,מצטער העיכוב שנבע מעיכוב הקודם הבנתי שנמצאים אתנו מהמרכז האקדמי רופין,בטחון,0.5487279,"('0.019*""הביטחון"" + 0.015*""צהל"" + 0.009*""חיילים"" + 0.005*""לפועל"" + 0.005*""משוחררים"" + 0.005*""בודדים"" + 0.004*""בצהל"" + 0.004*""שלמה"" + 0.004*""מובן"" + 0.004*""נכי""',)",1
17619,המטרה שאר ועדות לבוא ולחשוב פתרונות לבוא ולחשוב אמצעים תהליכים שנעשים תהליכים בתי הספר תהליכים מסגרות הרווחה תהליכים הבריאות במקרה פגשתי מנכל הבריאות משה סימן עשו צעדים מהפכניים בשנה האחרונה מאמינה מהעניין ותמיד צעדים חשובים הגאה,קורונה,0.54861623,"('0.011*""הבריאות"" + 0.006*""החולים"" + 0.005*""הדברים"" + 0.004*""צריכים"" + 0.004*""חולים"" + 0.004*""הקורונה"" + 0.004*""הציבור"" + 0.004*""בתי"" + 0.003*""בתחום"" + 0.003*""שצריך""',)",1
8876,אמרתי בסיור אומרת כוועדה וחברי ומאיר פעיל נעשה לטפל ולתת שיותר כלים ובכלל לארגונים לגופים שנתקפים ההתחלה תקיפות לטפל ולפחות מהסיור איתך שיחות שעשיתי שמבינים בתחום גיליתי שמשום אצלנו חסוי בפועל שנקרא פרוץ הגופים במדינה מאזרחים פרטיים לארגונים גדולים מילים וכמובן יגאל מערך הסייבר הלאומי מצגת הבנתי,קורונה,0.5483323,"('0.011*""הבריאות"" + 0.006*""החולים"" + 0.005*""הדברים"" + 0.004*""צריכים"" + 0.004*""חולים"" + 0.004*""הקורונה"" + 0.004*""הציבור"" + 0.004*""בתי"" + 0.003*""בתחום"" + 0.003*""שצריך""',)",1
14358,פינוי ובינוי פיצויים 4 פינוי בשל סירוב בלתי סביר התשעו–2016 מ/1023 נדון בסוגיית הקשישים שבעצם מעוניינים להתפנות,קורונה,0.54832727,"('0.018*""הפנים"" + 0.018*""הקורונה"" + 0.017*""הוראת"" + 0.014*""הסביבה"" + 0.013*""והגנת"" + 0.012*""נגיף"" + 0.011*""החוקה"" + 0.010*""המשפטי"" + 0.010*""לחוק"" + 0.010*""סמכויות""',)",1
18283,בתוקף סמכותי 29 לחוק שדות התעופה התשלז-1977 להלן התייעצות שדות התעופה באישור באישור האוצר 30 לחוק יסודות התקציב התשמה-1985 ובאישור הכלכלה מתקין,קורונה,0.54819196,"('0.018*""הפנים"" + 0.018*""הקורונה"" + 0.017*""הוראת"" + 0.014*""הסביבה"" + 0.013*""והגנת"" + 0.012*""נגיף"" + 0.011*""החוקה"" + 0.010*""המשפטי"" + 0.010*""לחוק"" + 0.010*""סמכויות""',)",1
13728,היבט נוסף חיוני ומאוד מרבים הפריפריה מרבים חיבור הפריפריה למרכז השתתפתי העבודה שהתעסק בפערים גדולים שקיימים בהמון מקצועות בריאות בנגב שאנשים שעובדים במקצועות בריאות יגיעו לנגב צריכים לספק תחבורה ציבורית וזולה שהתנועה לנגב תנועה אפשרית פריפריה לחבר הפריפריה למרכז תחבורה ציבורית זולה הפריפריה למרכז,קורונה,0.5481734,"('0.011*""הבריאות"" + 0.006*""החולים"" + 0.005*""הדברים"" + 0.004*""צריכים"" + 0.004*""חולים"" + 0.004*""הקורונה"" + 0.004*""הציבור"" + 0.004*""בתי"" + 0.003*""בתחום"" + 0.003*""שצריך""',)",1
4923,ממשיכים בסקירת מערכות קופות החולים בישראל שעברנו ההסתדרות מגיעים לקופה השנייה בגודלה שירותי בריאות היינו שמחים תאמר מצפה מהוועדה תוכל לקופה בהתנהלות המערכת מבינים הגידול באוכלוסייה מבינים הגירעון שנוצר בקופות הקפיטציה חלוקת הכספים יכולים תאמר ננסה כמיטב יכולתנו,קורונה,0.54802704,"('0.011*""הבריאות"" + 0.006*""החולים"" + 0.005*""הדברים"" + 0.004*""צריכים"" + 0.004*""חולים"" + 0.004*""הקורונה"" + 0.004*""הציבור"" + 0.004*""בתי"" + 0.003*""בתחום"" + 0.003*""שצריך""',)",1
23372,ביקורת ה-14 במרץ טז באדר התשעז בקשה לחוות-דעת מבקר החינוך המיוחד זוהי מעקב המשך סוג שייתר החירום בקיץ,חינוך,0.54799944,"('0.051*""החינוך"" + 0.014*""התרבות"" + 0.012*""והספורט"" + 0.010*""איתנו"" + 0.008*""חינוך"" + 0.006*""הבריאות"" + 0.005*""הספר"" + 0.005*""הלימודים"" + 0.005*""מכן"" + 0.005*""במערכת""',)",1
7251,הטראומה הנפשית שמלווה הפגיעה המינית ייחודית מכירים טראומות שמלוות נפגעי עבירה כללי בוודאי שכשמדובר בפגיעה מינית יודעות טראומות ופוסט-טראומה ובהחלט מאפיינים ייחודיים שיהוי בדיווח שיהוי בתלונה גרסאות שונות שנמסרות שמערכת המשפט ידעה להכיל ולהבין ובכלל ההליך ראה בהם סוג חוסר יכולת לקוהרנטיות חוסר יכולת להופעה קוהרנטית בפני שופטים תיקים הגיעו ועדיין מגיעים לבית-משפט הסיבות,קורונה,0.54796726,"('0.011*""הבריאות"" + 0.006*""החולים"" + 0.005*""הדברים"" + 0.004*""צריכים"" + 0.004*""חולים"" + 0.004*""הקורונה"" + 0.004*""הציבור"" + 0.004*""בתי"" + 0.003*""בתחום"" + 0.003*""שצריך""',)",1
18081,ברשותכם נתחיל מר תומר רוזנר היועץ המשפטי תומר לסקירת השינויים העיקריים בנוסח בעוד שלושה-ארבעה שבועות נשאף להקראה סביר להניח וספק לאחריו תומר,קורונה,0.54788935,"('0.018*""הפנים"" + 0.018*""הקורונה"" + 0.017*""הוראת"" + 0.014*""הסביבה"" + 0.013*""והגנת"" + 0.012*""נגיף"" + 0.011*""החוקה"" + 0.010*""המשפטי"" + 0.010*""לחוק"" + 0.010*""סמכויות""',)",1
17976,שבמערכה המגפה שהכתה בנו חודש וחצי-חודשיים צוותים רפואיים בחזית המערכה שמגנים עלינו ועובדים יומם ולילה לטפל בחולים לנסות לשקם שמחלימים מהמחלה אומרים צוותים רפואיים מתכוונים המעורבים בפעילות הריפוי שעוברים עליהם ימים קשים האוכלוסייה סובלת בימים להתעלם מהמאמץ שמשקיעים אנשי הצוותים הרפואיים רופאים אחיות אחים,קורונה,0.54772437,"('0.011*""הבריאות"" + 0.006*""החולים"" + 0.005*""הדברים"" + 0.004*""צריכים"" + 0.004*""חולים"" + 0.004*""הקורונה"" + 0.004*""הציבור"" + 0.004*""בתי"" + 0.003*""בתחום"" + 0.003*""שצריך""',)",1
4048,יפעת העשייה בתחום לברך החשוב שהתנהל שפתח אפשרות להתייחס ביקורתי למדיניות שנוגעת הקורונה והתמודדות הציבור והתמודדות,קורונה,0.5475719,"('0.011*""הבריאות"" + 0.006*""החולים"" + 0.005*""הדברים"" + 0.004*""צריכים"" + 0.004*""חולים"" + 0.004*""הקורונה"" + 0.004*""הציבור"" + 0.004*""בתי"" + 0.003*""בתחום"" + 0.003*""שצריך""',)",1
24224,שלישי כח באדר תשעו 832016 אחליף יושב יעקב מרגי וועדת החינוך התרבות והספורט בעיקרון אומרים לעסוק בשכר הלימוד במכללות האקדמיות הפרטיות פי הצעתו אראל מרגלית הגיע,חינוך,0.5475113,"('0.051*""החינוך"" + 0.014*""התרבות"" + 0.012*""והספורט"" + 0.010*""איתנו"" + 0.008*""חינוך"" + 0.006*""הבריאות"" + 0.005*""הספר"" + 0.005*""הלימודים"" + 0.005*""מכן"" + 0.005*""במערכת""',)",1
15254,כשנחשפתי לנושא תעסוקת נשים חרדיות שבוודאי היעדים האוצר לנגד עיניו ביקשתי לקיים ולראות ולהבין הפלונטר תקוע ולראות יכולים לסייע בהתרת הפלונטר,קורונה,0.54741126,"('0.011*""הבריאות"" + 0.006*""החולים"" + 0.005*""הדברים"" + 0.004*""צריכים"" + 0.004*""חולים"" + 0.004*""הקורונה"" + 0.004*""הציבור"" + 0.004*""בתי"" + 0.003*""בתחום"" + 0.003*""שצריך""',)",1
925,שבאופן כללי במספרים שעברתי עליהם בכמות המורים למוסיקה שקיימים בישראל בכמות התלמידים שלשמחתי ולשמחת המוסיקה הערך הגדול עבורם בגרות והם ללמוד,קורונה,0.54727954,"('0.011*""הבריאות"" + 0.006*""החולים"" + 0.005*""הדברים"" + 0.004*""צריכים"" + 0.004*""חולים"" + 0.004*""הקורונה"" + 0.004*""הציבור"" + 0.004*""בתי"" + 0.003*""בתחום"" + 0.003*""שצריך""',)",1
17621,יועצת משפטית רשמת פרלמנטרית התקנים הפחתה סכומי עיצום כספי התשעח-2018 נתחיל כמדי נקריא שיר ברשותכם,נשים,0.5471907,"('0.015*""לקידום"" + 0.014*""מעמד"" + 0.014*""האישה"" + 0.014*""הכלכלית"" + 0.011*""התקציב"" + 0.010*""התכנית"" + 0.009*""מגדרי"" + 0.009*""פרק"" + 0.009*""פותחת"" + 0.008*""נשים""',)",1
12321,באוגוסט קיימנו בנוגע לחיסון לקורונה ושמענו סקירה רחבה המכון הביולוגי החיסונים הנוספים הקיימים בינתיים קיימת התקדמות בדיווחים החברות השונות לאור הידיעות הבלתי פוסקות בנוגע לחיסונים נשאלת השאלה נוצרה תחושה שעוד חיסון ותבוא הגאולה לקורונה בעוד שהמציאות האמיתית בשטח חלילה עניין פסימיים חייבים תקווה לחיות באשליות ועדיף להבין המציאות ברורה,קורונה,0.54713255,"('0.011*""הבריאות"" + 0.006*""החולים"" + 0.005*""הדברים"" + 0.004*""צריכים"" + 0.004*""חולים"" + 0.004*""הקורונה"" + 0.004*""הציבור"" + 0.004*""בתי"" + 0.003*""בתחום"" + 0.003*""שצריך""',)",1
22472,מברכת בזמן שיא הצלחנו לקבוע החשוב הפרח לנסות לנחש בחירות בחירות האחריות הדברים לסדר,קורונה,0.5470569,"('0.011*""הבריאות"" + 0.006*""החולים"" + 0.005*""הדברים"" + 0.004*""צריכים"" + 0.004*""חולים"" + 0.004*""הקורונה"" + 0.004*""הציבור"" + 0.004*""בתי"" + 0.003*""בתחום"" + 0.003*""שצריך""',)",1
16772,ממשיכים סדרת הדיונים הכלכלה כהכנה לתקציב ואישור ההסדרים מכנים רפורמת היבוא פרקים שונים והיא מחולקת ליבוא כללי לענף המזון וענף התמרוקים רגישויות בריאות וסיכון בפרק המזון המכונה פרק כג יבוא התכנית הכלכלית חקיקה ליישום המדיניות הכלכלית התקציב ו-2022 בסעיפים 112 ו-113 הגנה בריאות מזון,נשים,0.54696405,"('0.015*""לקידום"" + 0.014*""מעמד"" + 0.014*""האישה"" + 0.014*""הכלכלית"" + 0.011*""התקציב"" + 0.010*""התכנית"" + 0.009*""מגדרי"" + 0.009*""פרק"" + 0.009*""פותחת"" + 0.008*""נשים""',)",1
19316,והוועדה רואות לנכון להקדיש בשנה שיהווה הוקרה לאותם שנושאים בנטל שמחזיקים אלונקה משימה מסתכלים סביב בחברה הישראלית הרב איננו משותף להקדיש לאלה שבמרכז לאלה שעושים במסירות בגאווה ובתוצאה מדהימה ואופטימלית,קורונה,0.546906,"('0.011*""הבריאות"" + 0.006*""החולים"" + 0.005*""הדברים"" + 0.004*""צריכים"" + 0.004*""חולים"" + 0.004*""הקורונה"" + 0.004*""הציבור"" + 0.004*""בתי"" + 0.003*""בתחום"" + 0.003*""שצריך""',)",1
11968,צהריים צו הארכת תקופות הוראה נגיף הקורונה אישורים רגולטוריים התשף-2020,קורונה,0.54687655,"('0.018*""הפנים"" + 0.018*""הקורונה"" + 0.017*""הוראת"" + 0.014*""הסביבה"" + 0.013*""והגנת"" + 0.012*""נגיף"" + 0.011*""החוקה"" + 0.010*""המשפטי"" + 0.010*""לחוק"" + 0.010*""סמכויות""',)",1
418,לחבר לשעבר דב ליפמן מיודענו עת פתיחת המליאה בשעה 1100 ויעסוק בשני נושאים ראשית נאשר קובצי והכרזה שכבר נכנסו לתוקף התקנות נכנסו לתוקף מאשרים אותן בדיעבד להוראות,חינוך,0.5468686,"('0.051*""החינוך"" + 0.014*""התרבות"" + 0.012*""והספורט"" + 0.010*""איתנו"" + 0.008*""חינוך"" + 0.006*""הבריאות"" + 0.005*""הספר"" + 0.005*""הלימודים"" + 0.005*""מכן"" + 0.005*""במערכת""',)",1
7655,חבריי המדע והטכנולוגיה באב תשף 27 ביולי דיווח וסקירה המדע והטכנולוגיה מר יזהר שי פעילות משרדו ותוכניות עבודת משרדו לשנים 20-21,חינוך,0.5467896,"('0.051*""החינוך"" + 0.014*""התרבות"" + 0.012*""והספורט"" + 0.010*""איתנו"" + 0.008*""חינוך"" + 0.006*""הבריאות"" + 0.005*""הספר"" + 0.005*""הלימודים"" + 0.005*""מכן"" + 0.005*""במערכת""',)",1
9584,נתחיל לרענן הזכרון בתקופה דרמטית המגיפה נעשה פוקוס חייבם מתמודדים המגיפה מתמודדים הפרה זכויותיהם נפתח בכתבה יובל אראל,חינוך,0.5467445,"('0.051*""החינוך"" + 0.014*""התרבות"" + 0.012*""והספורט"" + 0.010*""איתנו"" + 0.008*""חינוך"" + 0.006*""הבריאות"" + 0.005*""הספר"" + 0.005*""הלימודים"" + 0.005*""מכן"" + 0.005*""במערכת""',)",1
99,בעיצומה מהפכה מהפכה שמעוררת שמחה ותקווה פמיניסטית מגיל 14 57 אתן יכולות לדמיין לעצמכן בכמה שנות פמיניזם ולאחרות שיושבות סביב השולחן מנהלות המרכזים פרספקטיבה פריצת הדרך שנעשית בשנים האחרונות דרמטית ומרגשת ופורצת ומשנה עולמות המהפכה החשובה בהיסטוריה האנושית,נשים,0.54669464,"('0.015*""לקידום"" + 0.014*""מעמד"" + 0.014*""האישה"" + 0.014*""הכלכלית"" + 0.011*""התקציב"" + 0.010*""התכנית"" + 0.009*""מגדרי"" + 0.009*""פרק"" + 0.009*""פותחת"" + 0.008*""נשים""',)",1
15617,החברים שיושבים בשולחן סביבי מכירים ויודעים מאוחדת הדברים המיוחדים שנעשים בקופה אכן קופת חולים מאוחדת כשמה מאוחדת,קורונה,0.546691,"('0.011*""הבריאות"" + 0.006*""החולים"" + 0.005*""הדברים"" + 0.004*""צריכים"" + 0.004*""חולים"" + 0.004*""הקורונה"" + 0.004*""הציבור"" + 0.004*""בתי"" + 0.003*""בתחום"" + 0.003*""שצריך""',)",1
6217,האתגר בעיצומו שאמרתי חודש פתיחת שנת הלימודים כוועדה בטוחים שהילדים יוכלו ללמוד מרחוק להישאר מאחור התקופה האחרונה תקופה ומספר חודשים הצליחו ללמוד והגיע הגיע מזמן ודאי שעכשיו התשובות הנכונות,קורונה,0.54646194,"('0.011*""הבריאות"" + 0.006*""החולים"" + 0.005*""הדברים"" + 0.004*""צריכים"" + 0.004*""חולים"" + 0.004*""הקורונה"" + 0.004*""הציבור"" + 0.004*""בתי"" + 0.003*""בתחום"" + 0.003*""שצריך""',)",1
15355,איתנו בחדר עורכת הדין מוריה כהן בקשי עורך הדין איגי פז מהאפוטרופוס הכללי המשפטים עורכת הדין גלי גרוס ייעוץ וחקיקה איתנו,חינוך,0.546382,"('0.051*""החינוך"" + 0.014*""התרבות"" + 0.012*""והספורט"" + 0.010*""איתנו"" + 0.008*""חינוך"" + 0.006*""הבריאות"" + 0.005*""הספר"" + 0.005*""הלימודים"" + 0.005*""מכן"" + 0.005*""במערכת""',)",1
16384,המטרה מטרה פשוטה להניח השקיפות כחלק מסדרי עדיפויות המשרד בתכניות העבודה ואיך בונים אותן מלכתחילה והן מערך הפיקוח עבודת תפקידה ושל הציבור כמטרה עבורכם לשתף הציבור בהליכים שהמשרד במקרה התיירות משמעות לשיתוף הציבור הציבור ויכול לשמש כחלק מהמטרה לעודד תיירות לישראל וליצור שיותר שיתופי פעולה,קורונה,0.54634106,"('0.011*""הבריאות"" + 0.006*""החולים"" + 0.005*""הדברים"" + 0.004*""צריכים"" + 0.004*""חולים"" + 0.004*""הקורונה"" + 0.004*""הציבור"" + 0.004*""בתי"" + 0.003*""בתחום"" + 0.003*""שצריך""',)",1
4989,הפנים והגנת הסביבה סדר-היוםהצעת הדין הפלילי 61 הוראות המלצה חוקרת התשעח-2017,קורונה,0.5463355,"('0.018*""הפנים"" + 0.018*""הקורונה"" + 0.017*""הוראת"" + 0.014*""הסביבה"" + 0.013*""והגנת"" + 0.012*""נגיף"" + 0.011*""החוקה"" + 0.010*""המשפטי"" + 0.010*""לחוק"" + 0.010*""סמכויות""',)",1
18342,הנוסח שעומד בפנינו להאריך הצו קובע תקופת חירום חדשה לאור העובדה תקופת החירום הקודמת פקעה ב-26 בפברואר כלומר ימים הצו שמונח בפנינו קובע תקופת חירום חדשה שלאור בקשת הפנים תימשך שלושה חודשים לאור שאמרה יושבת-ראש המגבלות שעדיין קיימות בשל נגיף הקורונה,קורונה,0.5463212,"('0.018*""הפנים"" + 0.018*""הקורונה"" + 0.017*""הוראת"" + 0.014*""הסביבה"" + 0.013*""והגנת"" + 0.012*""נגיף"" + 0.011*""החוקה"" + 0.010*""המשפטי"" + 0.010*""לחוק"" + 0.010*""סמכויות""',)",1
8959,שמחה הפנים והגנת הסביבה למשבר הקורונה שפוקד אותנו שמונה חודשים השלכות רחבות החברה הישראלית שכוללות היתר למרבה הצער הדרדרות מהחברה הישראלית למצב עוני וקושי לרכוש מוצרי מזון בסיסיים,קורונה,0.54629374,"('0.011*""הבריאות"" + 0.006*""החולים"" + 0.005*""הדברים"" + 0.004*""צריכים"" + 0.004*""חולים"" + 0.004*""הקורונה"" + 0.004*""הציבור"" + 0.004*""בתי"" + 0.003*""בתחום"" + 0.003*""שצריך""',)",1
9850,מחדש המתמשכת שהחלה ביחד פרופ גמזו ופרופ גרוטו והישיבה וישיבת ההמשך הנושאים סמכויות מיוחדות להתמודדות נגיף הקורונה הוראת הגבלת פעילות 4 סמכויות מיוחדות להתמודדות נגיף הקורונה הוראת הגבלת פעילות 4 חובת היועץ המשפטי מקריא הדברים ברשות החברים מציע שנוכל להתקדם נעבור ישר פרופ גרוטו אתנו בזום מסוימת רציתי לנצל הסכמה החברים והחברים ההצעות לסדר עובד ביחד החברים,קורונה,0.54615587,"('0.018*""הפנים"" + 0.018*""הקורונה"" + 0.017*""הוראת"" + 0.014*""הסביבה"" + 0.013*""והגנת"" + 0.012*""נגיף"" + 0.011*""החוקה"" + 0.010*""המשפטי"" + 0.010*""לחוק"" + 0.010*""סמכויות""',)",1
10571,התכנסנו לישיבה מנת סקירה מהאגף לפניות הציבור במשרד הבריאות הטיפול בפניות הציבור בתקופת הקורונה שהקורונה תקופה לצערנו נכנסה לשגרה,קורונה,0.5459196,"('0.011*""הבריאות"" + 0.006*""החולים"" + 0.005*""הדברים"" + 0.004*""צריכים"" + 0.004*""חולים"" + 0.004*""הקורונה"" + 0.004*""הציבור"" + 0.004*""בתי"" + 0.003*""בתחום"" + 0.003*""שצריך""',)",1
16566,התמקד בכבה שיתוף הפעולה וההתמודדות אתגר כיבוי האש בגזרה ממה התרשמתי שיתוף פעולה מוצלח הגורמים הרלוונטיים שנמצאים בגזרה נכנסנו אליו יעילות המלחמה באש היינו יכולים תוצאה סופית כ-25000 דונם שנשרפו כ-1000 עפיפונים ובלונים למיניהם התוצאה וכדי להמשיך ולהשתפר ולזה נכנסנו,קורונה,0.5458617,"('0.011*""הבריאות"" + 0.006*""החולים"" + 0.005*""הדברים"" + 0.004*""צריכים"" + 0.004*""חולים"" + 0.004*""הקורונה"" + 0.004*""הציבור"" + 0.004*""בתי"" + 0.003*""בתחום"" + 0.003*""שצריך""',)",1
1756,נפתח אימאן חטיב יאסין שמלווה הנושאים שנכנסה לכנסת בוודאי,נשים,0.54583097,"('0.015*""לקידום"" + 0.014*""מעמד"" + 0.014*""האישה"" + 0.014*""הכלכלית"" + 0.011*""התקציב"" + 0.010*""התכנית"" + 0.009*""מגדרי"" + 0.009*""פרק"" + 0.009*""פותחת"" + 0.008*""נשים""',)",1
16594,בסעיף האחרון שעל הכנסה ניכויים מהכנסות משקיעים בסרט ישראלי הוראת התשעו-2015,קורונה,0.54576683,"('0.018*""הפנים"" + 0.018*""הקורונה"" + 0.017*""הוראת"" + 0.014*""הסביבה"" + 0.013*""והגנת"" + 0.012*""נגיף"" + 0.011*""החוקה"" + 0.010*""המשפטי"" + 0.010*""לחוק"" + 0.010*""סמכויות""',)",1
2249,לקידום מעמד האישה ולשוויון מגדרי דיווח מחש והמשטרה מניעה וטיפול בהטרדות מיניות,נשים,0.5457524,"('0.015*""לקידום"" + 0.014*""מעמד"" + 0.014*""האישה"" + 0.014*""הכלכלית"" + 0.011*""התקציב"" + 0.010*""התכנית"" + 0.009*""מגדרי"" + 0.009*""פרק"" + 0.009*""פותחת"" + 0.008*""נשים""',)",1
20602,במרתון פגישות ממשיכים סדרת ההסדרים והכנתו לתקציב קצר המלאכה מרובה והפועלים עצלים יחסית מצומצם וממוקד דנים בפרק תחבורה התכנית הכלכלית חקיקה ליישום המדיניות הכלכלית התקציב ו-2022 בסעיף 58 פקודת הקרקעות,נשים,0.545368,"('0.015*""לקידום"" + 0.014*""מעמד"" + 0.014*""האישה"" + 0.014*""הכלכלית"" + 0.011*""התקציב"" + 0.010*""התכנית"" + 0.009*""מגדרי"" + 0.009*""פרק"" + 0.009*""פותחת"" + 0.008*""נשים""',)",1
2404,משפט זוכר אמרתי בישיבה האחרונה בעיניי אישי הופתעתי הסתבר שמקובל אצלנו הסבלנות נדרשת והסבלנות משתלמת בשבוע קיימתי שיחה אחראי הקרן הנורבגית וכמו שאומרים באידיש וַאחֵד חתיכת 13 טריליון דולר בשיחה כשהוא סקר היסטוריית הקרן הפתיע כשהוא שב-1990 קמה הקרן הנורבגית ושש 1996 נכנס לשם שקל דולר קורונה שש הקרן קיימת ככותרת בקופה,קורונה,0.5453526,"('0.011*""הבריאות"" + 0.006*""החולים"" + 0.005*""הדברים"" + 0.004*""צריכים"" + 0.004*""חולים"" + 0.004*""הקורונה"" + 0.004*""הציבור"" + 0.004*""בתי"" + 0.003*""בתחום"" + 0.003*""שצריך""',)",1
24454,נפתח השקיפות שמחה החקלאות ופיתוח הכפר בראשות המנכל שלמה אליהו ביחד המשרד איתנו כרגיל החברה אזרחית והארגונים שביקשו לכאן,חינוך,0.5452944,"('0.051*""החינוך"" + 0.014*""התרבות"" + 0.012*""והספורט"" + 0.010*""איתנו"" + 0.008*""חינוך"" + 0.006*""הבריאות"" + 0.005*""הספר"" + 0.005*""הלימודים"" + 0.005*""מכן"" + 0.005*""במערכת""',)",1
