,NonStopwordsQuoteText,Topic,Topic_Prob,TopicWords,Batch
4116,ישיבה הפנים והגנת הסביבה בפתח הדברים להתייחס לרצח הנוראי התבשרנו בבוקר אסתר הורגן לשישה שנרצחה ברוטאלי בזמן שיצאה לרוץ ביער קורע מטריד מדאיג מכעיס להביע מכאן צער ותנחומים למשפחה,תחבורה,0.69947046,"('0.018*""התחבורה"" + 0.017*""הדין"" + 0.016*""המדע"" + 0.014*""הציבורית"" + 0.014*""והטכנולוגיה"" + 0.013*""ציבורית"" + 0.007*""עורכת"" + 0.007*""תחבורה"" + 0.006*""המקומי"" + 0.005*""העיר""',)",6
3104,הצעות היושב-ראש שאפשר ליישם אותן בישראל בארצות הברית שלקחו דמי החלת ונתנו למעסיקים שאנשים יקבלו דמי חלת ויישבו מניע המשק כזו המעסיקים יכולים להמשיך להניע הגלגלים ואותו עובד יקבל משכורת,נשים,0.6994259,"('0.024*""נשים"" + 0.007*""ציבור"" + 0.006*""אלימות"" + 0.006*""הכנסה"" + 0.005*""מוסדות"" + 0.005*""הנשים"" + 0.004*""לנשים"" + 0.003*""חייבת"" + 0.003*""במשפחה"" + 0.003*""רשימה""',)",6
7949,מקיימים בתקופה האחרונה נדרשים תוך תקופה קצרה הקודם חודשים הרשויות המקומיות דנו מהיבטים אבטחת מידע הגנה בפני מתקפת סייבר ועכשיו נדרשים לדון דרישות כופר,נשים,0.69926065,"('0.016*""מעמד"" + 0.015*""האישה"" + 0.014*""לקידום"" + 0.010*""מגדרי"" + 0.009*""נשים"" + 0.008*""ולשוויון"" + 0.007*""פותחת"" + 0.004*""הנשים"" + 0.003*""מינית"" + 0.003*""שמחה""',)",6
9056,בישיבה הקודמת ברכתי במזל תומר שבנו התארס ולך גור נבחרת במכרז היועץ המשפטי חוקה ומשפט כמחליפה סיגל מאחלים הצלחה הצלחה,כלכלי,0.69920665,"('0.003*""צריכים"" + 0.003*""מעונות"" + 0.003*""לעסקים"" + 0.002*""ימים"" + 0.002*""מצד"" + 0.002*""מדינה"" + 0.002*""הכלכלה"" + 0.002*""עליה"" + 0.002*""כפולה"" + 0.002*""לומדים""',)",6
6399,והניסיונות לאפשר הרצון לאפשר שימוש בשירותי התשלום החדשים המשתנים הבהירו סיכון צריכים לוודא שתהיה רמת אבטחה נאותה לחשוף הלקוח להונאות חשש משימוש לרעה צריכים מיני מהלכים שנוכל בסופו לקדם אמצעי התשלום בכך נגביר נפחית עלויות נייצר שיגרה נוחה עבור הלקוחות נצמצם הכלכלה השחורה,נשים,0.69885296,"('0.016*""מעמד"" + 0.015*""האישה"" + 0.014*""לקידום"" + 0.010*""מגדרי"" + 0.009*""נשים"" + 0.008*""ולשוויון"" + 0.007*""פותחת"" + 0.004*""הנשים"" + 0.003*""מינית"" + 0.003*""שמחה""',)",6
4990,צוהריים שמחה החינוך התרבות והספורט שאמונה צער שמחה לתיקון להסדרת הפיקוח כלבי ההפקר לחברתי יסמין פרידמן שנמצאת איתנו שיחד איתה פועלת חוסר מעש איזשהו אור יכולים לפועל לאופק פיילוט שלמעשה יבוא ויסדיר ולתמיד עניין כלבי ההפקר בסופו משנה לשנה האוכלוסייה גדלה שישה חודשים ארבעה שישה שמונה גורים מכפילים משלשים וכולי,נשים,0.6987492,"('0.016*""מעמד"" + 0.015*""האישה"" + 0.014*""לקידום"" + 0.010*""מגדרי"" + 0.009*""נשים"" + 0.008*""ולשוויון"" + 0.007*""פותחת"" + 0.004*""הנשים"" + 0.003*""מינית"" + 0.003*""שמחה""',)",6
5152,עצרנו בסעיף שכר ההסדר ונחזור אליו הושגה התקדמות הקראנו ודיברנו ונחזור אליו שניכנס נתקדם,כלכלי,0.6986577,"('0.003*""צריכים"" + 0.003*""מעונות"" + 0.003*""לעסקים"" + 0.002*""ימים"" + 0.002*""מצד"" + 0.002*""מדינה"" + 0.002*""הכלכלה"" + 0.002*""עליה"" + 0.002*""כפולה"" + 0.002*""לומדים""',)",6
82,העניינים שנמצאים יומנו בישיבה שבמידה מסוימת קשורים האחד הכרזת סמכויות מיוחדות להתמודדות נגיף הקורונה הוראת בידוד שלש שנכנס לישראל בנסיבות מיוחדות 2 התשפב-2021 והשני סמכויות מיוחדות להתמודדות נגיף הקורונה הוראת חובת ביצוע בדיקה בכניסה לישראל 5 התשפב-2021,קורונה,0.6985049,"('0.029*""הקורונה"" + 0.021*""הוראת"" + 0.014*""נגיף"" + 0.011*""סמכויות"" + 0.008*""להתמודדות"" + 0.008*""לחוק"" + 0.008*""מיוחדות"" + 0.008*""1"" + 0.007*""2"" + 0.007*""התקנות""',)",6
4638,מהרגע אמרתי שבתוך סעיפים יהפכו באמצעותי לחוק בנוסף אזרח במדינה ישלם החובות לרשות המקומית ובכלל שמוסר התשלום האזרחים מוסר גבוה ויכוח העיקרון אזרח לשלם החובות לרשות המקומית מצד משלם סיבות משלם עבריין להגדיר משלמים עבריינים כחברה מוכנים רחוק בהתעמרות מולו לתשלום החוב,כלכלי,0.69803256,"('0.003*""צריכים"" + 0.003*""מעונות"" + 0.003*""לעסקים"" + 0.002*""ימים"" + 0.002*""מצד"" + 0.002*""מדינה"" + 0.002*""הכלכלה"" + 0.002*""עליה"" + 0.002*""כפולה"" + 0.002*""לומדים""',)",6
9999,מאז דממת אלחוט הניסיונות איזשהו מענה קיבלנו התייחסות אליהם למעט בחול ההוא שייתן תשובה הנה וועדה,נשים,0.6979194,"('0.016*""מעמד"" + 0.015*""האישה"" + 0.014*""לקידום"" + 0.010*""מגדרי"" + 0.009*""נשים"" + 0.008*""ולשוויון"" + 0.007*""פותחת"" + 0.004*""הנשים"" + 0.003*""מינית"" + 0.003*""שמחה""',)",6
9198,בפתח דבריי שהדיון פניו אמור ענייני וממוקד קצר מהטעם הפשוט שמסתבר מסתבר שכבר התקבלו החלטות ואולי הוקצו תקציבים שותף לתהליך בשנים האחרונות יעדכן יחדד יסביר,תחבורה,0.6978248,"('0.018*""התחבורה"" + 0.017*""הדין"" + 0.016*""המדע"" + 0.014*""הציבורית"" + 0.014*""והטכנולוגיה"" + 0.013*""ציבורית"" + 0.007*""עורכת"" + 0.007*""תחבורה"" + 0.006*""המקומי"" + 0.005*""העיר""',)",6
5746,הנוסח מבטא ההסכמות שאליהן הגענו הייעוץ המשפטי ההצעות שמונחות בפניכם הצעות ברובן מוסכמות פערים מחלוקות סומנו המחלוקות בגוף מסומנות בצהוב,נשים,0.69762635,"('0.024*""נשים"" + 0.007*""ציבור"" + 0.006*""אלימות"" + 0.006*""הכנסה"" + 0.005*""מוסדות"" + 0.005*""הנשים"" + 0.004*""לנשים"" + 0.003*""חייבת"" + 0.003*""במשפחה"" + 0.003*""רשימה""',)",6
4093,חשבנו ייקח שבועיים ככל שצללו אנשי המקצוע שצריך שינוי מהותי יסודי משמעותי שלקח חודשיים שבועיים נולדה בשיתוף פעולה ובהידברות מרכז השלטון המקומי שחלק מהארגונים זכו למפגש ושמעו הדברים מופיע לקראת,חינוך,0.69752544,"('0.076*""החינוך"" + 0.020*""התרבות"" + 0.017*""והספורט"" + 0.012*""חינוך"" + 0.011*""הלימודים"" + 0.009*""במערכת"" + 0.008*""שנת"" + 0.008*""בחינוך"" + 0.007*""מערכת"" + 0.007*""הספורט""',)",6
8261,סיעת מרצ שלושה חמשת חבריה בפאנלים בשעות האלו יוכלו להשתתף בהצבעה שבדקתי זהבה גלאון,עולים,0.6971231,"('0.016*""העלייה"" + 0.015*""עולים"" + 0.013*""הקליטה"" + 0.011*""אתיופיה"" + 0.010*""יוצאי"" + 0.009*""העולים"" + 0.007*""חדשים"" + 0.007*""חברתי"" + 0.006*""והקליטה"" + 0.005*""מקיימים""',)",6
3328,מברך ראשי רשויות שנמצאים איתנו היינו סגורה בהיקף מצומצם מועצת בנימין היוצא אבי לנחם האסון הכבד ידעתי שתהיו פתח איתי לטקו הבוקר השיח כשהוועדה התעכבה חמש שרואה הכתבה הקבורה ושומע הדיבורים אנשי היישוב פסגות שמונה נפשות שהלכו להישאר עין יבשה,נשים,0.6971076,"('0.024*""נשים"" + 0.007*""ציבור"" + 0.006*""אלימות"" + 0.006*""הכנסה"" + 0.005*""מוסדות"" + 0.005*""הנשים"" + 0.004*""לנשים"" + 0.003*""חייבת"" + 0.003*""במשפחה"" + 0.003*""רשימה""',)",6
15707,רב לפניות הציבור שריפות הענק וזיהום האוויר באתרי פסולת סביב העיר אשדוד והאזור כולו בישיבת מעקב שהתקיים שתאריך 2152017 כלל התאריך העברי,חינוך,0.696914,"('0.076*""החינוך"" + 0.020*""התרבות"" + 0.017*""והספורט"" + 0.012*""חינוך"" + 0.011*""הלימודים"" + 0.009*""במערכת"" + 0.008*""שנת"" + 0.008*""בחינוך"" + 0.007*""מערכת"" + 0.007*""הספורט""',)",6
10105,להקדים נושאים סל התרופות כיוון המסדרת עשינו מעקב פיזור ממשיכים מעקב שוטף,קורונה,0.6966885,"('0.029*""הקורונה"" + 0.021*""הוראת"" + 0.014*""נגיף"" + 0.011*""סמכויות"" + 0.008*""להתמודדות"" + 0.008*""לחוק"" + 0.008*""מיוחדות"" + 0.008*""1"" + 0.007*""2"" + 0.007*""התקנות""',)",6
3095,להחזיק במקל בשני הקצוות מצד לטעון חברה ליברלית שוויונית ומתן הזדמנויות וכן הלאה וכן הלאה ומצד שבכל לנשים לגברים לגמרי הבדלים פיזיולוגיים ברורים נשים לגברים לגמרי גברים שמתאימים לתפקידים מסוימים מנשים שמתאימות לתפקידים מסוימים גברים מתאימים לחלק מהתפקידים בצבא והם אכן מתמיינים מצליחים לעמוד במשימות ועדיין נשים שכן מתאימות לתפקידים רוצות אסור שאומרים להן אתן יכולות אתן מין מסוים ממין,בריאות,0.69640595,"('0.022*""החולים"" + 0.022*""בתי"" + 0.017*""הספר"" + 0.010*""הבריאות"" + 0.010*""בבתי"" + 0.010*""חולים"" + 0.005*""השואה"" + 0.005*""לבתי"" + 0.004*""קופות"" + 0.004*""ניצולי""',)",6
8652,חבריי ברשותכם ברביזיה החשובה המרכז לגביית קנסות אגרות והוצאות 22 התשפב-2021 מ/1463 נוכחות השר שבדיון שקיימנו מזכיר לחברי וחברות שמדובר שמאפשרת מתן פיצוי מקדמי לנפגעי ונפגעות עבירה שנפסק לטובתם פיצוי מעין פיצוי מקדמי סיוע ראשוני כספי לנפגע עבירה ולמשפחה הקרבן,כלכלי,0.6962652,"('0.004*""הדברים"" + 0.004*""האוצר"" + 0.003*""גופים"" + 0.003*""הביטחון"" + 0.003*""להגנת"" + 0.003*""שוק"" + 0.003*""הרשות"" + 0.003*""המשרד"" + 0.003*""ההון"" + 0.003*""הגופים""',)",6
10076,להמשיך הכספים התגמולים לנפגעי פעולות איבה זכאות ליתום שהתייתם משני הוריו 37 התשעח-2018 פרטית נולדה עקב העובדה שבעבר בזמן התקציב עשינו נפגעים שנפגעו כתוצאה מפעולת איבה נהרגו הוריהם העברנו שמסייע לאותם יתומים קיימים ונפגעו בפעולת איבה עשינו 37 התברר יתומים 37 פי קריטריונים ששני הוריהם נהרגו והם התייתמו,כלכלי,0.69609267,"('0.004*""הדברים"" + 0.004*""האוצר"" + 0.003*""גופים"" + 0.003*""הביטחון"" + 0.003*""להגנת"" + 0.003*""שוק"" + 0.003*""הרשות"" + 0.003*""המשרד"" + 0.003*""ההון"" + 0.003*""הגופים""',)",6
19217,הכלכלה חבריי רשם פרלמנטרי ממ ננסה פעמיים חדשה מדבר אליו שבאמת חדשה בשבילי מימי בסדר גמור פי מרגיש,כלכלי,0.6958366,"('0.003*""צריכים"" + 0.003*""מעונות"" + 0.003*""לעסקים"" + 0.002*""ימים"" + 0.002*""מצד"" + 0.002*""מדינה"" + 0.002*""הכלכלה"" + 0.002*""עליה"" + 0.002*""כפולה"" + 0.002*""לומדים""',)",6
13991,למניעת הסתננות עבירות ושיפוט הוראת 4 הארכת תוקף התשעט-2018 בקשה מחדש שהגישה יעל כהן-פארן הרביזיה,קורונה,0.6958167,"('0.029*""הקורונה"" + 0.021*""הוראת"" + 0.014*""נגיף"" + 0.011*""סמכויות"" + 0.008*""להתמודדות"" + 0.008*""לחוק"" + 0.008*""מיוחדות"" + 0.008*""1"" + 0.007*""2"" + 0.007*""התקנות""',)",6
858,המנכל הקודמת עוברים לישיבה טבריה דנים המשבר הכלכלי הפוקד העיר טבריה רשויות לקיים עליהן נעשה מקבל פניות,תחבורה,0.69536287,"('0.018*""התחבורה"" + 0.017*""הדין"" + 0.016*""המדע"" + 0.014*""הציבורית"" + 0.014*""והטכנולוגיה"" + 0.013*""ציבורית"" + 0.007*""עורכת"" + 0.007*""תחבורה"" + 0.006*""המקומי"" + 0.005*""העיר""',)",6
5818,מעמדה הזכות לסביבה ראויה במשפט הישראלי הדברים הוגדרו בכותרת כזכות יסוד מציע הדברים בפרספקטיבה מרחיבה השאלה יסוד סביבה ראויה רמת ההגנה שקיימת במשפט הישראלי לזכות ואחת מאיתנו לסביבה ראויה כזכות שעומדת בפני עצמה כנגזרת ישירה הזכות הראשונה יסוד האדם וחירותו שמדברת השמירה חייו עקרוני רעיוני מבחינתי בהחלט שצריכות תולדות מעשיות להמשך הדרך ככל שהדברים תלויים נתרום חלקנו בביצור ההגנה המשפטית זכות היסוד חקיקת יסוד ובין כלים נורמטיביים,נשים,0.69527483,"('0.016*""מעמד"" + 0.015*""האישה"" + 0.014*""לקידום"" + 0.010*""מגדרי"" + 0.009*""נשים"" + 0.008*""ולשוויון"" + 0.007*""פותחת"" + 0.004*""הנשים"" + 0.003*""מינית"" + 0.003*""שמחה""',)",6
14002,נחכה יגיעו אפנה למשרד החינוך התהליך התקדמתם מהדיון האחרון קורה נאמני הבריאות,בריאות,0.6951843,"('0.022*""החולים"" + 0.022*""בתי"" + 0.017*""הספר"" + 0.010*""הבריאות"" + 0.010*""בבתי"" + 0.010*""חולים"" + 0.005*""השואה"" + 0.005*""לבתי"" + 0.004*""קופות"" + 0.004*""ניצולי""',)",6
3243,מבקשים לתקן טעות שנפלה בעדכון אגרות שוטף בשנה שעברה ולהפחית לתקופה אגרות הרכב הפרטי והמסחרי שלושה טון שקבועים בתוספת הראשונה לתקנות התעבורה בסכומי הפרשי גבייה עודפת שנוצרה עקב טעות מצערת שהייתה בעדכון אגרות שנכנסו לתוקף 1 באפריל,קורונה,0.695162,"('0.029*""הקורונה"" + 0.021*""הוראת"" + 0.014*""נגיף"" + 0.011*""סמכויות"" + 0.008*""להתמודדות"" + 0.008*""לחוק"" + 0.008*""מיוחדות"" + 0.008*""1"" + 0.007*""2"" + 0.007*""התקנות""',)",6
5201,אגרות המוטלות החקלאים המעסיקים עובדים זרים מעקב שניכנס אתן בריף קצר ההיסטוריה ערכנו דיונים ב-201 וב-165 שבגדול שביקשתי אקריא המכתב ביקשתי האגרות אלאה פותחים מחדש ביקשתי איחוד והפחתת האגרות המוטלות החקלאים ופישוט ההליך הבירוקרטי להתאים כמות המכסה העובדים לנושא החקלאות חקלאות,כלכלי,0.69491816,"('0.003*""צריכים"" + 0.003*""מעונות"" + 0.003*""לעסקים"" + 0.002*""ימים"" + 0.002*""מצד"" + 0.002*""מדינה"" + 0.002*""הכלכלה"" + 0.002*""עליה"" + 0.002*""כפולה"" + 0.002*""לומדים""',)",6
13201,ולכולן פותחת לקידום מעמד האישה ולשוויון מגדרי 20 ליולי,נשים,0.69477314,"('0.016*""מעמד"" + 0.015*""האישה"" + 0.014*""לקידום"" + 0.010*""מגדרי"" + 0.009*""נשים"" + 0.008*""ולשוויון"" + 0.007*""פותחת"" + 0.004*""הנשים"" + 0.003*""מינית"" + 0.003*""שמחה""',)",6
4490,מיקור שהייתה אי-הבנה הדברים והגענו להסכמות סביב העניין מרגע שהגענו להסכמות החדשות תהיינה ושלא יחשוב שהן תהיינה במיקור מצאנו עצמנו בהתקדמות לצאת תסייעו לסיים שיותר מהר לבנת חבלה שאיימה לפוצץ התהליך משפט בהקשר מנכל התאגיד יאמר דברו בקשה מנכל התאגיד אלדד קובלנץ קונספירציה עניין פוליטי מבין הלחצים מבין המתח שמתקיים בוודאי אצל העובדים ובנקודה המנכל שנמצא נותן הגיבוי שהעגלה תצא,בריאות,0.69436616,"('0.022*""החולים"" + 0.022*""בתי"" + 0.017*""הספר"" + 0.010*""הבריאות"" + 0.010*""בבתי"" + 0.010*""חולים"" + 0.005*""השואה"" + 0.005*""לבתי"" + 0.004*""קופות"" + 0.004*""ניצולי""',)",6
6591,היושב-ראש עיקר התקנות להשתמש במושג אשתמש עדכון טכני ב-17 באוגוסט נחתם הסכם קיבוצי הרופאים הווטרינרים והממונה השכר החיל ביולי ההסכם הקיבוצי הרופאים הווטרינרים שמועסקים מועצת הלול שבודקים השירות הווטרינרי במשחטות ובמקומות נדרשים לבצע עדכונים ההסכם הקיבוצי פלוס מכניסים שתי אגרות חדשות לאור העדכונים הטכנולוגיים קיימות בדיקות נוספות חיידקים מבקשים להכניס לתוך התקנות שהמועצה תוכל לבצע הבדיקות ולגבות האגרות הנדרשות לממן עלויות הבדיקה,חינוך,0.694271,"('0.007*""החינוך"" + 0.007*""גבוהה"" + 0.006*""הגבוהה"" + 0.006*""להשכלה"" + 0.004*""ההשכלה"" + 0.004*""במוסדות"" + 0.004*""מודה"" + 0.004*""התרבות"" + 0.004*""החשמל"" + 0.004*""האנרגיה""',)",6
17870,דנים לקראת הקריאה השנייה והשלישית סמכויות מיוחדות להתמודדות נגיף הקורונה הוראת 7 בידוד בפיקוח טכנולוגי שנכנס לישראל התשפא-2021,קורונה,0.6941438,"('0.029*""הקורונה"" + 0.021*""הוראת"" + 0.014*""נגיף"" + 0.011*""סמכויות"" + 0.008*""להתמודדות"" + 0.008*""לחוק"" + 0.008*""מיוחדות"" + 0.008*""1"" + 0.007*""2"" + 0.007*""התקנות""',)",6
1121,ממשיכים בענייני הגנת הסייבר באים מדיון שעסק ספציפית בהגנה גופים חיוניים שעלה לכותרות לאחרונה ההתקפה שלפחות פי התקשורת יוחסה לאיראן גופי שמענו סקירה מעניינת מרתקת ומאוד יסודית ההיערכות הגופים החיוניים,נשים,0.6938515,"('0.016*""מעמד"" + 0.015*""האישה"" + 0.014*""לקידום"" + 0.010*""מגדרי"" + 0.009*""נשים"" + 0.008*""ולשוויון"" + 0.007*""פותחת"" + 0.004*""הנשים"" + 0.003*""מינית"" + 0.003*""שמחה""',)",6
9107,החוץ והביטחון החליטה לכאן לשדרות הבוקר ה-11 למבצע שומר החומות משום שחוץ מההיבט הביטחוני נגיד החשאי תוכניות הפעולה צהל כוחות הביטחון ושל הדרג המדיני מערך שלם שצריך לטפל בזמן אמת השיח האזרחי הפרלמנט להמתין שוך הקרבות ואחר שמי שיוצא למבצע בסדר גודל משנה מהן הנסיבות נדבר בהמשך הציבור וצריך קשוב לצרכים שעולים,כלכלי,0.69382375,"('0.004*""הדברים"" + 0.004*""האוצר"" + 0.003*""גופים"" + 0.003*""הביטחון"" + 0.003*""להגנת"" + 0.003*""שוק"" + 0.003*""הרשות"" + 0.003*""המשרד"" + 0.003*""ההון"" + 0.003*""הגופים""',)",6
12623,פותחים סמכויות מיוחדות להתמודדות נגיף הקורונה הוראת הגבלת היציאה מישראל למעשה קבצי 6 ותיקון 7 כשבכל רשימה מדינות אינני טועה 6 נכנסו ב-23 לחודש שישי האחרון והתקנות בתיקון 7 עתידות להיכנס לתוקף ב-30 ביולי שישי הקרוב,קורונה,0.6937873,"('0.029*""הקורונה"" + 0.021*""הוראת"" + 0.014*""נגיף"" + 0.011*""סמכויות"" + 0.008*""להתמודדות"" + 0.008*""לחוק"" + 0.008*""מיוחדות"" + 0.008*""1"" + 0.007*""2"" + 0.007*""התקנות""',)",6
2535,רב השלום בבאר שבע מהגוש הקומוניסטי מברטיסלבה כתבתי בלטינית שוק מילים עבריות מביא המוסיף גורע שוק למדנו יבואני הרכב הזעירים,כלכלי,0.6933307,"('0.004*""הדברים"" + 0.004*""האוצר"" + 0.003*""גופים"" + 0.003*""הביטחון"" + 0.003*""להגנת"" + 0.003*""שוק"" + 0.003*""הרשות"" + 0.003*""המשרד"" + 0.003*""ההון"" + 0.003*""הגופים""',)",6
10943,שינוי בסכומים המוקצים להתמודדות המשבר שנוצר בשל התפשטות נגיף הקורונה מציג הפנייה,קורונה,0.69305754,"('0.029*""הקורונה"" + 0.021*""הוראת"" + 0.014*""נגיף"" + 0.011*""סמכויות"" + 0.008*""להתמודדות"" + 0.008*""לחוק"" + 0.008*""מיוחדות"" + 0.008*""1"" + 0.007*""2"" + 0.007*""התקנות""',)",6
7633,השפעת הסביבה והאקלים בריאות הציבור טז בטבת תשפב 20 בדצמבר חברים וחברות שבזום ואלה שנמצאים אתנו חודשיים ארגון הבריאות העולמי הכריז שמשבר האקלים האיום הבריאותי הגדול בזמן שהארגון נלחם כוחו הפנדמיה ומחלת הקורונה ובכל שינוי האקלים מהווה איום בריאותי לכאורה מכריז הצורך להיערך לקראת הפגיעה הבריאותית הקשורה בשינוי האקלים בפועל ההיערכות דלה הנה בזמן ועידת האקלים בגלזגו מזכל האום הכריז ש-50% מהמימון וההשקעות שהולכות לכיוון שינויי אקלים צריכים בהיערכות לאדפטציה למזער נזקים ובין היתר נזקים בריאותיים; בפועל כ-20%- 25% מיועדים,חינוך,0.69297415,"('0.076*""החינוך"" + 0.020*""התרבות"" + 0.017*""והספורט"" + 0.012*""חינוך"" + 0.011*""הלימודים"" + 0.009*""במערכת"" + 0.008*""שנת"" + 0.008*""בחינוך"" + 0.007*""מערכת"" + 0.007*""הספורט""',)",6
2797,למסגר נדבר החלק המבני ניגע בקרנות נייעד נפרד נעבור הסעיף מילים ולעדכן בלילה ארוך שהסתיים בשתיים בלילה השתתפו חברות שניהלו המשא ומתן האוצר אפרת רייטן נעמה לזימי גידא רינאוי זועבי רוזין אימאן חטיב יאסין והצטרפו חברות נירה שפק וטטיאנה מזרסקי פספסתי ירדנו לפרטים מתווה הסיוע לנשים בעקבות העלאת הפרישה ירדנו לפרטים והגענו הסיכומים הסיכומים בניסוח הלשכה המשפטית האוצר שבשבוע נביא לוועדה ונוכל להתקדם,עולים,0.69273096,"('0.016*""העלייה"" + 0.015*""עולים"" + 0.013*""הקליטה"" + 0.011*""אתיופיה"" + 0.010*""יוצאי"" + 0.009*""העולים"" + 0.007*""חדשים"" + 0.007*""חברתי"" + 0.006*""והקליטה"" + 0.005*""מקיימים""',)",6
921,המשפט ביטל הסעיפים האלו תוך השהה הביטול לפרק ששה חודשים במסגרתם העמיד תקופת השהייה המרבית במרכז לתקופה 12 חודשים בתקופה למחוקק פרק משמעותי הסדר חקיקתי ככל נביא הסדר חקיקתי בפרק שיחלוף בשבוע תפקע הסמכות הממונה ביקורת הגבולות להוציא הוראת שהייה למסתננים ומשמעות סגירת מרכז השהייה חולות,נשים,0.69263047,"('0.024*""נשים"" + 0.007*""ציבור"" + 0.006*""אלימות"" + 0.006*""הכנסה"" + 0.005*""מוסדות"" + 0.005*""הנשים"" + 0.004*""לנשים"" + 0.003*""חייבת"" + 0.003*""במשפחה"" + 0.003*""רשימה""',)",6
