,NonStopwordsQuoteText,Topic,Topic_Prob,TopicWords,Batch
2492,בעקבות הקודם שבו דיברנו שמעגנים הזכות העובד לצאת הבחירות המקדימות שהמעסיק ימנע היציאה לשם עוברת לאכסניה המפלגות שמוצע עובד במפלגה יוכל להיעדר מעבודתו שבו מתקיימות בחירות מקדימות בחירות מועמדי המפלגה לתפקיד יושב המפלגה ובמקרים למסור למעסיק הודעה עומד לצאת משך ההיעדרות הצפוי 14 ימים שהמעסיק יוכל להיערך בהתאמה,קורונה,0.6658862,"('0.037*""הקורונה"" + 0.029*""שקלים"" + 0.024*""הוראת"" + 0.024*""מיליון"" + 0.022*""נגיף"" + 0.016*""סמכויות"" + 0.013*""מיוחדות"" + 0.013*""להתמודדות"" + 0.012*""שקל"" + 0.011*""פעילות""',)",3
1638,עוסק בפרקטיקה הצבאית פלישות לבתי פלסטינים בגדה המערבית וההשלכות הפלישות הללו בריאות הנפש המשפחות הפלסטיניות לרבות,עולים,0.66584,"('0.011*""אתיופיה"" + 0.008*""יוצאי"" + 0.007*""הנוער"" + 0.007*""נוער"" + 0.007*""הארץ"" + 0.006*""פערים"" + 0.006*""הגבוהה"" + 0.005*""הסטודנטים"" + 0.005*""ההשכלה"" + 0.005*""הפריפריה""',)",3
18346,החינוך התרבות והספורט ה-7 בפברואר יא בשבט תשעז נוער גלישה בטוחה לציון זכויות קיימה בבוקר זכויות ומחסור לכאורה בסטודנטים לווטרינריה שמובילה רויטל סויד שמחויבת לנושא קיימה בסוגיה,חינוך,0.6657605,"('0.112*""החינוך"" + 0.033*""התרבות"" + 0.028*""והספורט"" + 0.015*""חינוך"" + 0.013*""בסעיף"" + 0.010*""במערכת"" + 0.010*""הלימודים"" + 0.009*""מוסדות"" + 0.008*""שנת"" + 0.007*""מערכת""',)",3
1206,חייב שחברי טרכטנברג תשימו אילן גילאון מנואל טרכטנברג מאיר כהן יגאל גואטה טלי חודורוב,חינוך,0.6655532,"('0.013*""גבוהה"" + 0.007*""להשכלה"" + 0.006*""בתחום"" + 0.006*""אילן"" + 0.005*""המשרד"" + 0.005*""מחקר"" + 0.004*""הבאה"" + 0.004*""החינוך"" + 0.004*""ברמה"" + 0.004*""רבים""',)",3
3993,לשבח ידידי אורי מקלב המחוקקים החברתיים היותר עברה חשובה בקריאה טרומית גאים הסתפחנו שיזם רץ ועושה ובעזרת יברך המוגמר ידידי הטוב איש דגל התורה לגאווה מאחל המפלגות,דיור,0.66555065,"('0.016*""ערך"" + 0.011*""שירותים"" + 0.008*""ניירות"" + 0.008*""פיננסיים"" + 0.008*""דירות"" + 0.007*""הבנקים"" + 0.007*""ציבורי"" + 0.007*""דירה"" + 0.006*""הפיקוח"" + 0.006*""דיור""',)",3
5512,מודה לאנשי המים ומקורות משום ומינהל אזרחי שעמלו רבות והגמר יוש הגמר פיקוד מרכז שעמלו רבות לספק במכליות בשקיות במענים שונים ובמכלים זמניים זמניים מענה לטווח הקצר והבינוני הטווח הארוך שכן ראינו התקדמות וכן ראינו קודמו ממלא משה לירזי ראינו מישיבה לישיבה איזו התקדמות הצגה קווים ותכניות ספציפיות קונקרטיות ופה סליחה שמעתי ממי שמונה הבטחות גבוהה-גבוהה שכאן מופיע זלזול,עולים,0.66529894,"('0.005*""בישראל"" + 0.004*""המשטרה"" + 0.004*""התפוצות"" + 0.004*""העולים"" + 0.004*""הרב"" + 0.004*""דרכים"" + 0.003*""החדשים"" + 0.003*""הדיווח"" + 0.003*""מקרים"" + 0.003*""מלחמה""',)",3
6290,שהחלטתי לעסוק בחינת המענה בחירום לאנשים מוגבלויות בזמן חירום בחודש נובמבר קיימנו חשבתי בקרה שגרתי ונוכל לעבור לנושא גיליתי שכלל הגופים ציינו יכולים לפעול הבסיס לסמכות ולאחריות שואבים מחמש שבמשך אושרו,עולים,0.6645117,"('0.005*""בישראל"" + 0.004*""המשטרה"" + 0.004*""התפוצות"" + 0.004*""העולים"" + 0.004*""הרב"" + 0.004*""דרכים"" + 0.003*""החדשים"" + 0.003*""הדיווח"" + 0.003*""מקרים"" + 0.003*""מלחמה""',)",3
6846,לחיילים בודדים בשחרור ובשירות 5 ה-10 בנובמבר דיונים הרב הקדימו המליאה והיא מתחילה בשעה 1100 מוגבלים בזמן להספיק הדיונים ואבקש מהדוברים שיותר תכליתיים שנוכל לחפש הפתרונות ולמצות המטרות,עולים,0.6644581,"('0.005*""בישראל"" + 0.004*""המשטרה"" + 0.004*""התפוצות"" + 0.004*""העולים"" + 0.004*""הרב"" + 0.004*""דרכים"" + 0.003*""החדשים"" + 0.003*""הדיווח"" + 0.003*""מקרים"" + 0.003*""מלחמה""',)",3
946,הזכרתי בזאת הקודם הכנת פרקי ההסדרים קוראים ולומדים פרשת נוח הבסיס המדרשי והפרשני למושג שבע מצוות נוח שהן המצוות שחלות האדם לשיוכם הדתי ניכר שבע המצוות עוסק בבניית מערכת משפט מתוקנת וראויה למעשה פי הפרשנים והדרשנים ובעלי ההלכה המצווה להקים מערכת משפט להקים בתי דין ולמנות דיינים המצווה הראשונים שנצטוותה האנושות מחייב עמידה הדין והבטחה שתהיה מערכת אכיפה נאותה באותה נשימה הקפדה בזכויות הנאשמים בזכויות שהורשעו בדין,כלכלי,0.66415435,"('0.013*""האוצר"" + 0.008*""הכנסה"" + 0.007*""עסקים"" + 0.007*""הכספים"" + 0.006*""המשפטית"" + 0.006*""קטנים"" + 0.006*""ציבורית"" + 0.005*""לדון"" + 0.005*""האשראי"" + 0.004*""לחוק""',)",3
17038,צהרים להגברת התחרות ולצמצום הריכוזיות בשוק הבנקאות בישראל התשעו-2016 הדיונים שמתחילים הגברת התחרות וצמצום הריכוזיות בבנקאות,כלכלי,0.6641441,"('0.013*""האוצר"" + 0.008*""הכנסה"" + 0.007*""עסקים"" + 0.007*""הכספים"" + 0.006*""המשפטית"" + 0.006*""קטנים"" + 0.006*""ציבורית"" + 0.005*""לדון"" + 0.005*""האשראי"" + 0.004*""לחוק""',)",3
6719,נוסיף מרכזי החלוקה שסיכמנו מנת לעגן הדאגה שמרכזי החלוקה יפעלו בהוגנות כלפי הלקוחות והמשתמשים בשירות מכן נלך להמשך 36 ואילך פלוס סודיות נסיים,חינוך,0.6640519,"('0.013*""גבוהה"" + 0.007*""להשכלה"" + 0.006*""בתחום"" + 0.006*""אילן"" + 0.005*""המשרד"" + 0.005*""מחקר"" + 0.004*""הבאה"" + 0.004*""החינוך"" + 0.004*""ברמה"" + 0.004*""רבים""',)",3
5853,שמחים הניהול ביתך הניהול מילים שהעמדה בטח הרצון לחזק הפרקליטות קו החזית המרכזי במאבק בפשע המאורגן שעובר שנקרא והאינטרס שתהיה פרקליטות חזקה כשאני פרקליטות מתכוון מייצגי למיניהם בתחום אצל אצל הפרקליטוֹת פרקליטות בישיבה האחרונה הופיע פרקליט רושם שהייתה תחושה שהאיום עליהם ישתכנעו שהמגמה ההיפך לחזק,נשים,0.66404694,"('0.054*""נשים"" + 0.018*""אלימות"" + 0.017*""פנים"" + 0.015*""הנשים"" + 0.012*""לביטחון"" + 0.011*""מינית"" + 0.010*""למאבק"" + 0.008*""האלימות"" + 0.007*""שלהן"" + 0.007*""לנשים""',)",3
18188,גורע ממאות ואלפי נשים ראינו הקודם שיותר ויותר נשים ויותר ויותר פונים ומבקשים עזרה וסיוע האלימות חווים הבתים,נשים,0.6639931,"('0.054*""נשים"" + 0.018*""אלימות"" + 0.017*""פנים"" + 0.015*""הנשים"" + 0.012*""לביטחון"" + 0.011*""מינית"" + 0.010*""למאבק"" + 0.008*""האלימות"" + 0.007*""שלהן"" + 0.007*""לנשים""',)",3
5137,צריכים לברך כאנשי חינוך כוועדת חינוך קיום המיוחד המקום וצריכים במערכת החינוך עיסוק בקהילה הגאה למקום,עולים,0.66398317,"('0.005*""בישראל"" + 0.004*""המשטרה"" + 0.004*""התפוצות"" + 0.004*""העולים"" + 0.004*""הרב"" + 0.004*""דרכים"" + 0.003*""החדשים"" + 0.003*""הדיווח"" + 0.003*""מקרים"" + 0.003*""מלחמה""',)",3
1288,קיימתי ב-28 במרץ 2011 יושב דוד אזולאי דנו בנושאים ממה שקיבלנו מהוועדה אמור להסתיים תוך שנתיים היינו מתחילים אישורי בנייה וחיבורי חשמל החיבורים הדרושים לצערנו הרב מאז עברו מחמש זז תושבים צריכים הקנסות תושבים צריכים לרוץ לבית משפט לשלם לעורכי דין תושבים מחוברים לרשת החשמל מחוברים לרשת הביוב תשתיות וצריכים לחצות כביש מעצ כביש מסוכן תאונות פגע בהרבה תושבים השכונה נציג עיריית שפרעם סגן,עולים,0.66391504,"('0.027*""העלייה"" + 0.018*""הקליטה"" + 0.014*""מנכל"" + 0.013*""מר"" + 0.010*""מוגבלות"" + 0.010*""והקליטה"" + 0.008*""והתפוצות"" + 0.007*""לישראל"" + 0.007*""לאנשים"" + 0.006*""זכויות""',)",3
9348,יומנו המוכנות הטכנולוגית הפנים והרשויות לבחירות לרשויות המקומיות שתיים הפצת מידע כוזב ותקיפות סייבר והשפעתן מערכת הבחירות לרשויות המקומיות מיותר לציין העיתוי בחרנו במושב הנושאים בציר בחירות מקומיות שאמורות להתקיים בעוד כשבועיים ודאי וודאי דורש מאיתנו לעקוב בעידן בעידן הדיגיטלי בעידן הרשתות החברתיות הנלווה לכך מערכת הבחירות מתקיימת הטכנולוגיה המתחדשת משפיעה התנהלות הבחירות מטעם הרשויות המוסמכות,בריאות,0.66373086,"('0.032*""הבריאות"" + 0.028*""החולים"" + 0.017*""חולים"" + 0.007*""בתי"" + 0.007*""קופות"" + 0.005*""התקנות"" + 0.005*""בריאות"" + 0.005*""למשרד"" + 0.004*""לבתי"" + 0.004*""העורף""',)",3
7427,ודאי שיקרות לכולנו צריכים למצוא שביל הזהב הדברים הללו למצוא מקור חיצוני נקרא אובייקטיבי צד שלישי שעיניו תחזינה מישרים שאומרים שנדע איזו בקרה פיקוח היינו רגועים המציאות שואפים ועדיין שאיפתנו קיימת לנושא הסנגורים שעומדים הרגליים האחוריות יציעו הצעה חלופית שתהיה שעדיין נרגיש כשמגיע לשופט שיודע האיפכא מסתברא שהשופט יחשוב שומע צד עסקנו ולקראת סיכום ודאי שנחזור לעסוק עברנו המעצרים עוסקים בהגבלות שמטילים מסוים,עולים,0.6635436,"('0.027*""העלייה"" + 0.018*""הקליטה"" + 0.014*""מנכל"" + 0.013*""מר"" + 0.010*""מוגבלות"" + 0.010*""והקליטה"" + 0.008*""והתפוצות"" + 0.007*""לישראל"" + 0.007*""לאנשים"" + 0.006*""זכויות""',)",3
2563,ראוי ואסור ממליץ נתייחס לרקע הפרסונלי הפרטים הראשונים ההסכמים והאמצעים מסביב לחברה נקיים פתוח מקובל ברשותך להשלים,דיור,0.663337,"('0.016*""ערך"" + 0.011*""שירותים"" + 0.008*""ניירות"" + 0.008*""פיננסיים"" + 0.008*""דירות"" + 0.007*""הבנקים"" + 0.007*""ציבורי"" + 0.007*""דירה"" + 0.006*""הפיקוח"" + 0.006*""דיור""',)",3
4627,שנושאו המשבר ממשלת פולין והבקשה הוגשה למליאת בראשם יושבת לשמאלי איילת ורבין נחמיאס הפולני השואה מניח שאנשי החוץ יידעו לנסח הסטטוס העכשווי לאור הפרסומים מדויקת והכי רלוונטית להגביל עצמנו רגיל רגיל מבחינת הוקצתה ואין מנדט לחרוג מעבר לשתיים ורבע בחשבון,תחבורה,0.6620989,"('0.024*""התחבורה"" + 0.012*""הציבורית"" + 0.006*""בשבת"" + 0.005*""נקרא"" + 0.004*""קיבלתי"" + 0.004*""בחודש"" + 0.004*""בתחבורה"" + 0.004*""ציבורית"" + 0.004*""המיסים"" + 0.003*""לעבוד""',)",3
8163,מגישים ההתפלגות התפלגות טכנית לצורך הבחירות משקיפים קלפיות והבנתי שהמועד האחרון 59 הבחירות מגישים הבקשה לסיעה תעל בראשות אחמד טיבי הבקשה לאשר,קורונה,0.662034,"('0.037*""הקורונה"" + 0.029*""שקלים"" + 0.024*""הוראת"" + 0.024*""מיליון"" + 0.022*""נגיף"" + 0.016*""סמכויות"" + 0.013*""מיוחדות"" + 0.013*""להתמודדות"" + 0.012*""שקל"" + 0.011*""פעילות""',)",3
21648,נדון מדיניות זיהוי מבדל בתביעות אבהות יוצאי אתיופיה להדגיש אמנם הבקשות הגיעו אלינו יהודי אתיופיה ויוצאי אתיופיה מקרים כאלו בקרב עולים חדשים מעליות אחרות מברית המועצות לשעבר עולים שנתמקד ביוצאי אתיופיה שזו הפגיעה שהגיעה אלינו להתייחס למקרים,עולים,0.6618967,"('0.011*""אתיופיה"" + 0.008*""יוצאי"" + 0.007*""הנוער"" + 0.007*""נוער"" + 0.007*""הארץ"" + 0.006*""פערים"" + 0.006*""הגבוהה"" + 0.005*""הסטודנטים"" + 0.005*""ההשכלה"" + 0.005*""הפריפריה""',)",3
3860,ממשיכים סדרת הדיונים קיצור שירות החובה לגברים מזכיר שהדיון פתוח,בטחון,0.6617806,"('0.026*""החוקה"" + 0.022*""הביטחון"" + 0.022*""החוץ"" + 0.020*""לוועדת"" + 0.020*""ומשפט"" + 0.016*""המשותפת"" + 0.014*""ועדה"" + 0.013*""והביטחון"" + 0.010*""משותפת"" + 0.009*""המקומי""',)",3
3100,לציין הערה אסביר סמכויות החקיקה תקפות לשנה מיום הקמת יתקבל הכוונה מנת להסיר ספק חקיקה שתתחיל אה מההצבעה במליאה קיבלתי התיקון הקמת בהצבעה במליאה טעיתי שאמרתי,כלכלי,0.661688,"('0.013*""האוצר"" + 0.008*""הכנסה"" + 0.007*""עסקים"" + 0.007*""הכספים"" + 0.006*""המשפטית"" + 0.006*""קטנים"" + 0.006*""ציבורית"" + 0.005*""לדון"" + 0.005*""האשראי"" + 0.004*""לחוק""',)",3
6416,רצינו הסעיף מתקדם מתפתח שמבחינת המחויבות נעמוד שסעיף 9 יתקיים ויהיה המענה שאותו הבטחנו לבתי החולים ייושם יוציאו השאלה הדרך ואיך דיווח,כלכלי,0.66156673,"('0.013*""האוצר"" + 0.008*""הכנסה"" + 0.007*""עסקים"" + 0.007*""הכספים"" + 0.006*""המשפטית"" + 0.006*""קטנים"" + 0.006*""ציבורית"" + 0.005*""לדון"" + 0.005*""האשראי"" + 0.004*""לחוק""',)",3
5707,היושב-ראש חגיגי בסיפור מהכנסת הקודמת מאז שהגעתי לכנסת הסביר,עולים,0.66144806,"('0.011*""אתיופיה"" + 0.008*""יוצאי"" + 0.007*""הנוער"" + 0.007*""נוער"" + 0.007*""הארץ"" + 0.006*""פערים"" + 0.006*""הגבוהה"" + 0.005*""הסטודנטים"" + 0.005*""ההשכלה"" + 0.005*""הפריפריה""',)",3
4415,צהריים ברשותכם מבקשת דילמות ואתגרים ברצף הטיפול בילדים בסיכון ובמשפחותיהם בקהילה והן במסגרות החוץ ביתיות מקיימים במסגרת העובד הסוציאלי הבין לאומי,עולים,0.6612258,"('0.005*""בישראל"" + 0.004*""המשטרה"" + 0.004*""התפוצות"" + 0.004*""העולים"" + 0.004*""הרב"" + 0.004*""דרכים"" + 0.003*""החדשים"" + 0.003*""הדיווח"" + 0.003*""מקרים"" + 0.003*""מלחמה""',)",3
5393,התקנות קובעות שיעור אגרה הרישום להיתר כללי היתר כללי מתכונת רישום שנקבעה בסעיף 4א1 לחוק התקשורת וקובעת מנגנון שונה ממתן רישיון ההיתר הכללי סוג רישיון מדף שמפורסם,בריאות,0.66120356,"('0.032*""הבריאות"" + 0.028*""החולים"" + 0.017*""חולים"" + 0.007*""בתי"" + 0.007*""קופות"" + 0.005*""התקנות"" + 0.005*""בריאות"" + 0.005*""למשרד"" + 0.004*""לבתי"" + 0.004*""העורף""',)",3
386,הפסקה הראשונה מופיעה בהצעה המקורית החברה כחברה משפחתית מיום ההתאגדות מיום שבו הוגשה הבקשה להיחשב לחברה משפחתית עניין מינורי יחסית,חינוך,0.66096175,"('0.013*""גבוהה"" + 0.007*""להשכלה"" + 0.006*""בתחום"" + 0.006*""אילן"" + 0.005*""המשרד"" + 0.005*""מחקר"" + 0.004*""הבאה"" + 0.004*""החינוך"" + 0.004*""ברמה"" + 0.004*""רבים""',)",3
1468,ממשיכים באותם 13 עיקרים כר 14 עיקרים בעיניי נוגע קשיש בהקשר תעסוקה ופרישה,עולים,0.6609237,"('0.005*""בישראל"" + 0.004*""המשטרה"" + 0.004*""התפוצות"" + 0.004*""העולים"" + 0.004*""הרב"" + 0.004*""דרכים"" + 0.003*""החדשים"" + 0.003*""הדיווח"" + 0.003*""מקרים"" + 0.003*""מלחמה""',)",3
9928,שידוע לכולן ליוויתי המאבק לשנה כפעילה פמיניסטית ידעתי קיומו ובינתיים מאז שלפחות התחלתי להתוודע למאבק התקדמנו פתרנו מהסוגיות העמדות בפני המטפלות עצמן ובפני רשויות קיבלנו ברורות,חינוך,0.6606463,"('0.013*""גבוהה"" + 0.007*""להשכלה"" + 0.006*""בתחום"" + 0.006*""אילן"" + 0.005*""המשרד"" + 0.005*""מחקר"" + 0.004*""הבאה"" + 0.004*""החינוך"" + 0.004*""ברמה"" + 0.004*""רבים""',)",3
4407,הצהריים ולכולן ערב שעוסקת סמכויות מיוחדות להתמודדות נגיף הקורונה הוראת 9 בידוד בפיקוח טכנולוגי החייב בבידוד התשפא-2021,קורונה,0.6606293,"('0.037*""הקורונה"" + 0.029*""שקלים"" + 0.024*""הוראת"" + 0.024*""מיליון"" + 0.022*""נגיף"" + 0.016*""סמכויות"" + 0.013*""מיוחדות"" + 0.013*""להתמודדות"" + 0.012*""שקל"" + 0.011*""פעילות""',)",3
854,תזכורת קצרה ממני עצרנו שהיו הערות ביקשנו השלמות פקודת התעבורה לאור דבריה נציגת משטרת משטרת התנועה היועצת המשפטית תני רקע ונעבור לנציגי התחבורה,כלכלי,0.6606103,"('0.013*""האוצר"" + 0.008*""הכנסה"" + 0.007*""עסקים"" + 0.007*""הכספים"" + 0.006*""המשפטית"" + 0.006*""קטנים"" + 0.006*""ציבורית"" + 0.005*""לדון"" + 0.005*""האשראי"" + 0.004*""לחוק""',)",3
12803,מסיימים המנהרה נצטרך לבנות הגובה ישיבה לבנות הגובה העומק,קורונה,0.6599254,"('0.017*""הקורונה"" + 0.012*""משבר"" + 0.006*""צהל"" + 0.005*""העוני"" + 0.005*""המשבר"" + 0.004*""צריכים"" + 0.004*""לסייע"" + 0.004*""בתקופה"" + 0.003*""הביטחון"" + 0.003*""הנחיות""',)",3
1786,פריסת תשתית הגז בישראל התקדמה הגיעה לקיצה אזורים מרושתים אזורים מרושתים הערבה ויהודה ושומרון באזורים מרושתים הצינור שנקרא הכביש המהיר נדרשת חלוקה החלק החלוקה לאותם יישובים לאותם מפעלים ובעתיד פיילוטים שכונות בישראל שינצלו הגז הטבעי לשימוש ביתי,דיור,0.6598195,"('0.016*""ערך"" + 0.011*""שירותים"" + 0.008*""ניירות"" + 0.008*""פיננסיים"" + 0.008*""דירות"" + 0.007*""הבנקים"" + 0.007*""ציבורי"" + 0.007*""דירה"" + 0.006*""הפיקוח"" + 0.006*""דיור""',)",3
7639,היושב-ראש ותודה למעשה הפעם השנייה מופיע בפני הפנים והגנת הסביבה רפורמה שהממשלה מנסה מדבר רפורמה מתכוון לרפורמה במלוא מובן המילה מילה שמשתמשים רפורמה כשמדברים מהפך שובר שוויון שדברים שהתנהלו כה ואיך שדברים יתנהלו מעכשיו והלאה המהות האמיתית רפורמה הפעם הקודמת דנה ברפורמה באכיפת דיני תכנון ובנייה רפורמה חשובה שמיושמת בימים ועושה שירות אזרחי מדינת רפורמה ברישוי עסקים הרפורמות הכלכליות המשמעותיות שהיו בישראל בעשורים האחרונים,דיור,0.65977716,"('0.016*""ערך"" + 0.011*""שירותים"" + 0.008*""ניירות"" + 0.008*""פיננסיים"" + 0.008*""דירות"" + 0.007*""הבנקים"" + 0.007*""ציבורי"" + 0.007*""דירה"" + 0.006*""הפיקוח"" + 0.006*""דיור""',)",3
5145,מכובדי מיד ניגש התקנות יפתח בדבריו היועץ המשפטי מנת להזכיר הזירה שבה עוסקים ניגש למשרד המציע,בריאות,0.6597598,"('0.032*""הבריאות"" + 0.028*""החולים"" + 0.017*""חולים"" + 0.007*""בתי"" + 0.007*""קופות"" + 0.005*""התקנות"" + 0.005*""בריאות"" + 0.005*""למשרד"" + 0.004*""לבתי"" + 0.004*""העורף""',)",3
7744,בבוקר שבועות ביחד הצגנו תוכנית שנקראת יוצאים מהריבוע שהמטרה לצאת מהקופסה ולחשוב מחשבות יצירתיות ובעיקר להוציא ילדי וילדות מהזום ולייצר איזשהו חינוך שכבר מחכים התוכנית גובשה בתיאום מוחלט הסעיפים השלטון המקומי המועצות האזוריות הנהגת המורים ארגוני המנהלים התלמידים גורם בשטח פגשתי ופגשנו בשבועות האחרונים עקרונות שבתקווה יצליחו לגרום לאותם לצאת מהריבוע ולחזור ללמוד,דיור,0.6594979,"('0.016*""ערך"" + 0.011*""שירותים"" + 0.008*""ניירות"" + 0.008*""פיננסיים"" + 0.008*""דירות"" + 0.007*""הבנקים"" + 0.007*""ציבורי"" + 0.007*""דירה"" + 0.006*""הפיקוח"" + 0.006*""דיור""',)",3
408,שהעלה טענת שלמה קרעי עלתה אמירה סיעה הליכוד יקשה לכאן בדקנו מתברר שחבר קרעי יצא להתראיין משכך פי העדיפויות קבע לעצמו מנהלים בהיעדרו עורך-דין גור בליי תנמק הטענה ונצביע עליה,נשים,0.6591884,"('0.025*""המשפטי"" + 0.018*""מעמד"" + 0.018*""לקידום"" + 0.017*""האישה"" + 0.013*""היועץ"" + 0.011*""מגדרי"" + 0.009*""ולשוויון"" + 0.008*""פותחת"" + 0.007*""שינויים"" + 0.007*""לממשלה""',)",3
5777,יחד צוות נטלי עשינו חריש עמוק לקראת העברנו תוצרים לעיון שחלק מהתוצרים הגיעו במשך הללה 100 בלילה זרמו חומרים כאילו מתחולל אירוע ביטחוני הגיעו מאוחר מאוחר ואפשר לעכל בהחלט שדאג להעביר חומרים שישמשו צוות לאורך הישיבות הבאות לקראת הישיבות הבאות,כלכלי,0.6589513,"('0.013*""האוצר"" + 0.008*""הכנסה"" + 0.007*""עסקים"" + 0.007*""הכספים"" + 0.006*""המשפטית"" + 0.006*""קטנים"" + 0.006*""ציבורית"" + 0.005*""לדון"" + 0.005*""האשראי"" + 0.004*""לחוק""',)",3
2081,ככל הנראה האחרונה המיוחדת שקמה כחודשיים בתקופת משבר כפול משבר פוליטי משבר בריאותי כלכלי; תקופה חסרת תקדים כשכל מערכת החינוך מושבתת מיליון תלמידים שמנהלת אומרת שאי בטוחים,עולים,0.6587194,"('0.005*""בישראל"" + 0.004*""המשטרה"" + 0.004*""התפוצות"" + 0.004*""העולים"" + 0.004*""הרב"" + 0.004*""דרכים"" + 0.003*""החדשים"" + 0.003*""הדיווח"" + 0.003*""מקרים"" + 0.003*""מלחמה""',)",3
20228,החינוך התרבות והספורט 27 במאי יג בסיון תשעח נוהל החשב הכללי לתמיכה מוסדות תורניים במשרד החינוך,חינוך,0.65870106,"('0.112*""החינוך"" + 0.033*""התרבות"" + 0.028*""והספורט"" + 0.015*""חינוך"" + 0.013*""בסעיף"" + 0.010*""במערכת"" + 0.010*""הלימודים"" + 0.009*""מוסדות"" + 0.008*""שנת"" + 0.007*""מערכת""',)",3
