,NonStopwordsQuoteText,Topic,Topic_Prob,TopicWords,Batch
14018,מכובדיי ערב בהנמקת הסתייגויות והצבעות בפרק התכנית הכלכלית חקיקה ליישום המדיניות הכלכלית התקציב ו-2022 התשפא–2021 מ/1443 הפרק עוסק בתאגידים שהוקמו לייתר דיוק בחובת הדיווח חובת התקנת הדוחות הכספיים והדיווח,נשים,0.60372627,"('0.015*""לקידום"" + 0.014*""מעמד"" + 0.014*""האישה"" + 0.014*""הכלכלית"" + 0.011*""התקציב"" + 0.010*""התכנית"" + 0.009*""מגדרי"" + 0.009*""פרק"" + 0.009*""פותחת"" + 0.008*""נשים""',)",1
24448,ננסה ללמוד התופעה ולראות מבחינה חברתית מנסים לחנך ליצור מציאות בסופו שותפים לדימוי ולתדמית מעניקים לאותם לאנשים משקל עודף מודל היופי משדרים בפרסומות בתכניות טלוויזיה בתכניות לימודים,קורונה,0.6036615,"('0.011*""הבריאות"" + 0.006*""החולים"" + 0.005*""הדברים"" + 0.004*""צריכים"" + 0.004*""חולים"" + 0.004*""הקורונה"" + 0.004*""הציבור"" + 0.004*""בתי"" + 0.003*""בתחום"" + 0.003*""שצריך""',)",1
24356,הפנים והגנת הסביבה נוהל מוכתר סטטוס אתנו עיריית ירושלים מתי,קורונה,0.60360116,"('0.018*""הפנים"" + 0.018*""הקורונה"" + 0.017*""הוראת"" + 0.014*""הסביבה"" + 0.013*""והגנת"" + 0.012*""נגיף"" + 0.011*""החוקה"" + 0.010*""המשפטי"" + 0.010*""לחוק"" + 0.010*""סמכויות""',)",1
12548,לציין שלפי הבנו במרכז יכולים שירות ונותנים שירות מדינת המוצא נותנים שירות לבדוק האפשרות שיתוף פעולה ושילוב ידיים מנת לקדם המטרה מודה שבאתם,קורונה,0.60357547,"('0.011*""הבריאות"" + 0.006*""החולים"" + 0.005*""הדברים"" + 0.004*""צריכים"" + 0.004*""חולים"" + 0.004*""הקורונה"" + 0.004*""הציבור"" + 0.004*""בתי"" + 0.003*""בתחום"" + 0.003*""שצריך""',)",1
10171,ביומיים הקרובים נעסוק בסל נושאים דחופים שלושה דיונים התמודדות משבר הקורונה במגזר החרדי נוגע לסוגיית הבדיקות זימנו הידיעות האחרונות המשבר בתחום זימנו מפני שסוגיית הבדיקות קריטית להסתכלות ולשינויי המדיניות שצריכים לטעמנו לקרות הפסח,קורונה,0.6032803,"('0.011*""הבריאות"" + 0.006*""החולים"" + 0.005*""הדברים"" + 0.004*""צריכים"" + 0.004*""חולים"" + 0.004*""הקורונה"" + 0.004*""הציבור"" + 0.004*""בתי"" + 0.003*""בתחום"" + 0.003*""שצריך""',)",1
7586,טעות; שמעתי ביומיים האחרונים כאילו נעמוד כאבן נגף נעמוד כאבן נגף ברגע שתהיה החלטה נצטער עליה החלטה חסרת אחריות נתנגד האחרונים שמפחדים מבחירות,בטחון,0.60322994,"('0.019*""הביטחון"" + 0.015*""צהל"" + 0.009*""חיילים"" + 0.005*""לפועל"" + 0.005*""משוחררים"" + 0.005*""בודדים"" + 0.004*""בצהל"" + 0.004*""שלמה"" + 0.004*""מובן"" + 0.004*""נכי""',)",1
9780,אעבור התקציר מהדוחות שהזכרת יושבים מכנה משותף והרעיון משותף,קורונה,0.6031649,"('0.018*""הפנים"" + 0.018*""הקורונה"" + 0.017*""הוראת"" + 0.014*""הסביבה"" + 0.013*""והגנת"" + 0.012*""נגיף"" + 0.011*""החוקה"" + 0.010*""המשפטי"" + 0.010*""לחוק"" + 0.010*""סמכויות""',)",1
4999,דיוני הכלכלה שלישי יועץ משפטי רשמת יקירה ברוכה הבאה קורתנו אברך עצמי בראש,נשים,0.60316193,"('0.015*""לקידום"" + 0.014*""מעמד"" + 0.014*""האישה"" + 0.014*""הכלכלית"" + 0.011*""התקציב"" + 0.010*""התכנית"" + 0.009*""מגדרי"" + 0.009*""פרק"" + 0.009*""פותחת"" + 0.008*""נשים""',)",1
2178,פותחים ישיבה נוספת לתיקון פקודת העיריות 149 גבייה התשף-2020,קורונה,0.6028912,"('0.018*""הפנים"" + 0.018*""הקורונה"" + 0.017*""הוראת"" + 0.014*""הסביבה"" + 0.013*""והגנת"" + 0.012*""נגיף"" + 0.011*""החוקה"" + 0.010*""המשפטי"" + 0.010*""לחוק"" + 0.010*""סמכויות""',)",1
17783,מכיר שמחה רוטמן שהצטרף אלינו דיוננו חף מוויכוחים ביקשתי להצטרף נסכים לכול,חינוך,0.6027647,"('0.051*""החינוך"" + 0.014*""התרבות"" + 0.012*""והספורט"" + 0.010*""איתנו"" + 0.008*""חינוך"" + 0.006*""הבריאות"" + 0.005*""הספר"" + 0.005*""הלימודים"" + 0.005*""מכן"" + 0.005*""במערכת""',)",1
6939,רבותי נתחיל ברשותכם הפנים והגנת הסביבה התכנון והבנייה 109 התשעו–2016 מ/1074 הכנה שנייה ושלישית פרק חסר,קורונה,0.60249335,"('0.018*""הפנים"" + 0.018*""הקורונה"" + 0.017*""הוראת"" + 0.014*""הסביבה"" + 0.013*""והגנת"" + 0.012*""נגיף"" + 0.011*""החוקה"" + 0.010*""המשפטי"" + 0.010*""לחוק"" + 0.010*""סמכויות""',)",1
4458,הרב אורן חזן וחברת זהבה גלאון עברו בשבוע גבול בוויכוח הפרלמנטרי יסלחו שמרגישים מטיף מוסר מחלק ציונים לחברי חובה לעצמי לתבוע עלבונה החינוך לדורותיה מחזה וזאת לאור התגובות השליליות שקיבלתי מאזרחים שהמדינה חשובה מביש אורן חזן וזהבה גלאון הביא וגרר אחריו תגובות רבות שפוגעות במעמדה ובמעמדה שיצאתי לידי חובת מחאה ותביעת עלבונה החינוך מאותו מביש בשבוע,חינוך,0.602168,"('0.051*""החינוך"" + 0.014*""התרבות"" + 0.012*""והספורט"" + 0.010*""איתנו"" + 0.008*""חינוך"" + 0.006*""הבריאות"" + 0.005*""הספר"" + 0.005*""הלימודים"" + 0.005*""מכן"" + 0.005*""במערכת""',)",1
10769,נתחיל נתחיל בבקשת יור הפנים והגנת הסביבה להקדמת לתיקון פקודת מסי העירייה ומסי תנאים לפטור מארנונה למוסד מתנדב קריאה שנייה ושלישית מציג,קורונה,0.60208637,"('0.018*""הפנים"" + 0.018*""הקורונה"" + 0.017*""הוראת"" + 0.014*""הסביבה"" + 0.013*""והגנת"" + 0.012*""נגיף"" + 0.011*""החוקה"" + 0.010*""המשפטי"" + 0.010*""לחוק"" + 0.010*""סמכויות""',)",1
15328,צהריים שלישי טז בחשוון תשפא 3112020 ישנם נושאים בקשת יור החוקה להארכת התקופה לאישור סמכויות מיוחדות להתמודדות נגיף הקורונה הוראת הגבלת פעילות והוראות נוספות 7 ו-תיקון 8; סמכויות מיוחדות להתמודדות נקיף הקורונה הוראת 3 אזור תיירות מיוחד העיר אילת אזור עין בוקק-חמי זוהר התשפא-2020 חכ איתן גינזבורג; יד יצחק בן-צבי 3 ביטול במועצה התשפא-2020,קורונה,0.6019471,"('0.018*""הפנים"" + 0.018*""הקורונה"" + 0.017*""הוראת"" + 0.014*""הסביבה"" + 0.013*""והגנת"" + 0.012*""נגיף"" + 0.011*""החוקה"" + 0.010*""המשפטי"" + 0.010*""לחוק"" + 0.010*""סמכויות""',)",1
18661,רב מתנצל האיחור המדע והטכנולוגיה שלישי בתמוז התשעז 472017 הזכויות נכסים דיגיטליים המוות,חינוך,0.60193056,"('0.051*""החינוך"" + 0.014*""התרבות"" + 0.012*""והספורט"" + 0.010*""איתנו"" + 0.008*""חינוך"" + 0.006*""הבריאות"" + 0.005*""הספר"" + 0.005*""הלימודים"" + 0.005*""מכן"" + 0.005*""במערכת""',)",1
21752,דיווח תשלום הפיצויים לעסקים ולעיריית נהריה בעקבות פגעי מזג האוויר בשנת מעקב,קורונה,0.6019192,"('0.018*""הפנים"" + 0.018*""הקורונה"" + 0.017*""הוראת"" + 0.014*""הסביבה"" + 0.013*""והגנת"" + 0.012*""נגיף"" + 0.011*""החוקה"" + 0.010*""המשפטי"" + 0.010*""לחוק"" + 0.010*""סמכויות""',)",1
9516,הכספים צו הכנסה קביעת תשלומים שירותים נכסים כהכנסה התשעז-,קורונה,0.6016448,"('0.018*""הפנים"" + 0.018*""הקורונה"" + 0.017*""הוראת"" + 0.014*""הסביבה"" + 0.013*""והגנת"" + 0.012*""נגיף"" + 0.011*""החוקה"" + 0.010*""המשפטי"" + 0.010*""לחוק"" + 0.010*""סמכויות""',)",1
24524,הונח לפנינו הלאומי שמדבר אובדן מזון והצלת מזון בישראל שכמו שאמרתי היבטים כלכליים היבטים חברתיים היבטים סביבתיים,קורונה,0.6016428,"('0.011*""הבריאות"" + 0.006*""החולים"" + 0.005*""הדברים"" + 0.004*""צריכים"" + 0.004*""חולים"" + 0.004*""הקורונה"" + 0.004*""הציבור"" + 0.004*""בתי"" + 0.003*""בתחום"" + 0.003*""שצריך""',)",1
10429,מתחילים הרשויות המקומיות בחירות הוראת נגיף הקורונה התשפא-2020 מ/1369,קורונה,0.60145664,"('0.018*""הפנים"" + 0.018*""הקורונה"" + 0.017*""הוראת"" + 0.014*""הסביבה"" + 0.013*""והגנת"" + 0.012*""נגיף"" + 0.011*""החוקה"" + 0.010*""המשפטי"" + 0.010*""לחוק"" + 0.010*""סמכויות""',)",1
13345,החינוך התרבות והספורט 24 בדצמבר טז בטבת תשעט אישור תשלומים להורים כלי לאפליה תלמידים,חינוך,0.6014133,"('0.051*""החינוך"" + 0.014*""התרבות"" + 0.012*""והספורט"" + 0.010*""איתנו"" + 0.008*""חינוך"" + 0.006*""הבריאות"" + 0.005*""הספר"" + 0.005*""הלימודים"" + 0.005*""מכן"" + 0.005*""במערכת""',)",1
22343,הסעיף האחרון בסדר החלק הרביעי לתקנון הבורסה כללי השימור ההשעיה והמחיקה ניירות ערך,קורונה,0.60130584,"('0.018*""הפנים"" + 0.018*""הקורונה"" + 0.017*""הוראת"" + 0.014*""הסביבה"" + 0.013*""והגנת"" + 0.012*""נגיף"" + 0.011*""החוקה"" + 0.010*""המשפטי"" + 0.010*""לחוק"" + 0.010*""סמכויות""',)",1
17334,הפנים והגנת הסביבה הסדרים במשק חקיקה להשגת יעדי התקציב נכס המשמש למגורי נכה התשעז-2016 פ/3581/20 דוד אמסלם להכנה,קורונה,0.6012774,"('0.018*""הפנים"" + 0.018*""הקורונה"" + 0.017*""הוראת"" + 0.014*""הסביבה"" + 0.013*""והגנת"" + 0.012*""נגיף"" + 0.011*""החוקה"" + 0.010*""המשפטי"" + 0.010*""לחוק"" + 0.010*""סמכויות""',)",1
944,שאמר היושב-ראש נעסוק בסעיפים 1 ו-2 סעיפים שבמידה כזו עסקה בהם בישיבות הראשונות שהיו בפגרה שבהם נדון הקונספט הכללי ובמסגרת מסוים בסעיפים ייחוד כולו לנוסח ולמרכיבים ספציפית,נשים,0.6011429,"('0.015*""לקידום"" + 0.014*""מעמד"" + 0.014*""האישה"" + 0.014*""הכלכלית"" + 0.011*""התקציב"" + 0.010*""התכנית"" + 0.009*""מגדרי"" + 0.009*""פרק"" + 0.009*""פותחת"" + 0.008*""נשים""',)",1
13626,שנשמע פרופ אפק עורך דין מאיר בוחניק ולאחר מכן נפנה למשרד הבריאות,חינוך,0.60091007,"('0.051*""החינוך"" + 0.014*""התרבות"" + 0.012*""והספורט"" + 0.010*""איתנו"" + 0.008*""חינוך"" + 0.006*""הבריאות"" + 0.005*""הספר"" + 0.005*""הלימודים"" + 0.005*""מכן"" + 0.005*""במערכת""',)",1
21086,מחדשים הקריאה השנייה והשלישית 89א להקריא מצביעה החידוש החידוש,קורונה,0.600885,"('0.018*""הפנים"" + 0.018*""הקורונה"" + 0.017*""הוראת"" + 0.014*""הסביבה"" + 0.013*""והגנת"" + 0.012*""נגיף"" + 0.011*""החוקה"" + 0.010*""המשפטי"" + 0.010*""לחוק"" + 0.010*""סמכויות""',)",1
24723,מתחילה בידיעה פורמלית שהדיון סופר מיוחד איתנו אקרא בשם נ בחור מהמם פגשתי פוגשת ושומעת פגשתי חיסיון שהחשיפה תסכן בהחלט רוצות הייחודיות אקריא ההודעה המיוחדת,בטחון,0.60051066,"('0.019*""הביטחון"" + 0.015*""צהל"" + 0.009*""חיילים"" + 0.005*""לפועל"" + 0.005*""משוחררים"" + 0.005*""בודדים"" + 0.004*""בצהל"" + 0.004*""שלמה"" + 0.004*""מובן"" + 0.004*""נכי""',)",1
3921,נתחיל הבריאות תוכלו סוג סקירה הכנה לקראת עומד בפנינו וקצת הזן ואיך נערכים להתייחסות אליו במערכת החינוך שנוכל לשתף המורים התלמידים אותנו הציבור,קורונה,0.60032785,"('0.011*""הבריאות"" + 0.006*""החולים"" + 0.005*""הדברים"" + 0.004*""צריכים"" + 0.004*""חולים"" + 0.004*""הקורונה"" + 0.004*""הציבור"" + 0.004*""בתי"" + 0.003*""בתחום"" + 0.003*""שצריך""',)",1
735,שלישי 12 בינואר בשבט תשעו דנים לקידום מעמד האישה ושוויון מגדרי דנים למעט שעברה בדיווח הכלכלה פיטורי עובדות בהריון ובטיפולי פוריות ובהיבטים אכיפה פלילית ומנהלית לשנת,נשים,0.5999692,"('0.015*""לקידום"" + 0.014*""מעמד"" + 0.014*""האישה"" + 0.014*""הכלכלית"" + 0.011*""התקציב"" + 0.010*""התכנית"" + 0.009*""מגדרי"" + 0.009*""פרק"" + 0.009*""פותחת"" + 0.008*""נשים""',)",1
15903,עמנו רוטמן עמנו לשעבר דב ליפמן הצטרפותכם איתנו עורך הדין אלעד גודינגר ממשרד הבריאות ודוקטור אולגה פרישמן ממשרד המשפטים אלעד צפוי להצטרף אלינו מהתחום המקצועי הבריאות,חינוך,0.59986,"('0.051*""החינוך"" + 0.014*""התרבות"" + 0.012*""והספורט"" + 0.010*""איתנו"" + 0.008*""חינוך"" + 0.006*""הבריאות"" + 0.005*""הספר"" + 0.005*""הלימודים"" + 0.005*""מכן"" + 0.005*""במערכת""',)",1
15822,בקשת יושב-ראש הזמנית כספים להקדמת הביטוח הלאומי 225 והוראת הוראות מיוחדות דמי אבטלה ודמי לידה הקריאה השנייה והשלישית,קורונה,0.59985083,"('0.018*""הפנים"" + 0.018*""הקורונה"" + 0.017*""הוראת"" + 0.014*""הסביבה"" + 0.013*""והגנת"" + 0.012*""נגיף"" + 0.011*""החוקה"" + 0.010*""המשפטי"" + 0.010*""לחוק"" + 0.010*""סמכויות""',)",1
19172,החינוך התרבות והספורט ביוזמתה דוקטור ענת ברקו פעילות ארגוני זכויות בביס הרצאות פליטים וביקור במתקן חולות,חינוך,0.5998242,"('0.051*""החינוך"" + 0.014*""התרבות"" + 0.012*""והספורט"" + 0.010*""איתנו"" + 0.008*""חינוך"" + 0.006*""הבריאות"" + 0.005*""הספר"" + 0.005*""הלימודים"" + 0.005*""מכן"" + 0.005*""במערכת""',)",1
23525,שנכון לרגע ואין כיוונים ברורים ואין שורה תחתונה ומתי חוזרים מנסים לקראת בממשלה והדיון אצל הצוהריים לקראת דיונים קרובים לקראת בשבועות הקרובים הצדדים השונים בנושאים השונים ולנסות להבין הבעיות ננסה לאפשר לאנשים לבטא המצוקות הבקשות והדרישות,קורונה,0.59955317,"('0.011*""הבריאות"" + 0.006*""החולים"" + 0.005*""הדברים"" + 0.004*""צריכים"" + 0.004*""חולים"" + 0.004*""הקורונה"" + 0.004*""הציבור"" + 0.004*""בתי"" + 0.003*""בתחום"" + 0.003*""שצריך""',)",1
20899,הכלכלה התעבורה בדבר תפקידי קצין הבטיחות ואופן העסקתו מנכלית התחבורה ברוכה הבאה קורתנו מתקבלת הדובר היועצת המשפטית תכף תגיע אתי,נשים,0.59953177,"('0.015*""לקידום"" + 0.014*""מעמד"" + 0.014*""האישה"" + 0.014*""הכלכלית"" + 0.011*""התקציב"" + 0.010*""התכנית"" + 0.009*""מגדרי"" + 0.009*""פרק"" + 0.009*""פותחת"" + 0.008*""נשים""',)",1
4482,לסבר האוזן בליבת האכפתיות הציבור כשהעלית העניין וצולמתי אוסאמה הזכרתי ואדוני מוזמן מנסה לסבר האוזן תכנית הצינור בערוץ 10 שכולכם מכירים הועלה התראיינתי 2 מיליון ציפיות בקטע 40000 שיתופים ומי שסביב השולחן ומי שצופה בנו ומבין המשמעות הכנת פרי מטורף,קורונה,0.5993328,"('0.011*""הבריאות"" + 0.006*""החולים"" + 0.005*""הדברים"" + 0.004*""צריכים"" + 0.004*""חולים"" + 0.004*""הקורונה"" + 0.004*""הציבור"" + 0.004*""בתי"" + 0.003*""בתחום"" + 0.003*""שצריך""',)",1
21380,ננסה מארגוני השטח המצב ניתוק ההתרחקות מהנושא לתקופה מסוימת המצב מנציגי ונציגות המשרדים השונים וננסה להבין עומדות,קורונה,0.5993283,"('0.011*""הבריאות"" + 0.006*""החולים"" + 0.005*""הדברים"" + 0.004*""צריכים"" + 0.004*""חולים"" + 0.004*""הקורונה"" + 0.004*""הציבור"" + 0.004*""בתי"" + 0.003*""בתחום"" + 0.003*""שצריך""',)",1
14870,המטרה מענה למקרים ההומניטריים הקשים ולמצוא פתרונות השיבוצים שהמציאות ורודה ממשיכות לחפש פתרונות ונקווה שנגיע אליהם בקרוב,קורונה,0.59926033,"('0.011*""הבריאות"" + 0.006*""החולים"" + 0.005*""הדברים"" + 0.004*""צריכים"" + 0.004*""חולים"" + 0.004*""הקורונה"" + 0.004*""הציבור"" + 0.004*""בתי"" + 0.003*""בתחום"" + 0.003*""שצריך""',)",1
5168,תרשו נבקש שיעדכנו אותנו התנתקו מאתנו האומנה זוהתה שהיו רשומים הייתם צריכים למנות נציבה לתלונות וכו מיניתם חדשה,בטחון,0.59925485,"('0.019*""הביטחון"" + 0.015*""צהל"" + 0.009*""חיילים"" + 0.005*""לפועל"" + 0.005*""משוחררים"" + 0.005*""בודדים"" + 0.004*""בצהל"" + 0.004*""שלמה"" + 0.004*""מובן"" + 0.004*""נכי""',)",1
12336,מדינת מדינה שנמצאת תחת איום מהקשים והכבדים שיכולים איום מגוון ומורכב המרכיבים הבסיסיים היכולת המשק מדינת משק החירום המשק הלאומי להתמודד עולם המפעלים המרכיבים המרכזיים שבהם תשתיות אסטרטגיות מלאים לאומיים וכדומה המפעלים החיוניים המרכיבים הקריטיים הרי בלעדיהם המשק יוכל לתפקד והאוכלוסייה תוכל להתקיים,קורונה,0.5992547,"('0.011*""הבריאות"" + 0.006*""החולים"" + 0.005*""הדברים"" + 0.004*""צריכים"" + 0.004*""חולים"" + 0.004*""הקורונה"" + 0.004*""הציבור"" + 0.004*""בתי"" + 0.003*""בתחום"" + 0.003*""שצריך""',)",1
22263,הדין הפלילי סמכויות אכיפה מעצרים לקראת הקריאה השנייה והקריאה השלישית,קורונה,0.59923744,"('0.018*""הפנים"" + 0.018*""הקורונה"" + 0.017*""הוראת"" + 0.014*""הסביבה"" + 0.013*""והגנת"" + 0.012*""נגיף"" + 0.011*""החוקה"" + 0.010*""המשפטי"" + 0.010*""לחוק"" + 0.010*""סמכויות""',)",1
24331,ישיבה נוספת הכלכלה עוסקים רישוי שירותים לרכב התשעג-2013 היועץ המשפטי נפל בחלקנו המנכל,נשים,0.5991226,"('0.015*""לקידום"" + 0.014*""מעמד"" + 0.014*""האישה"" + 0.014*""הכלכלית"" + 0.011*""התקציב"" + 0.010*""התכנית"" + 0.009*""מגדרי"" + 0.009*""פרק"" + 0.009*""פותחת"" + 0.008*""נשים""',)",1
10053,רביעי נוהג ננסה פעמיים היועצות המשפטיות הדובר אימפריית הדוברים ובכן להזכיר שבשבת נקרא פרשת מקץ תרשמי כהדתה,נשים,0.59897685,"('0.015*""לקידום"" + 0.014*""מעמד"" + 0.014*""האישה"" + 0.014*""הכלכלית"" + 0.011*""התקציב"" + 0.010*""התכנית"" + 0.009*""מגדרי"" + 0.009*""פרק"" + 0.009*""פותחת"" + 0.008*""נשים""',)",1
7967,מניח למודל ההכרה חסרונות להעלות לסדר שאגף השיקום שמשרד הביטחון ימשיך לעסוק המודל אכן ואכן לייעל המערכת לאמץ שלשם הדברים הולכים הדברים,קורונה,0.5988155,"('0.011*""הבריאות"" + 0.006*""החולים"" + 0.005*""הדברים"" + 0.004*""צריכים"" + 0.004*""חולים"" + 0.004*""הקורונה"" + 0.004*""הציבור"" + 0.004*""בתי"" + 0.003*""בתחום"" + 0.003*""שצריך""',)",1
15857,סוגיה ספציפית השימוש בשפה הערבית שקשור לתעודת הבגרות והן שקשור לתרגום חוזרי מנכל,קורונה,0.59881526,"('0.011*""הבריאות"" + 0.006*""החולים"" + 0.005*""הדברים"" + 0.004*""צריכים"" + 0.004*""חולים"" + 0.004*""הקורונה"" + 0.004*""הציבור"" + 0.004*""בתי"" + 0.003*""בתחום"" + 0.003*""שצריך""',)",1
10101,כול שנענית לבקשתי לערוך שנושא האזרחים הוותיקים פרט לקורונה התייחסות נפרדת ומיוחדת ובמיוחד בתקופת הקורונה כשיש סוגיות הבנו שדווקא האוכלוסייה האוכלוסייה רגישה במצב המורכב,קורונה,0.598795,"('0.011*""הבריאות"" + 0.006*""החולים"" + 0.005*""הדברים"" + 0.004*""צריכים"" + 0.004*""חולים"" + 0.004*""הקורונה"" + 0.004*""הציבור"" + 0.004*""בתי"" + 0.003*""בתחום"" + 0.003*""שצריך""',)",1
23187,הפנים והגנת הסביבה לתיקון פקודת העיריות 146 חלוקת הכנסות התשעח-2018 פ/4415/20 כ/784 מיכאל מלכיאלי הכנה שנייה ושלישית,קורונה,0.5987525,"('0.018*""הפנים"" + 0.018*""הקורונה"" + 0.017*""הוראת"" + 0.014*""הסביבה"" + 0.013*""והגנת"" + 0.012*""נגיף"" + 0.011*""החוקה"" + 0.010*""המשפטי"" + 0.010*""לחוק"" + 0.010*""סמכויות""',)",1
3166,שקורה בתכלס והיה מבחינת הדת היהודית גברת שיושבת מולי שסובלת שאצלה בעיות תסביר ממה סובלת תסבירי חסר ברוך השם מסודר גר בביתר עילית עירוב למהדרין לצערנו בעקבות הבעיות הביטחוניות הביטחון הגדר ההיקפי בסדר גמור הדעות תסביר סובלת,קורונה,0.5986555,"('0.011*""הבריאות"" + 0.006*""החולים"" + 0.005*""הדברים"" + 0.004*""צריכים"" + 0.004*""חולים"" + 0.004*""הקורונה"" + 0.004*""הציבור"" + 0.004*""בתי"" + 0.003*""בתחום"" + 0.003*""שצריך""',)",1
19511,לחבר סימון דוידסון אתנו הבוקר בשעה כה מוקדמת הבוקר לשעבר דב ליטמן ברוך המצטרף אתנו נציגות הבריאות עורכת הדין נינא כהן עורכת הדין טל פוקס ממשרד המשפטים דר אולגה פרישמן התיירות עורכת הדין סתיו קבלו,חינוך,0.5984749,"('0.051*""החינוך"" + 0.014*""התרבות"" + 0.012*""והספורט"" + 0.010*""איתנו"" + 0.008*""חינוך"" + 0.006*""הבריאות"" + 0.005*""הספר"" + 0.005*""הלימודים"" + 0.005*""מכן"" + 0.005*""במערכת""',)",1
2949,המשפטים התמהמה שאמרתי ורבע שעדיין הוגשה מקיימים ללבן סוגיות שאמנם לובנו כשנה שכבר נשתכחו מאתנו נוכל לדאבוני הרב החלטה להעלות בהחלט דיברתי יושב-ראש מכירה מקומי בסך הכול ממלאת ואיני להתייעץ אתו מקובל ההתמהמהות תימשך ברירה בסופו מקווים ניאלץ ושבאמת המשפטים יגיש,קורונה,0.5984027,"('0.011*""הבריאות"" + 0.006*""החולים"" + 0.005*""הדברים"" + 0.004*""צריכים"" + 0.004*""חולים"" + 0.004*""הקורונה"" + 0.004*""הציבור"" + 0.004*""בתי"" + 0.003*""בתחום"" + 0.003*""שצריך""',)",1
352,האחרון פרק כג התכנית הכלכלית חקיקה ליישום המדיניות הכלכלית התקציב ו-2022 בסעיפים 107-109 פקודת היבוא והיצוא וחוק ההתקנים בסעיפים 110 ו-111 מקורות אנרגיה בסעיף 116 טלגרף אלחוטי,נשים,0.5983371,"('0.015*""לקידום"" + 0.014*""מעמד"" + 0.014*""האישה"" + 0.014*""הכלכלית"" + 0.011*""התקציב"" + 0.010*""התכנית"" + 0.009*""מגדרי"" + 0.009*""פרק"" + 0.009*""פותחת"" + 0.008*""נשים""',)",1
