,NonStopwordsQuoteText,Topic,Topic_Prob,TopicWords,Batch
5877,פורסם ששר הבריאות סבבה להחזיר תלמידים בתמורה יפתחו קניונים נשים בצד הסחר מכר שצריך ייתכן שבמדינת העדיפויות הקניונים התלמידים מוכרח הפוך שתי האופציות שתי האופציות שתוחזר מערכת החינוך,נשים,0.57106405,"('0.054*""נשים"" + 0.018*""אלימות"" + 0.017*""פנים"" + 0.015*""הנשים"" + 0.012*""לביטחון"" + 0.011*""מינית"" + 0.010*""למאבק"" + 0.008*""האלימות"" + 0.007*""שלהן"" + 0.007*""לנשים""',)",3
14705,אזכיר מתחילים ההסדרים הקודם למעשה עוקב לתיקון ההסדרים הקודם מתכוון לכך ההסדרים הקודם הוגדל שיעור קצבת הבטחת הכנסה לאותם קשישים לאותם שעברו הפרישה זכאים לקצבת זקנה קצבת שאירים תלויים,כלכלי,0.5709527,"('0.013*""האוצר"" + 0.008*""הכנסה"" + 0.007*""עסקים"" + 0.007*""הכספים"" + 0.006*""המשפטית"" + 0.006*""קטנים"" + 0.006*""ציבורית"" + 0.005*""לדון"" + 0.005*""האשראי"" + 0.004*""לחוק""',)",3
3529,החינוך התרבות והספורט כד בחשוון תשעח 13 בנובמבר טיפול המחוז החרדי בשיבוץ בנות לסמינרים מילות פתיחה,חינוך,0.57093674,"('0.112*""החינוך"" + 0.033*""התרבות"" + 0.028*""והספורט"" + 0.015*""חינוך"" + 0.013*""בסעיף"" + 0.010*""במערכת"" + 0.010*""הלימודים"" + 0.009*""מוסדות"" + 0.008*""שנת"" + 0.007*""מערכת""',)",3
7687,הכספים הזמנית לטובת היוועצות הכספים הזמנית הסכם למתן מענקים 9 לחוק הביטוח הלאומי היועצת המשפטית,כלכלי,0.57090783,"('0.013*""האוצר"" + 0.008*""הכנסה"" + 0.007*""עסקים"" + 0.007*""הכספים"" + 0.006*""המשפטית"" + 0.006*""קטנים"" + 0.006*""ציבורית"" + 0.005*""לדון"" + 0.005*""האשראי"" + 0.004*""לחוק""',)",3
540,החינוך התרבות והספורט 6 במרץ באדר תשעז הסעה בטיחות ולפעוטות מוגבלות המשך חסרות דמויות החינוך,חינוך,0.57076293,"('0.112*""החינוך"" + 0.033*""התרבות"" + 0.028*""והספורט"" + 0.015*""חינוך"" + 0.013*""בסעיף"" + 0.010*""במערכת"" + 0.010*""הלימודים"" + 0.009*""מוסדות"" + 0.008*""שנת"" + 0.007*""מערכת""',)",3
158,משפטים פרופסור האוזר מטרת בישיבה הקודמת וניהל מיקי זוהר תאמר משפטים ואחר-כך נדבר הערות בנוסח ולאחר מכן הסתייגויות והערות נוכל נצביע נקיים נוסף,נשים,0.5707146,"('0.025*""המשפטי"" + 0.018*""מעמד"" + 0.018*""לקידום"" + 0.017*""האישה"" + 0.013*""היועץ"" + 0.011*""מגדרי"" + 0.009*""ולשוויון"" + 0.008*""פותחת"" + 0.007*""שינויים"" + 0.007*""לממשלה""',)",3
4698,לפנינו פרק פרק ופרקים ז ו-ח פרקים קצרים והיום נסיים הקראת בתקווה מחר בפני סיכומים שונים לחזור לסוגיות שונות נפרסם מחר נוסח המעודכנת ונזמין וחברות להגיש הסתייגויות המועד שנקבע שנוכל לערוך ההצבעות שלישי,כלכלי,0.570631,"('0.013*""האוצר"" + 0.008*""הכנסה"" + 0.007*""עסקים"" + 0.007*""הכספים"" + 0.006*""המשפטית"" + 0.006*""קטנים"" + 0.006*""ציבורית"" + 0.005*""לדון"" + 0.005*""האשראי"" + 0.004*""לחוק""',)",3
22582,החינוך התרבות והספורט 12 בפברואר כז בשבט התשעח הצעה לסדר-היום תהליך קבלת החלטות המלג הרחבת המכללות הפרטיות חהכ איתן ברושי חהכ מסעוד גנאים,חינוך,0.570577,"('0.112*""החינוך"" + 0.033*""התרבות"" + 0.028*""והספורט"" + 0.015*""חינוך"" + 0.013*""בסעיף"" + 0.010*""במערכת"" + 0.010*""הלימודים"" + 0.009*""מוסדות"" + 0.008*""שנת"" + 0.007*""מערכת""',)",3
2443,החינוך התרבות והספורט שעל חינוך מיוחד 11 התשעח-2018 הכנה שנייה ושלישית,חינוך,0.5705571,"('0.112*""החינוך"" + 0.033*""התרבות"" + 0.028*""והספורט"" + 0.015*""חינוך"" + 0.013*""בסעיף"" + 0.010*""במערכת"" + 0.010*""הלימודים"" + 0.009*""מוסדות"" + 0.008*""שנת"" + 0.007*""מערכת""',)",3
16821,נוכחנו תופעה שעלתה מעת לעת בשנים האחרונות שמדובר במקרים חריגים להכתים הרשויות המקומיות מקרים חריגים וברשויות מסוימות,עולים,0.57051617,"('0.005*""בישראל"" + 0.004*""המשטרה"" + 0.004*""התפוצות"" + 0.004*""העולים"" + 0.004*""הרב"" + 0.004*""דרכים"" + 0.003*""החדשים"" + 0.003*""הדיווח"" + 0.003*""מקרים"" + 0.003*""מלחמה""',)",3
23336,החינוך התרבות והספורט השלישית מהבוקר ה-212017 בטבת התשעז תכנית שילוב עובדי הקבלן במערכת החינוך,חינוך,0.5702004,"('0.112*""החינוך"" + 0.033*""התרבות"" + 0.028*""והספורט"" + 0.015*""חינוך"" + 0.013*""בסעיף"" + 0.010*""במערכת"" + 0.010*""הלימודים"" + 0.009*""מוסדות"" + 0.008*""שנת"" + 0.007*""מערכת""',)",3
20347,נעסוק בחסמים לפיתוח הרכב שנדבר החסמים שמגיעה לרכבת מילה רכבות קווים בהם רכבות נוסעים מהר בנוח לעבוד במהלך הדרך,תחבורה,0.5700679,"('0.024*""התחבורה"" + 0.012*""הציבורית"" + 0.006*""בשבת"" + 0.005*""נקרא"" + 0.004*""קיבלתי"" + 0.004*""בחודש"" + 0.004*""בתחבורה"" + 0.004*""ציבורית"" + 0.004*""המיסים"" + 0.003*""לעבוד""',)",3
2219,נפתח לביטחון פנים ה-7 לדצמבר בטבת התשפב הצעה מהיר שימוש בבואש בהפגנות במאה שערים מוסי רז ומשה ארבל מוסי מתעכב משה יגיע מתנצל נעשה מניחה יכולים לצפות,עולים,0.56997037,"('0.011*""אתיופיה"" + 0.008*""יוצאי"" + 0.007*""הנוער"" + 0.007*""נוער"" + 0.007*""הארץ"" + 0.006*""פערים"" + 0.006*""הגבוהה"" + 0.005*""הסטודנטים"" + 0.005*""ההשכלה"" + 0.005*""הפריפריה""',)",3
1958,שחברות הסלולר עומדות בדרישות התקשורת לכיסוי מיטבי לאחוז מסוים שהמשרד קבע אינני טועה 99%,חינוך,0.5699474,"('0.013*""גבוהה"" + 0.007*""להשכלה"" + 0.006*""בתחום"" + 0.006*""אילן"" + 0.005*""המשרד"" + 0.005*""מחקר"" + 0.004*""הבאה"" + 0.004*""החינוך"" + 0.004*""ברמה"" + 0.004*""רבים""',)",3
6766,לסבר האוזן נתונים שפורסמו התחלואה במערכת החינוך שביומיים האחרונים יומיים פתיחת שנת הלימודים 1315 תלמידים חולי קורונה 174 גני נסגרו בעקבות התחלואה תמונת המצב ברמת התחלואה צריכים לזכור המחיר הכבד שמשלמים מאות אלפי הסגירה הנמשכת מוסדות החינוך שאמרתי שמונה חודשים תוך המשבר,חינוך,0.56986016,"('0.112*""החינוך"" + 0.033*""התרבות"" + 0.028*""והספורט"" + 0.015*""חינוך"" + 0.013*""בסעיף"" + 0.010*""במערכת"" + 0.010*""הלימודים"" + 0.009*""מוסדות"" + 0.008*""שנת"" + 0.007*""מערכת""',)",3
9372,מיד נדבר עזרת נשים בעלות מיליוני שקלים הקמת מחיצה שנעשתה היוועצות וללא התראה שמצטרפת לשורה אירועים מעוררי מחלוקת כמוהם לכנס ולתצוגת הפרארי שגילינו ברחבה עליה התקבלו מספקות האירוע שקרה שבועיים בהחלטה לאפשר לעיתונאיות ולצלמות להיכנס ולצלם לתעד הגעתו סגן הנשיא פנס,דיור,0.56984144,"('0.016*""ערך"" + 0.011*""שירותים"" + 0.008*""ניירות"" + 0.008*""פיננסיים"" + 0.008*""דירות"" + 0.007*""הבנקים"" + 0.007*""ציבורי"" + 0.007*""דירה"" + 0.006*""הפיקוח"" + 0.006*""דיור""',)",3
20845,הצרות מעביר חוקים ונשאר צרות הסיפור ה-FATCA נפתרה הבעיה בסדר מצחיק,בטחון,0.5698292,"('0.007*""חיילים"" + 0.004*""וביטחון"" + 0.004*""ועדות"" + 0.004*""משוחררים"" + 0.004*""יושב-ראש"" + 0.004*""חודשים"" + 0.003*""בודדים"" + 0.003*""ומתן"" + 0.003*""משפחה"" + 0.003*""לקח""',)",3
6854,ניגשים מציע שעל מנת שנקדם הדברים נעבור הנוסח המשולב נבין מכוח הדברים לגביהם נושאים פתוחים ובמה צריכים להשקיע מאמץ,כלכלי,0.5696689,"('0.013*""האוצר"" + 0.008*""הכנסה"" + 0.007*""עסקים"" + 0.007*""הכספים"" + 0.006*""המשפטית"" + 0.006*""קטנים"" + 0.006*""ציבורית"" + 0.005*""לדון"" + 0.005*""האשראי"" + 0.004*""לחוק""',)",3
4500,אישית מעריכה שבאמת הוספנו לאור החירות הצדק והשלום זוכרת,בריאות,0.5696352,"('0.032*""הבריאות"" + 0.028*""החולים"" + 0.017*""חולים"" + 0.007*""בתי"" + 0.007*""קופות"" + 0.005*""התקנות"" + 0.005*""בריאות"" + 0.005*""למשרד"" + 0.004*""לבתי"" + 0.004*""העורף""',)",3
7854,מלווה ומוביל שמחויב למוזיקה ומשגע אותנו בהרבה תחומים בחקיקה בהעלאת נושאים לסדר-היום ידידי וחברי יעקב פרי רציתי דברי פתיחה איחרתי אילוץ ישר מעביר הדיבור,עולים,0.5695201,"('0.027*""העלייה"" + 0.018*""הקליטה"" + 0.014*""מנכל"" + 0.013*""מר"" + 0.010*""מוגבלות"" + 0.010*""והקליטה"" + 0.008*""והתפוצות"" + 0.007*""לישראל"" + 0.007*""לאנשים"" + 0.006*""זכויות""',)",3
23087,הסיבה השנייה שלהערכתי לקחו אינטרס שכחו אינטרס הציבור הסיבה שהגשתי רביזיה,עולים,0.5694686,"('0.011*""אתיופיה"" + 0.008*""יוצאי"" + 0.007*""הנוער"" + 0.007*""נוער"" + 0.007*""הארץ"" + 0.006*""פערים"" + 0.006*""הגבוהה"" + 0.005*""הסטודנטים"" + 0.005*""ההשכלה"" + 0.005*""הפריפריה""',)",3
19522,בקשת יושב-ראש הפנים והגנת הסביבה להקדמת גנים לאומיים שמורות טבע אתרים לאומיים ואתרי הנצחה 17 תכנית למגורים בתחום שכונת מגורים קיימת בגן לאומי התשעח-2018 הקריאה השנייה והשלישית,עולים,0.56929463,"('0.011*""אתיופיה"" + 0.008*""יוצאי"" + 0.007*""הנוער"" + 0.007*""נוער"" + 0.007*""הארץ"" + 0.006*""פערים"" + 0.006*""הגבוהה"" + 0.005*""הסטודנטים"" + 0.005*""ההשכלה"" + 0.005*""הפריפריה""',)",3
17047,לחברת ענבר בזק שנמצאת אתנו בראשית לצוות והלשכה המשפטית לנציגת הבריאות נינא כהן ונציגת המשפטים דר אולגה פרישמן הקורונה נושאים יומנו הארכת תוקפה ההכרזה חירום בשל נגיף הקורונה סמכויות מיוחדות להתמודדות נגיף הקורונה הוראת שעה; והשני סמכויות מיוחדות להתמודדות נגיף הקורונה הוראת הגבלת פעילות ציבורי עסקי והוראות נוספות בשם המקובל התו הירוק,קורונה,0.5691202,"('0.037*""הקורונה"" + 0.029*""שקלים"" + 0.024*""הוראת"" + 0.024*""מיליון"" + 0.022*""נגיף"" + 0.016*""סמכויות"" + 0.013*""מיוחדות"" + 0.013*""להתמודדות"" + 0.012*""שקל"" + 0.011*""פעילות""',)",3
13411,חשובה לקדם מהר ככל שניתן חייב מעמיס הלשכה המשפטית רציתי ברמה העקרונית עברנו עמדת המשרד הציבור הכוונה לקיים דיונים מנת לקדם החקיקה בהקדם האפשרי,כלכלי,0.5686705,"('0.013*""האוצר"" + 0.008*""הכנסה"" + 0.007*""עסקים"" + 0.007*""הכספים"" + 0.006*""המשפטית"" + 0.006*""קטנים"" + 0.006*""ציבורית"" + 0.005*""לדון"" + 0.005*""האשראי"" + 0.004*""לחוק""',)",3
3861,שבאתם ובאתן מכיוון שזו הראשונה להדגיש המטרה לאפשר מכבד שנמצא איתנו שנמצא איתנו בזום שיח פתוח אינטרס משותף להסדיר סוגיות משמעותיות שעולות במצוקה שקשור בסיעוד חל המטופלים וחל המטפלים עצמם והמטפלות,עולים,0.56846696,"('0.011*""אתיופיה"" + 0.008*""יוצאי"" + 0.007*""הנוער"" + 0.007*""נוער"" + 0.007*""הארץ"" + 0.006*""פערים"" + 0.006*""הגבוהה"" + 0.005*""הסטודנטים"" + 0.005*""ההשכלה"" + 0.005*""הפריפריה""',)",3
9038,היבט מגדרי העניין שתחום הסיעוד ומקצוע הסיעוד מרכיביו מקצוע נשי 80% מהעוסקים נשים שכמו מסתכלים משקל כבד מחולק שכמעט 70% מהנושא בכללותו עניין נשים ניקח בחשבון האפליה הקיימת כלפי נשים התחומים בחברה ובממלכה נגיע לנקודה שבה לוועדה בהחלט ניקח עצמנו האחריות לקדם,חינוך,0.5677878,"('0.013*""גבוהה"" + 0.007*""להשכלה"" + 0.006*""בתחום"" + 0.006*""אילן"" + 0.005*""המשרד"" + 0.005*""מחקר"" + 0.004*""הבאה"" + 0.004*""החינוך"" + 0.004*""ברמה"" + 0.004*""רבים""',)",3
21422,פותחת לקידום מעמד האישה ולשוויון מגדרי 13 במרס בעוד מעקב יישום בינוי מעונות תקציבים וביצוע,נשים,0.56771034,"('0.025*""המשפטי"" + 0.018*""מעמד"" + 0.018*""לקידום"" + 0.017*""האישה"" + 0.013*""היועץ"" + 0.011*""מגדרי"" + 0.009*""ולשוויון"" + 0.008*""פותחת"" + 0.007*""שינויים"" + 0.007*""לממשלה""',)",3
7944,רפורמה בחקלאות צריכים לבדוק החקלאים המחיר שחקלאי בישראל מציע צריכים לבדוק שרשרת המזון מוכר בכמה ואיך לשולחן ראינו ניירות עמדה אגף המחקר גופים רבים שלפיהם עולם הקרטלים והמונופולים שהכי מאפיין החקלאי הבודד 40 80 דונם רשתות שיווק רשתות הפצה מיני פטנטים שמונעים מתחרות להתקיים שרשרת המזון שרשרת ההספקה צריכות להיבדק שמגיעים למסקנות נמהרות,בריאות,0.56753665,"('0.032*""הבריאות"" + 0.028*""החולים"" + 0.017*""חולים"" + 0.007*""בתי"" + 0.007*""קופות"" + 0.005*""התקנות"" + 0.005*""בריאות"" + 0.005*""למשרד"" + 0.004*""לבתי"" + 0.004*""העורף""',)",3
2780,ושלום לחברתי שירלי פינטו המשותפת ועדה שיוויון זכויות לאנשים מוגבלויות המשותפת לנגישות עירונית שנעסוק בנפרד ובחרנו לעסוק יחד שירלי,נשים,0.5673552,"('0.025*""המשפטי"" + 0.018*""מעמד"" + 0.018*""לקידום"" + 0.017*""האישה"" + 0.013*""היועץ"" + 0.011*""מגדרי"" + 0.009*""ולשוויון"" + 0.008*""פותחת"" + 0.007*""שינויים"" + 0.007*""לממשלה""',)",3
19536,צוהריים מתנצל העיכוב הקצר לחברי שהצטרפו סמכויות מיוחדות להתמודדות נגיף הקורונה הוראת 10 הארכת תוקף והוראות נוספות התשפב-2021 מ/1461 ממשלתית שמבקשת בבסיסה להאריך תוקף סמכויות מיוחדות להתמודדות נגיף הקורונה ב-13 חודשים שתקף כיום עתיד לפקוע ב-30 בנובמבר בשבוע,קורונה,0.56732154,"('0.037*""הקורונה"" + 0.029*""שקלים"" + 0.024*""הוראת"" + 0.024*""מיליון"" + 0.022*""נגיף"" + 0.016*""סמכויות"" + 0.013*""מיוחדות"" + 0.013*""להתמודדות"" + 0.012*""שקל"" + 0.011*""פעילות""',)",3
8972,מתחיל הצעדים הספציפיים עליהם נדבר אתן רקע קצר צעדים שהממשלה קידמה בשנתיים האחרונות בתחום האשראי ובתחום הבנקאות שחקנים חדשים דנה בימים הפרדת חברות כרטיסי האשראי מהבנקים בנוסף צעדים להכנסת המוסדיים לשוק האשראי הקמעונאי הקלות רגולטוריות שנעשו ביטול המדוכה המספקת צעדים שכרגע מקודמים במשרד האוצר לעודד מוסדיים להיכנס לשוק האשראי הקמעונאי,כלכלי,0.56732136,"('0.013*""האוצר"" + 0.008*""הכנסה"" + 0.007*""עסקים"" + 0.007*""הכספים"" + 0.006*""המשפטית"" + 0.006*""קטנים"" + 0.006*""ציבורית"" + 0.005*""לדון"" + 0.005*""האשראי"" + 0.004*""לחוק""',)",3
12035,הכספים ניירות ערך לקביעת מנגנון להצעת ניירות ערך לציבור,דיור,0.56712925,"('0.016*""ערך"" + 0.011*""שירותים"" + 0.008*""ניירות"" + 0.008*""פיננסיים"" + 0.008*""דירות"" + 0.007*""הבנקים"" + 0.007*""ציבורי"" + 0.007*""דירה"" + 0.006*""הפיקוח"" + 0.006*""דיור""',)",3
4855,חייבים להתמודד להמשיך מהלך חד פעמי מצטער לציין באותו חדר השתמשו בחדר הקדוש בעיני לחלק כספים בזויה בעיני ונעשתה בסיס אינטרסים לחצים הגונים המערכת הועדה העמידה היכולות חילקו תקציבים כספים מיסים ישרה שיכולה פוליטיקה העמדה,תחבורה,0.5670751,"('0.024*""התחבורה"" + 0.012*""הציבורית"" + 0.006*""בשבת"" + 0.005*""נקרא"" + 0.004*""קיבלתי"" + 0.004*""בחודש"" + 0.004*""בתחבורה"" + 0.004*""ציבורית"" + 0.004*""המיסים"" + 0.003*""לעבוד""',)",3
5362,החינוך התרבות והספורט 12 בדצמבר כד בכסלו תשעח להסדר ההימורים בספורט 7 הוראת התשעח-2017 להצעת ממשלתית הסיכום הקודם שמשרד התרבות לוקח צעדים אחורה מכין נוסח שמאפשר המחאת זכות תעדכנו אותנו מעדכן אותנו התרבות,חינוך,0.56679064,"('0.112*""החינוך"" + 0.033*""התרבות"" + 0.028*""והספורט"" + 0.015*""חינוך"" + 0.013*""בסעיף"" + 0.010*""במערכת"" + 0.010*""הלימודים"" + 0.009*""מוסדות"" + 0.008*""שנת"" + 0.007*""מערכת""',)",3
11090,מציע לאדוני שבפרוטוקול ייאמר נעשה חד-פעמי כאמור לעכב הכספים הנכים,כלכלי,0.5667474,"('0.013*""האוצר"" + 0.008*""הכנסה"" + 0.007*""עסקים"" + 0.007*""הכספים"" + 0.006*""המשפטית"" + 0.006*""קטנים"" + 0.006*""ציבורית"" + 0.005*""לדון"" + 0.005*""האשראי"" + 0.004*""לחוק""',)",3
8092,החינוך התרבות והספורט 20 בפברואר כד בשבט תשעז חיזוק הכדורגל בפריפריה מלווה באותה תערוכה זוכים בחוץ תערוכה שהבנתי תערוכה נודדת שיזם עיסוואי פריג הביא לכנסת ומחליפה ומייצגת נאמנה רוזין קיבלתי בקשה אישית לערוך והנה הגיע,חינוך,0.56673354,"('0.112*""החינוך"" + 0.033*""התרבות"" + 0.028*""והספורט"" + 0.015*""חינוך"" + 0.013*""בסעיף"" + 0.010*""במערכת"" + 0.010*""הלימודים"" + 0.009*""מוסדות"" + 0.008*""שנת"" + 0.007*""מערכת""',)",3
13026,התחבורה הציבורית אדיר הכשל מדינת בתחבורה הציבורית מזכיר מדינה הודו לאפריקה באירופה המקומות שמדברים פיתוח התחבורה הציבורית והורדת הזיהום הרכב הפרטי שמורידים הזיהום הרכב הפרטי מגישים תחבורה ציבורית נגישה,תחבורה,0.56672114,"('0.024*""התחבורה"" + 0.012*""הציבורית"" + 0.006*""בשבת"" + 0.005*""נקרא"" + 0.004*""קיבלתי"" + 0.004*""בחודש"" + 0.004*""בתחבורה"" + 0.004*""ציבורית"" + 0.004*""המיסים"" + 0.003*""לעבוד""',)",3
23513,דנים בתקנות שוויון זכויות לאנשים מוגבלויות שהיו אמורות אלינו ממשרד הביטחון שנאמר הגיעו,עולים,0.56656444,"('0.027*""העלייה"" + 0.018*""הקליטה"" + 0.014*""מנכל"" + 0.013*""מר"" + 0.010*""מוגבלות"" + 0.010*""והקליטה"" + 0.008*""והתפוצות"" + 0.007*""לישראל"" + 0.007*""לאנשים"" + 0.006*""זכויות""',)",3
8413,הכספים 24 במאי טז באייר התשעו צו היטלי סחר ואמצעי הגנה היטל יבוא הנובע מהסכם העדפה הוראת התשעה-2015 מציג הדברים,עולים,0.5665247,"('0.027*""העלייה"" + 0.018*""הקליטה"" + 0.014*""מנכל"" + 0.013*""מר"" + 0.010*""מוגבלות"" + 0.010*""והקליטה"" + 0.008*""והתפוצות"" + 0.007*""לישראל"" + 0.007*""לאנשים"" + 0.006*""זכויות""',)",3
3468,הפנים והגנת הסביבה לתיקון דיני הרשויות המקומיות חוקי עזר פתיחתם וסגירתם עסקים בימי מנוחה התשעח-2017 מ/1175 השלמת,קורונה,0.56642604,"('0.017*""הקורונה"" + 0.012*""משבר"" + 0.006*""צהל"" + 0.005*""העוני"" + 0.005*""המשבר"" + 0.004*""צריכים"" + 0.004*""לסייע"" + 0.004*""בתקופה"" + 0.003*""הביטחון"" + 0.003*""הנחיות""',)",3
12904,עוסקים במשהו שצריך קראתי במשהו שפרסמתי הפארטו ה-20% ה-80% הבעיות זימנו,בריאות,0.5663607,"('0.032*""הבריאות"" + 0.028*""החולים"" + 0.017*""חולים"" + 0.007*""בתי"" + 0.007*""קופות"" + 0.005*""התקנות"" + 0.005*""בריאות"" + 0.005*""למשרד"" + 0.004*""לבתי"" + 0.004*""העורף""',)",3
15408,לצערנו הרב שקורה בשטח שאמור לקרות ודאי שאמור לקרות פי ההנחיות פיקוד המשטרה מקווים וכך חושבים וכך ב-12 ביולי,עולים,0.56603646,"('0.005*""בישראל"" + 0.004*""המשטרה"" + 0.004*""התפוצות"" + 0.004*""העולים"" + 0.004*""הרב"" + 0.004*""דרכים"" + 0.003*""החדשים"" + 0.003*""הדיווח"" + 0.003*""מקרים"" + 0.003*""מלחמה""',)",3
23302,ברוכים המתכנסים והמתכנסות הכרזת סמכויות מיוחדות להתמודדות נגיף הקורונה הוראת שעהבידוד בפיקוח טכנולוגיתיקון 3 התשפב-2021,קורונה,0.56587225,"('0.037*""הקורונה"" + 0.029*""שקלים"" + 0.024*""הוראת"" + 0.024*""מיליון"" + 0.022*""נגיף"" + 0.016*""סמכויות"" + 0.013*""מיוחדות"" + 0.013*""להתמודדות"" + 0.012*""שקל"" + 0.011*""פעילות""',)",3
22077,צהרים שמחה החינוך התרבות והספורט נדון סמכויות מיוחדות להתמודדות נגיף הקורונה הוראת הגבלת פעילות מוסדות המקיימים פעילות חינוך והוראות נוספות,קורונה,0.56583315,"('0.037*""הקורונה"" + 0.029*""שקלים"" + 0.024*""הוראת"" + 0.024*""מיליון"" + 0.022*""נגיף"" + 0.016*""סמכויות"" + 0.013*""מיוחדות"" + 0.013*""להתמודדות"" + 0.012*""שקל"" + 0.011*""פעילות""',)",3
538,המרשם הפלילי ותקנת השבים אסור לשכוח צדדים למשוואה הרישום הפלילי תקנת השבים,בריאות,0.56572926,"('0.032*""הבריאות"" + 0.028*""החולים"" + 0.017*""חולים"" + 0.007*""בתי"" + 0.007*""קופות"" + 0.005*""התקנות"" + 0.005*""בריאות"" + 0.005*""למשרד"" + 0.004*""לבתי"" + 0.004*""העורף""',)",3
5976,1 אגרה רישיון שירות נתוני אשראי שירות מידע עוסקים בסכום 50000 שקלים חדשים,כלכלי,0.5656519,"('0.013*""האוצר"" + 0.008*""הכנסה"" + 0.007*""עסקים"" + 0.007*""הכספים"" + 0.006*""המשפטית"" + 0.006*""קטנים"" + 0.006*""ציבורית"" + 0.005*""לדון"" + 0.005*""האשראי"" + 0.004*""לחוק""',)",3
23492,פותחים סמכויות מיוחדות להתמודדות נגיף הקורונה הוראת הגבלת היציאה מישראל למעשה קבצי 6 ותיקון 7 כשבכל רשימה מדינות אינני טועה 6 נכנסו ב-23 לחודש שישי האחרון והתקנות בתיקון 7 עתידות להיכנס לתוקף ב-30 ביולי שישי הקרוב,קורונה,0.5655696,"('0.037*""הקורונה"" + 0.029*""שקלים"" + 0.024*""הוראת"" + 0.024*""מיליון"" + 0.022*""נגיף"" + 0.016*""סמכויות"" + 0.013*""מיוחדות"" + 0.013*""להתמודדות"" + 0.012*""שקל"" + 0.011*""פעילות""',)",3
