,NonStopwordsQuoteText,Topic,Topic_Prob,TopicWords,Batch
23593,בשבוע הקרוב נשקול צעדנו בשום תוך מעקב התחלואה הפיזית תוך מזכירים למשרד הבריאות אחראי בריאות הציבור בריאות הציבור מצבם הנפשי הקטטוני וההשלכות ארוכות הטווח לסגר החברה הישראלית במצב שהכי לסגור הכול סגר כללי מערכת החינוך נתונים דרמטיים ומפחידים כללי הבריאות הנתונים שמפשטים הפילוח לאוכלוסיות נותנים,קורונה,0.7091463,"('0.011*""הבריאות"" + 0.006*""החולים"" + 0.005*""הדברים"" + 0.004*""צריכים"" + 0.004*""חולים"" + 0.004*""הקורונה"" + 0.004*""הציבור"" + 0.004*""בתי"" + 0.003*""בתחום"" + 0.003*""שצריך""',)",1
9052,מכבד החינוך התרבות והספורט 10 בינואר יב בטבת תשעז מצוקת קלינאי התקשורת במערך החינוך המיוחד בדרום,חינוך,0.7091104,"('0.051*""החינוך"" + 0.014*""התרבות"" + 0.012*""והספורט"" + 0.010*""איתנו"" + 0.008*""חינוך"" + 0.006*""הבריאות"" + 0.005*""הספר"" + 0.005*""הלימודים"" + 0.005*""מכן"" + 0.005*""במערכת""',)",1
13317,כוועדה נעשה הכול לאזרחי שקט נדע לעבוד ביחד המשרד לפקח לתושבים הגנה לביטחון פנים ביטחון הציבור אומרת שונה מחוץ וביטחון שהרבה נושאים חסויים פתוחה לציבור ותהיה קשובה לציבור,קורונה,0.70872355,"('0.011*""הבריאות"" + 0.006*""החולים"" + 0.005*""הדברים"" + 0.004*""צריכים"" + 0.004*""חולים"" + 0.004*""הקורונה"" + 0.004*""הציבור"" + 0.004*""בתי"" + 0.003*""בתחום"" + 0.003*""שצריך""',)",1
19517,הכלכלה ה-14 באוקטובר כו בתשרי התשפא סמכויות מיוחדות להתמודדות נגיף הקורונה הוראת הגבלת פעילות בתחום התחבורה 2 התשפא-2020,קורונה,0.70829785,"('0.018*""הפנים"" + 0.018*""הקורונה"" + 0.017*""הוראת"" + 0.014*""הסביבה"" + 0.013*""והגנת"" + 0.012*""נגיף"" + 0.011*""החוקה"" + 0.010*""המשפטי"" + 0.010*""לחוק"" + 0.010*""סמכויות""',)",1
5733,כול אשתדל להתייחס לאירועים שקרו הסכמה הפסקת אש הסדר ובלי ומצד הציבור מרגיש מיצינו שצריך למצות והשארנו הכול בתחושה שהחמאס כאילו ניצח פועלים החליל מעין תחושה שחבל מאחר מכיר השיקולים נכנס שכרגע שקט שקט,קורונה,0.70825887,"('0.011*""הבריאות"" + 0.006*""החולים"" + 0.005*""הדברים"" + 0.004*""צריכים"" + 0.004*""חולים"" + 0.004*""הקורונה"" + 0.004*""הציבור"" + 0.004*""בתי"" + 0.003*""בתחום"" + 0.003*""שצריך""',)",1
10548,לקידום מעמד האישה ולשוויון מגדרי ה-7 בספטמבר יח באלול תשפ תנאי העסקת הסייעות בגנים ובצהרונים,נשים,0.70807654,"('0.015*""לקידום"" + 0.014*""מעמד"" + 0.014*""האישה"" + 0.014*""הכלכלית"" + 0.011*""התקציב"" + 0.010*""התכנית"" + 0.009*""מגדרי"" + 0.009*""פרק"" + 0.009*""פותחת"" + 0.008*""נשים""',)",1
11101,להתנצל בפני הנוכחים התקלה שגרמה להתחיל באיחור שמחה הפנים והגנת הסביבה ולהודות לחברת עאידה תומא סלימאן שיזמה החשוב,חינוך,0.7077342,"('0.051*""החינוך"" + 0.014*""התרבות"" + 0.012*""והספורט"" + 0.010*""איתנו"" + 0.008*""חינוך"" + 0.006*""הבריאות"" + 0.005*""הספר"" + 0.005*""הלימודים"" + 0.005*""מכן"" + 0.005*""במערכת""',)",1
24264,ארי כללה הניחה בפני לקראת הקריאה שנייה ושלישית החלק הנוגע הראשונה ונושא נוסף בקריאה הראשונה ודובר נכנס להצעת הארכת תוקפה ועדה מיוחדת,קורונה,0.70772034,"('0.018*""הפנים"" + 0.018*""הקורונה"" + 0.017*""הוראת"" + 0.014*""הסביבה"" + 0.013*""והגנת"" + 0.012*""נגיף"" + 0.011*""החוקה"" + 0.010*""המשפטי"" + 0.010*""לחוק"" + 0.010*""סמכויות""',)",1
7035,הפך החברה בישראל ניצנים התגברות עליית מחירים ולנסות לייצב המשק באיזושהי צורה ובאמת במצב מאשר בעבר הדירות אופטימיות היתר בעיות הבנק,קורונה,0.7075571,"('0.011*""הבריאות"" + 0.006*""החולים"" + 0.005*""הדברים"" + 0.004*""צריכים"" + 0.004*""חולים"" + 0.004*""הקורונה"" + 0.004*""הציבור"" + 0.004*""בתי"" + 0.003*""בתחום"" + 0.003*""שצריך""',)",1
4565,הכלכלה ה-14 באוקטובר כו בתשרי התשפא סמכויות מיוחדות להתמודדות נגיף הקורונה הוראת הגבלות הפעלת שדות תעופה וטיסות 2 התשפא-2020,קורונה,0.7075183,"('0.018*""הפנים"" + 0.018*""הקורונה"" + 0.017*""הוראת"" + 0.014*""הסביבה"" + 0.013*""והגנת"" + 0.012*""נגיף"" + 0.011*""החוקה"" + 0.010*""המשפטי"" + 0.010*""לחוק"" + 0.010*""סמכויות""',)",1
21183,הקדמה קצרה בחודשים האחרונים מגיעים לפה מנכלי לדווח לוועדה בתחום השקיפות פותחים המשרד לציבור משקפים מידע חיוני ממידע תקציבי למידע הזכויות שהציבור לבקש במקרה ציבור רחב שכולל תעשיינים וחברות ועסקים קטנים וגדולים וכו וכו מידע מקבלים בבואם לבקש הסיוע מהמשרד ההליכים הבירוקרטיים ואיך מייעלים המענה לשאילתות המענה לשאילתות מענה לבקשות חופש מידע וכו וכו,קורונה,0.7074859,"('0.011*""הבריאות"" + 0.006*""החולים"" + 0.005*""הדברים"" + 0.004*""צריכים"" + 0.004*""חולים"" + 0.004*""הקורונה"" + 0.004*""הציבור"" + 0.004*""בתי"" + 0.003*""בתחום"" + 0.003*""שצריך""',)",1
9854,תופס חשיבותה עצמאות מערכת ההשכלה הגבוהה ושל המוסדות נגיע בהמשך,קורונה,0.7073685,"('0.011*""הבריאות"" + 0.006*""החולים"" + 0.005*""הדברים"" + 0.004*""צריכים"" + 0.004*""חולים"" + 0.004*""הקורונה"" + 0.004*""הציבור"" + 0.004*""בתי"" + 0.003*""בתחום"" + 0.003*""שצריך""',)",1
16208,פותחת החינוך התרבות והספורט ה-21 בפברואר כה בשבט תשעז באיחור נפתח מועדוניות הרווחה החינוך חסמי מערכת החינוך מפני צמצום פערים וכמובן לאור העובדה שהכנסת מציינת העוני,חינוך,0.7072871,"('0.051*""החינוך"" + 0.014*""התרבות"" + 0.012*""והספורט"" + 0.010*""איתנו"" + 0.008*""חינוך"" + 0.006*""הבריאות"" + 0.005*""הספר"" + 0.005*""הלימודים"" + 0.005*""מכן"" + 0.005*""במערכת""',)",1
23486,חילופי אישים המשותפת וועדת הכלכלה בפרק יא כולו רשויות תחבורה מטרופוליטניות התוכנית הכלכלית חקיקה ליישום המדיניות הכלכלית לשנת התקציב התשעח–2018 אושרו,נשים,0.7064711,"('0.015*""לקידום"" + 0.014*""מעמד"" + 0.014*""האישה"" + 0.014*""הכלכלית"" + 0.011*""התקציב"" + 0.010*""התכנית"" + 0.009*""מגדרי"" + 0.009*""פרק"" + 0.009*""פותחת"" + 0.008*""נשים""',)",1
1717,הכותרת בסופו מדברת תרבות וספורט כדיון בסדרת דיונים נקבל תמונת עומדים מתכנסים פעילות ספורט ומתקני תרבות ומפה נמשיך להתקדם לדיונים,קורונה,0.70629156,"('0.011*""הבריאות"" + 0.006*""החולים"" + 0.005*""הדברים"" + 0.004*""צריכים"" + 0.004*""חולים"" + 0.004*""הקורונה"" + 0.004*""הציבור"" + 0.004*""בתי"" + 0.003*""בתחום"" + 0.003*""שצריך""',)",1
15167,הכלכלה 1 בפברואר יט בשבט התשפא סמכויות מיוחדות להתמודדות נגיף הקורונה הוראת הגבלות הפעלת שדות תעופה וטיסות 9 התשפט-2021 הגיע ה-1 בפברואר אתנו בזום התחבורה רננה שחר אמרת בתקנות האלו,קורונה,0.70582366,"('0.018*""הפנים"" + 0.018*""הקורונה"" + 0.017*""הוראת"" + 0.014*""הסביבה"" + 0.013*""והגנת"" + 0.012*""נגיף"" + 0.011*""החוקה"" + 0.010*""המשפטי"" + 0.010*""לחוק"" + 0.010*""סמכויות""',)",1
8714,החינוך התרבות והספורט 14 באוגוסט באלול התשעח היערכות לפתיחת שנת הלימודים תשעט,חינוך,0.7054463,"('0.051*""החינוך"" + 0.014*""התרבות"" + 0.012*""והספורט"" + 0.010*""איתנו"" + 0.008*""חינוך"" + 0.006*""הבריאות"" + 0.005*""הספר"" + 0.005*""הלימודים"" + 0.005*""מכן"" + 0.005*""במערכת""',)",1
16175,סמכויות מיוחדות להתמודדות נגיף הקורונה הוראת הגבלת פעילות בתחום התחבורה 4 התשפא–2020 התחבורה איתנו,קורונה,0.7049528,"('0.018*""הפנים"" + 0.018*""הקורונה"" + 0.017*""הוראת"" + 0.014*""הסביבה"" + 0.013*""והגנת"" + 0.012*""נגיף"" + 0.011*""החוקה"" + 0.010*""המשפטי"" + 0.010*""לחוק"" + 0.010*""סמכויות""',)",1
153,לבקש הנוכחים שחלקם נושאים עמם הסיפור האישי הקשה והכואב מעוניינת שהדיון קונסטרוקטיבי שצופה פני עתיד שמבקש ללמוד לפעול הלאה ופחות פרטני בקשתי נתחיל נציג מבקר,קורונה,0.70486504,"('0.011*""הבריאות"" + 0.006*""החולים"" + 0.005*""הדברים"" + 0.004*""צריכים"" + 0.004*""חולים"" + 0.004*""הקורונה"" + 0.004*""הציבור"" + 0.004*""בתי"" + 0.003*""בתחום"" + 0.003*""שצריך""',)",1
36,ברשותכם נתחיל קצר ב-9 במרץ כט באדר התשעו 1041 ברשותכם ככל שניסיתי להעמיק ולהבין מודה שהידע משלי ממשרד החקלאות,חינוך,0.7048344,"('0.051*""החינוך"" + 0.014*""התרבות"" + 0.012*""והספורט"" + 0.010*""איתנו"" + 0.008*""חינוך"" + 0.006*""הבריאות"" + 0.005*""הספר"" + 0.005*""הלימודים"" + 0.005*""מכן"" + 0.005*""במערכת""',)",1
2660,השירות הלאומי האזרחי מתנדבים 18000 מתנדבים 90% מהמתנדבים מתנדבות 35% מהמתנדבים ממשיכים לשנה השנייה קיימת הגדרה חוקית לבת שירות בודדה שמקנה הטבות שקיים עבור חייל בודד כלל המתנדבים כ-160 מתנדבות מוגדרות כעולות בודדות עורף משפחתי לשנה הבאה 15% ל-20% מהמתנדבות העולות תמשכנה להתנדב לשנה שנייה,בטחון,0.7044413,"('0.019*""הביטחון"" + 0.015*""צהל"" + 0.009*""חיילים"" + 0.005*""לפועל"" + 0.005*""משוחררים"" + 0.005*""בודדים"" + 0.004*""בצהל"" + 0.004*""שלמה"" + 0.004*""מובן"" + 0.004*""נכי""',)",1
15532,החינוך התרבות והספורט ה-25 בדצמבר יז בטבת תשעט נגישות מוסדות תרבות ומופעי תרבות לרגל הבינלאומי לזכויות מוגבלויות אחליף יור שנבצר להודות ליוזמים החשוב הפעם הרביעית החמישית,חינוך,0.7039271,"('0.051*""החינוך"" + 0.014*""התרבות"" + 0.012*""והספורט"" + 0.010*""איתנו"" + 0.008*""חינוך"" + 0.006*""הבריאות"" + 0.005*""הספר"" + 0.005*""הלימודים"" + 0.005*""מכן"" + 0.005*""במערכת""',)",1
11845,קיימה מיוחד למאבק באלימות נשים שיזמתי התקיימו ארבעה דיונים בוועדות שונות לקידום מעמד האישה קיימנו דיונים שהיו חשובים תקצוב ויישום התכנית הלאומית למאבק באלימות נשים התכנית הממשלתית שידוע שהיינו צריכות להאבק לאימוצה ואישורה השרים,נשים,0.7038727,"('0.015*""לקידום"" + 0.014*""מעמד"" + 0.014*""האישה"" + 0.014*""הכלכלית"" + 0.011*""התקציב"" + 0.010*""התכנית"" + 0.009*""מגדרי"" + 0.009*""פרק"" + 0.009*""פותחת"" + 0.008*""נשים""',)",1
12633,הפנים והגנת הסביבה שדה התעופה דב הוז הוראות מיוחדות מ/1280,קורונה,0.7037436,"('0.018*""הפנים"" + 0.018*""הקורונה"" + 0.017*""הוראת"" + 0.014*""הסביבה"" + 0.013*""והגנת"" + 0.012*""נגיף"" + 0.011*""החוקה"" + 0.010*""המשפטי"" + 0.010*""לחוק"" + 0.010*""סמכויות""',)",1
2890,הבית נותנים שירות שמגיעים מארצות אחרות ממדינות אויב יושבים מסוריה מגיעים ומקבלים טיפול מדינת מגיעים נדרשים לסייע ובכלל לאזרח בטוחה שכולנו זוכרים התמונות מרעידות האדמה במקומות השונים שהצוותים הגיעו לסייע בחילוץ ובטיפול הרפואי,קורונה,0.7036687,"('0.011*""הבריאות"" + 0.006*""החולים"" + 0.005*""הדברים"" + 0.004*""צריכים"" + 0.004*""חולים"" + 0.004*""הקורונה"" + 0.004*""הציבור"" + 0.004*""בתי"" + 0.003*""בתחום"" + 0.003*""שצריך""',)",1
13786,יועצות משפטיות היועצת המשפטית לקידום מעמד האישה שתצטרף אלינו לדיונים רשמת פרלמנטרית קמלר קצין מילואים ראשי אורחות נכבדות,נשים,0.7036679,"('0.015*""לקידום"" + 0.014*""מעמד"" + 0.014*""האישה"" + 0.014*""הכלכלית"" + 0.011*""התקציב"" + 0.010*""התכנית"" + 0.009*""מגדרי"" + 0.009*""פרק"" + 0.009*""פותחת"" + 0.008*""נשים""',)",1
922,כינוס השנייה לקידום הבטיחות בדרכים מתכנסת לאור הבטיחות בדרכים מציינים ובמדינת הציון במליאת שלישי קיימנו ישיבות לזכויות הילד היפגעות 50% מהפגיעות בתאונות דרכים ובוועדת המדע והטכנולוגיה השימוש באמצעים טכנולוגיים לרלבד הרגשתי דגש הטעמת אמצעים טכנולוגיים,נשים,0.70323396,"('0.015*""לקידום"" + 0.014*""מעמד"" + 0.014*""האישה"" + 0.014*""הכלכלית"" + 0.011*""התקציב"" + 0.010*""התכנית"" + 0.009*""מגדרי"" + 0.009*""פרק"" + 0.009*""פותחת"" + 0.008*""נשים""',)",1
4516,21 בפברואר כה בשבט תשעז פותחת החינוך התרבות והספורט יצירת מרחב מוגן לנוער להטב במערכת החינוך וההשכלה הגבוהה לציון הגאה,חינוך,0.70257306,"('0.051*""החינוך"" + 0.014*""התרבות"" + 0.012*""והספורט"" + 0.010*""איתנו"" + 0.008*""חינוך"" + 0.006*""הבריאות"" + 0.005*""הספר"" + 0.005*""הלימודים"" + 0.005*""מכן"" + 0.005*""במערכת""',)",1
5424,סליחה האיחור החלפתי יושב העבודה והרווחה מצוין ומאד מירב ארי אחליף יור החינוך התרבות והספורט ה-31 במאי כג באייר תשעו,חינוך,0.70231307,"('0.051*""החינוך"" + 0.014*""התרבות"" + 0.012*""והספורט"" + 0.010*""איתנו"" + 0.008*""חינוך"" + 0.006*""הבריאות"" + 0.005*""הספר"" + 0.005*""הלימודים"" + 0.005*""מכן"" + 0.005*""במערכת""',)",1
15471,פותחת ברשותכם מוכנות מערכת הבריאות לטיפול בנגיף הקורונה תוך שמירה שגרת טיפולים במחלות אחרות לקראת החורף המשך לדיונים שכבר התחילו היערכות מבחינת מכונות הנשמה האביזרים הטכנולוגיים נקרא ההיבט המכשור שנדרש בבתי החולים נוכל לטפל בקורונה במחלות אחרות והיום נדבר ההיערכות כללי מבחינת תקינת כוח האדם המחלקות השונות צריכים בגל היינו ממוקדי קורונה ואנשים פחדו לבתי החולים לקופות החולים ויוצא שאנשים פגעו בבריאותם בהיבטים שאינם קשורים בקורונה יכולנו להציל במציאות,קורונה,0.7020855,"('0.011*""הבריאות"" + 0.006*""החולים"" + 0.005*""הדברים"" + 0.004*""צריכים"" + 0.004*""חולים"" + 0.004*""הקורונה"" + 0.004*""הציבור"" + 0.004*""בתי"" + 0.003*""בתחום"" + 0.003*""שצריך""',)",1
537,יושבת עאידה תומא מקרים שבהם קושי במעקב קרובי המשפחה הקרבן שנרצח הקרבן שנרצחה קושי במעקב החקירה ומצבה הנוכחי אפשרות למשפחה הנרצח הנרצחת לעקוב החקירה והחוק הפרקטיקה מאפשר לעמותה שהמשפחה פונה אליה לעקוב החקירה בפרקטיקה ניגודי אינטרסים מדברת מציאות שהחוק מתייחס אליה שמוחלשת לעקוב החקירה בתה הנרצחת לבין האחים והאמא סיוע משפטי עדיפות בנוגע להנגשת המידע הזוג שהחוק מאפשר לעקוב החקירה האחרים ואחר אפוטרופוס הכללי,בטחון,0.70205104,"('0.019*""הביטחון"" + 0.015*""צהל"" + 0.009*""חיילים"" + 0.005*""לפועל"" + 0.005*""משוחררים"" + 0.005*""בודדים"" + 0.004*""בצהל"" + 0.004*""שלמה"" + 0.004*""מובן"" + 0.004*""נכי""',)",1
24122,היושב עלה נכונות לקיים במסגרת מהיר ותודה לחברי דב חנין,חינוך,0.70189095,"('0.051*""החינוך"" + 0.014*""התרבות"" + 0.012*""והספורט"" + 0.010*""איתנו"" + 0.008*""חינוך"" + 0.006*""הבריאות"" + 0.005*""הספר"" + 0.005*""הלימודים"" + 0.005*""מכן"" + 0.005*""במערכת""',)",1
4648,שמדינת מוזר ולמרות עשרות השנים מדינה יהודית ודמוקרטית עצמאית וחופשית מוגדרת כמדינה במצב חירום מיום הכרזתה כמדינה ואין ספק שהסיטואציה חריגה בריאה נכונה בנסיבות חייבים להבין שהמציאות שנוצרה מחייבת אותנו לעסוק ועכשיו מציאות פוליטית מורכבת העובדה שלאורך מוגדרים כמצב חירום מחייבת שינוי סוגיה שנדונה עסקו רבות הגיעה לערכאות משפטיות שנדרשו ולדעתי תהליך משמעותי שינוי לאורך השנים בכנסות האחרונות והוועדה החוץ והביטחון לאורך השנים עסקה לצמצם המציאות שבה מוגדר חירום צריכים מאמץ שהאילוץ ישתנה ונוכל להפוך לחקיקה ההגדרות הנדרשות במצב הקיים ובעוד שנותר,קורונה,0.70180875,"('0.011*""הבריאות"" + 0.006*""החולים"" + 0.005*""הדברים"" + 0.004*""צריכים"" + 0.004*""חולים"" + 0.004*""הקורונה"" + 0.004*""הציבור"" + 0.004*""בתי"" + 0.003*""בתחום"" + 0.003*""שצריך""',)",1
20953,הכספים מתחילים לתיקון פקודת הכנסה 221 התשעו-2016 המכונה הפטקא,קורונה,0.701745,"('0.018*""הפנים"" + 0.018*""הקורונה"" + 0.017*""הוראת"" + 0.014*""הסביבה"" + 0.013*""והגנת"" + 0.012*""נגיף"" + 0.011*""החוקה"" + 0.010*""המשפטי"" + 0.010*""לחוק"" + 0.010*""סמכויות""',)",1
2462,לפיכך ביקשנו שבועיים פירוט מדויק השימושים בתקנות נתנו הנחיות מדויקות מרבית העבירו לוועדת השקיפות המידע להסתיר מיד נבחן ואולי סיבה שקופים הציבור יוכל נעשה הכסף שעובר תחת הכותרת גליל לרווחת התושבים שחיים בגליל מתחלק כשעמותה מקבלת עמותות אחרות שפועלות באותו שדה ובאותו תחום קיבלו זכות להתחרות ולזכות בתקציב מהמדינה כשמעבירים ליהדות מחברי החליטו להעביר כספים פוליטיים תחת כותרת שנקראת יהדות העבירו לחינוך יהודי סוגי היהדות הזרמים שקיימים ביהדות ביהדות חילונית ביהדות רפורמית יהדות קונסרבטיבית יהדות פלורליסטית גווניה שמדובר בזרם מסוים ובארגונים מסוימים שירות פוליטי לפוליטיקאים מסוימים,קורונה,0.7013242,"('0.011*""הבריאות"" + 0.006*""החולים"" + 0.005*""הדברים"" + 0.004*""צריכים"" + 0.004*""חולים"" + 0.004*""הקורונה"" + 0.004*""הציבור"" + 0.004*""בתי"" + 0.003*""בתחום"" + 0.003*""שצריך""',)",1
5507,השתתפות להתעלם ממי שהביא אותנו בעקבות תחקיר בעיתון ידיעות אחרונות האצבע דליפת המידע לדון לפגוע בחשיבות עצם חשיפת המידע מחויבים חשיפת מידע יכולים ההגנה המקסימלית לנזק וחשיפה ולתוצאות לוואי בעקבות המידע הנחשף ראינו כוועדת המדע והטכנולוגיה צורך מיוחד לדון חושבים פתרונות טכנולוגיים חדישים שיכולים במניעת חשיפת מידע מעוניינים בהמשך כתוצאה מחשיפת המידע נזקים קרו ואיזו פגיעה קרתה לאנשים ואיך מונעים חושבים פרקטי והתנהלותי ושל כוח מיומן כוח פיתוחים טכנולוגיים שקיימים שאפשר מענה מודים ונדון,קורונה,0.7011837,"('0.011*""הבריאות"" + 0.006*""החולים"" + 0.005*""הדברים"" + 0.004*""צריכים"" + 0.004*""חולים"" + 0.004*""הקורונה"" + 0.004*""הציבור"" + 0.004*""בתי"" + 0.003*""בתחום"" + 0.003*""שצריך""',)",1
2214,לפסיכולוגים מסלולים פסיכולוגים שמיועדים לשירות הציבורי פסיכולוגים חינוכיים והתפתחותיים פסיכולוגים רפואיים-שיקומיים ופסיכולוגים תעסוקתיים חינוכיים מעוניינים להבין מסלולי הכשרה מעשית פתוחים תקנים זמני ההמתנה מהתחומים נעשה מנת לתמרץ ולפתוח תחומי הכשרה,בטחון,0.70096254,"('0.019*""הביטחון"" + 0.015*""צהל"" + 0.009*""חיילים"" + 0.005*""לפועל"" + 0.005*""משוחררים"" + 0.005*""בודדים"" + 0.004*""בצהל"" + 0.004*""שלמה"" + 0.004*""מובן"" + 0.004*""נכי""',)",1
15798,צהריים נפתח וועדת השקיפות שמחה שהיום מנכל הבריאות משה סימן ונציגי המשרד שמצטרפים אלינו למדד השקיפות במשרדי,חינוך,0.7007776,"('0.051*""החינוך"" + 0.014*""התרבות"" + 0.012*""והספורט"" + 0.010*""איתנו"" + 0.008*""חינוך"" + 0.006*""הבריאות"" + 0.005*""הספר"" + 0.005*""הלימודים"" + 0.005*""מכן"" + 0.005*""במערכת""',)",1
24453,החינוך התרבות והספורט 151116 יד בחשוון תשעז החינוך הטכנולוגי כמערכת תומכת ומפתחת כמסללה לציון הכשרות המקצועיות,חינוך,0.70074546,"('0.051*""החינוך"" + 0.014*""התרבות"" + 0.012*""והספורט"" + 0.010*""איתנו"" + 0.008*""חינוך"" + 0.006*""הבריאות"" + 0.005*""הספר"" + 0.005*""הלימודים"" + 0.005*""מכן"" + 0.005*""במערכת""',)",1
17167,כול צודק הדברים דייקת הבריאות אמרת הטכנוקרט באירוע בחקיקה שנעשתה מהר ואכן בצדק מסיבות ברורות והנושא חלוקת סמכויות מורכב הבריאות באחריות הקולקטיבית הרים הכפפה וזז קדימה הגיוני שבחוק סעיפים מהותיים לבריאות שאמרת יוגדרו הבריאות המנהל לאפשר לממשלה גמישות מסוימת ולומר כדיפולט שבהתחלה הבריאות המנהל בהחלטתה להעביר סמכות למשרד שעוסק,קורונה,0.70066166,"('0.011*""הבריאות"" + 0.006*""החולים"" + 0.005*""הדברים"" + 0.004*""צריכים"" + 0.004*""חולים"" + 0.004*""הקורונה"" + 0.004*""הציבור"" + 0.004*""בתי"" + 0.003*""בתחום"" + 0.003*""שצריך""',)",1
