QuoteText,Topic,Topic_Prob
"אני רוצה לפתוח בהתייחסות לעדכונים שאנחנו מקבלים ממש מהדקות האחרונות, שהממשלה אישרה את זה שכבר ממחר לא יהיו לימודים במערכת החינוך בכלל, אני רגע שם בצד את מערכת ההשכלה הגבוהה. אני מניח שההחלטה הזאת תגיע לאישור ועדת החינוך, ממש בשעות הקרובות, כפי שקורה כל פעם ואני מוכרח להגיד שאני מתקשה להבין את ההחלטה לשגע את מערכת החינוך ככה. הייתה החלטה שלומדים עד יום שישי, עכשיו יש החלטה שכבר מחר לא לומדים. ממש חמש דקות לפני שהגעתי אשתי התקשרה אליי שכל הגן בלחץ והם לא מבינים מה הם צריכים לעשות היום, אם הם צריכים עכשיו לציין את החגים ולסיים את הגן, כן או לא. בהקשר הזה אני חושב שזו פשוט הייתה החלטה מיותרת שהיה אפשר להימנע ממנה. ",בריאות,0.63952553
לנציגי האוצר: מדובר על החזר שקופות החולים יעבירו לבתי החולים 101.5% מהפעילות שנעשתה ב-2019. לקחת את 2019 ולהעביר 101.5%. ,בריאות,0.72771764
"בשני המקרים האלו, ובעוד רבים שבטח יעלו כאן בדיון, מערכת המשפט ואכיפת החוק בישראל משמשת כמפלצת בעלת כמה ראשים. היא מאשימה את אזרחי ישראל מחד, רודפת אותם מאידך, עוקבת אחריהם ברשת, ואם זה לא מספיק היא גם מצנזרת את הביקורת שיש לגביה. מדובר בשימוש במשאבי ציבור כדי להגן על עובדי המערכת, אף בענייניהם האישיים, בשימוש במשאבי ציבור ובכלים חקירתיים כנגד אזרחים ללא שום הצדקה או סמכות בחוק.",בריאות,0.97781974
"אני רוצה להצביע על חבריי בליכוד שכל הזמן בוכים וצועקים ""מרה-מרה"" על מערכת המשפט ועל העריצות המשפטית של היועץ המשפטי, ושכל פעם אומרים לנו: ""איפה אתם הייתם בכל הזמן הזה"". אז הנה, שוב פעם אנחנו רוצים להביא פה משהו שירסן את מערכת הייעוץ המשפטי, כמו שאנחנו מאמינים, כמו שהליכוד טוען שהוא מאמין, אבל שוב פעם הליכוד משתפן ומתנהג כאסקופה נדרסת בפני כחול לבן ומושך את ההסתייגויות האלו. רק אנחנו, ימינה, נשארים כאן כדי להגן על עקרונות הימין. אחר כך שוב פעם אוסנת מארק תצעק שאנחנו היינו כל הזמן, אבל בפועל, כשהליכוד כאסקופה נדרסת בפני כחול לבן מושכים את ההסתייגויות שלהם, לנו נשאר להגן על הממשלה מפני העריצות המשפטית. ",בריאות,0.77890533
"לכן באחד הדיונים שהיה פה על מימון בתי החולים מקופות החולים, שאלתי מדוע אנחנו לא משפרים את השירות הביתי שאנחנו נותנים לאזרחים כשקורה משהו, כשמגיע גוף לתת שירות ביתי, למה הוא קודם כל מפנה. ",בריאות,0.5210607
"אמרתי שאנחנו צריכים לשפר את המערכת הזאת והאוצר הסכים להעביר 41 מיליון, שאנחנו צריכים להעביר אותם לגוף או גופים שיתנו שירות ביתי שימנע פינוי אנשים לבתי החולים. העלויות האלה ירדו מקופות החולים, צריך לראות איך האוצר משלם את זה, מי משלם את זה, אבל יש התחייבות של האוצר ל-41 מיליון. למען האמת ראיתי את זה clear cut שזה עובר למד""א, כל הכסף, ומד""א מפעיל מערכת כי יש לו מערכות מוכנות, הוא השקיע בזה כסף, ואמרה לי היועצת המשפטית שאני מקשיב לה בעניינים האלה, 'אתה לא יכול לעשות את זה כי יש עוד גופים שחושבים שהם יכולים לתת את השירות הזה, והם יכולים להתמודד, אני לא יודע אם במכרז או לא במכרז - - -",בריאות,0.7110244
"אני אומר למשרד לביטחון פנים שהייתה אמורה להיות יחידה שאמר השר הקודם שהוא יקים אותה ושהיא תתחיל לפעול ב-1 בספטמבר. כמובן שאין יחידה כזאת או לפחות אנחנו לא מכירים יחידה כזאת ולא יודעים על מעקב כזה שמתקיים, ככל שמתקיים. אני מבקש לקבל את ההתייחסות שלכם.",בריאות,0.8192274
"שלום לכולם. אני מתכבד לפתוח את ישיבת ועדת הכלכלה של הכנסת. היום 13 באוקטובר 2020, כ""ה בתשרי התשפ""א. הנושא על סדר היום הוא הצעת חוק הגנת הצרכן (תיקון מס' 62) (מאגר צרכנים להגבלת שיחות שיווק מרחוק), התש""ף-2020,  מ/1362, וכן הצעת חוק הגנת הצרכן (תיקון – איסור על שיווק טלפוני למספר הרשום במאגר ""אל תתקשרו אלי""), התש""ף-2020, פ/196/23, של חברי הכנסת משה גפני ויעקב אשר, שכמובן יוצמדו. הנוסח יהיה הצעת החוק שהוועדה, ביחד עם השרה, נגיע ביחד להסכמה לגביו. ",בריאות,0.67786217
התחקיר מעלה חשד חמור לביצוע מעשים פליליים ופגיעה צרכנית בציבור העולים החדשים והוותיקים שהם אנשים מבוגרים שאינם שולטים בשפה העברית. מעשים כפי שהוצגו בתחקיר בוצעו על ידי טכנאי שפרסם מודעה בעיתונות דוברת רוסית והציג את עצמו כבחור בשם אלכס והבטיח הנחה של 30 אחוזים בעלות התיקון ובשל כך הוזמן לתקן תקלה על ידי מספר אנשים. אותו אדם במזיד הגדיל את התקלה או לחילופין המציא תקלה שכלל אינה קיימת וכל זאת במטרה להגדיל את עלויות התיקון ולהוציא מאנשים מבוגרים כספים בסכומים גבוהים ביותר באופן לא חוקי.,בריאות,0.5971815
"עיקרי הדברים, שעליהם נשמע עוד את הדוברים הבאים, ואני אשמח לשמוע התייחסות של סמנכ""ל רשות ההסדרה שנמצא איתנו בהמשך, אחרי שנשמע את היתר. למעשה, עברו חמש שנים מדוח מבקר המדינה שאנחנו דנים בו היום. הדוח הזה הצביע על חוסר מדיניות, על קיפאון בתהליך ההסדרה. והשאלה היא: מה נעשה בחמש השנים האחרונות? איך יושמו לקחי הדוח הזה ומה ההתקדמות שחלה? מה קורה בשטח? מה הסטטוס? מכיוון שרוב אלו שעסקו בנושא ההסדרה, גם דוח גולדברג, גם פראוור, גם בגין, שעסקו בנושא ההסדרה, התמקדו בנושא של תביעות הבעלות. אז מה הסטטוס של תביעות הבעלות? מה הסטטוס של תביעות נוגדות? כמה אחוזים מהשטח הוסדרו בחמש השנים האחרונות? מה הסטטוס של היישובים שנבנו ב-2003? ",בריאות,0.6781792
אחרי ראש השנה התקבל תקציב העודפים למשרד הקליטה. משרד הקליטה פנה לחברת טלדור בבקשה לנסות ולהפעיל את המרכז שוב אך נענה כי אין עובדים להפעיל את המרכז מחדש כי הם כולם פוטרו או משכו את הפיצויים. לפיכך משרד הקליטה צריך לצאת עכשיו למכרז חדש להקמת מרכז חדש והדבר ייקח זמן ממושך וכרוך בבירוקרטיה מיותרת ממנה סובלים האמנים העולים. בינתיים אין תעסוקה לאמנים העולים. חשוב לציין כי בעידן הקורונה כלל האמנים סובלים ויחד עם זאת הסבל של העולים החדשים פי כמה וכמה.,בריאות,0.7839359
"הדיון הזה בא כדי לקדם את הרעיון שמי שינהל את המשבר בכל אחד מהישובים, זאת באמת הרשות המקומית תוך מתן סיוע לרשויות שיידרשו לכך, רשויות חלשות יותר, ואני מקווה שמהדיון הזה אנחנו נצא עם החלטות מאוד מאוד ברורות שאנחנו באמת מעבירים את השרביט למי שידע לעשות את הדברים בצורה נכונה.",בריאות,0.59032434
"השם עזר ועוזר, אדוני המנכ""ל של קופת חולים לאומית. יש לו אנשים טובים, שליחים טובים עבור עם ישראל והם יודעים לשחות בין הגלים, הגל הראשון, הגל השני. מקווה שלא יהיה גל שלישי. אני אומר את זה באופטימיות. עם האנשים הטובים האלה אנחנו מצליחים לבוא ולתת את המענה.",בריאות,0.6504536
"צלצלו לראש אגף התקציבים, לממלא מקומו של ראש אגף התקציבים, שישלח מישהו עכשיו. מה זאת אומרת?",בריאות,0.9030178
"אני קודם כל רוצה להודות על שיתוף הפעולה של שרת הקליטה שעשתה לילות כימים לממש את החלטת הממשלה הזאת ואני גם עזרתי וסייעתי לה, וגם סגן השר יברקן סייע, אבל ברור שהחלטת ממשלה כזאת, אחרי לחץ שהפעילה השרה, אני חושב משמעותי. זה לא מספיק מכיוון הוועדה בזמנו קיבלה החלטה שצריך להעלות במהירות את כל 7,000 האנשים על מנת לסגור ולהרוס את המחנות האלה. זה לא יסתיים, אם לא יעשו זאת. בגלל שיקולים תקציביים בעיקר, כל פעם נותנים נתח ואז שוב המחנה מתמלא. הגיע הזמן שיקבלו החלטה אחת, יסיימו את העניין במהירות והמחנות האלה ייסגרו.",בריאות,0.5375811
"אם אפשר באמת ספציפית בנושא של הליגות, ואני חושבת שזה מצוין שזה דיון ממוקד ודיון מעקב בנושא הזה. המשק כאילו חוזר לאט לאט, עוד לפני החזרה משרד הבריאות בשיתוף משרד הספורט שמו קריטריון של הליגות המקצועניות מסיבות אפידמיולוגיות במטרה לוודא שבאמת במסגרת הפחתת המפגשים השחקנים והמאמנים בליגות המקצועניות באים רק לשם, מתאמנים וחוזרים, כאילו מקום מקביל למקום עבודה או משהו מן הסוג הזה, הכול טוב יפה, העניין הוא שבכל ספורט, גם בספורט הגברים וגם בספורט הנשים, יש יותר מליגה מקצוענית אחת. הליגה הבכירה, אנחנו כולנו רואים, הכוכבים, הם מסוקרים, רואים את זה בשידורים בטלוויזיה, אבל גם הליגה השנייה והרבה פעמים בענפי ספורט מסוימים גם הליגה השלישית היא ליגה שפועלת, שהשחקנים והשחקניות משתכרים בה ועובדים ומתאמנים בצורה מקצועית ומקצוענית וכו'.",בריאות,0.7368022
"כל הדברים האלה חשובים לא פחות מההגנה שלנו מפני ההידבקות שלהם בקורונה ואנחנו חייבים למצוא את הדרך מצד אחד למנוע את ההדבקה שלהם ומצד שני כן לאפשר להם חיים. בדוח השתמשו בביטוי שתפס, אני חושבת שהוא מקפל בתוכו את כל מה שאנחנו אומרים כל הזמן, וזה העניין של התגוננות יתר. בהתגוננות יתר אנחנו לא רוצים שהם ימותו מקורונה, אבל אנחנו הורגים אותם מבדידות ומעוד הרבה דברים אחרים, טיפולים רפואיים שהם לא מקבלים, פחד שהם נכנסים אליו וכו'.",בריאות,0.97492784
"ייאמר לזכותה של שרת התחבורה שבתקופה שהייתי בבידוד, אולי עוד לפני כן, היא אמרה לי: יעקב, ייתכן מאוד שנצטרך לחוקק שוב. אני צרחתי עליה, אמרתי לה: לא יקום ולא יהיה, אין דבר כזה, אני לא מאריך. פחדתי שברגע שאני אאריך מנהלי החברות יורידו הילוך מתהליך ההשבה, לכן משכתי את זה ודרשתי מסמך שמראה כמה החברות הספיקו להחזיר. החברות עצמן לא יכולות לתת לנו מסמך, הן חברות בורסאיות, זה חושף אותן לכל מיני דברים, אז ביקשתי מסמך מרת""א, שהם יעשו את הבדיקה ויתנו לנו מסמך כמה כל אחת משלוש החברות הצליחה להחזיר. על מספר ימי ההשבה אנחנו לא מתפשרים. ",בריאות,0.9825656
"דבר שני: מסעדות הן מטבען עסק בסיכון, ודאי מסעדות שרק פתחו ועדיין מתמודדות עם ההשקעה הראשונית הגדולה. משרד האוצר לא מבין את המבנה העסקי של מסעדה, הם לא מבינים שיש בהתחלה השקעה מאוד גדולה ולכן הדוחות העסקיים נראים איך שהם נראים. הם מנסים למדוד אותם באותה צורה שמקבילה לעסקים קטנים וזו טעות. זו גם הסיבה שקרן ההלוואות ""הון סיכון"" אינה אפקטיבית. המון מסעדנים שפונים לא מקבלים הלוואה כי הם נחשבים עסק בסיכון. כפי שכבר אמרתי, משרד האוצר חייב להעלות את גובה הערבות בקרן להלוואות לעסקים בסיכון כי זה פשוט לא אפקטיבי וגם המיצוי של זה הוא באזור ה-20% מה שמראה שאי-אפשר לממש את ההלוואות בצורה מיטבית. ",בריאות,0.74990815
"אני מבקש להתחיל עם מורן באבאי, נציג תחום התל""ן, שיסביר לנו בדיוק את מי הוא מאגד. מורן, צוהריים טובים. ",בריאות,0.9117305
"אנחנו מדברים כאן רבות על הילדים הצעירים, על מערכת החינוך, על הקשישים ועל בעלי העסקים, אבל יש רצועת גיל שאנחנו אולי לא נתנו את הדעת עליה עד הסוף והכנסנו אותה בתוך הסך הכולל, וזו קבוצת הצעירים. אנחנו מדברים על חיילים משוחררים שהתחילו לעבוד ופתאום מוצאים עצמם ללא מענה כי הם לא צברו את התקופה שצריך כדי לקבל את דמי החל""ת, והם נופלים בין כסאות. כמו כן, סטודנטים שהחלו ללמוד ונשארים עכשיו ללא מענה כלכלי שמשפיע גם על המענה ההשכלתי כי חלקם לא יכולים להבטיח לעצמם את המשך הלימודים, והם חווים את החוויות בצורה מאוד מאוד מורכבת, ולפעמים רב ממדית. אנחנו מקדישים כמובן את הדיון הזה אליהם.",בריאות,0.799979
"ראשית, יש בקשה של יו""ר ועדת הכלכלה למיזוג הצעות החוק הבאות: הצעת חוק הגנת הצרכן (תיקון מס' 62) (מאגר צרכנים להגבלת שיחות שיווק מרחוק), התש""ף-2020 והצעת חוק הגנת הצרכן (תיקון – איסור על שיווק טלפוני למספר הרשום במאגר ""אל תתקשרו אלי""), התש""ף-2020, של חברי הכנסת משה גפני ויעקב אשר. ",בריאות,0.6391488
"לפני שאני נותן למציעים לפרט את ההצעה והבקשה שלהם אני רוצה לומר שעד היום, מתחילת השנה, נהרגו 11 ילדים מתחת לגיל 14, האחרון נהרג אתמול בתאונה שכנראה היא פגע וברח באשקלון. בהשוואה לשנה קודמת אנחנו מדברים על בערך אותו מספר ילדים אלא שהשנה אנחנו נמצאים בקורונה וסגר כך שכביכול יש הרבה פחות תנועה של ילדים בכבישים, כך שיש עלייה. בשנת 2019 נהרגו 13 פעוטות מתחת לגיל ארבע לעומת עשרה בשנת 2018. זאת אומרת, אנחנו חיים בעולם שבו ילדים שלא צריכים למות אלא צריכים לחיות, להתפתח, לגדול ולבנות את עצמם, הם נהרגים והורסים משפחות שלמות שלעולם לא מתאוששות מכך.",בריאות,0.5303243
"אנחנו מתחילים את הדיון היום עם חברנו חבר הכנסת אוסאמה סעדי שהגיש בקשה לדיון מהיר בעקבות ריבוי מקרי רצח. אמנם זה נחשב שאנחנו נכנסים לרוטינה מסוימת, אבל אסור לנו לקבל את זה כעובדה וללמוד לחיות עם זה, אנחנו תמיד צריכים לחזור לנקודת האפס בדיון בוועדה הזאת ובנושא הזה ותמיד לשאול את השאלות למה זה קורה ואיך אפשר לטפל בזה. לכן אני מברך את חברי, חבר הכנסת אוסאמה סעדי שהעלה את הנושא הזה לדיון מהיר ואנחנו ניתן לו את הבמה כדי שהוא יוכל להציג את הנושא וניכנס אל תוך הדיון עצמו. חברי אוסאמה, בבקשה. ",בריאות,0.52431035
"ברשותכם בפתח הדברים הייתי רוצה לעדכן קצת, אני אגיד שבהחלט הבוקר קיבלה את פנינו כתבה לא פשוטה במעריב והבנתי שגם אתמול בערב הייתה כתבה ב'כאן'. אנחנו בסך הכול רואים שהנושא הזה נמצא בסדר יומה של מדינת ישראל ואי אפשר להתעלם ממנו. זה גם כואב וגם אומר שהציבור בישראל מבין עד כמה הנושא הזה חשוב. צריך להגיד שהסיפור גם של 'שעת נעילה' גם העלה את הנושא לסדר היום.",בריאות,0.6943854
"העצה שלי – שמי שמאחר, צריך סוג של ענישה או קנס או משהו, לעשות את זה מידתי. אם אדם מאחר בכמה ימים – תקנוס אותו חודש. אבל לא בגלל זה שנה שלמה, להעניש – זה יסגור את הכולל. מה ייצא – אותם אברכים ילמדו בכולל אחר, המדינה תשלם את זה בצורה אחרת. לא מדובר פה בערים מבוססות, קרי מקום אחד כמו נתיבות, שהפריחה התורנית היא מאוד משמעותית, והנושא הזה מאוד עוזר להם, לכל בני הישוב; אלעד, ראש העין, מקומות כאלה.",בריאות,0.97203165
"לאור הדיווחים המדאיגים שהגיעו ללשכה שלי, ואני מבינה שגם לחבר הכנסת כסיף שיזם את הדיון הזה, וזה המקום באמת להודות לך על הצפת הנושא החשוב, על עלייה מדאיגה בכמות הניסויים בבעלי חיים שמבצעים בצה""ל ובמערכת הביטחון, אני רוצה שאחרי שנבין את הנתונים המלאים. אני מבינה שמשרד הביטחון העביר אתמול, תודה רבה, אתמול, יום לפני הדיון, את הנתונים העדכניים. אני רוצה שנבחן מה מודל הפיקוח שקיים היום על הניסויים שמתבצעים במערכת הביטחון והאם לא כדאי אולי ולא הגיע הזמן להעביר את הפיקוח על הניסויים שאינם דורשים סיווג וחשאיות לפיקוח של גורם אזרחי חיצוני, כמו, אני קראתי בדוח המבקר, שביקש בעצמו המשנה ליועץ המשפטי למשרד הביטחון במכתב בשנת 2008. ",בריאות,0.8575695
סוגיה שעלתה גם בדיונים מקבילים לגבי איחוד משפחות. משפחה שבה יש בן משפחה שהוא לא אזרח ישראלי לא יכול להגיע לארץ. מה אנחנו עושים? נמצאים כבר הרבה חודשים בתוך האירוע וכנראה עוד הרבה חודשים לפנינו. אנחנו רוצים לדעת איך עוזרים למשפחות האלה להיפגש ולהתאחד על פי כל הקריטריונים וההנחיות הרפואיות uלאפשר גם כניסה של לא ישראלים.   ,בריאות,0.71703774
בוקר טוב. הדיון הראשון היום יעסוק בעוד פרק מתוך דוח הביניים המיוחד של מבקר המדינה העוסק בהתמודדות משבר הקורונה והפעם נעסוק בהיבטים בפעילות רשות המיסים. ,בריאות,0.6498136
"בוקר טוב, אדוני יושב-הראש. אני מבקש, מעניין לעניין באותו עניין, בהקשר ליום החקלאות שמצוין היום בכנסת וכאן בוועדה, ותיכף ניכנס לדיון הקונקרטי, לשים על השולחן את תופעת הפשיעה החקלאית, שהיא תופעה קשה שמחריפה מאוד. תיכף אציג רק מעשרת הימים האחרונים, או 15 הימים האחרונים, דוח מקרים מול אזלת יד מוחלטת של רשויות האכיפה, בין אם זה המשטרה, הפרקליטות או בתי המשפט. מפקירים את החקלאים, פשוטו כמשמעו. החקלאות גם כך, הרווחיות שלה גבולית מאוד, קשה מאוד להתפרנס היום מחקלאות. שוב, תיכף ניכנס לנושא עצמו, נדבר על זה. החקלאות היא אירוע סופר ציוני ואסטרטגי בהקשר הערכי-חינוכי-ציוני – תפיסת קרקע, שמירת קרקע, עוד הרבה לפני ביטחון תזונתי וקיימות וירוק וגם פרנסה של חקלאים, חקלאות כערך. ",בריאות,0.5866209
"אני מברך את האנשים שנמצאים אתנו כאן פיזית, אנשים שעושים מלאכת קודש, שעות ללא שעות. את חלק מהנוכחים אני מכיר אישית וחלק פחות.",בריאות,0.5226771
"אין ספק שמשרד הבריאות נמצא בחזית וכל הדברים מתרכזים ומתנקזים למשרד הבריאות. ההוראות מגיעות ממשרד הבריאות, ההנחיות, כמובן בשיתוף הקבינט והשרים הנכבדים, האוצר ושאר הגורמים. זה לא הנושא שלנו, איך מתקבלות ההחלטות, באיזו צורה הן מתקבלות, האם ההחלטות נכונות. מאוד קל לבקר. יכול להיות שאם אני הייתי יושב שם, הייתי רואה את הדברים אחרת. יש הרבה שאלות אבל אני שוב אומר שזה לא הנושא. ",בריאות,0.80402845
"תודה רבה גבירתי יושבת הראש. אני אתן הקדמה קטנה. מרגע שנבחרתי, באמת נושא צמצום הפערים ומתן שירותי הרפואה בין הפריפריה למרכז זה נושא שאני מקדם, מנסה לקדם, הייתי בכל בתי החולים בפריפריה, שומע את התלונות, שומע את המצוקות, מכיר אותן עוד לפני אבל עכשיו בתוך בתי החולים אתה רואה הלכה למעשה עד כמה זה קשה להיות בית חולים בפריפריה. היום בעוד כחצי שעה, יש לי דיון בוועדת הכספים על מרכז שיקום שאין לנו בצפון, נתנו רישיון ונתנו חצי מהכסף ועכשיו אנחנו מנסים למצוא את החצי השני של הכסף על מנת שיהיה לנו, כי היום תושב בצפת או בקרית שמונה צריך לנסוע לרעננה כדי לקבל שיקום. אז רק נסיעה של שעתיים, אני לא יודע אם השיקום הזה באמת משתלם לו, ויש כאלה אנשים שאפילו מוותרים על טיפול שיקומי שהם צריכים. וזה מצב באמת שאסור לנו כחברי כנסת לאפשר, וצריכים לעשות כל מה שאנחנו יכולים בכלים הפרלמנטריים שלנו ולנסות להשפיע ולעזור.",בריאות,0.524489
