QuoteText,Topic,Topic_Prob
"התראיינתי באולפן ynet"""" ושאלו אותי אם אני היום דן בהצעת החוק של חברת הכנסת שרן השכל, או שאני מעניש אותה על כך שהיא לא מצביעה, או שהיא אמרה שהיא לא מצביעה יחד עם הקואליציה. אז יכול להיות שאם הייתי דן בענישה, או בהתנהלות הדדית של שותפות, יכול להיות באמת שהייתי צריך לשקול את הדבר הזה – שותפות ושותפות, במיוחד שאנחנו גם חלוקים גם על הבנת החוק בהתנגדות שלה. יש אנשים שמתנגדים, מתנגדים שמבינים את החוק והם מתנגדים, אבל מי שמתנגד לחוק, בגלל שהחוק אוסר, חוק המרכולים כמובן, לפי שלא יודע. חוק המרכולים מדבר על בתי קפה שאוסר לפתוח בתי קפה ומסעדות, ומצביעי הליכוד כפי שהיא אמרה, אוהבים ללכת בבוקר לבית הכנסת, ואחר הצהריים לבתי קפה. ",בריאות,0.83000696
"הרפורמה כפי שהתבצעה בשלב הראשון, העבירה מסר אחר לגמרי לתושבי הפריפריה. היא העבירה לתושבי הנגב, למשל, את המסר, מגיע לכם לנסוע בזול לבאר שבע, היא העבירה לתושבי הגליל את המסר, מגיע לכם לנסוע בזול לחיפה. אבל אם אתם תושבי הנגב או אם אתם תושבי הגליל, ואתם רוצים להגיע גם למרכז הארץ, לתל אביב או לירושלים, אנחנו נגבה מכם מחירים מאוד מאוד גבוהים. זו בפועל מדיניות של ניתוק הפריפריה מהמרכז. זו בפועל מדיניות שמשאירה את הפריפריה בפריפריה ומנתקת את הפריפריה ממרכז הארץ.",בריאות,0.98023003
"אני מבין שגם לוועדה נעלמו עקבותיו. אני אומר לך אדוני שצריך מישהו להגיע לכאן לתת שני משפטים. לא צריך מעבר לזה. זאת לא ישיבה ארוכה. צריך להבין, ותכף אולי נשמע מהחברים שחלקם יודעים יותר ממי, כי גם נעשים שם צעדים חד צדדיים על ידי הפולנים. יש איזשהו ניסיון שהאתר הזה לא ייראה כל כך נורא כפי שהוא היה ואת הדברים הנוראיים שהיו שם, חלקם לא ייראו כל כך נוראיים כפי שהם היו שם. ",בריאות,0.54524434
"הנושא הוא ברור. היה פעם יותר ממחזור אחד הכנה לבחינות לסטג' וזה הופסק ונשאר רק מועד אחד, אם אני לא טועה, דבר שבולם, למרות הצורך ברופאים וחזרה לארץ של צעירים רבים שלמדו בחוץ לארץ. אני שמח שנמצאים אתנו פרופסור יציב ופרופסור מימוני.",בריאות,0.7997542
"אני רוצה להתחיל עם משהו ישן יחסית. מבקר המדינה עשה ביקורת בנושא המיון והגיוס בשבט. הדוח מדצמבר 2014 ועד לנובמבר 2015, זאת אומרת ממש לפני שנה וחצי והוא כתב: ",בריאות,0.86611605
"יחד עם זאת, שיהיה ברור. שום הישג אינו יכול להיות תקף אם הוא קופא על שמריו. הישגים בעיקר בתחומים הביטחוניים הצבאיים, כאשר אינם ממשיכים להיות מטופלים, הם נשחקים ומאבדים את ערכם. ",בריאות,0.59544367
"יחד עם זאת, שיהיה ברור. שום הישג אינו יכול להיות תקף אם הוא קופא על שמריו. הישגים בעיקר בתחומים הביטחוניים הצבאיים, כאשר אינם ממשיכים להיות מטופלים, הם נשחקים ומאבדים את ערכם. ",בריאות,0.59544367
חבל שמשרד הרווחה לא נמצאים אני מקווה שהם ייכנסו בדקות הקרובות כדי שאנחנו נוכל לשאול את השאלות ולוודא שאכן התכנית שמונחת על השולחן לפי ההצהרה שלהם היא אכן מה שאנחנו נדרשים לו מבחינת המענים כדי שנוכל להרגיש בטוחים ושקטים כשהילדים האלרגיים נמצאים במסגרת של מעונות היום.,בריאות,0.55055845
"אנחנו נחכה שהם יגיעו, עד אז אני אפנה למשרד החינוך, איפה אתם בתוך התהליך הזה, מה התקדמתם מהדיון האחרון ומה קורה עם נאמני הבריאות. ",בריאות,0.6951843
"מדינת ישראל היא מדינה שנמצאת תחת איום מהקשים והכבדים שיכולים להיות, איום מגוון ומורכב. המרכיבים הבסיסיים של היכולת של המשק של מדינת ישראל, גם משק החירום וגם המשק הלאומי בכלל, להתמודד – עולם המפעלים הוא אחד מן המרכיבים המרכזיים שבהם, כמו תשתיות אסטרטגיות, כמו מלאים לאומיים וכדומה. המפעלים החיוניים הם אחד המרכיבים הקריטיים. הרי בלעדיהם המשק לא  יוכל לתפקד והאוכלוסייה לא תוכל להתקיים. ",בריאות,0.9779913
"רגע, בוא נעשה סדר כי זה מטריד גם אותי. אני גם דיברתי עם מנהל רשות מקרקעי ישראל. היו לי כמה שיחות. אמרו שיש פתרון אבל כנראה שאין פתרון.",בריאות,0.6681697
"האם הקרן עושה מספיק כדי להגיע לקהל היעד הזה? האם בכלל יש יעד לקרן בתחום, או שזה פשוט סוגיה של היצע וביקוש וזהו? אם זו סוגיה של היצע וביקוש וזהו. אם זה היצע וביקוש וזהו ואלה הנתונים, אז אולי אין לנו הרבה מה לעשות, אבל אם אנחנו יוצאים מנקודת הנחה שצריכה להיות כאן התערבות אקטיבית, פוזיטיבית, כדי להגיע לקהל היעד הזה של נשים שמעוניינות לפתח עסקים, אז כנראה שיש עוד הרבה מה לעשות ולקדם כדי להגיע לתוצאה שונה לגמרי, לפיה גם נשים ערביות זוכות לקבל את אותה הטבה שקיימת בקרן וככה גם לקדם את העסקים שלהן. אז פשוט חשוב להבין את המחסומים ולנסות לראות איך אפשר לסייע בלהסיר אותם.",בריאות,0.79878694
"יש לנו כמה שאלות לגבי ההתנהלות של המשרד בכלל אבל אנחנו נפתח בהצגה של המנכ""ל בפועל, מימון שמילה, בבקשה, כמה זמן זה כבר בפועל?",בריאות,0.56622696
"בוקר טוב לכולם, אני שמחה לפתוח את דיון ועדת המשנה לקידום אנרגיות מתחדשות ופיקוח ומעקב אחר יישום ממשלת ישראל את המחוייבות שלה לאור הסכם פריז. הדיון שלנו היום יעסוק בעיקר בנושא של גז ותחנות הכוח בגז ואיך הן משתלבות באותה תכנית גדולה ויעדים גדולים של הפחתת פליטות גזי חממה ועל ההליכים שמביאים להקמתן של עשרות אלפי מגה וואטים אולי של תחנות ייצור חשמל בגז.",בריאות,0.9231313
"במעבר חד, כמדי יום אנחנו מקריאים שיר ואיתו פותחים את היום. זאת מסורת שכבר נמשכת כמה וכמה חודשים טובים. היום אנחנו נקריא שיר של הדס גלעד, משוררת ויוצרת, בוגרת הקבוצה ביפו, בית ספר עצמאי למחול; למדה באוניברסיטת תל אביב ספרות וכתיבה יוצרת, וכן בוגרת תכנית העמיתים של מכללת עלמא לתרבות עברית ויהדות. בשנת 2012 פרסמה את ספרה ""שיר עירום"" – ספר תרגומים למשוררת ההודית בת המאה ה-14 ללה, ובשנת 2013 פרסמה את ספר הביכורים שלה 'כל אור בעצם'. ",בריאות,0.8750184
"אני צריכה להודות פה לחברת myheritage, שעושה עבודה נהדרת ובסבלנות, ותורמת לחברה. כל ערכה כזאת עולה הרבה כסף. הם תורמים לחברה ועושים את הפעילות הזאת, וימשיכו, ואנחנו נקבע עוד ימי בדיקות של בדיקות דנ""א. המשפחה ביום שני - ראו במחשב שיש התאמה, התקשרו למשפחה, והמשפחה אמרה מייד: אנחנו לא רוצים להמתין. הבאתי אותם. הם יהיו פה היום. אם תרצה לפגוש אותם, נזמין אותך.",בריאות,0.9703894
"בוקר טוב. החוק הזה הוא חוק חשוב לכן אנחנו דנים בו לעומק, אבל צריכים להתקדם. אנחנו ננסה להתקדם למרות שאנחנו משאירים מאחורינו קצוות לא סגורים שנצטרך לחזור אליהם בשלב מסוים. לדעתי שני גופים מתוך השבעה עדיין לא היו אצלנו, המוסד ומח""ש. אנחנו נתקדם והם יגיעו לוועדה. ",בריאות,0.55797833
"אני מתכבד לפתוח את הישיבה הלפני אחרונה של הוועדה לצדק חלוקתי ושוויון חברתי, ועדה שהקמתי בכנסת לפני כשנה וחצי, ועדה שאני גאה להיות זה שהקים אותה ועצוב להיות זה שסוגר אותה. היא נסגרת משיקולים קואליציוניים, אני חושב שהיא תרמה רבות לשיח במדינת ישראל, ואני חושב שאנחנו בפעם הראשונה בשנים האחרונות במפלגת הליכוד, מפלגת השלטון, הקמנו ועדה שטיפלה בצמצום פערים בחברה הישראלית. ",בריאות,0.7494059
"אנחנו גם נשמע עוד קצת מבקרי פנים, כדי להכניס אותנו לאווירה וכדי שלא תהיה תחושה שאנחנו מדברים פה על משהו יבש ופורמליסטי, אלא על סוגיות שמתרחשות מדי יום ביומו וכן ננסה למקד את הדיון בטיוטת התקנות המתוקנת שהעביר לנו משרד הפנים, תקנות שמייצרות מספר מינימום של תקנים של מבקרי פנים ברשויות מקומיות. אלה תקנות מאוד משמעותיות, כי בלעדיהן ברצותו יכול ראש רשות לבטל ולאיין לחלוטין את מוסד הביקורת. ",בריאות,0.9359194
"אנחנו גם צריכים לעשות חשבון נפש ולדעתי גם הקופות צריכות לעשות חשבון נפש וגם המערכות השונות. אם לא יהיה חשבון נפש, זה יהיה מלאכותי מאוד. כל אחד מאתנו מנסה לעשות פעולה נקודתית ואילת זקוקה למערכת בריאות שונה בתהליך ומערכתית כוללת. אני מסתכל על מנהל בית החולים וברור שבית החולים שהכרתי לפני כמה שנים לעומת בית החולים היום, זה עולם אחר אבל זה עולם לא מספיק טוב. אני שומע את המעשים של הקופות ואני רואה חוסר תיאום בין הקופות. ביחד אפשר להתמודד אחרת עם העיר אילת ולתת תשובות טובות יותר לתושבים. לכן כאן חשבון הנפש, כאן הצורך בתיאום בין הקופות השונות.",בריאות,0.7003534
"גברתי היושבת ראש, המשתתפים, אני פניתי לנשיאות הכנסת וביקשתי לאשר הצעה דחופה לסדר לדיון כאן בוועדה למעמד האישה. מדובר בפנייה שהגיעה אליי מחברת המועצה מקריית אונו שנמצאת כאן לידי ובוודאי תקבל את ההזדמנות להסביר את מה שמתרחש שם. אבל הטענה היא בשני מובנים: גם לגבי האירוע עצמו וגם אופן הטיפול שמתבצע לאחר מכן גם על ידי הגורמים שהוסמכו בחוק בתוך העירייה, הגורמים השונים שאמורים לטפל באופן מיידי וגם, כמובן, הגורמים החיצוניים. ",בריאות,0.78599375
"על סדר היום בריאות הנפש בקהילה האתיופית. היתה כתבה השבוע. קראתי את  הכתבה. כיושבת- ראש אני מאוד מבינה כמה התרבות משפיעה כשאדם בא מארץ אחרת, מתרבות אחרת, ממסורת שונה כל כך, וכמה היו חשוב שיהיו מטפלים בבריאות הנפש מהעדה. זה מאוד מאוד חשוב.",בריאות,0.8616634
"לכן המצב הזה שבו יש כל כך הרבה תיקים שלא נחשפים והוראת יועמ""ש מלפני מספר חודשים, שעוד בכלל משנה פה את סדר הדברים ועלולה לגרום לכך שמעט מאוד תיקים ייחשפו בעתיד ושהמקרה הזה של שקיפות הולך להיות המקרה החריג בעוד שהנורמה תיהפך להיות חלילה מצב של הסתרת מידע הוא דבר שהוא בלתי מתקבל על הדעת. אנחנו נקיים את הדיון ואני כבר אומרת לכם מהי עמדת הוועדה, אבל זו תמונה שאנחנו לא יכולים להשלים איתה כאן. אנחנו נשאל היום שאלות גם את משרד היועץ המשפטי לממשלה וכמובן את יעקב לזוביק, שעומד בראש ארכיון המדינה, עד?",בריאות,0.517074
"אני מזכירה לכולם שאלו המסקנות של הוועדה המקצועית שהקימה שרת המשפטים, שהשתתפו בה משרדי הממשלה, חלקכם, אבל היא לא מחייבת את כנסת ישראל. כנסת ישראל העבירה בהצעה טרומית את הצעות החוק שדורשות הפללת לקוחות ואנחנו מאד מאד רוצים להמשיך בחקיקה וכדי שיהיו בידינו המענים והתשובות לשאלות, שהרי המציאות מאד מורכבת ואנחנו יודעות ויודעים את זה. ",בריאות,0.5622467
"הנשים הערביות הבדואיות בנגב מיוצגות בתחום התעסוקה בסטטיסטיקה הנמוכה ביותר בקרב נשים אזרחיות מדינת ישראל. אנחנו חושבות שזה מונע מהן עצמן זכות בסיסית להתקיים בכבוד ולהתפתח ולהיות גם נשים שמקיימות את העצמאות שלהן ואת היכולת שלהן להוביל בתוך המשפחות שלהן וזה מונע גם מקור פרנסה חשוב למשפחות שלהן. המדינה יוצאת גם, ולא במקרה נתתי את הסיבה האחרונה, נפסדת מעצם העובדה שהנשים הערביות והיכולות של הנשים הערביות לא מיושמות בשטח ותורמות לכלכלת המדינה. ",בריאות,0.52885324
"שלום לכולם. אני פותח את ישיבת ועדת החוץ והביטחון. על סדר היום הצעת חוק להסדרת הביטחון בגופים ציבוריים (תיקון מס' 8) (פעולות אבטחה ימית), התשע""ז-2017. האמת היא שהדיון הזה לקח הרבה מאוד התייחסות וכל הזמן תהיתי אם יש דברים שאני לא מבין או לא מכיר כי זה נראה לי דיון – בשלב מסוים, לאור המכתבים, תכתובת, הערות, טלפונים, בקשות דחופות לשיחות – שחשבתי שאנחנו משתלטים על האוקיינוס האטלנטי או משהו בנוסח הזה. אבל כנראה שבאמת הדיון הוא מספיק מעניין.",בריאות,0.6056192
"החלטה נוספת שאנחנו מתבססים עליה היא החלטה ב-53 שעניינה המים הכלכליים שבעצם נותנת את אותו תפקיד לחיל הים ולצה""ל בהקשר של אבטחת מתקני הקידוח בים התיכון באזור המים הכלכליים של מדינת ישראל.",בריאות,0.72826153
"לענייננו. אתם יודעים, כל מי שנמצא כאן היום מבין מדוע התכנסנו ומה משמעות הדיון שלהערכתי הוא גם יקוצר ונעבור לדיון הבא, כי ללא הנציב יהיה לנו קשה מאוד לנהל כאן דיון אמיתי וכן, אבל אני רוצה להתחיל בתזכורת קטנה למי שיושב כאן ולציבור, תזכורת למה ואיך ועל בסיס מה הוקמה רשות הכבאות הארצית. אז כולנו זוכרים שרשות הכבאות הארצית הוקמה בעקבות השריפה בכרמל, היעדר טייסת הכיבוי, רשלנות פושעת של כל הגורמים בנושא וחוסר תקצוב גורמי ההצלה, והגרוע מכול, ש-44 איש נספו למוות באסון הכרמל, נשרפו למוות. ",בריאות,0.9813579
"אני רוצה להתחיל לפי החלטת הממשלה עליה עברתי יותר מפעם וכל פעם כשאני עובר עליה, אני אומר שאם הדברים האלה מיושמים, מצבנו במגזר הדרוזי היה צריך להיות הרבה יותר טוב. השאלה אם הדברים האלה מיושמים או לא מיושמים. ",בריאות,0.70817614
"בוקר טוב לכולם, אני רוצה לפתוח את ישיבת הוועדה לקידום מעמד האישה ושוויון מגדרי. הנושא הוא הדרת חיילות וקצינות צה""ל בבסיסים המשלבים חיילים חרדים משימוש בשירותים אלמטריים כגון חדר אוכל ובתי שימוש. הדיון הדחוף הזה הוא של חברת הכנסת מיכל בירן. אנחנו ביקשנו מחברת הכנסת לדחות את הדיון בשבוע כדי שהיא תוכל להיות פה, היא ביקשה לקיים אותו בלעדיה. ",בריאות,0.57279766
"כן, בסדר, אנחנו ביקשנו לדחות והיא ביקשה לקיים את הדיון, ולכן אנחנו מקיימים אותו בלעדיה שזה יהיה ברור לפרוטוקול.",בריאות,0.75110495
"בא משרד התחבורה ופרסם לפני שבועיים – במחטף שהוא ברכה – תזכיר תקנות שאמור לתת תשובה, אמנם לא לגמרי מלאה, לחניית רכב בחניה פרטית. והגיעו אחר כך מיילים, וכמובן שאף פעם לא כולם מרוצים מהכול. נשאר לנו העניין של חניית רכב חירום, מד""א וכיו""ב, שצריך לראות אם נחריג אותם או לא; וההסמכה של פקחי רשויות מקומיות לאכוף את ההסדר המוצע. כי עדיין קיימת התנגדות של הרשויות המקומיות ושל משרד הפנים, והועלתה אפשרות לתת לרשויות סמכות, כך שכל רשות תחליט בעצמה אם היא אוכפת או לא. ",בריאות,0.5764638
"אני מזכירה שב-7 בינואר, שזה היה ערב כינוס הישיבה הקודמת של ועדת הביקורת, נשלח מכתב מסמנכ""ל ממשל וחברה במשרד ראש הממשלה, אודי פראוור, שיושב פה לשמאלי, למנכ""ל רשות האוכלוסין, פרופסור מור יוסף, שיושב כאן, בבקשה ליידע את הממשלה בהערכת מספר הזכאים לכניסה לישראל, לפי החלטת הממשלה 1911. ",בריאות,0.50984126
"קודם כול, תודה רבה, אדוני היושב-ראש, מנהלת הוועדה וכל הצוות. אני רוצה להסביר, בגלל שראיתי כל מיני התנגדויות וגם לכם האורחים, מה הצעת החוק אומרת ומה היא באה לפתור. ",בריאות,0.6000806
"צהריים טובים לכולם. אני מתכבדת לפתוח את ישיבת ועדת הסמים והאלכוהול של הכנסת בנושא שהוועדה עוסקת בו לא מעט. אני חייבת להגיד שזה אחד הנושאים שאנחנו חשבנו והיינו בטוחות ובטוחים שעומד להיפתר על הצד הטוב ביותר, באמת לטובתה של מדינת ישראל, לטובת החקלאות, לטובת התעשייה ולצערנו הרב, כמו אולי במקרים אחרים, אבל במקרה הזה בעינינו באופן שהוא עם פוטנציאל ממש לנזק משמעותי, כרגע נמצא במצב תקוע, ואני מדברת על יצוא הקנאביס לחו""ל, הקנאביס הרפואי.",בריאות,0.59478205
"כמו בדיון הקודם שיצרנו מסגרת וסיכמנו גם עם האוצר ועם משרד התחבורה שנושא הנת""צים יהיה אחד הנושאים המרכזיים לטיפול בטווח המיידי, אותו דבר אני רוצה כאן. אני רוצה לראות איך אנחנו יוצאים מהדיון הזה, מעבר לכל אותם נושאים שאנחנו נותנים להם את המענה בטווח הבינוני ובטווח הארוך – איך אנחנו יודעים לנסות להתמודד עם הכותרת הזאת, ""ערים במצור"", ""שכונות במצור"", שאלה לא מילים גדולות. ",בריאות,0.86023194
"גבירותיי ורבותיי, אני רוצה בפתיחת הדברים לומר לכם שהתחנה המרכזית החדשה בתל אביב היא מפגע ארוך שנים שגורם נזק להמון סוגים של אנשים. קודם כל, הוא גורם נזק לתושבים שגרים בסביבה. האזור הזה הוא אזור נפגע זיהום אוויר בגלל התחנה המרכזית, האזור הזה הוא אזור של הזנחה חברתית בגלל התחנה המרכזית, ולכן התושבים של נווה שאנן, של שכונת שפירא, של כל שכונות דרום תל אביב, הם הנפגעים הראשונים מהתחנה המרכזית.",בריאות,0.63285434
"היא גם לא נמצאת פה. אני חוזר שוב ואומר שמדובר על כך – וזה גם היה בהבנות הראשונות, ואני משבח את חברת הכנסת ענת שנשארת בהבנות – שאם מישהו נשפט לשבע שנים בפועל, אז 14 שנה לאחר מכן הוא לא יוכל להיבחר לכנסת.",בריאות,0.88365686
"שלום לכולם. בוקר טוב. אנחנו פותחים את ישיבתה של הוועדה לביקורת המדינה בהמשך לדו""ח מבקר המדינה על כשלים וסחבת בטיפול המדינה בניצולי שואה. אנחנו מדברים על דו""ח המבקר לאפריל 2017. הוועדה הזאת משודרת, אני אומרת לכולם, הייתה אמורה להיות משודרת עכשיו ישיבת ועדת הפנים עם מפכ""ל המשטרה. אני חושבת שזה לא פחות חשוב. הישיבה עם המפכ""ל בוטלה. אני גם אוסיף בהזדמנות הזאת כיוון שאני כאן את המחאה שלי על זימונו של המפכ""ל למשפט שדה בהתראה של 24 שעות לכאורה כדי להטיל עליו אימה ופחד ולהראות לו ""מי הבוס"". אני חושבת שזה לא נאה לא מכובד ולא מתפקידה של הכנסת לקיים בית דין שדה שכזה. אני שמחה שהוועדה שלנו חוזרת להיות משודרת במקום ההצגה הטובה בעיר לכאורה כי גם ובעיקר הדברים שאנחנו עוסקים בהם הם כמובן דיני נפשות.",בריאות,0.5113435
"כבר הארכתי, אין מה למסור יותר, חוץ ממה שאנחנו מבקשים שהוועדה תוציא מכתב חריף ונקיים ישיבה איתו. ",בריאות,0.91190034
"אנחנו מדברים פה על תופעה מעניינת, שאדם שיש לו בבנק פחות מ-20,000 שקל, ולא עלינו, הוא נפטר, ורוצים להטיל על זה עיקול, וזה סכום קטן מדי מכדי שימנו נאמן שיעשה סדר ויראה איך לחלק את הסכום הזה בין התובעים. וצריך לציין שכנראה הוא חייב כסף, ואם הוא חייב לאחד, יכול להיות שהוא חייב לכמה. עכשיו השאלה היא מה עושים עם זה. זה התחיל עם רשות אחת, ואני מבין שוירא מנוחה כי טוב ואת הארץ כי נעמה, אז כל אחד עכשיו רוצה להתלבש על הסכום הזה וכל מיני גופים נוספים רוצים גם הם להיות חלק מהעניין.",בריאות,0.79964477
