QuoteText,Topic,Topic_Prob
"תודה כבוד היושב-ראש, התבקשתי גם על-ידי העמותה שלנו וגם על-ידי ארגון הנכים בראשות ד""ר עמיחי תמיר, להביע את התמיכה שלנו בהצעת החוק ואנחנו סבורים שהמקום הטבעי שהצעה תידון זו ועדת העבודה והרווחה. ",בריאות,0.9535202
"אגב, רוב האסירים או אחוז גבוה מתוכם הם עד שלוש שנים; יותר ממחצית הם אסירים עד שלוש שנים, כלומר, פחות מקדנציה של רשות מקומית. זה עניין שלנו שאסירים ימשיכו להיות חלק מתוך המנגנון והרקמה הקהילתית, וזה הסיפור בעלות לא גבוהה. אין סיבה לא להשלים את זה.",בריאות,0.95963156
"ועכשיו, אחרי הדברים האלה, אנחנו נפתח פה ישיבה שנועדה לדאוג לחיילים שלנו אחרי שהם משתחררים מהצבא. הישיבה הזו מתרחשת בעקבות מספר שאלות ושאילתות שהופנו לקרן לחיילים משוחררים ולקרן לסיוע. אנחנו שאלנו והפננו את השאלות האלה לאחר שבוועדת הכספים קיבלנו פניות לקיצוצים ולהעברות, מה שנקרא עודפים, מתוך כספי הקרן – שתי הקרנות: גם של הסיוע וגם של הפיקדונות. כששאלתי איך ייתכן שיש עודפים בכספים האלה נעניתי שיש אנשים שלא משכו, חיילים משוחררים שלא משכו את הכספים שלהם, שנעשים מאמצים. אנחנו גם יודעים שנעשים מאמצים מצד הקרן כדי להעביר אותם אליהם. אנחנו ננסה להבין פה איזה מאמצים והאם המצב באמת משתפר.        ",בריאות,0.7719785
"אז התקדמנו. לא בקצב שאני רוצה, אני אומר בכנות, לא בקצב שאני רוצה, קודם כל נתנו לזה עדיפות במערך העיסוק שלנו בחוקי הבריאות, שהם כמו תמיד, מורכבים, והכנו באמת טיוטת תזכיר לתיקון החוק שבעצם יאפשר להכיר באמת בפודולוגים ומיד עורכת הדין אגמון תסביר בדיוק את הפרטים שלו. זה הועבר כבר בנובמבר למשרד המשפטים ואני מבין שכנראה בזכות זה שאמרת לנו שאנחנו מגיעים היום לוועדה, קיבלנו מהם תשובה, אבל ברשותך עורכת הדין אגמון תעדכן.",בריאות,0.644716
"בזמנו, הוועדה הזאת הרבה שאלו לגביה שאלות, שאמרו, מה תעשה הוועדה? מהן המטרות שלה, ולמה צריך עוד ועדה בכנסת? אז בינתיים הוכחנו לא מעט מקרים שלוועדה הזו יש הרבה מאוד השפעה, כי היא באמת נוגעת בסוגיות הכי כואבות בחברה הישראלית. היא נוגעת בקיפוח בחברה הישראלית שהוא קיפוח עתיק יומין, זה לא פיקוח חדש. אנחנו רוצים להתמודד אתו בוועדה ללא חטא וללא מורא באופן שלפעמים גם מביא למצב שאנחנו מבקרים את הממשלה ואת המדיניות שלה, כי אנחנו כמובן לא רוצים להיות במצב שאנחנו צריכים לבקר את הממשלה, ולפעמים אין ברירה. ",בריאות,0.78753227
"בוקר טוב לכולם, אני פותחת את הישיבה של הוועדה לקידום מעמד האישה ולשוויון מגדרי. היום ה-10.1.2017 ואנחנו מקיימות את הדיון הזה גם כן במסגרת היום המיוחד לבריאות הבריאות הציבורית בכנסת, יום המודעות לבריאות, שיזמו חברי הכנסת דב חנין, יעל גרמן וכמדומני גם חברת הכנסת שולי מועלם. אנחנו נתמקד היום בטיוב הטיפול הראשוני בנפגעות אלימות מינית, חדרי מיון או מרכזים אקוטיים. את האמת התעוררתי בבוקר גם עם כתבה שהייתה בנושא הזה ואני ידעתי שהכתבה תהיה. הייתה התעניינות רבה בנושא ברגע שהכרזנו שהוועדה מקיימת את הדיון סביב הנושא. כמי שהייתה מעל ל-20 שנה במסגרת התנועה הפמניסטית שנאבקה למען תמיכה וטיפול בנפגעות תקיפה מינית, שמחנו בזמנו על הקמת החדרים האקוטיים וחשבנו שזה הישג דיי מרשים לנו, גם של איגוד מרכזי הסיוע, של הנהלות מרכזי הסיוע לנפגעות תקיפה מינית.",בריאות,0.55913055
"אנחנו מבינים שהאיכות והרמה שבית החולים יכול להעניק לאזרחים הן דבר קריטי, קודם כול מבחינתנו כמדינה, כאמירה שאנחנו רוצים שתהיה זכות שווה וזהה לכל אזרח במדינת ישראל לקבל טיפול רפואי ברמה טובה כמו שהוא יכול לקבל גם במרכז הארץ. זו אמירה חשובה, ואנחנו רוצים בסוף הדיון הזה להיות במצב שאנחנו יכולים לומר את האמירה הזאת, ועל כן הדיון הזה מתקיים.",בריאות,0.6289631
"וכשרוצים לאמץ ולטפל בחוק יודעים לעשות את זה. אני לפני שנתיים שברתי את הרגל שלי ואני כל שנה מארגנת תיקון ליל שבועות בצוותא והייתי עם רגל שבורה והחבר'ה שלי עזרו לי וסחבו אותי מאזור המלונות ליד הים אל צוותא ברגל. והאמת, פשוט נדהמתי לראות איך עיריית תל אביב לקחה על עצמה להנגיש. כל המדרכות, חשבתי שיהיה נורא קשה, אבל כל המדרכות היו מונגשות. מה שאני לא מורגלת לא בעיר שלי ולא במקומות אחרים, אבל העיר הזאת מונגשת. היה קל לסחוב אותי על כיסא גלגלים אל צוותא בליל שבועות. ",בריאות,0.82109505
"בעזרת השם זה יקרה. אז חבר המועצה אבי חיים. אצלם וברשויות אחרות לא ממש יש הפחתה ברגולציה. זאת הטענה. כמובן שאני שוב מחדדת את זה שברור לכל היושבים כאן שברשות לכבאות והצלה כותבים את ההנחיות כדי להציל חיי אדם ולשמור על הבטיחות של תושבי המדינה, והפניות של אותן רשויות מגיעות דווקא על הבסיס הכלכלי, כי מאוד קשה להן לממן את אותן תקנות שנכתבות בכבאות, וחייבים להביא את הנושא זה לכדי פתרון בהקדם האפשרי. ",בריאות,0.74867827
"צהריים טובים. אני מתכבד לפתוח את ישיבת ועדת המדע והטכנולוגיה, היום יום שלישי, שנאמר בו פעמיים כי טוב, י""ב בטבת התשע""ז, ה-10.1.2017. על סדר יומנו בריאות דיגיטלית, מהפכת הדיגיטציה במערכת הבריאות. אנחנו היום, כפי שידוע, מציינים יום בריאות בכנסת והדיונים של הוועדות מתמקדים בנושא הזה. אנחנו התבקשנו ואנחנו ביקשנו לשים את הדגש ולהעלות על סדר היום את הנושא של בריאות דיגיטלית, שתיכף נרחיב בכותרת הזו. ",בריאות,0.50101423
"בוקר טוב. יושב-ראש, חבריי מהתחום של התרבות והספורט. התרבות והספורט היו תמיד בתחום פעילות מרכזי של השלטון המקומי, של השלטון המרכזי ותחום חשוב בשעות הפנאי ובפיתוח של החברה הישראלית - עד כדי כך שהיכולת שנוצרה כאן הפכה להיות גם נכס בעולם, וגופי תרבות גדולים, ובמרכזם להקות המחול, הפילהרמונית וגופים נוספים, אפילו ברגע זה, נמצאים מעבר לים, והם שגרירים נאמנים של ישראל.",בריאות,0.8339728
"מהנתונים שהתקבלו, בעשור האחרון נהרגו למעלה מ-40 אנשים ונפצעו למעלה מ-800 אנשים בכביש 66, כביש קצר יחסית, הוא אפילו מכונה: כביש הדמים. בדיון הקודם נציג משרד התחבורה שבשישה קילומטר בכביש הזה היו חמישה הרוגים בחמש השנים האחרונות. חמישה הרוגים בשישה קילומטר זו סטטיסטיקה נוראית. הנציג גם לא ידע לומר אם יש אח ורע לדוגמה כזאת באחד מכבישי הארץ. ניסינו להבין אם הכביש ייכנס לתוכנית החומש של משרד התחבורה, ביקשנו לקבל עדכון בנושא הזה, להעביר לנו את הקריטריונים להכללה או אי הכללה של הכביש. לצערנו, כמו שאומרים, יוק, לא קיבלנו שום נתון.",בריאות,0.88500714
"תודה, זו הפתעה עבורי אבל אני אנסה. באמת לא חיכיתי שאני אתחיל לדבר כאן כי יש לנו עדה מכובדת, תמיד יש אחריות גדולה למי שמתחיל, אבל אני מאוד מאוד מקווה שחברת הכנסת סבטלובה שהיא גם קולגה שלנו, שנים רבות עבדנו ביחד ברדיו, היא תבין אם אני אטעה במשהו ותוסיף.",בריאות,0.8863335
"אני חושב שאנחנו באמת ניתן למנכ""ל לקט ישראל גידי כרוך להציג את הדברים ואולי גם לכוון מבחינתנו לדיון בוועדה כאן את הנקודות הפרקטיות איך אנחנו כחברי כנסת או כוועדה יכולים להמשיך את הפעילות החשובה הזאת. בבקשה.",בריאות,0.94294643
"אני שמח לשמוע עכשיו את דבריו של השגריר, כבודו מר קרלוס גרסיה, ולאחר מכן נשמע גם את ד""ר גוסטבו פרדניק בנושא. איתי נמצא חבר הכנסת, אם אתה רוצה להתייחס אחרי השגריר, תגיד לי מתי שאתה רוצה. לחבר הכנסת יש פריבילגיה להיכנס. ",בריאות,0.630939
"אני זוכר בילדותי, איך עשו לגולדה מאיר, ראש הממשלה דאז, ז""ל, כשהיא אמרה, מי שלא יודע יידיש הוא לא יהודי וחלק לקחו את זה ברמה אישית. לימים, אני במקור איש באר שבע, הייתי ראש המועצה הדתית של באר שבע בשנות ה-90 והנה, גלי העלייה הברוכים הגיעו. פונים אלי, תשמע, באר- שבע עיר קולטת עלייה ויש את הסוגיה הזו של בירור יהדות. אמרתי להם, מה לי ולבירור יהדות? זה בתי הדין הרבנים. אמרו, לא, רוצים לפתוח ערוץ מהיר, נפרד ואתה תהיה החלוץ. אם זה יצליח פה אז נעתיק את זה. פתחנו ממש אגף קטן והתחילו להגיע עולים. ",בריאות,0.7642236
"לפני כן, איציק. אנחנו היום מארחים באולם הוועדה את תערוכת ציוריו של סגן הדר גולדין ז""ל, שהוא עצמו צייר. לצערנו הרב, גופתו עדיין לא הוחזרה, היא מוחזקת על ידי ארגון הטרור חמאס, תוכלו להתרשם אחרי הדיון מהציורים של סגן הדר גולדין ז""ל. בבקשה. ",בריאות,0.96245795
"אני אאחל לך שבפעם הבאה שאנחנו נדון על הפערים בין הפריפריה למרכז אתה תהיה עסוק בלהניח אבן פינה חדשה לחדר טיפול נמרץ ילדים חדש בפוריה, או לשיקום החדש, או לכך שהרופאים יגיעו לנהריה - - - ",בריאות,0.51058614
"מה זה ""תושבי האזור""? יש עוד תושבי אזור שלא שמעתי עליהם חוץ מפלסטינים? היבוסיים, הבסנו אותם, החיתים גם לא אתנו, האדומים לא אתנו, הכנענים לא אתנו – אז מה נשאר? מה זה ""תושבי האזור""?",בריאות,0.5482091
"או יחד עם זה שהיא שרדה והצליחה להקים דור, והם כבר לא כצאן לטבח. חזר הביטחון.",בריאות,0.60247034
"חשוב ואפילו אקוטי לשפר את המצב. אנחנו כאן כדי לראות שדברים באמת קרו מאז הדיון האחרון. נשמעו כאן התחייבויות שלא מביישות שום משרד מפואר. אנחנו היום כאן כדי לבדוק שהדברים אכן נעשים. בדיון הקודם הוועדה שיבחה את משרד המבקר ואת משרד הביטחון על פעילות ענפה, אז הייתי מציעה שנמשיך בשבחים, וזה אומר שהייתה התקדמות משמעותית. ",בריאות,0.7373205
"כן. לא מדובר בפעולה של אדם פרטי. החוק לא מסדיר בכלל את האנשים הפרטיים, את בעלי הרכב; הוא מסדיר רק את בעלי המקצוע, את נותני השירותים, את העיסוק המקצועי-מסחרי בשירותים השונים. לכן כאן אנחנו מדברים על סיוע- - -",בריאות,0.9348661
"בשנת 2013 תוקן החוק והוספה בו הוראת שעה ל-5 שנים, שאפשרה לקחת חלק מן הכסף. אם באותו שנה הוקצו כבר כספים למטרות של הפיתוח של אמצעי המיחזור וכן הלאה, אפשר לקחת עד 35% מכספי היטל ההטמנה של אותה שנה ולהשתמש בהם למטרות נוספות, שהן טיפול במפגעי פסולת, הקמת תשתיות לטיפול בפסולת ברשויות המקומיות שמשויכות לאשכולות 1-4 ואפשר יהיה גם לתת סיוע של שנה.",בריאות,0.8325854
"למארג הסוציאלי במדינת ישראל יש שתי שכבות עיקריות. יש את השכבה הראשונה שהם התשלומים שמגיעים דרך הביטוח הלאומי והמארג השני הם תשלומים שמגיעים לאדם כתוצאה מעבודתו, אם אלה תשלומי פיצויי פיטורין או חיסכון פנסיוני או חובת הביטוח של המעסיק מפני אירועי מוות או נכות. הכנסת חוקקה לא מעט חוקים שמגבילים את התשלומים שמגיעים מהביטוח הלאומי ומשום מה הוזנח אותו חלק חשוב שלדעתי צריך להיות חלק חשוב משלילת ההטבות, גם מהמערך הסוציאלי שקיים במדינת ישראל, שוק הפנסיה או הביטוח הפנסיוני. הצעת החוק נועדה בעיקר להשלים את החסר בקשר לזה. ",בריאות,0.6171811
"כידוע, חוק השבות אינו מבחין בין גיור אורתודוכסי, קונסרבטיבי או רפורמי בבואו לקבוע זכאותם של גרים. המצב הכלכלי בוונצואלה קשה וקיים שם מחסור במזון ותרופות, הם חיים בסכנה ואינם מורשים לעלות. ",בריאות,0.9578554
"לכן, בהיגיון המקצועי הפשוט, גם אם מי שחושב שנכון היה שמדינת ישראל תאשר באופן כמעט בלי מגבלות פיצול דירות בניה רוויה, אי-אפשר לעשות את זה בחוק הזה. אני לא אומר שאי-אפשר יהיה לעשות את זה, אבל זה יצריך דיון מאוד ארוך על כל התנאים. כן בקשתי בעניין הזה שתשקלו את עניין ההסתייגות, הייתי רוצה להסיר אותה מסדר היום, אבל אם צריך, נצביע עליה.  ",בריאות,0.78347796
"אנחנו ממשיכים עם החוק למניעת העסקה של עברייני מין במוסדות מסוימים. המטרות שלנו הן מאוד ברורות בדיון הזה: אחת, קודם כל לעקוב אחר אכיפת החוק. אני אומרת את זה בכל דיון של הוועדה שאני מנהלת פה, ומכאן גם החשיבות שאני רואה בדיונים האלה. זה לא דיונים של כותרות; זה דיונים שבאים באמת לומר: חוקקנו, קבענו – מה נעשה עם זה? מה קורה בסופו של דבר? אנחנו מחוקקים חוקים נפלאים. איך אנחנו עוקבים ומיישמים בסופו של דבר?",בריאות,0.7012865
"דבר שני, אני יודעת שיש תזכיר חוק שמתעכב – נאמר זאת בלשון המעטה – כבר מספר שנים, של תיקונים חשובים מאוד שצריכים להיעשות בחוק. נעלה את זה פה על השולחן היום - לפחות חלק מהדברים הנדרשים, ונראה עם גורמי השטח, האם זה באמת נדרש. אנחנו נרצה לשמוע מהמשרד לביטחון פנים, מדוע זה מתעכב, ומהן הדילמות שבהן הם נתקלים ובשל כך החוק לא מקודם. נשמע מהמשטרה בעיקר את אתגרי האכיפה.",בריאות,0.78799886
"שלום לכולם, אני מתכבד לפתוח את הוועדה לצדק חלוקתי ושוויון חברתי. הנושא שלפנינו היום: בחינת השוואת תנאי חיילים וחיילות המשרתים שרות חובה לתנאי משרתי שירות לאומי בתחבורה ציבורית.",בריאות,0.6347093
"ההורים העבירו את רשות הדיבור אליי, בכל זאת, אז נכבד אותם כפי שצריך. ""ודור יקום וחי ישיר ליופי ולחיים"". מי שמסתכל בפוסטר הזה יראה למטה את הווטסאפ האחרון שאני קיבלתי מהדר. הייתה דילמה גדולה, הדר היה עתיד להינשא וכשהוא ישב שם אל מול האויב הוא בה בעת ישב וצייר את ההזמנה לחתונה שלו, ששם הוא כתב את השיר של הרב קוק ""ודור יקום וחי, ישיר ליופי ולחיים"". אנחנו התכתבנו בווטסאפ כי הייתה דילמה קשה איך לוקחים מעוין ומכניסים אותו לתוך מעטפה מרובעת. ",בריאות,0.95574105
"אני רוצה להעלות פה עוד נושא. כל נושא הקבורה שנמצא היום בידי חברה קדישא הוא דבר מטריד ביותר. חברה קדישא היא חברה פרטית לכל דבר ועניין. אז נכון שהכירו בה כחברה פרטית קוואזי-ציבורית מפני שהיא חברה פרטית שעושה את הדבר הכי ציבורי. לא כולנו נזקקים לחינוך ולא כולנו נזקקים לבריאות, אבל מה ניתן לעשות, כולנו, בסופו של דבר, נזדקק לקבורה. אז הצורך הציבורי ביותר, המצרך הציבורי ביותר, השירות הציבורי ביותר נמצא בידיים פרטיות. והראייה עד כמה הדבר הזה מסוכן ולא ראוי שהנה כאשר ידיים פרטיות הן אלו שעוסקות בקבורה הן גם יכולות לקבוע שזוג שהוא זוג נשוי, אמנם לא על פי, לדאבוננו הרב, מדינת ישראל, אבל הוא התחתן ומדינת ישראל, דרך אגב, מכירה במרבית הזכויות שלו, כשהוא בא לרכוש קבר זוגי אומרים לו לא, אתם מוכרים בתור בודד. ",בריאות,0.8336144
"	רבותי, יש פה איזה סיפור קפקאי שמתפתח כבר מספר חודשים. ישבתי אתך, עדיאל, דיברתי אתך על הנושא, ושום דבר לא קרה.",בריאות,0.53459686
"מה שקרה שבגלל ההגדרה הזאת של משרה מלאה, חלק גדול מהנשים נופלות בין הכיסאות בעניין הזה, כי אנחנו יודעים היום שיש הרבה מקומות עבודה ששעות העבודה שלהם לא בדיוק בהגדרה, וגם אין הגדרה ברורה על משרה מלאה, יש הרבה לקונות בחקיקה השונה.",בריאות,0.9511729
"אני כמעט 28. מה שהיה אז הוא שהמדינה נתנה שירותים חברתיים, שירותים כלליים. היא נתנה שירותים לאזרחים, למשל, כשהיינו בבית ספר יסודי הייתה אחות בבית הספר, שהמדינה הייתה מחזיקה אותה. היא הייתה עובדת מדינה. אז לא היה הבדל בין ילדים עניים לילדים עשירים או בין ילדות עניות לילדות עשירות. היו מקבלים טיפול והיו מקבלים את הבדיקות וכל אחד מה שהיה צריך, היה מקבל. ",בריאות,0.9697324
"אני ממלאת מקום היועץ המשפטי, הרשות לניירות ערך. אנחנו מאוד שמחים להביא את התקנות האלה לכאן ובעצם בכך להשלים את החקיקה שהתחלנו בה בוועדה והחוק הראשי שהעברנו בסוף השנה שעברה. בחוק זה התחלנו את ההסדרה ובעצם קבענו סעיף פטור מתשקיף והצעה שתעמוד בתנאים שייקבעו בתקנות. כמו כן, הנחנו את התשתית הראשונית איך יעבוד מימון המונים באמצעות פלטפורמה ורכז הצעה. גם תנאי הכשירות הראשוניים נקבעו בחוק ופה יש השלמה של ההסדרה. ",בריאות,0.88425404
"אקדים ואומר שלא הייתי צריך לנהל את הישיבה הזאת אלא חברי בני בגין, שלצערנו היה מקרה מוות במשפחתו אז אנחנו משתתפים בצערו. ",בריאות,0.69937825
"4. לפעול ליישום החוק האמור, לרבות בנושא זרעים מאושרים לגידולי שדה, לאוכפו, ולמנוע מסחר בזרעי חיטה למי שאינם מורשים לעשות כן. ",בריאות,0.7561462
נכון. בדיוק עכשיו דיברתי על הסיור. היה סיור מאוד מרשים כי זה המקום היחיד בארץ – הם כאן והם יציגו אותו – שנותן פתרון לנושא של תחלואה כפולה. היינו במאור ופגשנו חבר'ה. באמת היה סיור מרתק.,בריאות,0.9515753
"תוך כדי דיונים נחשפתי לאנשים שבאו וסיפרו על המקרים שקורים במגזר החרדי למשל, בגלל כל הנושא של מיחמי השבת, ששם צריך אולי לעשות אפילו עבודה יותר ממוקדת. ולאט לאט, ככל שצוללים פנימה, מזהים את שני הרבדים – פעם אחת המרחב הציבורי הכללי, ופעם שנייה אותם מגזרים שבהם צריך לעשות איזה שהוא טיפול או איזה שהוא תהליך הסברה יותר ממוקד, יותר ייחודי, כדי למנוע בעצם את הכוויות בקרב ילדים.",בריאות,0.6520638
"אבל מה? את אותו חוק, אבל נעשה את זה בשטחים. זה לרוקן ולהוציא את התכלית הראויה ולהסתפק אך ורק בתכלית הפוליטית. לכן אני חושב שזה מאוד-מאוד - - -",בריאות,0.82645184
"אנחנו מקיימים דיון בעקבות הדוח של פרופסור גרוטו על בתי החולים בגליל, גם בעקבות הדוח של מבקר המדינה וגם על פי בקשת מספר חברי כנסת.",בריאות,0.5510913
"תודה רבה, אדוני היושב-ראש. שלום כבוד השר. חברי חברי הכנסת, אדוני היושב-ראש, אנחנו ביקשנו את הדיון בגלל שאנחנו חשים שיש איזושהי מגמה שהיא מסוכנת, שאפשר לכנות אותה קריסה והתמוטטות של התחום הסיעודי, ובתוך זה של מערך האשפוז הסיעודי במדינת ישראל. ייאמר לזכותו של השר ליצמן שב-2011 הוא היה הראשון שהתריע על המצוקה של המערך הסיעודי במדינת ישראל ושם את הפתרון על השולחן – ביטוח סיעודי ממלכתי. אבל מאז לא קרה עם הדבר הזה דבר. אנחנו מדברים על כמה דברים, אדוני היושב-ראש. הדבר הראשון הוא המכרז שלפיו מתוקצבים בתי האבות והמחלקות הסיעודיות, שלפי הנטען מתומחר בחסר של 400 מיליון שקל. לא רק אנחנו טוענים את זה, אלא גם בית המשפט לגבי המכרז הקודם. כבוד השופטת מיכל אגמון קבעה שהתעריף לא מאפשר לא רק את מרכיב הרווח לבתי האבות, אלא גם לא את עלות הקיום בכבוד.",בריאות,0.9854283
