QuoteText,Topic,Topic_Prob
"בתחילה היו חבלי לידה של הזוכה במכרז, גיוס כוח אדם. אנחנו מכירים את המצוקה של מקצועות פרא-רפואיים בכלל בארץ - סוגיה שחברי הכנסת חייבים להתאחד כולנו לטפל בה, כי משרד הבריאות כנראה יש לו דברים אחרים שלוחצים אותו יותר וצריך לעשות את הכל כדי שהמצוקה – יחד עם המל""ג, יחד עם משרד הבריאות.",קורונה,0.6514165
"רבותיי, בוקר טוב לכולם, אני מתכבד לפתוח את ועדת הפנים והגנת הסביבה, בנושא: הצעת חוק המפלגות (תיקון - מימון בחירות מקדימות למועמד שהוא נבחר הציבור), התשע""ז-2017, פ/3796/20, של חבר הכנסת דוד אמסלם – זה שלי – הכנה לקריאה ראשונה.",קורונה,0.51648724
"אני חששתי, גם שוחחתי על כך עם המנכ""ל, ממדרון חלקלק, שבעצם כל כך הרבה ועדות איתור, בסופו של דבר הכול ייעשה באמצעות ועדות איתור. והוא אמר באופן חד משמעי, אני גם ארצה שזה יהיה רשום, שמדובר רק בתפקידים האלה שיהיו בוועדות איתור, נדמה לי רק בכנסת העשרים. הדברים יובהרו על ידך אז תאמר את הדברים. ",קורונה,0.82451415
"בוקר טוב, אני מתכבד לפתוח את ועדת העבודה, הרווחה והבריאות. היום ה-30 לאוקטובר 2017, י""ב בחשוון תשע""ח. הנושא: תקנות שירות המדינה (גימלאות) (רישום פרטי פסק דין לחלוקת חיסכון פנסיוני), התשע""ז-2017.",קורונה,0.72060114
"רק לפי השתתפות חברי הכנסת אתם רואים כמה הנושא הזה חשוב לנו. אבל אי אפשר להתעלם ממי שהביא אותנו לדיון עצמו בעקבות תחקיר שלו בעיתון ""ידיעות אחרונות"", והוא שם את האצבע על נושא דליפת המידע. זה נושא שאנחנו רוצים באמת לדון בו בלי לפגוע בחשיבות של עצם חשיפת המידע. אנחנו מחויבים לכל חשיפת מידע. אנחנו גם יכולים לתת את ההגנה המקסימלית לנזק וחשיפה ולתוצאות לוואי שיש בעקבות המידע הנחשף. אנחנו גם ראינו כוועדת המדע והטכנולוגיה צורך מיוחד לדון בזה כי אנחנו חושבים שיש פתרונות טכנולוגיים חדישים שיכולים לעזור במניעת חשיפת מידע שאנחנו לא מעוניינים בו. בהמשך נראה בעניין הזה מה היה כתוצאה מחשיפת המידע – איזה נזקים קרו ואיזו פגיעה קרתה לאנשים, ואיך אנחנו מונעים אותם. אנחנו חושבים שזה חלק פרקטי והתנהלותי ושל כוח אדם מיומן יותר. עוד כוח אדם, פיתוחים טכנולוגיים שקיימים היום שאפשר לתת לזה מענה. אנחנו מודים בעניין הזה, ונדון. ",קורונה,0.7011837
"בוקר טוב, אני מתכבד לפתוח את ועדת הפנים והגנת הסביבה בנושא: נציבות שירות בתי הסוהר –דו""ח חצי שנתי תכנון מול ביצוע תקציבי. הבמה שלכם, בקשה.",קורונה,0.5615356
"הדיון שאני ביקשתי לקיים הוא דיון שבעיניי הוא חשוב מאוד והוא חלק מהמכלול של היום הזה. היום הזה עוסק בנושא של הנגשת אוכלוסיות מכל החברה הישראלית אל המכינות ושנת השירות. אחד הנושאים החשובים בעיניי הוא באמת לקחת את אותם חניכים, בוגרי הפנימיות, פנימיות חינוך ופנימיות רווחה, ולחבר אותם אל העולם הזה של שנת השירות והמכינות. אני לא הגעתי לפה עם דעה מגובשת, אני כבר אומרת, אני אשמח לשמוע את המצב כיום, אני אשמח לשמוע את השיתוף או אם אין שיתוף, אני אשמח לשמוע אפילו ממנהלים לצד חניכים ולהבין את החיבור. אם אנחנו עוסקים באוכלוסיות מפריפריה חברתית וגיאוגרפית, אנחנו חייבים חייבים להתעסק בבוגרי הפנימיות והחיבור שלהם אל העולם. ",קורונה,0.8454888
"בוקר טוב לכולם, אני מתכבדת לפתוח את ישיבת ועדת העבודה, הרווחה והבריאות. אני אחליף את חבר הכנסת אלי אלאלוף. היום ה-1 בנובמבר, י""ב בחשון תשע""ח. הנושא הוא הקיצוץ המתוכנן בקצבת ההתניידות לעיוורים ולליקויי ראייה. אנחנו שמענו גם בתקשורת ובתקופה האחרונה על התכנון של המשרד לקצץ ב-50% את קצבת ההתניידות. אני רוצה קודם כל להתחיל עם חברי הכנסת. יש כאן נוכחות מרשימה של חברי הכנסת. לתת להם להציג מה המקום שלהם, ולאחר מכן נשמע את משרדי הממשלה הרלוונטיים. נתחיל עם חברת הכנסת קארין אלהרר.",קורונה,0.5146726
"אני מתכבד לפתוח ישיבת ועדת הכספים, הצעה לסדר היום בנושא: ""חשש מסגירת מפעל מיחזור בקבוקי הפלסטיק היחיד בארץ ופיטורי עשרות עובדים בנגב כתוצאה מכך"". כבר קיימנו על זה כמה דיונים. מי מהממשלה נמצא פה? הקרן לשמירת הניקיון, אפשר להעביר כסף ל""אביב מיחזור""?",קורונה,0.96246946
"שלום לכולם. אנחנו דנים בדיון חקיקה, דיון פתוח. אני מזכיר לכל מי שהיה בחלקים אחרים במשך היום. בקשת הממשלה להצעת חוק להארכת תוקפן של תקנות שעת חירום (שירותי עבודה חיוניים בוועדה לאנרגיה אטומית), התשע""ח-2017. אני מבקש מהיועץ המשפטי לקרוא את הבקשה, ואנחנו נשמע את ההתייחסויות. בבקשה. ",קורונה,0.74536467
"הארכת תוקף, 1. תוקפן של תקנות שעת חירום (שירותי עבודה חיוניים בוועדה לאנרגיה אטומית), התשע""ז–2017‏ (בחוק זה – תקנות שעת חירום), בנוסח שבתוספת, מוארך בזה עד יום כ""ט בשבט התשע""ח (14 בפברואר 2018).",קורונה,0.71279734
"אנחנו נתחיל דווקא מכאן ואחר כך נצא לדיון הרחב, של איך אנחנו מסייעים להורים לשהות בצורה קצת יותר שפויה לצד ילדיהם. אז בבקשה, בית החולים הדסה עין כרם, רבקה הררי.",קורונה,0.54138017
"ברשותכם, אני פותח את ישיבת ועדת העבודה, הרווחה והבריאות. היום ה-6 לנובמבר 2017, י""ז בחשון התשע""ח, והשעה היא 13:10.",קורונה,0.59746385
"אותו אזרח שבא ושילם על הבדיקה או שילם עליה בקניית המשקפיים – הרי מה שמקובל היום בחנויות זה שכשאתה בא ובוחר את המסגרת, ואז נותנים לך להיבדק. אם אתה רוצה רק בדיקה לבד אז יש תעריף כזה או אחר שלוקחים או לא לוקחים. אני לא נכנס לזה, אני נכנס רק לדבר אחד. בסופו של דבר, בדקו לי את העיניים. שילמתי על זה בצורה כזו או בצורה אחרת, שיהיה אצלי המרשם ביד כדי שאני אוכל להשתמש בזה כשאני צריך את זה, ולפעמים צריך את זה באופן דחוף. ",קורונה,0.58095205
"בוקר טוב. היום ה-7 בנובמבר 2017, י""ח בחשון התשע""ח, השעה 9:05 ואני מתכבד לפתוח את ישיבת ועדת העבודה, הרווחה והבריאות. ",קורונה,0.89205736
"אני כן אגיד מילה אחת בעניין הזה. החשיבות של התפקיד שלכם אתם מכירים בעצמכם אבל אנחנו גם יודעים את החשיבות. הרבה הרבה בוועדה בדיונים רבים שדנים עולה ממשקים לנושא של כרטיס חכם, מאגרי מידע, אבטחה של שימושים דיגיטליים. אנחנו מנסים ורוצים ושואפים ודוחפים להרחבת השימושים, לקחת את הטכנולוגיה המתקדמת ולהעביר אותה ולהפוך אותה לטכנולוגיה ישימה ורחבה כמה שיותר עד לקצה, עד לאזרח הרבים. וכמה שאנחנו נדע לתת מענים משפטיים ורגולטוריים או חוקיים, פיקוחיים, הסדרה של העניין, ככה אנחנו נוכל יותר להרחיב, ככה נהיה בטוחים וככה גם השימוש יגבר. ",קורונה,0.55153525
"בוקר טוב, אני מתכבד לפתוח את ישיבת ועדת הפנים והגנת הסביבה. על סדר-היום: השתלחות יועץ התקשורת של המפכ""ל ודוברת המשטרה ביושב-ראש הוועדה וחברי הכנסת. ",קורונה,0.5504428
"בוקר טוב, אני מתכבד לפתוח את ישיבת ועדת הכלכלה. היום 8.11, י""ט חשוון התשע""ח. על סדר-היום: תקנות הטיס (הפעלת כלי טיס וכללי טיסה) (תיקון  מס'...), התשע""ז-2017, בדבר יירוט כלי טיס.",קורונה,0.5025298
"בוקר טוב. אני שמחה לפתוח את הדיון על הצעת חוק פינוי ובינוי (פיצויים) (תיקון מס' 4) (פינוי בשל סירוב בלתי סביר), התשע""ו-2016.  זאת ועדה משותפת של הוועדה המיוחדת וועדת חוקה. ",קורונה,0.87633103
"אני מחדש את ישיבת ועדת הכספים. אנחנו ממשיכים את הדיון בהצעת חוק הקרן הקיימת לישראל – תחולת דיני המס, התשע""ח-2017.",קורונה,0.70320225
"אנחנו עוקבים מאוד אחרי נושא השיקום, ספציפית בהוסטלים. אנחנו כוועדה רואים בו מפתח מאוד משמעותי לשיקום, בכלל, באופן כללי של אנשים שיוצאים מהתמכרות, מכורים ומכורים לשעבר, וכמובן, ספציפית אסירים משוחררים שמצבם אולי אפילו יותר מורכב בהשתלבות בחזרה בחברה. אנחנו מבינים שיש כרגע משבר תמיכה, משבר תקציבי שמעמיד את ההוסטלים שכאמור הם מפתח בשיקום הזה, בסכנה. ",קורונה,0.68406314
"אני אתן סקירה קצרה של מה שאנחנו עושים. שיקום האסיר בעצם מתעסק ממאה שמונים יום לפני שחרור האסיר, וממשיך איתו הלאה, עם האסיר. בונים לו תכנית – בעצם כל שנה במדינת ישראל משתחררים 7500 אסירים. מתוכם נכנסים למנהרת השליש 27 אחוז מה7500. לנציב נותר עוד 6 אחוז שהוא יכול להכניס למנהרת השליש הזאת, מי מהסיבות של מחלה וסיבות אחרות, כאלה. ",קורונה,0.8171717
שלום ובוקר טוב לכולם. אנחנו דנים היום בהכנה לקריאה שניה ושלישית של הצעת חוק ליישום ההסכמים בין ממשלת ישראל לבין ממשלת יוון והצעת חוק ליישום ההסכמים בין ממשלת ישראל לבין ממשלת קפריסין בדבר מעמד כוחותיהן כאן בארץ. עידו?,קורונה,0.7660519
"שלום, חברים, אני פותח את ישיבת ועדת הכנסת. יש לנו על סדר-היום את בקשת יושב-ראש ועדת הכספים להקדמת הדיון בהצעת חוק קרן קיימת לישראל (תחולת דיני המס והוראת שעה), לפני הקריאה השנייה והשלישית. מי מציג פה? יש מישהו מוועדת הכספים? ",קורונה,0.7084475
"צהרים טובים. השעה 11:16, היום ה-14 בנובמבר 2017, כ""ה בחשון התשע""ח ואני מתכבדת לפתוח את ישיבת ועדת העבודה, הרווחה והבריאות. על סדר היום חודש המודעות לסרטן השד: סרטן השד וחשיבות האיתור והטיפול המיידי.",קורונה,0.51359063
"אני מאוד הייתי רוצה שהדיון היום לא יישאר רק ברמה של דיון. אני מאוד הייתי רוצה שכל מי שידבר, ישים לנו על השולחן את הנושאים בהם אפשר לטפל ולשפר את המצב הקיים. אני חייבת לציין שיש הרבה שיפורים. אם אנחנו נשווה מה היה לפני חמש שנים ומה קורה היום, בוודאי ובוודאי המצב הוא שונה אבל יחד עם זאת אנחנו יודעים שיש לנו עוד הרבה מה לעשות. לכן, מכל מי שידבר כאן אני אשמח מאוד לדעת מה הנושאים שאתם חושבים שצריך לשפר ובוודאי אנחנו נשמע גם את עמדתו של משרד הבריאות בנושא ואולי כמה מהרעיונות שיעלו כאן על ידי נציגות העמותה שנמצאות אתנו, נוכל ליישם בעבודה השוטפת שלנו.",קורונה,0.52273357
"שלום לכולם. אני מתכבד לפתוח את ישיבת ועדת החינוך, התרבות והספורט של הכנסת, הישיבה הרביעית שלנו היום. זאת ישיבה מספר 496 שלנו מתחילת הקדנציה. היום 14 בנובמבר 2017, כ""ה בחשוון התשע""ח. הנושא על סדר היום הוא השביתה במכללה ""האקדמית תל אביב-יפו"" ובמכללה האקדמית ""בית ברל"". ",קורונה,0.64365315
"שלום לכולם, אני מתכבד לפתוח את ישיבת ועדת הכלכלה בנושא תקנות התעבורה (תיקון מס'...) התשע""ז-2017, תיקונים לחלק ב' לתקנות בדבר כללי התנהגות בדרך. מי מציג את התקנות?",קורונה,0.78445107
"היום אנחנו מסיימים - אני מקווה - את המנהרה הזאת ואז נצטרך לבנות את הגובה שלה. תהיה עוד ישיבה אחת לבנות את הגובה שלה, או את העומק שלה. ",קורונה,0.6599254
"שלום לכולם. נתחיל בדיון. כרגע אנחנו ממשיכים את הנושא של חיית נחייה ולאחר מכן עוד כמה תיקונים, תיקונים של פעם קודמת, של מה שגם אמרנו בישיבה. כן, מרים.",קורונה,0.66998655
"בוקר טוב, היום 15 בנובמבר 2017, כ""ו בחשוון התשע""ח, אנחנו דנים בהצעת חוק שירות הקבע בצבא הגנה לישראל – הצעה של חברת הכנסת יוליה מלינובסקי והרבה מאוד חברים. יוליה, תפתחי את הדיון בבקשה.",קורונה,0.7180998
"יש לנו שני נושאים לדיון, כאשר הראשון הוא תקנות ההגנה על בריאות הציבור (מזון) (סימון תזונתי), התשע""ח-2017 והשני, צו הגנה על בריאות הציבור (מזון) (שינוי התוספת החמישית לחוק), התשע""ח-2017.",קורונה,0.5492258
"אני אומר מה עושה הוועדה לטובת נציגי משרד הפנים והמנכ""ל. אנחנו עוקבים ומקיימים ישיבות עם כל משרדי הממשלה בדרג מנכ""ל כאשר המטרה היא שתוכלו לבוא ולהציג בפנינו מה עשיתם בתחום השקיפות בתקופה האחרונה, מה היעדים שלכם, מה המטרות, איך אתם רואים את עניין השקיפות והדיווח לציבור.",קורונה,0.5376727
"המושג שקיפות, הוא נפתח לכמה רבדים כאשר אחד ממנו – המשמעותי ביותר – הוא כמובן שקיפות ציבורית, שקיפות כלפי הציבור הרחב והממד השני הוא שקיפות בתוך הכנסת כלפי הפרלמנט וכלפי הכנסת.",קורונה,0.651404
"לדעתי אנחנו מרגיזים את האוצר ואת הרפרנטים שלנו והחבר'ה האלה מתחילים כבר לצייץ שאם נמשיך בדרך הזו, לא רק לא נקבל כסף, עוד אנחנו מרגיזים אותם גם.",קורונה,0.52539456
"היום ה-20 בנובמבר 2017, ב' בכסלו התשע""ח, השעה 11:11 ואני מתכבד לפתוח את ישיבת ועדת העבודה, הרווחה והבריאות. אני מתנצל על האיחור.",קורונה,0.5712089
"בוקר טוב, גברתי מנהלת הוועדה, היועץ המשפטי, רשמת, דובר, אני מתכבד לפתוח את ישיבת ועדת הכלכלה. ברשותכם, נתחיל תקנות תכנון משק החלב (העברת מכסות של יצרנים מושביים בענף הבקר ויצרנים בענפי העיזים והכבשים), התשע""ז-2017. בכוונתי לסיים את הדיון היום כדי שנוכל להוציא - -",קורונה,0.5011719
"ניתן לכם, הצלמים, חצי דקה לצאת? תודה. סדרן, בשלב שהדוברות הראשונות מדברות אין כניסה לאף אחד כי הם לא שמעו את ההתראות ואת האזהרות, אז לא להפריע. בבקשה, מי ראשונת הדוברים?",קורונה,0.9394223
"יחד עם עינת קריצמן, המפמ""ר לאומנויות העיצוב, חלמנו גם אנחנו כילדות בפועל, ליזום משהו שילדים ישתתפו בקבלת ההחלטות – איך ייראה בית הספר לילדים שלהם. אשמח מאוד שגם המורות ידברו פה. מה שחשוב היה בנושא של השיתוף, זה שאנחנו בכלל כינסנו את המורים בחודש אוגוסט, החופש הגדול, והם רצו. כל מורה הגיעה עם שניים-שלושה ילדים לישיבת הפתיחה, כלומר גם המורים וגם הילדים הפעילו ביחד בתוך כל בית ספר את התוכנית הזו, וזה מה שמיוחד, שמורים וילדים מובילים יחד. זה השיתוף האמתי. כך גם התכנסנו בחופשת חנוכה. זה עוד מדד. אנחנו נמדדים גם על החופשות. אבל העבודה הקשה שלהם – עוד מעט נראה.",קורונה,0.6725718
"אבל מתוך כל זה, אני אומר, הגענו גם לנושא המאגרים, שנרצה להיות בטוחים, בפרט לאור כל מה שקורה היום בתקשורת, לא צריכים אולי מאגרים, אפשר פשוט לפתוח את העיתון, לקרוא הכול ולשמוע הכול – אם זה נכון, אנחנו כבר לא יודעים – לפעמים יש שם דו-שיח, הכול מה שנקרא, מה הוא שאל ומה אמרו לו ומה הוא שאל, ובחלק מהפעמים יש גם מה יהיה בחקירה הבאה, מה ישאלו. אז אני אומר, הרבה פעמים זה נותן תחושה לא טובה, לא נעימה ולא מכובדת גם. ",קורונה,0.730202
"סעיף 2, הכנסנו אותו למקרה שוועדת העבודה, הרווחה והבריאות לא יקבעו דיון. הייתי מקיים את הדיון על הסוגיה הזו. אנחנו נתייחס אליה כמשנית בדיון כאן. נמצה את זה בוועדת העבודה, הרווחה והבריאות. ",קורונה,0.606126
"המטרה שלו היא אחת: לבדוק, לברר ולוודא כיצד משרדי הממשלה משקיעים בתחום השקיפות שבמשרד. זה נוגע גם לשקיפות של תקציבים, שקיפות של הוצאות, שקיפות של מדדים, מאגרי מידע ועוד תחומים שגם קיבלתם מראש כחלק מהמדד שלנו.",קורונה,0.69980323
"בעניין הזה אנחנו עוד בהתחבטויות מכיוון שוועדת החלל נשארה כוועדת המשנה לענייני חלל והיא דנה בנושאים שלה, שהם נושאים מאוד חשובים. לנו יש חשיבה מאוד רצינית להקים ועדת משנה רק לנושא הרחפנים. תשאלו למה, מכיוון שאנחנו רואים את הנושא הזה כנושא חשוב מאוד שמתרחב מאוד שהיום שזור בכלל הפעילות, בין אם זה בנושא ביטחון ודאי, אבל בין אם זה בנושא של חקלאות, בין אם בנושא של פיקוד העורף, הצלה, בתחום הרפואה, בתחום האזרחי, בתעשייה, במסחר, בתחבורה, גם בנושא פנאי וספורט, בכל הנושאים שמניתי כאן והרבה מעבר לכך שהיא היום שזורה והיא תתעצם הרבה יותר ממה שאנחנו כבר היום מכירים, שהיא בכמות ושימוש לא מועט. ",קורונה,0.6737217
"אז בדברי ההסבר נאמר שקיימת הגדרה כללית לאתר הנצחה, אשר מוכרז בהתאם להסדר זה וזה, בידי שר הפנים, ובהתייעצות עם המועצה להנצחה מוצע להותיר הגדרה זו כהגדרה כללית לאתר הנצחה או להוסיף הגדרה ספציפית לאתר הנצחה מקומי.",קורונה,0.90523356
"בוקר טוב, אני מתכבד לפתוח את הישיבה. על סדר-היום: צו בתי הסוהר (קביעת תקן כליאה) התשע""ח-2017. עידו, בבקשה תציג.",קורונה,0.5694253
"אני רוצה לומר שהוועדה הזו מעצם היוולדה, נועדה לצמצם את הפערים בחברה הישראלית בין פריפריה למרכז, אגב גם בן פריפריה חברתית ולא רק פריפריה גיאוגרפית. ועשינו לא מעט דיונים ועשינו גם סיורים בדרום תל אביב. זו תופעה שלא אני ולא אתה התחלנו אותה. זו תופעה שקיימת שנים ארוכות, אנחנו מנסים להתמודד איתה במגוון פרמטרים. ",קורונה,0.57294
"	בנוסף לשקיפות שאנחנו אמונים עליה בחוק הזה, יש אספקטים נוספים של העברת האחריות ליצרן. אנחנו כרגולטור מבצעים פיקוח על נותני היתרים לייבוא ולייצור של מזון לבעלי חיים. המטרה של התקנות היא בסופו של דבר לתת הוראות מנחות ליצרנים וליבואנים. ",קורונה,0.6244952
"שלום לכולם, אני מתכבד לפתוח את הדיון. קודם כל, חוב שיש לנו מאתמול – לא הספקנו לדון בנושא של המקומות הקדושים, לכן נדון בו בתחילה. לאחר מכן נעבור לסעיף של שימור מורשת. ",קורונה,0.50871617
"הם ליוו אותנו, הם היו גם נוכחים בדיון קודם. נשאלנו שאלות, ראיינו אותנו, שאלות לא קלות. אני מקווה שעמדנו בזאת בגבורה. לי אין ספק שתצאו מכאן עם תובנות חשובות הן על מדינת ישראל, הן על הדמוקרטיה במדינת ישראל והן על הכנסת. תודה רבה.",קורונה,0.6253623
1. ביטול סעיף 5 – בחוק יסוד: ירושלים בירת ישראל (להלן – חוק היסוד) סעיף 5 בטל.,קורונה,0.6293299
"בוקר טוב. היום ה-29 בנובמבר 2017, י""א בכסלו התשע""ח, השעה 8:53 ואני פותח את ישיבת ועדת העבודה, הרווחה והבריאות. על סדר היום הצעת חוק הבטחת הכנסה (תיקון מס' 51) (מענק חימום אחיד), התשע""ח-2017.",קורונה,0.58163166
"תודה, אדוני היושב-ראש שנענית לבקשתי לקיים דיון בנושא הזה. אנחנו נציגיו של הציבור בכנסת, ובהגדרת תפקידנו, לדעתי, אין לנו מספיק סמכויות לעשות זאת, אבל התפקיד שלנו הוא לפקח ולבקר את הפעילותם של משרדי הממשלה.",קורונה,0.67450374
תציגו את המכלול של התקנות ואחר-כך נעמה תתחיל לקרוא את הסעיפים הרלוונטיים. אם יהיה צורך נדבר עליהם. לאחר שנסיים את כל הסעיפים נחזור ל-7א ונדבר עליו. ,קורונה,0.68159294
