QuoteText,Topic,Topic_Prob
"תודה למי שנשאר בזום, עברנו לדיון אחר, סגרנו אותו וחזרנו, הבטחתי שזה יהיה קצר. אנחנו דנים פה בתקנות שהם בעצם אותו סט התקנות – ואם אני טועה במשהו, אז תסבירי – שאישרנו פה אתמול. העניין המשמעותי הוא תקנות תיקון מס' 14 לחוק שהגיע אלינו בשבוע שעבר, מכיוון שלא אישרנו אותו ולאור הפעמים הקודמות, מי שזוכר, שהבנו שאנחנו מחויבים: לאשר או לא לאשר כל תקנות אחרת הסיפור של קנסות פליליים לא יכולים להיכנס לתוקף, אנחנו מאשרים כל פעם מחדש את התקנות ולכן התכנסו פה.",קורונה,0.53923416
"בוקר טוב. אני מתכבד לפתוח את ישיבת ועדת הכספים בנושא הראשון שעל סדר-היום: צו היטלי סחר ואמצעי הגנה (היטל יבוא הנובע מהסכם העדפה) (הוראת שעה), התשפ""א-2020.",קורונה,0.7055353
"בוקר טוב לכולם. אני מתכבד לפתוח את ישיבת ועדת הכלכלה של הכנסת, 30 בדצמבר 2020, ט""ו בטבת תשפ""א. הצעת צו שירותי תעופה (פיצוי וסיוע בשל ביטול טיסה או שינוי בתנאיה) (נגיף הקורונה החדש - הוראת שעה - תיקון) (הארכת התקופה הקובעת) (תיקון מס' 3), התשפ""א-2020. רננה איתנו, ואני מקווה שזאת הבקשה האחרונה. ",קורונה,0.6065308
"אני פותח את ישיבת הוועדה. על סדר היום יש לנו שלושה נושאים: בקשה להארכת הכרזה על מצב חירום בשל נגיף הקורונה, כמו שאתם זוכרים, אחת ל-60 יום, הממשלה מודיעה לנו קודם ואנחנו דנים בזה ומקבלים את ההחלטה שלנו. הדבר השני, הצעת הכרזת סמכויות מיוחדות להתמודדות עם נגיף הקורונה החדש (בידוד של אדם שנכנס לישראל) (ביטול) – אתם מבינים, איך שהגעתי אני מבטל את מה שמלכיאלי העביר רק לפני יומיים – והצעת הכרזת סמכויות מיוחדות להתמודדות עם נגיף הקורונה החדש (בידוד של אדם שנכנס לישראל בנסיבות מיוחדות) (מס' 3) – ותיכף נשמע את זה.",קורונה,0.9786737
"שלום לכולם. אני מתכבד לפתוח את ישיבת ועדת הכלכלה של הכנסת, 30 בדצמבר 2020, ט""ו בטבת תשפ""א. על סדר היום: הצעת תקנות סמכויות מיוחדות להתמודדות עם נגיף הקורונה החדש (הוראת שעה) הגבלת פעילות בתחום התחבורה) (תיקון מס' 6), התשפ""א-2020. משרד התחבורה איתנו? ",קורונה,0.8459138
"  בוקר טוב. אני פותח את ישיבת ועדת הכספים. על סדר-היום: הצעת צו לעידוד השקעות הון (קביעת תחומי אזורים מיוחדים לעניין מפעלי תיירות), התשפ""א-2020. ",קורונה,0.83448625
"השנה נקלענו למצב שאין החלטת ממשלה. לצערי, המשרדים לא ניצלו את הזמן הזה כדי להאריך את החלטת הממשלה. כבר לפני 5 שנים הזהירו שזה לא יספיק ל-5 שנים וצריך החלטת ממשלה ל-10 שנים. תמיד היתה הבטחה שזה יהיה ל-5 שנים נוספות. לצערי זה לא קרה והנה אנחנו מגיעים לנקודת משבר במועצה. ",קורונה,0.5831
"בוקר טוב, חברות וחברים. היום 4 בינואר 2021, השעה 10:03. אני פותחת את ישיבת ועדת העבודה, הרווחה והבריאות.",קורונה,0.7797695
"בוקר טוב לכולם. אני מתכבד לפתוח את ישיבת ועדת החוץ והביטחון בדיון המשך בנושא: סטטוס קידום הנגשת מערת המכפלה. נדמה לי שזה דיון רביעי שאנחנו עושים בחצי השנה האחרונה, כאשר הדיון האחרון היה בחודש נובמבר.",קורונה,0.9389305
"גם הסעיף הזה מונח בפני חברי הוועדה בנוסח המתוקן, בעמוד 9. יש גם את פסקה (ג3): סירב נוהג ברכב לדרישת שוטר לפי תקנת משנה (ג1),  יראו אותו כמי שעבר עבירה לפי תקנה 168 לתקנות. ",קורונה,0.8227026
"1. הצעת חוק הארכת תקופות (הוראת שעה – נגיף הקורונה החדש) (אישור רגולטוריים) (מ/1383). יש כאן נציג ממשרד ראש הממשלה, עמיחי פישר?",קורונה,0.7221267
"כן, אני דרך הזום. מדובר בהצעת חוק שהיא למעשה המשך של הוראת השעה הקיימת. לאור נגיף הקורונה, הממשלה והכנסת אישרו הארכה אוטומטית של אישורים רגולטוריים, רישיונות עסק, רישיונות ייבוא, מאות רבות של רישיונות. זה אושר בעבר כל פעם לשלושה חודשים פעמיים, עד למעשה סוף נובמבר. ",קורונה,0.5574547
"שלום לכולם, אני מתכבד לפתוח את ישיבת  ועדת הכלכלה של הכנסת, 5 בינואר 2021, כ""א בטבת התשפ""א. הצעת חוק דחיית מועדים לביצוע בדיקות של מיתקני גז (נגיף הקורונה החדש) (הוראת שעה), התשפ""א–2020. בבקשה, משרד האנרגיה.",קורונה,0.64710885
"זה הדיון השני של הוועדה. הייתי מלאת תקווה שעד סוף הקדנציה נצליח להביא בשורה לאנשים החשובים והיקרים האלה. לצערי הרב, כפי שאתם יודעים, אנחנו יוצאים לבחירות. יחד עם זאת, שמחתי מאוד לדעת שמשרד הביטחון כן הכין לנו טיוטה. לפחות אולי חלק מן העבודה שהיינו צריכים לעשות בכל הקדנציה של הכנסת העשרים-ושלוש אנחנו כן נצליח לעשות. ",קורונה,0.55280274
אנחנו בתקופת ניקיון שולחן. כרגע על סדר-היום שני חוקים ממשלתיים. קיבלנו ממש עכשיו בקשה מוועדת הכלכלה להקדמת דיון בנושא של דחיית מועדים לביצוע בדיקות של מתקני גז. האם להעלות את זה היום להצבעה - - - ,קורונה,0.55642086
"שלום לכולם. אני מתכבד לפתוח את ישיבת ועדת הכלכלה של הכנסת, 5 בינואר 2021, כ""א בטבת התשפ""א. הנושאים: 1.הצעת תקנות התעבורה (תיקון מס'... ), התשפ""א-2021 בדבר התקנת מערכת עזר לנהג להתרעה על השארת ילדים ברכב; 2. הצעת צו התעבורה (עבירות קנס) (תיקון), התשפ""א-2021 בדבר התקנת מערכת עזר לנהג להתרעה על השארת ילדים ברכב. לגבי סעיף 2, אני מבין שצריך אישור של שר המשפטים.",קורונה,0.6184327
"צוהריים טובים. היום 5 בינואר 2021, השעה 15:35. אני פותחת את ישיבת ועדת העבודה, הרווחה והבריאות. הנושא לדיון היום הוא תקנות שוויון זכויות לאנשים עם מוגבלות (נגישות לשירותי חירום במסגרות לאנשים עם מוגבלות), התשפ""א-2020. זה צריך להיות התשפ""א-2021 אז נתקן את זה. ",קורונה,0.5012113
"אחד הדברים הקשים גם כן ושצריך להציג אותם ולקבל את המענה על השאלות שלהם – היום ראש המועצה מתדפק כמעט על כל דלת, מגיע לכל משרד, מבקש תשובות, עושה את כל המאמצים על מנת לפתור את הבעיה הקשה מאוד, וזה לא באשמת הקדנציה הנוכחית של ג'דיידה-מכר, ובכל זאת, המשרדים השונים לא משתפים פעולה.",קורונה,0.55958945
"ואנחנו כאן להציג את הבעיה, את חומרת הבעיה, את התופעה המאוד- מדאיגה, וברצוננו לקבל תשובות מידיות כמה שאפשר, כי המפגע הזה לא מחכה לאף בן אדם ולא מחכה לאף אחד, ולתושבי ג'דיידה-מכר מגיע לחיות בכבוד, בסביבה טובה יותר, מכבדת יותר, סביבתית יותר ובריאותית יותר. במיוחד בתקופה קשה כזו אנחנו מצפים מהמשרדים השונים לתת מענה ולענות על השאלות ולתקצב את הבעיה הזו על מנת לפתור אותה.",קורונה,0.971957
"בוקר טוב. היום 6 בינואר 2021, כ""ב בטבת התשפ""א. אני מתכבד לפתוח את ישיבת העבודה והרווחה בנושא תקנות המזון, בנושא: הצעת צו הגנה על בריאות הציבור (מזון) (הארכת תקופת תוקפן של הנחיות. ",קורונה,0.6739026
"בוקר טוב לכולם, כבוד שר האוצר, בוקר טוב, היום יום רביעי, כ""ב בטבת התשפ""א, 6 בינואר 2021, ואני מתכבד לפתוח את ישיבת ועדת הכספים בנושא: הצעת חוק התוכנית לסיוע כלכלי (נגיף הקורונה החדש) (הוראת שעה) (תיקון מס' 4), התשפ""א-2021 (מ/1386), הכנה לקריאה שנייה ושלישית. מיקי לוי, ביקשת הצעה לסדר, בבקשה. ",קורונה,0.54158175
בוקר טוב לכולם. על סדר-היום: הצעת תקנות סמכויות מיוחדות להתמודדות עם נגיף הקורונה החדש (הוראת שעה) (הגבלת פעילות והוראות נוספות)(תיקון מס' 22). ,קורונה,0.919438
"גברתי היועצת המשפטית, תזכירי לנו את התיקון. תקריאי ותסבירי. למיטב זכרוני, זה היה התיקון של רפואה משלימה ועוד כמה דברים קטנים. למעשה, אנחנו מאשרים עכשיו אישור פורמלי כי אנחנו כנראה הולכים למשהו אחר, על פי ההחלטה, לפחות מאתמול, למרות שעדיין לא קיבלנו את התקנות החדשות, ולכן זה כרגע באמת דיון  פורמלי לחלוטין. ",קורונה,0.62163407
"צוהריים טובים, התכנסנו כאן כדי להאריך את תוקף התקנות לסמכויות מיוחדות להתמודדות עם נגיף הקורונה החדש וגם לעשות מספר תיקונים. רננה מרשות התעופה האזרחית תציג את התיקונים. בבקשה. ",קורונה,0.8804469
"המהות של התקנות האלה זה כל נושא הכניסה לטרמינל והעבודה בטרמינל בזמן המשבר. אני רוצה לציין שכל עניין הפרט, האם מותר ליסוע לחו""ל, באילו תנאים וכו' – כל זה לא יתנהל פה, זה מתנהל עכשיו בוועדת חוקה ואנחנו משערים שזה יגיע מחר. כרגע אנחנו מטפלים בכל עניין התחבורה והטרמינל, מה שבסמכות הוועדה. אנחנו צריכים לתקן מספר דברים ולהאריך את תוקף התקנות. ",קורונה,0.56028587
"אני פותח את ישיבת הוועדה. על סדר-היום: הצעת הכרזת סמכויות מיוחדות להתמודדות עם נגיף הקורונה החדש (בידוד של אדם שנכנס לישראל בנסיבות מיוחדות)(מס' 3)(תיקון). מי מציג לנו את זה, משרד המשפטים או משרד הבריאות?",קורונה,0.92999613
"אנחנו עוברים לנושא הבא: הצעת חוק התוכנית להבראת כלכלת ישראל (תיקוני חקיקה להשגת יעדי התקציב והמדיניות הכלכלית לשנות הכספים 2003 ו-2004) (תיקון מס' 18 והוראת שעה) (תיקון), התשפ""א-2021 (מ/1385) – הכנה לקריאה שנייה ושלישית (מ/1385).",קורונה,0.5191086
"הנושא הוא הצעת חוק הארכת תקופות (הוראת שעה – נגיף הקורונה החדש) (אישורים רגולטוריים) (תיקון), התשפ""א–2020. מי מציג? בבקשה.",קורונה,0.7009471
"אני פותח את ישיבת ועדת החוקה. על סדר היום: הצעת תקנות סמכויות מיוחדות להתמודדות עם נגיף הקורונה החדש (הגבלת פעילות והוראות נוספות), ועוד שתי תקנות שקשורות להגבלת פעילות במקומות עבודה. בהזמנה הייתה גם הגבלת פעילות כללית יותר, רחבה יותר, שעל פי בקשה של יושב-ראש ועדת הכנסת ועל פי הסמכות שניתנה לו בחוק הוא ביקש לעשות דיון בוועדה אצלו על מנת לראות לאיזו ועדה להעביר את זה. ככל שוועדת הכנסת תחליט, אם תחליט, להעביר את זה אלינו, הישיבה תימשך הערב, לאחר הישיבה בוועדת הכנסת. עכשיו אנחנו דנים בשלושת הדברים האלה. אני מבקש מהיועץ המשפטי לוועדה להציג לנו את סעיף שלוש: תקנות סמכויות מיוחדות של הממשלה, שקשורות להגבלת פעילות והוראות נוספות. ",קורונה,0.89742696
"תקנות סמכויות מיוחדות להתמודדות עם נגיף הקורונה החדש (הוראת שעה) (הגבלת פעילות והוראות נוספות) (תיקון מס' 23), התשפ""א-2021",קורונה,0.9261497
"	בתוקף סמכותה לפי סעיפים 4, 6, 7, 8, 23, 24, 25 ו-27 לחוק סמכויות מיוחדות ",קורונה,0.86665267
"חברי הכנסת, אני מתכבד לפתוח את ישיבת ועדת הכנסת. היום יום חמישי, כ""ג בטבת התשפ""א, 7 בינואר 2021. על סדר-היום מספר נושאים. נתחיל מהדברים הפשוטים ואז נעבור לדברים הכבדים. אני בסעיף ב', חברים: בקשת הממשלה להקדמת דיון בקשת הממשלה להקדמת הדיון בהצעת חוק הביטוח הלאומי (הוראת שעה – נגיף הקורונה החדש) (תשלום דמי לידה ליולדת בתקופת אבטלה), התשפ""א-2021 (מ/1387), בכל הקריאות. זו הצעה ממשלתית שלתעלה להצבעה ביום שני.",קורונה,0.74801105
"ערב טוב לכולם, אנחנו מתכנסים כאן לאשר את תקנות סמכויות מיוחדות להתמודדות עם נגיף הקורונה החדש. יש לפנינו ארבעה נושאים: הגבלת הפעילות, תחום החינוך, הגבלת מקומות העבודה ונושא התחבורה. נתחיל בהקראה.",קורונה,0.7658244
"בתוקף סמכותה לפי סעיפים 4, 6, 7, 8, 9, 10, 11, 12, 12ה, 23, 24, 25, 27 ו-44(ד)(2) לחוק ",קורונה,0.9486491
"שלום, אני מתכבד לפתוח את ישיבת ועדת החוקה, חוק ומשפט, על סדר-היום הצעת הכרזת סמכויות מיוחדות להתמודדות עם נגיף הקורונה החדש (הוראת שעה) (בידוד של אדם שנכנס לישראל בנסיבות מיוחדות), התשפ""א-2020. קיבלנו את מכתב מזכיר הממשלה ב-7 בינואר. למרות שאנחנו כמובן בפגרת בחירות כן מצאתי לנכון לקיים את הדיון הזה כי הדיון הזה הוא תוצאה של החלטות שלנו בתקנות לגבי המגיעים מחו""ל, האם לחייב את כל החוזרים, מכול המדינות, להיכנס לבידוד במלוניות, או רק ממדינות מסוימות. אני אבקש מנציגת משרד הבריאות להסביר לנו את ההכרזה הזו.",קורונה,0.77188206
"בוקר טוב, אני מתכבד לפתוח את ישיבת ועדת הכספים. היום 11 בינואר 2021, כ""ז בטבת התשפ""א. ברשות הרב גפני שביקש להעלות את נושא בתי החולים שזועקים - - - ",קורונה,0.52252424
"אני מתכבד לפתוח את ישיבת ועדת הכנסת, היום יום שני, כ""ז בטבת התשפ""א – 11 בינואר 2021. בפנינו בקשת הממשלה להקדמת הדיון בהצעות חוק שונות בכל הקריאות. נתחיל בהצעת חוק סליקת שיקים ושיקים ללא כיסוי (תיקוני חקיקה) (מ/1388). ",קורונה,0.9459933
"צוהריים טובים, היום ה-11 בינואר 2021, כ""ז בטבת התשפ""א, אני מתכבד לפתוח את ישיבת ועדת העבודה, הרווחה והבריאות, והנושא: הצעת חוק הביטוח הלאומי (הוראת שעה - נגיף הקורונה החדש) (תשלום דמי לידה ליולדת בתקופת אבטלה), התשפ""א-2021 מ/1387 -  בהכנה לקריאה שנייה ושלישית. ",קורונה,0.55756646
"ב-2019 היא עברה, במהלך 2018 היא נחקקה. היא עברה הרבה מאוד דיונים והייתה פתוחה לכל המגזרים ולכל ההערות. אני לא הולך להיכנס עכשיו לכל התהליך שהיה אז. מה שאני כן הולך לעשות – ויכול להיות שבסוף גם לא נמצה את זה ונקבל החלטות כאלה ואחרות, אבל אני כן רוצה לראות מה אפשר להחיל היום כי בסופו של דבר טובת האזרחים עומדת לנגד עינינו בהצעת החוק הזאת; שנית, אם יש דברים נוספים שיעלו – ואני מתאר לעצמי שיעלו – כבר ראיתי את הפניות שהגיעו לוועדה, עברתי על כל ניירות העמדה, אמנם לא בעיון רב אבל עוד יהיו מספיק, כדי להבין שיש אנשים שחושבים שיש עכשיו הזדמנות להיפטר מכל החקיקה הזאת. אני לא שם. אני מתכוון להמשיך אותה. אני רוצה לטייב אותה במידת האפשר בלוח הזמנים הזה שיש לנו. אני לקחתי על עצמי את לוח הזמנים הזה.  ",קורונה,0.5018193
"שלום לכולם. אני מתכבד לפתוח את ישיבת ועדת הכלכלה של הכנסת. היום 18 בינואר 2021, ה' בשבט התשפ""א, בנושא: הצעת תקנות סמכויות מיוחדות להתמודדות עם נגיף הקורונה החדש (הוראת שעה)(הגבלות על הפעלת שדות תעופה וטיסות)(תיקון מס'6), התשפ""א.",קורונה,0.83502555
"צוהרים טובים לכולם. אני פותח את ישיבת ועדת החוקה. על סדר-היום הצעת תקנות סמכויות מיוחדות להתמודדות עם נגיף הקורונה החדש (תיקון מס' 24), שמדברת על נושא חגים של עמים או עדות נוספות, שזה תיקון קטן; והצעת הכרזת סמכויות מיוחדות להתמודדות עם נגיף הקורונה החדש (בידוד של אדם שנכנס לישראל בנסיבות מיוחדות) (מס' 3) (תיקון מס' 2), שמדברת על צמצום והרחבה של רשימת המדינות.",קורונה,0.97168946
"שלום לכולם, אני מתכבד לפתוח את ישיבת ועדת הכלכלה של הכנסת, ה-20 בינואר 2021, ז' בשבט תשפ""א. הנושא על סדר-היום: הצעת תקנות סמכויות מיוחדות להתמודדות עם נגיף הקורונה החדש (הוראת שעה) (הגבלות על הפעלת שדות תעופה וטיסות) (תיקון מס' 7). אני הייתי מציע שקודם כול היועץ המשפטי של הוועדה ייתן לנו תמונת מצב איפה אנחנו, לקראת מה אנחנו הולכים ועל מה אנחנו הולכים לדון, לפני שנעלה את המבקשים של התקנות להתייחסות. ",קורונה,0.76518387
"שהם אלה שיסבירו כמובן בפרטי פרטים את התיקון. התיקון הוא, כפי שנאמר, לתקנות סמכויות מיוחדות להתמודדות עם נגיף הקורונה החדש, שעוסקות בהגבלות על הפעלת שדות תעופה וטיסות. אלה תקנות שאושרו כאן בוועדה לראשונה בחודש אוגוסט, מאז מוארכות מעת לעת לפי החוק. התקנות ככלל הן בתוקף ל-28 יום בכל פעם, אלא אם כן הוועדה מחליטה על קיצור התקופה.",קורונה,0.59255373
"אני רוצה כאן להדגיש, שמדובר על תיקון לתקנות העיקריות, שאיננו קשור מבחינה משפטית להגבלות החדשות או להידוק הסגר. כלומר, זה תיקון שישולב מעתה ואילך בתקנות שעוסקות בהגבלות על הפעלת שדות תעופה וטיסות. התקנות האלה כרגע בתוקף עד ה-3 בפברואר, אלא אם כן הוועדה עכשיו – הוועדה בעצם עכשיו לא יכולה להחליט על קיצור, מכיוון שזה התוקף של התקנות העיקריות. התיקון הזה ישתלב באותן תקנות.",קורונה,0.97361684
"בוקר טוב לכולם, אנחנו מתחילים דיון של ועדת המשנה לוועדת העבודה, הרווחה והבריאות, דיון שעוסק בנפגעי פוסט-טראומה בעקבות לחימה.",קורונה,0.6975716
"בפתח הדברים אני אגיד שהדיון הזה היה חשוב, כיוון שאנחנו נמצאים בתקופה מאוד מורכבת מבחינה פוליטית, ואנחנו נמצאים במינוי זמני של ראש אגף השיקום, וככל שאפשר לעשות בתקופה קצרה ותחת מינוי זמני, אני מאחל לו בהצלחה. אבל דווקא בגלל זה היה לי חשוב מאוד לקיים את הדיון. הייתה כתבה כואבת בשבוע שעבר, וגם עליה נדבר קצת, ונראה מה המשמעות של כתבה, איך היא יכולה לעזור ולשנות מציאות במדינת ישראל.",קורונה,0.62208813
"שלום. בוקר טוב לכולם. אני פותח את הישיבה של ועדת חוקה, חוק ומשפט. על סדר-היום: הצעת תקנות סמכויות מיוחדות להתמודדות עם נגיף הקורונה החדש (הוראת שעה)(הידוק הגבלות)(תיקון מס' 3) התשפ""א–2021.",קורונה,0.9127239
"בוקר טוב, אני מתכבד לפתוח את ישיבת ועדת הכלכלה של הכנסת. היום יום שני, י""ב שבט התשפ""א, 25 בינואר 2021. על סדר-היום: הצעת תקנות סמכויות מיוחדות להתמודדות עם נגיף הקורונה החדש (הוראת שעה) (הגבלות על הפעלת שדות תעופה וטיסות) (תיקון מס' 8), התשפ""א-2021; הצעת תקנות סמכויות מיוחדות להתמודדות עם נגיף הקורונה החדש (הוראת שעה) (הגבלות על הפעלת שדות תעופה וטיסות) (תיקון מס' 6) (תיקון), התשפ""א-2021.",קורונה,0.9384521
"בוקר טוב. היום יום שני, 25 בינואר 2021, י""ב בשבט התשפ""א, ואני מתכבד לפתוח את ישיבת ועדת העבודה, הרווחה והבריאות. על סדר-היום: הצעת צו ביטוח נפגעי חיסון (שינוי התוספת לחוק), התשפ""א-2020 והצעת  תקנות ביטוח נפגעי חיסון (תיקון). ",קורונה,0.80436176
"המטרה העיקרית של שני התיקונים האלה היא להוסיף את החיסון נגד נגיף הקורונה החדש לרשימת החיסונים שבחוק ביטוח נפגעי חיסון. חוק ביטוח נפגעי חיסון קובע פיצוי למי שנגרם לו נזק כתוצאה מחיסון, כלומר, מי שיש קשר סיבתי בין הפגיעה שלו לבין החיסון, בגובה מרבי של כ-920,000 שקל למי שחלילה נפטר כתוצאה מחיסון או מי שהוכח שיש לו נכות מלאה וצמיתה של 100%. מי שנקבעה לו דרגת נכות חלקית יקבל את החלק היחסי מהסכום הזה שציינתי - כ-920,000 שקל. ",קורונה,0.5903534
