QuoteText,Topic,Topic_Prob
"תודה, כבוד היושב-ראש. על רקע הפגיעה המתמשכת בשכר המורים והמורות, שכמעט הביאה לשביתה השבוע, שנמנעה במאמצים של משרד החינוך – ושלא בצדק, אני חייבת לומר – אבקש לשאול:",קורונה,0.5508442
"לקריאה ראשונה, מטעם הממשלה, הצעת חוק סמכויות מיוחדות להתמודדות עם נגיף הקורונה החדש (הוראת שעה) (תיקון מס' 2), התשפ""א–2020.",קורונה,0.8041086
" << נושא >> הצעת חוק התוכנית לסיוע כלכלי (נגיף הקורונה החדש) (הוראת שעה) (תיקון), התשפ""א–2020 << נושא >>   ",קורונה,0.7537013
"לפני כשנה, בחודש יוני 2014, אישרה הכנסת שני תיקוני חקיקה. האחד, תכנון לחוק נכי רדיפות הנאצים, שנדון בוועדה שלנו והשני תיקון לחוק הטבות לניצולי שואה, שנדון בוועדת העבודה, הרווחה והבריאות. ",קורונה,0.5129078
"אולי נתחיל דווקא מהמהות. תמ""א 13 היא כזאת ששמה הרבה מאוד הגנות על החופים, ובטח בין הגורמים האזרחיים שנמצאים כאן יש שיגידו שלא מספיק. יש בה איזונים מסוימים בין... הייתה לנו שיחה מקדימה ודיברנו על השימושים השונים שצריכים להיות בחוף ובקרבת החוף. יכולים להיות בינינו חילוקי דעות האם במצב הקיים יש מספיק הגנות או לא, אבל בטח שלבטל את כל ההגנות האלה בצורה כל כך גורפת, גם מבחינת הרצועה הקרובה לחוף וגם מבחינת המעטפת, האזור שעוטף את החוף, זה דבר שיוצר סכנה מידית וממשית של התנקשות במשאב הציבורי החשוב הזה, שצריך להיות פתוח. ",קורונה,0.8762568
"בסעיף 1, בהגדרה ""קופת גמל"", ""קופת גמל לתגמולים"", ""קופת גמל לפיצויים"", ""קופת גמל לקצבה"", ""קופת גמל לא משלמת לקצבה"", ""קרן השתלמות"", ""קרן ותיקה"", ""קופת ביטוח"" ו""תכנית ביטוח"", במקום ""קופת גמל לא משלמת לקצבה"" יבוא ""קופת גמל לחיסכון"".",קורונה,0.97039133
"היום ה-8 בנובמבר 2015, כ""ו בחשון התשע""ו, השעה 15:10 ואני פותח את ישיבת ועדת העבודה, הרווחה והבריאות.",קורונה,0.89205694
"נודע לנו שהיית בדרכך ליועץ המשפטי של הכנסת. אני רוצה להבין האם בהיעדר תקציב הביטחון – זאת אומרת, שהצביעו נגדו – אנחנו יכולים, חוקית, לדון בתקציב המדינה ולגדר אותו? מה המצב המשפטי? אלא אם כן אדוני הלך לנושאים שהם נושאים אחרים, הייתי שמח לשמוע עליהם. ",קורונה,0.55615395
"בוקר טוב. אני מתכבד לפתוח את ישיבת ועדת הפנים מהיום, ט""ז בטבת תשע""ו, ואנחנו עסוקים בנושא מועצת בתי העלמין תל רגב. הכותרת פה היא טיפול המשטרה בהתנכלות ליושב ראש המועצה ואני רוצה שלא נתעסק רק במשטרה, נתעסק במכלול. המכלול, למיטב הבנתי, ממה שעברתי על החומר קודם, מתנהל בשני מישורים, האחד זה מה קורה בבית העלמין עצמו, ושתיים זה מה קורה עם יושב ראש מועצת בתי העלמין והאיומים עליו באופן אישי. גם פה נלך בשני צירים. ציר אחד הוא הציר המבצעי, עד כמה שאפשר יהיה לפרט ונצטרך להתרשם האם, בעיקר המשטרה, אבל בכלל מערכת הביטחון, עושה את מה שהיא צריכה לעשות כדי לטפל בזה, והמישור השני הוא המישור הכספי, מי אמור לשלם את כל סוגיית האבטחה, גם בבית העלמין ויותר מזה, על יושב ראש המועצה. אנחנו ניתן ליושב ראש המועצה לפתוח כמה דקות בתמונת המצב מהזווית שלו ואז נתקדם. ",קורונה,0.799238
"היום ה-28 בדצמבר 2015, ט""ז בטבת התשע""ו והשעה 10:37. אנחנו פותחים דיון בהצעת חוק לחלוקת חיסכון פנסיוני בין בני זוג שנפרדו. ההצעה הובאה על ידי חברי הכנסת מרב מיכאלי שנוכחת, על ידי חברת הכנסת זהבה גלאון שלא נוכחת ועל ידי חבר הכנסת אלי אלאלוף שגם הוא נוכח.",קורונה,0.5645255
"הרגשות של כל אחד מאתנו לשואה, ולא חשוב מהיכן הוא בא, הם אמיתיים, הם מאוד רגישים אבל הם חלק אינטגרלי של מחשבותינו, של החינוך האישי של כל אחד מאתנו. בוודאי כמי שהייתה לו הזכות גם לגדול במדינה ערבית, במרוקו, הרגשנו כל הזמן שמה שההורים שלנו סבלו, נלקח בתודעה ההיסטורית של עם ישראל ותושבי ישראל.",קורונה,0.7998515
"אני מתכבד לפתוח את ישיבת ועדת הכנסת. בקשת יושב-ראש ועדת הכספים להקדמת הדיון בהצעת חוק לתיקון פקודת מס הכנסה (מס' 217), התשע""ו-2015 לפני הקריאה השנייה והשלישית. זה מס חברות. נכון? ",קורונה,0.9261475
"תודה. אנחנו ממשיכים עם התקנות. אני מזכיר שסדר הדיון הוא כדלקמן: אנחנו נקריא. אני לא חוזר ופותח דיונים במה שכבר דנו בעבר. אנחנו מסיימים סעיף ולאחר שמסיימים אותו, אם יש הערות והתייחסויות – אני אשמח להן אבל לא באמצע ההקראה.",קורונה,0.7213346
"תודה. צהרים טובים. אני מודה ליושב ראש הוועדה על שנענה לבקשתי, בקשתנו, לקיים את הדיון. בפתח הדיון אני צריך להודות גם לכל צוות תכנית ""המערכת"". אני מודה משום שעל פניו הנושאים שקשורים לדת ומדינה, אלה נושאים שהציבור כבר התייאש מהם והבין שהמערכת הפוליטית לא תפתור אותם. הבעיה שלי, של הייאוש, היא שאנשים פשוט לא עוזבים את הרבנות אלא עוזבים את היהדות. החובה שלנו היא לנתק, לעשות כל מה שאנחנו יכולים לעשות, בין מה שלצערי הרב דבק במערכת הכשרות – מילה שלצערי הפכה כמעט מילה נרדפת לשחיתות – אותה אתה פוגש בכל המערכים, בבתי המלון, במסעדות, בבתי הקפה, באלה שיש להם כשרות ובאלה שאין להם כשרות.",קורונה,0.6189345
"השר ממונה על ביצוע הוראות חוק זה והוא רשאי  באישור ועדת הפנים והגנת הסביבה להתקין תקנות לביצועו""",קורונה,0.51978475
"הנושא שנדון בו היום – חדרי מיון (מלרד""ים) של בי ה חולים הכלליים – היעדר תקינה סדורה – דו""ח מבקר המדינה 60 ב'. זה דיון שני.",קורונה,0.53356856
"שלום. אני מתכבד לפתוח את ישיבת ועדת החינוך, התרבות והספורט של הכנסת. 11 בינואר 2016, א' בשבט תשע""ו, הנושא על סדר היום הוא התבטאויות חריפות של מרצים באקדמיה נגד נבחרי ציבור ונגד סטודנטים, של חבר הכנסת מרדכי יוגב. המציעה השנייה, התבטאויות חריפות של מרצים באקדמיה הישראלית נגד חברי ציבור ונגד סטודנטים, חברת הכנסת שרן השכל, והמציע השלישי, האיום על מרצים באקדמיה בגין התבטאויות, של חבר הכנסת ג'מאל זחאלקה. ",קורונה,0.50107086
"אתה יודע שפעם היה כתוב ""לעדת המערבים"" חברת קדישא לעדת המערבים. הייתי ילד בירושלים ואחר כך שמעתי שהמערב זה אירופה ושהמערבים זה המוגרבים. מגלב וזה מערב, לא ידעתי אז איך יכול להיות שדווקא המוגרבים הם המערבים והמערבים הם מזרחיים כי האירופים היו מזרח אירופה, יהודי מזרח אירופה. הסבירו לי שזה תלוי איפה אתה נמצא. כשאתה נמצא בארץ ישראל אז מגרב זה מערב, עירק זה מזרח ומרוקו מגרב זה מערב. כשאתה מדבר לעומת אירופה, אז אירופה במערב. אני לא יודע מתי הפכו הצפון אפריקאים למזרחיים כי למעשה הם בכל מקרה מערבים, אם כי כשסופרים מארץ ישראל, אבל זה היה שיעור בגיאוגרפיה.",קורונה,0.68382895
"אנחנו ננסה ללמוד על התופעה ולראות איך מבחינה חברתית אנחנו מנסים לחנך או ליצור מציאות שהיא קצת אחרת, כי אנחנו בסופו של דבר שותפים, אני חושבת, לדימוי ולתדמית שאנחנו מעניקים לאותם ילדים, או בכלל לאנשים שהם בעלי משקל עודף, אם זה דרך מודל היופי שאנחנו משדרים – אם זה בפרסומות, אם זה בתכניות טלוויזיה – ואם זה אפילו בתכניות לימודים. ",קורונה,0.6036615
"הסעיף הבא בסדר-היום: צו מס הכנסה (קביעת תשלומים בעד עיבוד יהלומים או בעד מסחר ביהלומים כהכנסה) (תיקון), התשע""ו-2016. ",קורונה,0.68798405
"צו מס הכנסה (קביעת תשלומים בעד שירותים או נכסים כהכנסה) וצו מס הכנסה (קביעת תשלומים בעד עיבוד יהלומים או בעד מסחר ביהלומים כהכנסה) עוסקים באותו נושא. מכוח סעיף 164 לחוק, הותקנו תקנות. התקנות קובעות חובות ניכוי מס במקור של 20%, במקרים מסוימים 30%. מכוח התקנות ישנו צו, כשהצו קובע מחזורים שבכפוף לגובה המחזור המשלם לא חייב לנכות מס במקור. ",קורונה,0.6125597
"18 בינואר 2016, ט' בשבט תשע""ו. אנחנו מתחילים את ישיבת ועדת המשנה של ועדת העבודה, הרווחה והבריאות בטיפול בצעירים וצעירות חסרי בית. ",קורונה,0.930584
"הדבר השני, מה שאנחנו נעשה בוועדות האלה, שתדעו, בכל התקופה שהוועדה הזו פועלת, קודם אנחנו נדבר על מסקנות של פגישה קודמת כדי לעשות פולו-אפ ולראות שבאמת מה שביקשנו מתקדם. הוועדה היום באופן ספציפי בגלל הבקשה שהועלתה כאן, תתייחס בנושא של דרי רחוב באופן כללי ותיתן דגש, כמו שאני תמיד אומרת, בגלל התקופה הזאת של החורף, אבל בכלל של דרי רחוב.",קורונה,0.5631017
"הנושא הראשון על סדר-היום: בקשת יו""ר ועדת החוקה, חוק ומשפט להעברת הצעות לסדר היום בעניין דוח גולדברג מהוועדה לענייני ביקורת המדינה לדיון בוועדת החוקה, חוק ומשפט – לפי סעיף 57(ג) לתקנון. ",קורונה,0.5820743
"אנחנו בסעיף האחרון שעל סדר היום שהוא תקנות מס הכנסה (ניכויים מהכנסות משקיעים בסרט ישראלי) (הוראת שעה) (תיקון), התשע""ו-2015.",קורונה,0.54576683
"בוקר טוב לכולם. אנחנו פותחים את הישיבה. הנושא הוא תקנות להגברת אכיפה של דיני עבודה (הפחתה של סכום העיצום הכספי), (תיקון), התשע""ו, 2015. ",קורונה,0.81088567
"בוקר טוב, רבותי. אני פותח את ועדת החוקה. הנושא הראשון הוא הצבעה על הסתייגויות ואחר כך על החוק עצמו של הצעת חוק סמכויות לשם שמירה על ביטחון הציבור (תיקון מס' 5) (סמכות חיפוש לשוטר לשם מניעת אלימות), התשע""ו-2015.",קורונה,0.76378864
"מהנדס אבנר פלור, סמנכ""ל בכיר תנועה, משרד התחבורה. אנחנו בדיון הקודם התחלנו את פרק ד', ייבוא רכב, שעסק בנושא רישיונות לייבוא רכב ותנאים. מסעיף 35 אנחנו דנים בנושא של רישיון יבואן, כשאנחנו דנים בעיקר בשלושה סוגי יבואנים – יבואן ישיר שרוכש את הרכב ישירות מיצרן הרכב; יבואן עקיף שרוכש רכב באמצעות הסוכן המורשה; והסוג השלישי של יבואן זעיר, שהוא יבואן שרוכש כמות מוגבלת של עד 20 כלי רכב בשנה. הסוג הרביעי, מדובר בייבוא אישי של רכב. ",קורונה,0.9609393
"משרד המשפטים. גיל שלח לי את זה. עוד לא הספקתי לעבור עליו. בכל מקרה, כדי שהדברים ינוהלו באופן הגיוני, אותם סעיפים שקשורים להתמחות שנמצאים פה - -",קורונה,0.54938656
"בוקר טוב. כבוד היושב ראש, אני יועצת משפטית בשירות המזון הארצי במשרד הבריאות. כפי שהבהרת היטב, מהות התקנות האלה הוא עדכון של הרמה המותרת של שאריות חומרי הדברה במזון. כמובן שהעבודה שנעשתה היא בשיתוף פעולה מלא בין משרד החקלאות ומשרד הבריאות באמצעות ועדה בין-משרדית מקצועית.",קורונה,0.5622642
"שלום רב, אני מתכבד לפתוח את ישיבת ועדת הפנים ואיכות הסביבה. על סדר-היום: הצעת חוק למניעת הסתננות (תיקון מס' 5 והוראת שעה), לקריאה שנייה ושלישית.",קורונה,0.819427
אני פותח את הישיבה. רביזיה על הצעת חוק למניעת הסתננות (עבירות ושיפוט) (תיקון מס' 5 והוראת שעה). אני מבקש לנמק בבקשה את הרביזיה. יש לך שתי דקות לנמק. ,קורונה,0.5949327
"אחד התהליכים שלצערי עדיין לא הצלחנו לממש, אם אנחנו כבר מדברים על חינוך, זה שאנחנו כל הזמן אומרים שלבית הזה יש ייחודיות. הייחודיות שלו קודם כל שיש לו את השם של מוזיאון העם היהודי. זה לא עוד מוזיאון, זה מקום שאמור להיות הבבואה של העם היהודי על כל ההיסטוריה שלו. ייאמר לזכות אירנה ודן שעושים מאמצים גדולים לא רק לשמר את מה שהיה בעבר, אלא גם שהדברים החדשים יהיו כאלה מזמינים שאנשים יוכלו לבוא מכל העולם. ",קורונה,0.5339691
"לא, זאת האמת. גם אמת צריך לפעמים לומר. הנושא של המעבדות הוא נושא שסמוי מן העין. גם אתה הודית שקיבלת הדרכה מהשכנה שלך, אבל אני בטוחה שמי שלא מקבל הדרכה לא יודע עד כמה העבודה של מעבדות בריאות הציבור היא חיונית וקריטית לבריאות בכלל ולבריאות הציבור. גם אני לא ידעתי לפני שנכנסתי לתפקידי וגם לאחר שנכנסתי לתפקידי הייתי צריכה לעבור את הפרשה ואת הטראומה של הפוליו כדי להבין שאמנם בחזית היו האחיות, אבל מאחורי הקלעים הגיבורים האמיתיים היו עובדי המעבדות, ובלי עובדי המעבדות, שהלכו ובוססו בביוב ואספו דגימות ובדקו והשוו וראו בדיוק מה קורה ואת ההתפתחות וגילו כמובן את ההתפתחות של הפוליו לא היינו מגיעים למיגור הפוליו.",קורונה,0.7728327
"כמובן שאנחנו גם הוצאנו מכתב לאחר הדיון, למי שהיה אז סגן שר, היום הוא שר הבריאות, בנושא הזה. אנחנו נשמח אם נציגי משרד הבריאות יגידו אם יש התקדמות גם בנושא הזה בתכנית הלאומית, אם יש משמעות תקציבית ואנחנו נשמח גם לקבל מנציגי משרד הבריאות. אני חושב שאלה הדברים. ",קורונה,0.5677634
"כמובן שאנחנו גם הוצאנו מכתב לאחר הדיון, למי שהיה אז סגן שר, היום הוא שר הבריאות, בנושא הזה. אנחנו נשמח אם נציגי משרד הבריאות יגידו אם יש התקדמות גם בנושא הזה בתכנית הלאומית, אם יש משמעות תקציבית ואנחנו נשמח גם לקבל מנציגי משרד הבריאות. אני חושב שאלה הדברים. ",קורונה,0.5677634
"חשוב לי לציין, שלפי מה שאנחנו הבנו במרכז, לא רק שהם גם יכולים לתת שירות ונותנים שירות, בתוך מדינת ישראל אלא גם בארץ המוצא נותנים שירות ולכן, אנחנו רוצים לבדוק את האפשרות של שיתוף פעולה ושילוב ידיים על מנת לקדם את המטרה. אני מודה לכם שבאתם. ",קורונה,0.60357547
"אני באתי לפה לא בגלל עניין הרדיוס. אני מקווה שכולם בסוף יפקחו עיניים ויראו שעונשים, בלי שום פרופורציה שניתנים בגלל תקנות מיושנות, שהדברים הללו יושנו. אנחנו נאבקים בנושא הזה כבר הרבה מאוד זמן. כבודו, זה לא רק נושא הרדיוס, זה חוסר פרופורציה בגלל סעיפי התקנון. מי שזורק כוס פלסטיק הוא נענש באותה מידה, התקנות מאפשרות להעניש אותו באותה מידה ממש כמו אירועים ביציאה. ",קורונה,0.8758865
"כשאנחנו מדברים על שחיתות ציבורית אנחנו נזכרים תמיד במקרים האחרונים וגם כאלה שהם קצת יותר מזמן שנבחרי ציבור, בין אם בשלטון המרכזי ובין אם בשלטון המקומי, פקידי ציבור, שהשחיתות דבקה גם בהם. אני רוצה לומר לך, אדוני מבקר המדינה, שאתה גם בוודאי מכיר את הנתונים היטב, אתה נותן הגנה לחושפי שחיתויות, אני רוצה לומר, זו מחלה, ואני חושבת שזו מחלה מדבקת, ואם לא נפעל כדי למגר אותה אנחנו נגיע למקום מאוד מאוד לא טוב, בוודאי מקום שמדינת ישראל לא רוצה להיות בו. ",קורונה,0.59640026
"שלום לכולם. היום ה-22 בפברואר 2016, י""ג באדר א' תשע""ו, השעה 13:06. למרות שהייתי בישיבה מעניינת אחרת הספקנו להגיע בזמן.",קורונה,0.5127914
"צהריים טובים. אני מתכבד לפתוח את ישיבת ועדת הפנים והגנת הסביבה. על סדר-היום: הצעת חוק לתיקון פקודת מסי העירייה ומסי הממשלה (פטורין) (תנאים לפטור מארנונה למוסד מתנדב), התשע""ו 2015 (פ/2255). זאת הצעה שלי. הכנה לקריאה ראשונה. אני כבר מודיע שלא נעבור להצבעות, אז מי שרוצה משוחרר מבחינתי. תומר, אתה רוצה להסביר? ",קורונה,0.5920057
"קיבלנו הרבה הסברים, חלק מההסברים היו למה זה לא אפשרי ולא יכול לקרות. אני יודע שיש עדיין פערים גדולים, ויש עוד הרבה צרכים שאנחנו נעמוד עליהם בדיון הזה. אנחנו רואים שכאשר נעשים השינויים, גם גדלים הביקושים. צומחים הביקושים והתחבורה הציבורית מתחילה למלא את התפקיד החשוב שיכול להיות לה בתוך הרקמה החברתית. ",קורונה,0.54694784
"היום ה-23 בפברואר 2016, י""ד באדר א' התשע""ו, השעה 11:45 ואני פותח את יישבת ועדת העבודה, הרווחה והבריאות. אנחנו דנים בהצעת חוק האזרחים הוותיקים (תיקון מס' 14) (תנאי להשתתפות בפעילות מטעם המשרד לאזרחים ותיקים), התשע""ה-2015.",קורונה,0.52855617
"אני מתכבד לפתוח את ישיבת ועדת הכספים. על סדר היום כללי המים (שינוי התוספת השנייה לחוק) (תיקון והוראות שעה), התשע""ו-2016, אישור ועדת הכספים בתוקף סמכותה לפי סעיף 116(ד) לחוק המים, התשי""ט-1959.",קורונה,0.673099
"הנושא הוא פיקוח על העברת מידע מצד גורמי ההצלה בזמן פיגועים. אני מודה לכל המשתתפים האחרים מהמשטרה, ממשרד הבריאות. ",קורונה,0.50953454
"ערכי יעד – אלו הם ערכים שאנחנו שואפים כמדינה וכציבור לעמוד בהם, בעיקר, אך לא רק, כדי להגן על בריאות הציבור. אלה הם הערכים ""האידיאלים"" שאנחנו רוצים להגיע אליהם והיינו מאוד שמחים להגיע אליהם בכל מקרה כאשר המטרה העיקרית של ערכי היעד היא להנחות בעיקר את גורמי התכנון בבואם לתכנן למשל מפעלים חדשים, לראות שאנחנו לא מתרחקים מערך היעד אליו אנחנו רוצים להגיע.",קורונה,0.79188585
יחד עם זאת אנחנו מודעים לכך שערכי היעד לא תמיד מושגים ולכן נקבע הסוג השני של הערכים שהם ערכי הסביבה. ערכי הסביבה הם ערכים שמבוססים על ערכי היעד אבל שאותם ניתן להשיג באמצעים הטכנולוגיים והאחרים שקיימים היום ומתפתחים כמובן עם השנים.,קורונה,0.5014077
"חברים, אני מתכבד לפתוח את הישיבה. אנחנו מקיימים את הישיבה השנייה שלנו בנושא של קרנות הריט. מדברים על הצעת חוק לתיקון פקודת מס הכנסה (מס' 218), התשע""ו-2016, קרנות להשקעה במקרקעין, קרנות ריט. אנחנו נתחיל בדיונים.",קורונה,0.8059516
"צהרים טובים. אנחנו פותחים את הדיון בנושא צו שירות ביטחון (שירות מוכר להשגת יעדים ביטחוניים-לאומיים) (הוראת שעה) התשע""ו-2015. אני יודעת שמעבר לאישור צו, יש איזשהו דיון ערכי שאנחנו רוצים לעשות. לכן קודם נשמע את ההסבר של הייעוץ המשפטי של משרד הביטחון.",קורונה,0.56789804
"אני מתכבד לפתוח את ישיבת ועדת העבודה, הרווחה והבריאות. על לסדר היום תקנות להגברת האכיפה של דיני העבודה (הפחתה של סכום העיצום הכספי) (תיקון), התשע""ו-2016.",קורונה,0.93058515
"צהריים טובים לצוות מבקר המדינה ולאורחים המכובדים. זה דיון שלישי בנושא. אני לא חושבת שאני צריכה להכביר במילים שנאמרו כבר קודם, על חשיבות השירות הלאומי האזרחי, שבאמת בעיני הוא מינוף לתעסוקה, מינוף לשילובן של אוכלוסיות שלא מתגייסות לצבא ועדיין רוצות וזכאיות להיות חלק מהחברה הישראלית.",קורונה,0.7265229
"מכל מקום, בשנת 2010 פורסם דו""ח חשוב מאד של מבקר המדינה בנושא. בשנת 2014 דו""ח מעקב, שבדק את הליקויים במשך 5 השנים שקדמו לדו""ח. למרות מגמות השיפור, ואני אומרת יש מגמות שיפור קטנות, לצערנו עדיין יש ליקויים שיש לתקן.",קורונה,0.72458637
"צהרים טובים. היום ה-7 במרץ 2016, כ""ז באדר א' התשע""ו, השעה 13:12 ואני מתכבד לפתוח את ישיבת ועדת העבודה, הרווחה והבריאות.",קורונה,0.90285236
