QuoteText,Topic,Topic_Prob
"אני מאמין שנעשה דברים גדולים, כי גם בתקופה הקרובה צריכה להיות עלייה גדולה. יש דברים שאנחנו צריכים לשנות ביחד ולעשות ביחד. אני מאמין שנוכל לעשות עבודה טובה. ",קורונה,0.9127053
"טוב, חברים, אני רוצה לפתוח את ישיבת ועדת הכנסת, בוקר טוב לכולם. אנחנו צריכים היום לקבוע ועדות לדיון בשתי הצעות חוק שנוגעות לקורונה: הצעת חוק סמכויות מיוחדות להתמודדות עם נגיף הקורונה החדש (הוראת שעה), מה שקרוי חוק הקורונה, חוק המסגרת בעצם, תכף נשמע את ההסברים. המליאה לא החליטה באיזו ועדה זה יידון, היו שלוש הצעות, ולכן זה מגיע לכאן. ההצעות היו להעביר את זה לוועדה המיוחדת לעניין נגיף הקורונה או ועדת העבודה והרווחה או ועדת החוקה, חוק ומשפט. ",קורונה,0.8167624
"והצעת החוק השנייה היא הצעת חוק להארכת תוקפן של תקנות שעת חירום (נגיף הקורונה החדש – הגבלת פעילות). זה בעצם החוק שאפשר את ההקלות על הציבור, מה שקרוי התו הסגול. הוא עומד לפקוע ביום ראשון הקרוב, ועל כן צריך אותו היום בשנייה ושלישית. אז זה ממש ממש דחוף. בהצעת החוק הזאת ההמלצה של הלשכה המשפטית הייתה להעביר את זה לוועדת העבודה והרווחה או לוועדת הקורונה. במליאה מישהו אמר: ועדת החוקה או ועדת הקורונה.",קורונה,0.7795979
"בוקר טוב. הצעת חוק סמכויות מיוחדות להתמודדות עם נגיף הקורונה, בעצם הצעת החוק המקיפה, שמאגמת לתוכה בפירוט די רב את כל הסמכויות שהממשלה לקחה לעצמה בתקופת הגל הראשון. זה אומר צמצום מספר עובדים במקום עבודה, הגבלת פעילות, ובעצם מה שאמר היושב-ראש התו הסגול וכל מה שנובע ממנו.",קורונה,0.96384007
"הצעת החוק נותנת לממשלה סמכות להתקין תקנות בכל הנושאים האלה. נושא שצריך לדון עליו, מכיוון שמדובר בתקנות שעת חירום, הכרזה על תקופת חירום קורונה, שהיא תקופה שלא הוגדרה עד היום בחוק בעצם. ואנחנו צריכים לבדוק את הנושא. ",קורונה,0.60596365
"בוקר טוב. היום יום רביעי בשבוע, 17 ביוני 2020, כ""ה בסיוון התש""ף. אני מתכבד לפתוח את ישיבת ועדת העבודה, הרווחה והבריאות בנושא: מאבק המתמחים לקיצור שעות התורנויות. ",קורונה,0.65907025
" ברשותכם, אני מבקשת לפתוח את דיון הוועדה בנושא: הצעת החוק להארכת תוקפן של תקנות שעת חירום (נגיף הקורונה החדש – הגבלת פעילות), התש""ף–2020, הצעת חוק לקריאה שנייה ולקריאה שלישית.",קורונה,0.7321096
"אני מתכבד לפתוח את ישיבת ועדת הכנסת. אנחנו מתכנסים לאור בקשתה של יושבת-ראש הוועדה המיוחדת לעניין נגיף הקורונה החדש להעברת הצעת חוק סמכויות מיוחדות להתמודדות עם נגיף הקורונה החדש (הוראת שעה), (מ/1320), מה שמכונה חוק המסגרת לקורונה, מוועדת החוקה, חוק ומשפט לדיון בוועדה המיוחדת לעניין נגיף הקורונה החדש. ",קורונה,0.8248411
"הבוקר התכנסנו כאן כדי לדון בהחלטה איפה יידון החוק. בעקבות בקשות של חברי כנסת בזמן הצבעה במליאה ביחס לוועדה שתדון בחוק, שני חוקים עלו לדיון – חוק אחד שעסק במה שנקרא התו הסגול, וחוק אחד שעוסק בחוק המסגרת. לאחר דיון כאן הוחלט שחוק אחד יעבור לוועדת הקורונה וחוק אחד יעבור לוועדת החוקה. עכשיו מבקשת יושבת-ראש ועדת הקורונה להעביר את זה מוועדת החוקה, חוק ומשפט לוועדת הקורונה, ניתן ליושבת-ראש הוועדה לנמק את הבקשה.",קורונה,0.50985575
"בוקר טוב לכולם, כאן ובזום. ברשותכם אני פותחת את ישיבת הוועדה בנושא הצעת חוק להארכת תוקפן של תקנות שעת חירום (נגיף הקורונה החדש – הגבלת פעילות), התש""ף-2020. אנחנו בדיון המשך מאתמול, המשך החקיקה. ",קורונה,0.9425976
"בכוונתי שנקיים את ההצבעות ביום שני בבוקר, כולל על כל ההסתייגויות, כך שזה לגמרי תלוי בכם מבחינת קצב ההתקדמות היום אם נסיים בזמן שפוי או לא.",קורונה,0.6097651
"כן, תודה, אדוני היושב ראש. בוקר טוב לכולכם. אכן נושא חשוב מאוד. לפי הדירוג הזה של חברת QS שמדרגת את רמת המוסדות להשכלה גבוהה בעולם רואים ירידה עקבית של הרמה של האוניברסיטאות בארץ. זה התחיל מ-2004 והירידה המשיכה. יש כאלה שחזרו לקבל רמה טובה ואז גם חזרו לסגת בחזרה. הדירוג כולל הרבה מאוד היבטים, כמובן.",קורונה,0.75132734
"בוקר טוב. היום יום שני, ל' בסיון התש""ף, 22 ביוני 2020, ואני מתכבד לפתוח את ישיבת ועדת העבודה, הרווחה והבריאות. על סדר היום יישום התוכנית הלאומית נגד אלימות במשפחה.",קורונה,0.72607744
"בוקר טוב לכולם. אני מתכבד לפתוח את ישיבת ועדת הכלכלה, 22 ביוני 2020, ל' בסיון התש""ף. הנושא: סיוע לדייגים בשל מגבלות הדיג בים התיכון. ",קורונה,0.57538724
"בוקר טוב לכולם, אני פותחת את דיון הוועדה בנושא: הצעת חוק להארכת תוקפן של תקנות שעת חירום (נגיף הקורונה החדש – הגבלת פעילות), התש""ף-2020. אנחנו בדיון המשך לדיונים שקיימנו בסוף השבוע האחרון. יש כמה נושאים שהעלינו על סדר היום, גם של שר הבריאות וגם של קבינט הקורונה, שביקשנו שיידונו. כרגע יש לנו התייחסות ושינוי לגבי הנושא של ספרים, שהוא שינוי מבורך, אבל הוא עדיין לא שינוי עד הסוף. ",קורונה,0.6730647
"מבחינת המטרות של הוועדה הזו, אני רוצה קודם כל להגיד כמה מילים. אני לא חושב שצריך להרוס או לשנות מערכים קיימים. אני חושב שהעבודה שנעשית היום בעיקר בעיקר בעיקר על ידי המגזר השלישי, היא פשוט מלאכה מקודשת ואנשים עושים פה עבודה מצוינת וצריך להגיד לכם קודם כל תודה על זה שאתם קיימים ועל זה שאתם מטפלים. יחד עם זה, אני חושב שהממשלה חייבת פה לקחת הרבה יותר אחריות, כי בסופו של דבר, אני לא צריך להגיד לכם כי אתם עוסקים בתחום הזה, החבר'ה האלה עוברים הרבה מאוד קשיים והרבה מאוד אתגרים בשביל להגיע לשירות הצבאי, בין אם מדובר בעולים החדשים, שמגיעים לפה ומתגייסים לצבא, ובין אם מדובר בחבר'ה שהם חסרי עורף משפחתי שבאים מרקע סוציו-אקונומי וחברתי קשה, ועדיין מוצאים בתוך עצמם את הכוחות ומתגייסים לצבא.",קורונה,0.57053113
"בוקר טוב. היום יום שני בשבוע, ה-22 ביוני 2020, ל' בסיון התש""ף, ואני מתכבד לפתוח את ישיבת ועדת העבודה, הרווחה והבריאות. על סדר היום הצעת חוק להארכת תוקפן של תקנות שעת חירום (נגיף הקורונה החדש – הגבלת מספר העובדים במקום עבודה לשם צמצום התפשטות נגיף הקורונה החדש), התש""ף-2020.",קורונה,0.8660198
"שלום לכולם. אני מתכבד לפתוח את ישיבת ועדת הכלכלה של הכנסת, ה-22 ביוני 2020, ל' בסיון התש""ף. על סדר היום הצעת חוק שירותי תעופה (פיצוי וסיוע בשל ביטול או שינוי בתנאיה) (הוראת שעה - נגיף הקורונה החדש), התש""ף-2020, שמספרה מ/1300. אני מדגיש שזו הוראת שעה, אם בכלל יעבור.  ",קורונה,0.63184905
"בוקר טוב. זה הדיון השלישי היום. יום שני בשבוע, 22 ביוני 2020, ל' בסיון התש""ף, ואני מתכבד לפתוח את ישיבת ועדת העבודה, הרווחה והבריאות. ",קורונה,0.9028512
"אני פותחת את ישיבת הוועדה המיוחדת לעניין נגיף הקורונה. על סדר-היום: חידוש הדיונים בהצעת חוק להארכת תוקפן של תקנות שעת חירום (נגיף הקורונה החדש – הגבלת פעילות), התש""ף-2020. ",קורונה,0.93927974
"אנחנו בעצם מחדשים את הדיון בוועדה לפני הקריאה השנייה והשלישית, לפי סעיף 89(א). לא צריך להקריא אותו אז אני מצביעה על החידוש. מי בעד? החידוש? מי נגד?",קורונה,0.600885
"אני פותח את ישיבת ועדת הכנסת. על סדר-היום: בקשת יושבת ראש הוועדה המיוחדת לעניין נגיף הקורונה החדש ולבחינת היערכות המדינה למגפות ולרעידות אדמה להקדמת הדיון בהצ""ח להארכת תוקפן של תקנות שעת חירום (נגיף הקורונה החדש – הגבלת פעילות), התש""ף-2020 (מ/1324), לפני הקריאה השנייה והשלישית.",קורונה,0.7582673
"בחלקים גדולים מהדברים האלה, ההסבר שלהם נמצא בתוך דוח מבקר המדינה שמיד יוצג והתשובות למה נעשה עם זה ומה אמור להיעשות עם זה נמצאות אצל הנציגים שידברו יותר מאוחר.",קורונה,0.5869621
"בוקר טוב לכולם, אני פותח את הדיון בהצעת חוק דיונים באמצעים טכנולוגיים (הוראת שעה – נגף הקורונה החדש (דיונים בבתי משפט ובבתי דין בהשתתפות עצורים, אסירים וכלואים).",קורונה,0.6036819
"בסדר, הולך להיות דיון ארוך. ספציפית, אני ביקשתי שלדיון הזה יוצגו בפנינו נתונים, ושלא יהיה דיון לפני שיהיו לנו נתונים – מהי עלות העלאת השכר של ראש הממשלה החלופי? מה עלויות הכיבוד לבני הבית? מה עלויות האחזקה ותיקון המעון הפרטי? כל האומדנים האלה - - -",קורונה,0.69215304
"בוקר טוב לכולם. אנחנו נפתח את הישיבה הראשונה של הוועדה הקבועה למיגור הפשיעה והאלימות בחברה הערבית. היום א' בתמוז התש""ף, 23.6.2020.",קורונה,0.7337217
"אני פותח את הישיבה על הצעת חוק סמכויות מיוחדות להתמודדות עם נגיף הקורונה החדש (הוראת שעה). נעשה היום דיון פתיחה וננסה גם לגעת, ככל שהזמן ייתן לנו, בנושא הראשון שנדון בו בפרק ב': הכרזה על מצב חירום בשל נגיף הקורונה. זה מה שנקרא חוק הקורונה הגדול. הדיונים בחוק הזה יהיו אינטנסיביים ומעמיקים. נשמע בקשב רב ובנפש חפצה, כמו שאתם אוהבים לקרוא לזה, את כל הגורמים המקצועיים. חבריי לוועדה ואני נשאל ונבקר ונחתור להוציא מתחת ידנו את החוק הכי טוב והכי צודק.",קורונה,0.5073228
"בוקר טוב לכולם. אני מתכבד לפתוח את ישיבת ועדת הכלכלה, 24 ביוני 2020, ב' בתמוז התש""ף. הנושא על סדר היום: הצעת חוק תכנון משק החלב (תיקון מס' 3), התש""ף-2020 (מ/1322). מי רוצה להציג את זה? ",קורונה,0.8168185
"אנחנו ננסה להבין היום מהי תמונת המצב בשטח, איך נמנעים מהמשך התופעה ואיך פותרים ועוזרים לאנשים שנמצאים במצוקה בעקבות חוסר התכנון הזה. ",קורונה,0.5940226
"אני פותח את ישיבת ועדת החוקה, חוק ומשפט. היום 24 ביוני 2020. היום נדון בחוק להסדר התדיינות בסכסוכי משפחה (הוראת שעה), התש""ף-2020. לפני כמה ימים הארכנו את הוראת השעה. למעשה, החוק המקורי היה אמור להסתיים ביוני, החודש. הארכנו את זה בשנה בפה אחד על מנת שנמשיך לדון בהצעה שעומדת לפנינו היום, והיא להפוך את הוראת השעה להוראת קבע. ",קורונה,0.5031076
"בוקר טוב. אני מתכבד לפתוח את ישיבת ועדת הכספים. על סדר-היום: הצעת תקנות הפיקוח על שירותים פיננסיים (קופת גמל) (הוצאות ישירות בשל ביצוע עסקאות) (הוראת השעה), התש""ף-2020. ",קורונה,0.5375836
"בוקר טוב לכולם. היום יום רביעי, ב' בתמוז התש""ף , 24 ביוני 2020. שמח לפתוח את ישיבת הוועדה . היום נעסוק בדיון מהיר בנושא: ""רפורמת הקנאביס הרפואי לא מגשימה את יעדיה, גורמת לעלייה במחירים ולמחסור בתרופה, ופוגעת ברצף הטיפולי של עשרות אלפי אנשים"", של ח""כ  עידן רול, תמר זנדברג. ",קורונה,0.53952885
"אני פותח את ישיבת ועדת הכנסת לצורך קביעת ועדה לדיון בהצעת חוק הסמכות שירות הביטחון הכללי לסייע במאמץ הלאומי לצמצום התפשטות נגיף הקורונה החדש (הוראת שעה), התש""ף-2020. ",קורונה,0.83382213
"בוקר טוב לכולם. ברשותכם אני פותחת את דיון הוועדה בנושא הצעת חוק הארכת תקופות ודחיית מועדים (הוראת שעה – נגיף הקורונה החדש) (אישורים רגולטוריים ועיצומים כספיים), התש""ף-2020. ",קורונה,0.86866266
"אני פותח את הישיבה בהצעת חוק להארכת תוקפן של תקנות שעת חירום (נגיף הקורונה החדש) (בידוד במקום לבידוד מטעם המדינה), התש""ף-2020, הכנה לקריאה שנייה ושלישית. אני רוצה לומר בפתח הדברים שחלק גדול מההגבלות זה גם היערכות נכונה מבחינה משפטית אבל בעיקר ביצועית של המלוניות. למלוניות יש חלק בלתי נפרד בעצירת התפשטות המחלה, כי בעצם הן אמורות לאכלס בתוכן קודם כול – קודם כול, וזה בשונה ממה שהיה עד עכשיו – אנשים שהם חולים מאומתים ואין באפשרותם, בגלל בעיות אובייקטיביות לחלוטין, להיות בביתם בבידוד מתאים בלי שיהוו סכנה לאחרים. זה הדבר הראשון, וזה נורא נורא חשוב. אני אשמח לשמוע מנציגי המל""ל שנמצאים איתנו לגבי ההיערכות הפיזית שלהם לגל השני, שאנחנו נמצאים כבר בעיצומו. ",קורונה,0.8195779
"אני רוצה לומר מכאן, מהכנסת, מהבית הזה, למפגינים מכל הקשת הפוליטית, מכל מגזר, דת, מין, מגדר ולאום שעושים את זה באופן חוקי ולא אלים, יש לכם גיבוי מהבית הזה. אנחנו נילחם כאן על זכות הציבור להפגין ללא חשש ממעצרים מיותרים.",קורונה,0.763944
"	סדר גודל של כחודשיים וחצי נעשה שימוש בכלי. אני רוצה לשמוע באשר לדחיפות. אני רוצה להעמיד לרשות משרד הבריאות את אותם כלים במסגרת הסדר זמני ומוגבל. אנחנו נשמע עכשיו מנציגי משרד הבריאות על עלייה ושינוי מגמה בהתפרצות ובהפצה של המגיפה. אני רוצה לאפשר לוועדה את הזמן הראוי לקיים דיון מהיר אך לא חפוז בהסדר הראשי. אני רוצה להעביר היום בקריאה שנייה ושלישית הסדר זמני, בעצם לפצל את החוק. אנחנו נסדיר כלי זמני שיאפשר למשרד הבריאות לעשות פעולה בזמן שאנחנו דנים בהסדר הראשי, כשלנגד עינינו עומדים שני אינטרסים ציבוריים מהותיים: האחד, חיי אדם, והשני, עשיית כל המאמצים כדי למנוע פגיעה במשק הישראלי. נתחיל עם נציגת משרד הבריאות.",קורונה,0.5208436
"אני רוצה להגיד בפתיחה. הסוגיות שאנחנו נעסוק בהן – כן, אני לא משלה את עצמי, נמצאים פה חברי כנסת שיש להם עמדה מאוד ברורה בנושא, כולל אני, ואני מניח שההתבטאויות ילכו לפה ולשם. ",קורונה,0.68736523
"  בוקר טוב ושבוע טוב. היום יום שני בשבוע, ה-29 ביוני 2020, ז' בתמוז התש""ף, אני מתכבד לפתוח את ישיבת ועדת העבודה, הרווחה והבריאות. על סדר-היום: הצעת חוק מענק הסתגלות מיוחד לבני 67 ומעלה (הוראת שעה – נגיף הקורונה החדש), התש""ף-2020.",קורונה,0.85125583
"תודה רבה, גברתי. קודם כול, המון תודה על כך שנענית לבקשתי לערוך דיון. אני חושבת בכלל שנושא האזרחים הוותיקים במדינת ישראל, פרט לקורונה, צריך לקבל התייחסות נפרדת ומיוחדת, ובמיוחד בתקופת הקורונה כשיש כל כך הרבה סוגיות. הבנו עכשיו שדווקא האוכלוסייה הזו היא האוכלוסייה הכי רגישה במצב המורכב הזה. ",קורונה,0.598795
"שלום לכולם, היום יום שני, ז' בתמוז התש""ף, ה-29 ביוני 2020, אנחנו בדיון המשך מאתמול בשני נושאים. יש שתי הארכות תקש""חים, האחת היא של אזור מוגבל והשנייה היא של הבידוד, או המלוניות כפי שקוראים לזה. ",קורונה,0.5446795
"יש לנו שלוש הצבעות. הנושא הראשון, בועז טופורובסקי הגיש רביזיה על בקשת יושב-ראש ועדת החוץ והביטחון להקדמת הדיון בהצעת חוק הסמכת שירות הביטחון הכללי לסייע במאמץ הלאומי לצמצום התפשטות נגיף הקורונה (הוראת שעה), התש""ף–2020. בבקשה, נא לנמק את הרביזיה. ",קורונה,0.8185291
"צהרים טובים. יום שני, 29 יוני 2020, ז' בתמוז התש""ף, ואני מתכבד לפתוח את ישיבת ועדת העבודה, הרווחה והבריאות. על סדר היום הצעת תקנות הביטוח הלאומי (דמי קבורה) (הוראת שעה) (תיקון) תש""ף -2020.",קורונה,0.75344443
"שלום לכולם. אני מתכבד לפתוח את ישיבת ועדת הכלכלה של הכנסת, ה-29 ביוני 2020, ז' בתמוז התש""ף. על סדר-היום הצעת חוק הגז (בטיחות ורישוי) (תיקון מס' 7) (הארכת תקופות מעבר), התש""ף-2020. ",קורונה,0.7296515
"שלום, צהריים טובים לכולכם, אני פותח את ישיבת הוועדה בנוגע להתמודדות המגזר החרדי במשבר הקורונה בהיבט ההסברה. בתחילת דבריי אני רוצה לומר שכשאני הזמנתי את הישיבה חשבתי לנכון לדבר על איך אנחנו נערכים לגל השני, יותר נכון מה היה בגל הראשון ואיך אנחנו מתקדמים הלאה, אבל בפועל אנחנו יושבים פה היום ואנחנו נמצאים באירוע מתגלגל ומתמשך עם הנגיף, אנחנו בתוך הגל השני. ",קורונה,0.65259904
"  אני מתכבד לחדש את ישיבת ועדת הכנסת. חבריי חברי הכנסת, אנחנו דנים ברביזיה שהגיש חבר הכנסת בועז טופורובסקי לבקשת הממשלה להקדים דיון בהצעת חוק לתיקון וקיום תוקפ של תקנות שעת חירום (נגיף הקורונה החדש – אכיפה) (תיקון), התש""ף-2020. ",קורונה,0.79866034
"צהריים טובים לכולם. אני מתכבד לפתוח את ישיבת ועדת חוקה, חוק ומשפט. על סדר-היום: הצעת חוק חדלות פירעון ושיקום כלכלי (תיקון מס' 3) (הוראת שעה לעניין מינוי נאמן), התש""ף-2020. ",קורונה,0.8421724
"לאט-לאט ככל שהתקדמנו בזמן לקראת הדיון הנוכחי גילינו שזו תופעה שהולכת ומתרחבת – גם הספורט וגם הסמי-ספורט, כך נקרא לו – נושא של ריקודי עם, מכוני כושר, הרבה מאוד גופים וענפים שנמצאים בתוך הדבר הגדול הזה שנקרא ספורט. אנחנו ננסה להתייחס לכולם. ",קורונה,0.5931721
"צהרים טובים. עדיין יום שני בשבוע, 29 ביוני 2020, ז' בתמוז התשע""ף ואני שמח לפתוח את ישיבת ועדת העבודה, הרווחה והבריאות.",קורונה,0.90285224
"על סדר היום הצעת חוק מענק הסתגלות מיוחד לבני 67 ומעלה (הוראת שעה – נגיף הקורונה החדש), התש""ף-2020, רביזיה.",קורונה,0.65261185
"אני שוקל לקיים דיון בעניין הזה, הבעיה שאין לנו הרבה זמן ומתי לעשות את זה, אבל אני קורא מכאן לשר הבריאות ולשרים האחרים הנוגעים בדבר, אתם צריכים להיות לעזר לרשויות המקומיות, להיות נוכחים בשטח ולתת היום עדיפות עליונה להוצאת חולים. קודם כל חולים, אחר כך נגיע למבודדים. כשאני אומר חולים זה גם משפחות מסוימות שבהן ההורים חולים, יש שלושה תינוקות בבית שאי אפשר להפריד אותם וחייבים להוציא אותם גם. גם אלה שאי אפשר להוציא, צריכים לקבל את המזון הביתה, מישהו צריך לקנות להם את הדברים, אחרת הם יצאו החוצה והם עלולים להדביק.",קורונה,0.8416161
"ברשותכם, אני פותחת את ישיבת הוועדה המיוחדת לעניין נגיף הקורונה. על סדר היום צו לתיקון ולקיום תוקפן של תקנות שעת חירום (נגיף הקורונה החדש - הגבלת פעילות) (שינוי התוספת לחוק) - התש""ף-2020, לפי חוק לתיקון ולקיום תוקפן של תקנות שעת חירום (נגיף הקורונה החדש - הגבלת פעילות), התש""ף-2020.",קורונה,0.9679974
"אנחנו נמצאים כאן בהמשך להחלטות ועדת הקורונה מאתמול. כאמור, בהתאם לחקיקה שלנו בשבוע שעבר, לנו יש את הסמכות כוועדה להביא שינויים שהממשלה מבקשת בתוקף צו ולא בתהליך חקיקה, ועכשיו אנחנו עכשיו נמצאים עם הצו החדש.",קורונה,0.8856176
"משרד הבריאות. סעיף 2(1) בחוק לתיקון ולקיום תוקפן של תקנות שעת החירום מסמיך את הממשלה, באישור ועדה, לשנות את מספר השוהים המותר באירוע שמתקיים באולם אירועים. ",קורונה,0.58007026
