QuoteText,OriginalTopic,Topic,Topic_Prob,,,,,,,
"	מה שאני יודעת ומבינה - שירותי בריאות הנפש אמורים להיות מונגשים, בטח טיפול פסיכיאטרי, לעובדות ועובדים זרים. החריגו את הסוגיה של טיפול פסיכולוגי, ועל זה כמובן תישאל השאלה אחרי השאלה שלנו לגבי קודם כל טיפולים פסיכיאטריים לעובדות ועובדים זרים, טיפולים נפשיים.",בריאות,בריאות,0.82406676,,,,,,,
"היום, כדי שאנחנו נוכל להתקדם ולדעת מה מהות החוק וההתייחסות לזה – ממילא אחרי זה יהיה לנו דיון יותר מקצועי ויותר יעיל בנושא של ניכיון צ'קים. לכן, כפי שאמרתי, אני רוצה לאפשר למי שמבקש להתייחס ולחדד את ההגדרות. בבקשה, ראיתי אותך ראשון. ",בריאות,כלכלי,0.82382673,,,,,,,
"שלום לכולם. בוקר טוב. חודש טוב, ל' שבט, ה-9 בפברואר. אנחנו נקיים דיון לבקשת אגודת אסף, שזה אגודת החולים של חולי פיברומיאלגיה בנוגע למחלה, כשהמטרה שלנו היא להעלות מודעות ולהאיר את המחלה ואת ההתמודדות של החולים, ואם לדייק חולות ברובן, עם המחלה.",בריאות,בריאות,0.82316744,,,,,,,
"מטבע הדברים, כשהמערכת לא פועלת באופן סדור ואם אין איזו שהיא אג'נדה מאד מאד ברורה עם תכנית שיודעת איך לקלוט, אז גם קמות להן כל מיני מסגרות עצמאיות כאלה או אחרות. צריך להבין שהן לא יכולות לבוא במקום הכלל, אלא יכולות לבוא בנוסף. לעתים, למישהו יותר מתאים מסגרת כזו או מסגרת אחרת. ",בריאות,בלי,0.822148,,,,,,,
"צהריים טובים. אנחנו מחדשים את הדיון בנושא: תקנות בתי המשפט (אגרות) (תיקון), התשע""ו-2015; תקנות בתי המשפט לענייני משפחה (אגרות) (תיקון), התשע""ו-2015; תקנות הדיינים (אגרות) (תיקון), התשע""ו-2015; תקנות בתי הדין הדתיים הדרוזיים (אגרות) (תיקון), התשע""ו-2015; תקנות בתי הדין השרעיים (אגרות) (תיקון), התשע""ו-2015. ",בריאות,בלי,0.8211288,,,,,,,
"שלום לכולם, אני פותח את ישיבת ועדת הכלכלה בנושא הצעת תקנות התעבורה (תיקון מס') אין כרגע מספר, תיקון שיקבל מספר סידורי כלשהו, התשפ""ב-2022, בדבר אכיפת האיסור על רכב הנושא תו נכה להחנות במקום חנייה לנכה המסומן כחניה של רכב מסוים שמספרו סומן בתמרור. ובפשטות, שיש שעות חניה על אזור חניה של רכב נכה, ומישהו חונה שם בשעות החניה שאסור לו לחנות גם.",בריאות,תחבורה,0.8211257,,,,,,,
"וכשרוצים לאמץ ולטפל בחוק יודעים לעשות את זה. אני לפני שנתיים שברתי את הרגל שלי ואני כל שנה מארגנת תיקון ליל שבועות בצוותא והייתי עם רגל שבורה והחבר'ה שלי עזרו לי וסחבו אותי מאזור המלונות ליד הים אל צוותא ברגל. והאמת, פשוט נדהמתי לראות איך עיריית תל אביב לקחה על עצמה להנגיש. כל המדרכות, חשבתי שיהיה נורא קשה, אבל כל המדרכות היו מונגשות. מה שאני לא מורגלת לא בעיר שלי ולא במקומות אחרים, אבל העיר הזאת מונגשת. היה קל לסחוב אותי על כיסא גלגלים אל צוותא בליל שבועות. ",בריאות,רווחה,0.82109505,,,,,,,
"לא. עשינו הרבה מאוד דיונים וזומים. אני רוצה להודות, בעיקר לכל היועצים המשפטיים. לפעמים קשה לי להבין מדוע יש פער בין כל ההיגיון למשפטיזציה. אבל הם עוזרים לי להפוך את כל ההיגיון והרציונל ואת כל המוסר והאתיות לנוסח משפטי הדוק ונכון. אני מודה להם על זה. גם אם אני מתווכחת, זהו תפקידי. אילת, תודה בעיקר לך. אנא, בואו נתחיל. ",בריאות,בלי,0.8210385,,,,,,,
"מבחינת הבנקים, הסביבה הרגולטורית שבה הם יוכלו לפעול מול הגופים האלה הולכת להתבהר מאוד משמעותית. אנחנו גם התחייבנו במסגרת ה-MOU לתקן את הצו של המערכת הבנקאית ולהכניס הקלות בפעילות היום יומית של הפלטפורמות מתוך הבנה שהם מפוקחים ובאמת כדי להקל עליהם בניהול הפעילות היום יומית. ",בריאות,כלכלי,0.82096726,,,,,,,
"אני אומר למשרד לביטחון פנים שהייתה אמורה להיות יחידה שאמר השר הקודם שהוא יקים אותה ושהיא תתחיל לפעול ב-1 בספטמבר. כמובן שאין יחידה כזאת או לפחות אנחנו לא מכירים יחידה כזאת ולא יודעים על מעקב כזה שמתקיים, ככל שמתקיים. אני מבקש לקבל את ההתייחסות שלכם.",בריאות,בטחון פנים,0.8192274,,,,,,,
"	תודה לחברת הכנסת לשעבר מיכל בירן שהצטרפה אלינו וכמובן תיקח גם חלק פעיל בדיון הזה. לפני שנשמע את החברים והחברות ואת כל הקולות שישנם, אני אתן לדניאל פסו להציג את הסוגיה. דניאל היא כתבת מגזין ""לאישה"" עשתה כמה כתבות תחקיר מאוד מקיפות וחשובות בנושא, יש לך היום גם איזה מידע אמפירי כי כל כך הרבה נשים פנו אליך – את יכולה ממש לאמוד את התופעה מתוך הפעילות העיתונאית שלך. אז תודה שאת כאן ושהבאת את הנושא הזה לפתחנו. ",בריאות,בלי,0.8189526,,,,,,,
"השאלה, האם אפשר להשים אנשים במקומות עבודה הופכת להיות השאלה הקריטית של המשק הישראלי? אנחנו מדברים על למעלה מחצי מיליון איש שנמצאים כרגע באבטלה והם דורשי תעסוקה. אין מקומות עבודה כרגע שמחפשים אותם. השאלה מה עושה המדינה כדי לקדם את שילובם בתעסוקה היא שאלה קריטית. אנחנו יוצאים מתוך דו""ח מבקר המדינה 68ג. ",בריאות,כלכלי,0.8187879,,,,,,,
"אני אומר למה כינסתי את הדיון הזה, כי סוגיית הקב""סים התגלגלה לפתחי עוד בתחילת הקדנציה על ידי נציגות של הקב""סים, וכבר אז נחשפנו למצוקה האמיתית של מחסור לא בתקנים, מחסור בקב""סים, באיוש המשרות המתוקננות. כשיש בעיה, מנסים לזהות מה מקור הבעיה, אז אני חושב שיחד עם כולם, זה לא שהיה לי איזה גילוי. הבנו שתנאי השכר של הקב""סים הם נמוכים, תנאי העבודה הם שונים, מצד אחד. מצד שני, גם תנאי הקבלה שלהם למשרה הזו חייב להיות עובדי הוראה עם ניסיון בהוראה. ",בריאות,בלי,0.8185089,,,,,,,
"רק הליגה הישראלית היא לא בדיוק הפרמייר ליג, והתחרות שיצאה עליה, איך אומרים? קצת יצאה מפרופורציות. ",בריאות,תרבות,0.81786627,,,,,,,
"בוקר טוב לכולם. אני גידי מזור, מנהל מחוז מרכז, המשרד להגנת הסביבה. אנחנו יוצאים לדרך. אנחנו חשבנו במקור שהסיור יהיה שעה וחצי, אבל בסופו של דבר יש לנו שעה, אז אנחנו נצטמצם לשתי נקודות שבהן אנחנו נלך ונראה מצבורים של פסולת. הבחירה הייתה קשה כי יש המון נקודות כאלה, וכמו שאמרנו, שתי הנקודות שאנחנו נראה היום, הנקודה הראשונה תהיה באזור של ג'לג'וליה, הנקודה השנייה תהיה באזור של טייבה, אבל, כמו שאמרתי, את הבעיה הזאת יש לנו בכל הארץ. ",בריאות,בלי,0.8175946,,,,,,,
"צהריים טובים לכולם. אני מבקשת לפתוח את דיון הוועדה בנושא סטטוס גיבוש מתווה להפעלת אירועי תרבות. אנחנו בישיבת מעקב מהשבוע שעבר, קיימנו דיון ביום שני והתחייבנו לחזור הנה כדי לעקוב אחר גיבוש מתווה להפעלת אירועי תרבות. בהתחלה ביקשנו לגבש מתווה לגבי מרחבים חיצוניים, שבעינינו שם לא צריכה להיות שום בעיה, אבל אנחנו מחדדים את זה גם לגבי אולמות אירועים סגורים, היכלי תרבות, תיאטראות וכו'.",בריאות,תרבות,0.8163064,,,,,,,
"הפנייה הזאת מבקשת לתגבר את תקציב משרד החוץ בסך של כ-131 מיליוני שקלים. התקציב מיועד למספר דברים. כפי שהוועדה בטח יודעת, משרד החוץ פועל בנציגויות שהוא מפעיל במדינות רבות בעולם. הסכום הגדול ביותר בתקציב מיועד לבצע תשלומים לאו""ם שמשרד החוץ מעביר בשם מדינת ישראל לאו""ם ולארגונים הבינלאומיים שישראל מחויבת להם. ",בריאות,בלי,0.8156876,,,,,,,
"צריך להבין שתהליך של השמדת מזון חובן בתוכו כסף, יש בו עלויות, אבל הוא פשוט יותר מאשר להפנות אותו לתרומת מזון. בתרומת מזון צריך להקים מערך, צריך להיות בקשר עם עמותת ""לתת"", צריך לדעת שהמשאיות מגיעות ליעדן. כמה גופים פה חוברים ביחד.  ",בריאות,רווחה,0.81495184,,,,,,,
"הטענה היסודית שאני מניח שיוזמי החוק יעלו כשידברו ראשונים, הטענה שאם זה לא בריא, זה לא בריא באינטרנט, זה לא בריא בכל מקום אחר וגם בעיתונות הכתובה. לצד זה נאפשר לשמוע בקשב רב גם את הנפגעים הפוטנציאליים מתיקון החוק הזה, העיתונות המודפסת, היצרנים וכל אחד שירצה לומר את דברו יזכה לומר את זה פה, כך אנחנו נוהגים. בתהליך חקיקה לא עושים מחטפים ולא עושים חקיקה פזיזה. ",בריאות,בלי,0.8143447,,,,,,,
"עליכם לדעת, הגיעה אליי פנייה של יושב-ראש ועדת הכספים של הכנסת, חבר הכנסת גפני, שמתנגדת התנגדות נחרצת להעברת הכספים האלה לניטור אוויר. אינני רוצה עכשיו לפתוח את כל הדיון, שהמנכ""ל גם העלה בפניי אתמול, על כך שכספי הקרן, שבעצם הם תוצאה של פעילות של גביית כסף עבור מכלי המשקה, הטענה היא שהם צריכים להיות מופנים לטיפול בעניינים הקשורים עם בקבוקים ואריזות וכולי. זה דיון שלא נפתח אותו פה. יש את משרד האוצר ואחרים. לא  ניגע בו. ",בריאות,אנרגיה,0.8142745,,,,,,,
"אז גם אם בוועדה הזאת אנחנו ננסה להיות מאד תכליתיים ולדבר על סוגיות קונקרטיות, שאנחנו מחויבים לפתור, אני רוצה שתדעו שמעל לכל הדברים האלה יש הזדהות שלי ונכונות לתמוך בכם; ואני רואה גם שהשרה לשעבר יעל גרמן נמצאת כאן, שהיא ידידת הקהילה ומסייעת לה רבות.",בריאות,בלי,0.8134096,,,,,,,
"בסדר. יש לנו עוד שתי השלמות קטנות מהישיבה הקודמת. ברשותכם, נתחיל בנוהל הרגיל. משרד הכלכלה יתחיל לקרוא, אחרי כמה סעיפים תעצרי, תסבירי אם צריך, נשמע התייחסויות ונצביע.",בריאות,בלי,0.8131303,,,,,,,
"בוקר טוב לכולם. אנחנו ממשיכים לעסוק, כבר דיון רביעי, בנהלי המשטרה בנוגע להפגנות, נהלי מעצר, עיכובים, היחס לצעדות. זאת הייתה המטרה המקורית של הדיון הנוכחי, אבל אני מרגישה שלאור המצב החדש שאנחנו נכנסים אליו חשוב שאנחנו נגדיל משמעותית את רוחב היריעה בדיון הזה היום. ",בריאות,בטחון פנים,0.81175876,,,,,,,
"התיקון בעצם, מה שמציעים משרד המשפטים, מציע להפחית את רמת ההזדהות הקיימת, בעצם לאפשר רמת הזדהות קצת יותר נמוכה שתהיה רמת הזדהות בוודאות גבוהה אבל לא תעודה אלקטרונית שהיא רמת הזדהות חזקה יותר.",בריאות,טכנולוגיה,0.8117503,,,,,,,
"ועוד דבר שגיליתי, וזה מהארכיונים האחרונים שאנחנו כל הזמן פותחים, היו ילדים שהחזיקו אותם במעונות, החזיקו אותם מעל לשנה, לפעמים שנתיים. הייתה מישהי שהתקשרה אליי לא מזמן וסיפרה לי שהיא הוחזקה באיזה שהוא מעון אומנה שלוש שנים ורק אחר כך היא הוחזרה להורים שלה. האם לה אין שום זכות שההורים שלה יטפלו בה? איך אנחנו מתגברים על הדבר הזה? לכן אני חושבת שכאן זה העניין וזה המצב, שאנחנו צריכים שהמדינה תקבל אחריות ולו רק בשם האמנה, תקבל אחריות ותתנצל ותדאג שהילדים וגם המשפחות יקבלו תשובות, ולכן אני פועלת ולכך אני פועלת. ",בריאות,רווחה,0.81148374,,,,,,,
"שלום רב, אני מתכבד לפתוח את הישיבה. אני מבין שהשולחן העגול ישב. הנושאים שלא היו בהסכמה, לא יהיו בדיון היום. הנושאים שהגעתם בהם להסכמה, כל מיני הערות שונות, הן היום על הפרק, ונתחיל בהקראה. תסלחו לי שהדיונים האלה לא תמיד מעניינים ומשעממים, אבל אנחנו צריכים להספיק ולהעביר הלאה, כי הזמן הוא המוצר היחיד שמתכלה. כל השאר אפשר לעשות – לדבר הרבה, לפרגן הרבה, לכעוס הרבה, אבל זמן אין לנו יותר מדי. לכן מה שהסכמנו בו, בואו נסכים ונלך עליו, והדברים שבמחלוקת, נמשיך בפעם הבאה.",בריאות,בלי,0.81085575,,,,,,,
"על כל פנים, אני סבור שעם כל הקשיים שיש בעניין צריך להעביר. אני חושב שצריך לעשות עוד כמה תיקונים, אבל זה מה שצריך. זה שהדליף את זה לעיתון אמר לי שהוא סבור שלא צריך לחוקק חוק. צריך רק על איסור הלבנת הון ולגבי שאר הדברים – בלאו הכי לא יודעים מה זה, אז בוא נחכה כמה שנים. כך אמר לי זה שהדליף את זה. ",בריאות,בלי,0.8108146,,,,,,,
"אני הגעתי למסקנה קודם כול, לא רק בגלל שהשכר שלהם נמוך, בגלל שאני מכיר את עבודת הקב""סים. אני חושב שבזמנו מי שחשב בשעתו שצריך בתנאי הסף שיהיה ניסיון בהוראה, יכול להיות שהוא צדק בזמנו. בתנאים שנוצרו היום וסוג העבודה של הקב""ס, היא לא חייבת להיות עם ניסיון בהוראה. זו לא עבודת הוראה. צריך להכיר את המסגרת במערכת החינוך. תעשה ככה עד מחר. אתן לך את רשות הדיבור. זו דעתי ואני אומר אותה ואני אאבק עליה גם, כי מה לעשות, כשחולה מגיע לרופא ושם לו אנטיביוטיקה ולא עזר וחבישה ולא עזר והנמק הולך וגדל, מה עושה בסוף? הוא מפחד על כל הגוף. לא רוצה לומר שהוא עושה קטיעה. ",בריאות,חינוך,0.8107094,,,,,,,
"אני עובר לנושא השני, הצעת חוק לתיקון דיני הבחירות לרשויות המקומיות (מסירת מידע מפנקס הבוחרים למתמודדים לראשות מועצה אזורית והצבעת בעלי תפקידים), התשע""ח-2018. זה עבר קריאה ראשונה אתמול לדעתי, נכון?",בריאות,בלי,0.8103326,,,,,,,
"אני רוצה פתרון בעניין הזה. רבותיי, אני רוצה כבר בישיבה הזאת שנצא עם איזה בשורה. אני יודע שאתה תטפל בבעיות, אבל אם אפשר בשורה כבר עכשיו כי הבעיה היא עכשיו, אנחנו לא יכולים להמתין לאישורי התקציב ולסוף השנה. היום יש בעיה עם אלה שלמדו באולפנים ובגלל הקורונה הפסיקו את הלימודים. ",בריאות,קורונה,0.80635244,,,,,,,
"כל תאגיד שיוכל להתמודד, והתאגיד שייבחר יהיה כפוף למינהל תקין וכל מה שדרוש בנושא שמירה על שידורים תקינים ומאוזנים, ללא שום הטיה אינטרסנטית.",בריאות,בלי,0.80574554,,,,,,,
"בוקר טוב לנוכחים, כולל נוכחות, או נוכחות ונוכחים. אני פותח את הדיון בחוק הגבלת שימוש במקום לשם מניעת ביצוע עבירות, התשע""ה-2015. לגבי הנוהל של הישיבה, אני כמובן הולך בדרכו של היושב-ראש, וחברים בארגונים שרוצים להעיר כמובן יעירו, אבל אנא שימו לב שהיושב-ראש הקבוע שלנו זיכה אותי בעמדה הזאת ואם אני לא אוכיח יעילות ואם לא נגמור עד 12:00 ולא נסיים, לפחות את עיקר העבודה, אני לא אזכה בתפקיד הזה להבא, אז אני מבקש שתתרמו גם אתם ליעילות.",בריאות,בלי,0.80514205,,,,,,,
"התיקון הוא תיקון לחוק בתי המשפט, לתוספת הראשונה של החוק, שזה רשימת עבירות. זו תוספת שמפנה אליה סעיף 37 לחוק. הסעיף הזה קובע ברירת מחדל, שעבירות שהעונש שלהן הוא עשר שנים ומעלה, נידונות בפני הרכב במחוזי, והתוספת זה אותן עבירות שלמרות שהעונש שלהן הוא עשר שנים ומעלה, הן דנות בפני דן יחיד במחוזי, אלא אם כן נשיא בית המשפט המחוזי הורה אחרת. ",בריאות,בלי,0.8050106,,,,,,,
"אין ספק שמשרד הבריאות נמצא בחזית וכל הדברים מתרכזים ומתנקזים למשרד הבריאות. ההוראות מגיעות ממשרד הבריאות, ההנחיות, כמובן בשיתוף הקבינט והשרים הנכבדים, האוצר ושאר הגורמים. זה לא הנושא שלנו, איך מתקבלות ההחלטות, באיזו צורה הן מתקבלות, האם ההחלטות נכונות. מאוד קל לבקר. יכול להיות שאם אני הייתי יושב שם, הייתי רואה את הדברים אחרת. יש הרבה שאלות אבל אני שוב אומר שזה לא הנושא. ",בריאות,בריאות,0.80402845,,,,,,,
"אנחנו חווינו לפני כשבועיים הדבקה, שהיו 15 עובדי כנסת ועובדי משמר שנדבקו מהאומיקרון, והיינו על סף כמעט סגירת הכנסת מבחינת הרצף התפקודי שלה. היו לנו כ-133 עובדים, ביניהם עובדי משמר, שהיו בבידוד. בנוסף, היו במעטפת בערוץ הכנסת ומוועדת בחירות מרכזית, הגענו לקרוב ל-180 אנשים בבידוד. סך כל עובדי הכנסת פלוס עובדי משמר יש כ-800 עובדים, יועצים פרלמנטריים ועובדי כנסת – סך הכול כ-1,300 נוכחים קבועים בבניין. בנוסף אליהם יש ערוץ הכנסת ועובדי ועדת בחירות מרכזית.",בריאות,קורונה,0.80370444,,,,,,,
"מדובר בחוק גרוע, בכייה לדורות. מניפולציה ממשלתית ממסדית. גם הליך פרלמנטרי לא תקין. אני מבקש רביזיה.",בריאות,בלי,0.8014092,,,,,,,
"אני מבקש להפריד את מספר 5 ברשימה, את עמותת מדרשת הגולן, מכיוון שגבריאל חמו חשוד במתן שוחד. הוא לא יכול להמשיך לשמש כמנכ""ל או כיו""ר כשיש עננה כזאת על ראשו. כתוב שהוא הבולדוזר של רמת הגולן. ",בריאות,בלי,0.8007248,,,,,,,
"בנושא השני יש התנהלות כבר מספר ימים וביקשתי גם מירדנה לפנות למזכיר הממשלה. יש העברות של 1.4 מיליארד שקלים שאמורות להגיע אחרי ועדת הסכמות לוועדת הכספים. אנחנו מחכים. הפרוצדורה היא שמזכיר הממשלה יבצע את הפנייה. כבר אתמול ביקשתי שאם הפנייה היא על דעת משרד ראש הממשלה אז שהיא תתבצע. אני יודע שיש הרבה לחץ בנושא הזה, גם של העברות שהן העברות חברתיות במהות שלהן וגורמים שונים. כרגע זה לפתחו של מזכיר הממשלה. ",בריאות,בלי,0.8007247,,,,,,,
"כפי שציינתי כאשר הוועדה הזאת הוקמה, היא תעבוד כמיטב יכולתה לחשוף עוולות ובעיות, מצד אחד, ומנגד גם לעמוד על הפתרונות ולוודא את ביצועם בפועל. ",בריאות,בלי,0.8006063,,,,,,,
"אנחנו מדברים כאן רבות על הילדים הצעירים, על מערכת החינוך, על הקשישים ועל בעלי העסקים, אבל יש רצועת גיל שאנחנו אולי לא נתנו את הדעת עליה עד הסוף והכנסנו אותה בתוך הסך הכולל, וזו קבוצת הצעירים. אנחנו מדברים על חיילים משוחררים שהתחילו לעבוד ופתאום מוצאים עצמם ללא מענה כי הם לא צברו את התקופה שצריך כדי לקבל את דמי החל""ת, והם נופלים בין כסאות. כמו כן, סטודנטים שהחלו ללמוד ונשארים עכשיו ללא מענה כלכלי שמשפיע גם על המענה ההשכלתי כי חלקם לא יכולים להבטיח לעצמם את המשך הלימודים, והם חווים את החוויות בצורה מאוד מאוד מורכבת, ולפעמים רב ממדית. אנחנו מקדישים כמובן את הדיון הזה אליהם.",בריאות,חינוך,0.799979,,,,,,,
"הנושא הוא ברור. היה פעם יותר ממחזור אחד הכנה לבחינות לסטג' וזה הופסק ונשאר רק מועד אחד, אם אני לא טועה, דבר שבולם, למרות הצורך ברופאים וחזרה לארץ של צעירים רבים שלמדו בחוץ לארץ. אני שמח שנמצאים אתנו פרופסור יציב ופרופסור מימוני.",בריאות,בריאות,0.7997542,,,,,,,
"אנחנו מדברים פה על תופעה מעניינת, שאדם שיש לו בבנק פחות מ-20,000 שקל, ולא עלינו, הוא נפטר, ורוצים להטיל על זה עיקול, וזה סכום קטן מדי מכדי שימנו נאמן שיעשה סדר ויראה איך לחלק את הסכום הזה בין התובעים. וצריך לציין שכנראה הוא חייב כסף, ואם הוא חייב לאחד, יכול להיות שהוא חייב לכמה. עכשיו השאלה היא מה עושים עם זה. זה התחיל עם רשות אחת, ואני מבין שוירא מנוחה כי טוב ואת הארץ כי נעמה, אז כל אחד עכשיו רוצה להתלבש על הסכום הזה וכל מיני גופים נוספים רוצים גם הם להיות חלק מהעניין.",בריאות,כלכלי,0.79964477,,,,,,,
