QuoteText,OriginalTopic,Topic,Topic_Prob,,,,,,,
"המטרה שלנו הייתה לבחון האם האמצעים שאנחנו נוקטים למלחמה בעבריינות הם יעילים, האם הם מקטינים את שיעור העבריינות, האם לבית המשפט יש את כל הכלים הדרושים כדי לקבוע את הטיפול הנכון בעבריין. כמובן, וצריך לזכור זאת וגם זה כתוב בדוח, יש מטרה חשובה מאוד לענישה וזה הגמול, אנחנו קוראים לזה. אדם עשה מעשה רע, פגע בחברה, צריך להעניש אותו, אחרת החברה לא יכולה לקבל את זה, הרגת בן אדם, אתה צריך להיכנס לבית סוהר, אבל יש לענישה מטרה אחרת, לא פחות חשובה וזה להפחית את העבריינות על ידי שיקום וטיפול בעבריינים. ",נשים,בטחון פנים,0.9787628,,,,,,,
"בדיון הקודם שלנו ביקשנו והתרענו שיפעלו באופן מיוחד ושימצאו פתרונות מחוץ לקופסה בנושא של אלימות. אנחנו בימים לא רגילים, הפתרונות צריכים להיות לא רגילים. צריכים לקחת בחשבון שכאשר אנחנו בתוך הבתים אנחנו מנותקים מהעולם החיצוני. הרבה נשים אולי לא יודעות שיש להן את האפשרות לצאת מהבית, לנוס על נפשן כאשר יש אלימות נגדן. הן חושבות שצריך להישאר בתוך הבית סגורות. הרבה ילדים לא מוצאים איך לתקשר ואיך להודיע על האלימות שהם רואים בתוך הבתים.",נשים,נשים,0.9779999,,,,,,,
" לצד האינטרס הלאומי הישראלי יש אינטרס לאומי פלסטיני בשטח, ואנחנו בוחנים כיצד – הייתי אומר גבול או השפעה או אינטרסים שאמורים להיות מעוגנים ואולי אפילו עוגנו בהסכמים בין-לאומיים קודמים בינינו לבין הפלסטינים הלכה למעשה – השטח משנה את פניו, והפלסטינים במאמץ לאומי שיטתי מנסים לקבוע עובדות בשטח ובעצם לייתר כל משא ומתן עתידי בינינו לבינם. ",נשים,בלי,0.97780895,,,,,,,
"אני מתכבד לפתוח את ישיבת הוועדה לענייני ביקורת המדינה, יום רביעי ,27 ביוני. השאלה היא סוגיית היחידה האווירית של משטרת ישראל וההתמודדות עם עפיפוני התעברה ביישובי עוטף עזה. מה שאני מבקש לדיון עצמו, כללי הדיון מה שנקרא, לא מתפרצים, למעט, יש לנו את איילת, חברת הכנסת, אז לגבי חברי כנסת, יש להם פריבילגיה אחת, שהם יכולים להתפרץ לדברים, אבל אנחנו משתדלים לעשות את זה בנימוס. לגבי השאר, כל מי שרוצה לדבר נרשם, מדבר, לא מתפרצים. אני מבקש לכבד את אלה שמדברים גם אם חושבים אחרת, זה בסדר גמור, אבל נא לתת לאנשים לגמור לדבר. אני מבקש תשובות קצרות ולעניין, לא פריסות שאנחנו הרבה פעמים שומעים אותן פה, אבל הן לא עושות לנו שום דבר טוב. ",נשים,בטחון,0.97778517,,,,,,,
"אני כן חייב לומר, שמסקירה שערכה הלשכה המשפטית של הכנסת לפני כשנה, מצאו שמחקרים מעידים על תוצאות חיוביות עבור החברות שצירפו נשים למועצות מנהלים. אחד המחקרים מצא שחברות אמריקאיות שהחלו את חמש השנים, 2011 עד 2016 עם לפחות שלוש נשים במועצת המנהלים שלהן, דיווחו שההכנסות שלהן למניה היו גדולות ב-45% יותר לעומת חברות שבמועצות המנהלים שלהן לא היו נשים. ",נשים,נשים,0.9772969,,,,,,,
"נשים שיוצאות ממקלט לנשים מוכות, הן חוות הדרה משוק העבודה. זאת בשל העובדה שהן נאלצות לקטוע את מהלך חייהן על מנת לשמור על חייהן ועל חיי ילדיהן. הן מתמודדות עם קשיים כלכליים משמעותיים – כמו אובדן מקום עבודה, אובדן של זכויות, קטיעת אופק ההתפתחות שלהן המקום העבודה המסודר ולמעשה בעל כורכן, הן נאלצות להתחיל חיים חדשים במקום חדש ולא מוכר. ",נשים,נשים,0.9771713,,,,,,,
"אני רוצה להכיר מה קרה ביהדות תוניס, אני רוצה להכיר מה קרה ביהדות צרפת, במרוקו, בתימן, אני רוצה לדעת מה קרה בארצות הברית, אני רוצה לדעת בספרד, אני רוצה לדעת איפה האחים שלי, מה הם חיו שם, אז אני רוצה שזה יהיה כחלק לילדים שלי, שהם ילמדו את זה, ילמדו את הסיפור שלהם, דרך סיפור של האחים החברים שלהם, לא לקבל סיפור היסטורי של קבוצה מסוימת, באנו, הקמנו, ייבשנו ביצות, קיבלנו מדינה, חשוב, אבל יש עוד שותפים בתהליך הזה, יש כאן עם ולכן זה בעיניי מהות הסיפור והחוק שאני רוצה להעביר.",נשים,עולים,0.9763739,,,,,,,
"בשנת 2008 חוקקנו, חבר הכנסת דאז גדעון סער ואנוכי, את חוק הלוביסטים שהסדיר את פעילות הלוביסטים בכנסת והפך את עבודתם לשקופה. שוב אני אומרת, מדובר ברע במיעוטו כיוון שלדעתי נבחרי ציבור לא צריכים לדבר עם לוביסטים, נקודה. כנ""ל גם פקידי ציבור ונושאי משרה בשירות המדינה, משרדים ממשלתיים ורשויות מקומיות. זו תופעה נפסדת לפיה רק מי שיש לו כסף יכול לקבל עוד כסף ולהיעזר בשירותיו של לוסביסט/מאכער. ",נשים,כלכלי,0.97636855,,,,,,,
"אני רוצה להתחיל אתך, פרופסור גרוטו, וזאת הזדמנות מצוינת להודות לך שהצטרפת אלינו. בשם הוועדה אני אומרת שההשתתפות העקבית שלך בדיונים שלנו וזה שאתה מקפיד להגיע, מבחינתנו זאת עדות לחשיבות שאתה באופן אישי וכמובן בשם משרד הבריאות רואים בנושא. אתה השתתפת בישיבה הקודמת שלנו לפני כחודש, אולי חודשיים, והצגת בפנינו שורה של צעדים שבשיתוף עם המנכ""ל החלטתם לעשות ואנחנו היום רוצים להתמקד בצעדים בתחום הפרסום והשיווק.",נשים,בלי,0.9762273,,,,,,,
"בדיון הקודם שהיה על הטרדות מיניות ועל פגיעות מיניות אנחנו דיברנו על איך שתופעת ההתעמרות בעבודה מתלווה תמיד לנושא של ההטרדות המיניות וחשיפת הטרדות מיניות במקומות העבודה כך שכל פעם שיש סוג אחד של אלימות אי אפשר לציין שיש רק סבל מסוג אחד, זה גורר גם סוגים אחרים שמתלויים ועושים את הסבל של האישה בלתי נסבל. 20 נשים כמעט כל שנה נרצחות במדינת ישראל. השנה עוד לא הסתיימה וכבר יש 20 נשים שנרצחו השנה הזו. ",נשים,נשים,0.97559905,,,,,,,
"טוב. רבותי, לפני שאני מעביר את רשות הדיבור לחברי הכנסת המציעים לפי הסדר, יש תחושה שלפעמים אסור לציין לשבח איזה מיזמים או פרויקטים מצליחים במדינת ישראל. היינו מובילים בעולם בסוגיית טיפות חלב ואחיות בתי-ספר – חיסלנו אותם. כל הדברים הטובים אנחנו – בדרך כלל מי שרוצה, אני אומר לכם, מי שעה מפעל חיים ורוצה שהמפעל חיים שלו ימשיך להתקיים, ויציעו לו לקבל פרס ישראל – שלא יקבל, כי בדרך כלל אחרי שהוא יקבל פרס ישראל, מתחילים משרדי הממשלה לחסל אותו.",נשים,בלי,0.9755915,,,,,,,
"שלום לכולם ולכולן. אני פותחת את הישיבה של הוועדה לקידום מעמד האישה ולשוויון מגדרי. היום ה-2 באוגוסט 2016 והדיון הינו בנתונים הקשים על תחלואת נשים לאחר לידה ועל תחלואה שאינה זוכה לטיפול ראוי על ידי מערכת הבריאות. חברת הכנסת רחל עזריה, שהצטרפה אלינו, היא היוזמת של הדיון הזה ואני מברכת אותה על היוזמה של הדיון. אנחנו החלטנו שאנחנו נקבע את הדיון בצורה המהירה ביותר ונענינו לבקשה של חברת הכנסת רחל, מתוך הבנה של החשיבות של הנושא הזה. ",נשים,נשים,0.9751792,,,,,,,
"אבל זה שיעבוד ב-4, ב-5 הוא צריך לבוא לכנסת ב-11 בבוקר לעשות את עבודתו ולמלא את תפקידו בוועדות. זה באמת לעג לרש כל הסיפור הזה. אני אומר לכם: אנחנו לא נשלים עם המצב הזה, ואנחנו כבר חושבים איך לפעול נגד החלטה דרקונית, בלתי סבירה בעליל, בלתי מדתית בעליל, לא מאוזנת, ואנחנו אומרים לכם שתהיינה השלכות. כבר אנחנו חושבים איך להתמודד עם העניין הזה, וכל סיעות האופוזיציה, אנחנו נפעל נגד החלטה כזו. ",נשים,בלי,0.97494864,,,,,,,
"בנוסף, כל הסיפור של להט""ב נמצא תחת הפריזה של שפ""י – שירות פסיכולוגי ייעוצי – ותחת הסעיף של חינוך למיניות. רבותיי, להיות להט""ב הוא לא רק הסעיף של חינוך למיניות, יש פה דבר הרבה יותר עמוק מזה: של חינוך לסובלנות, של זהות, של שוויון. הדברים האלה לא צריכים להיות תחת הפריזה של חינוך מיני בשעת חברה, ככל שבכלל מעלים את זה על סדר-היום. זה צריך להיות משהו הרבה יותר עמוק והרבה יותר רחב. ",נשים,נשים,0.9745379,,,,,,,
"אני אומרת את הדברים האלה, גם כי מי שמכיר אותי, אני הולכת אחורה הרבה מאוד פעמים, גם כחוקרת וגם כפוליטיקאית, לבדוק מה עשו בתקופות קודמות, לא רק בסוגיה שלפנינו עכשיו. המקום הזה של השיקום, וזה, אדוני, עולה בסקר שלכם, סקר עכשווי, שאני מניחה שאתה תדבר עליו, אבל 75% מהנשים שמועסקות ועוסקות ופועלות, וגם על המינוחים האלה אנחנו יכולים להתווכח עד מחר, היו רוצות להשתקם, מבקשות להשתקם, רוצות לצאת ממעגל הזנות. ",נשים,נשים,0.97451085,,,,,,,
"לפני שנתחיל אני מבקש לומר כמה מלים. החלטה בכל העולם, של אנשים להצטרף או להביע את הזהות המינית שלהם, להצטרף לקהילה הלהט""בית, היא החלטה אמיצה. אבל היא כרוכה במחיר אישי, במיוחד לאור דעות קדומות בחברות ובמשפחות. ולכן זה לא צריך להפתיע שהמצוקה הנפשית, שהיא לפעמים מלווה החלטה כזו משמעותית, היא אמיתית. ויש לא מעטים שמתמודדים עם אותה מצוקה, ובדידות, וחרדות, עם התמכרויות שונות, אלכוהול וסמים. ",נשים,נשים,0.97451085,,,,,,,
"מטבע הדברים האולם מלא. בדיון על הלוחמים בצה""ל שאין להם אפשרות להשתלב לעומת אנשי המודיעין היו רק שלושה חברי כנסת. יש רייטינג גבוה לדיון הזה, אבל זה מחייב אותי להיות קפדן ולשמור על הסדר. בדיון הזה יישמעו דעות, אני מקווה לא אמירות פוגעניות ולא לגופו של אדם, אבל דעות חלוקות. גם לי יש מחלוקת וגם אני אגיד בדברים שלי פתיח. הכל ייאמר בצורה מכבדת. חברי כנסת יקבלו שלוש קריאות. משתתפים שהם לא חברי כנסת יוצאו החוצה בהפרעה ראשונה.",נשים,בטחון,0.9742817,,,,,,,
"אני חייב לומר שמבחינתי אני מאוד נרגש וגם שמח. נתחיל בשבחה של אכסניה, שאני בהחלט מודה ליושב ראש הוועדה, חבר הכנסת חיים כץ, על המנדט שהוא נתן לי, מודה לריבונו של עולם שמסייע בידי להיות שליח נאמן למען שליחות כל כך חשובה, שמרגיש שיש לי הזדמנות לקדם ולסייע בה. אני חושב שזו בשורה גדולה לאלפי אנשים, לאלפי לוחמים, שנתנו את מיטב דמם הפיזי והנפשי לטובת מדינת ישראל.",נשים,בטחון,0.9742541,,,,,,,
"יכול להיות שיש לנו מה ללמוד בשלב היישום, בזה אני לא יכול להגיד שאנחנו הכי מתקדמים, אבל בחלק הזה של פיתוח והחדשנות יש לנו מה להגיד ובאמת אנחנו גם שמחים שיש לנו מדינה ידידותית מאוד לשתף פעולה. יש ביטוי יהודי, אני לא יודע בגרמנית, יותר משהעגל רוצה לינוק הפרה רוצה להניק. באופן טבעי זה נראה שהעגל רוצה לינוק, אבל מי שבאמת משקיע, אז כשיש לו למי לתת את זה, למישהו ידידותי שעושה שימושים מיוחדים לטובת האנושות ולטובת שלום, אנחנו שמחים לשתף פעולה.",נשים,טכנולוגיה,0.97384006,,,,,,,
"אין לי ספק שמאז האירוע המסופר, עדות קשה מאוד, קראתי אותה, תחושה של גועל קיבלתי כשקראתי. סליחה, ג'וש. גועל. השאלות, מה זה הדבר הזה? למה לשאול שאלות כאלה בכלל? קראתם, אני מניחה. מי שלא, שיקרא. תחושה של קבס עלתה בי כשקראתי את זה. אני בטוחה שזה כבר לא קורה. אבל אני רוצה לדעת שההתנהלות היא אחרת, שיש הבנה, שהראייה היא שונה, וגם מה אנחנו יכולים לעשות כוועדה כדי לשפר את הסיטואציה שבה נמצאים כיום.",נשים,בלי,0.9738349,,,,,,,
"החוק הזה הוא חוק מאוד חשוב כי אני חושבת שאפשר להתייחס אליו בתור הדייר הסרבן ואיך אנחנו מקטינים את הכוח של הדייר הסרבן, אבל אנחנו צריכים מצד אחד להגן על דייר שבאמת לא יכול לצאת מביתו, ואפילו אם הרבה דיירים אחרים מעוניינים, אנחנו יודעים שזה יפגע בו. מצד שני, לא לגרום לכך שדייר שמעוניין בעוד כסף או שיש לו מניעים אחרים, ימנע את כל העסקה הזו שהיא חשובה גם לשאר המשפחות שנמצאות בבניין.",נשים,דיור,0.9736686,,,,,,,
"אני מתכבדת לפתוח את ישיבת הוועדה. אנו מציינים את יום המאבק הבינלאומי למניעת אלימות נגד נשים. אלימות כלפי נשים היא תופעה מזעזעת הקיימת בכל שכבות האוכלוסייה. אלימות היא מחלה, מחלה קשה ביותר שגובה קורבנות ומפרקת משפחות. מוכרחים להילחם בה ללא פשרות. אלימות בתוך המשפחה ובפרט אלימות כלפי נשים נוטה להחמיר במצבי משבר ולחץ. ",נשים,נשים,0.9728854,,,,,,,
"בשנת 2016 נקלטו במקלט מעגן, שזה מקלט לניצולות סחר בבני אדם, נקלטו 26 נשים, מתוכן 12 נשים שנסחרו לזנות בישראל, 5 נשים אפריקאיות ניצולות מחנות העינויים בסיני ו-4 מהגרות עבודה שהועסקו בתנאי עבדות, ו-5 נשים חירשות-אילמות שהועסקו בקיבוץ נדבות.",נשים,נשים,0.97286844,,,,,,,
"נושא הדיון היום  חשוב מאין כמותו. אני מברך על היוזמה של חברות הכנסת אמילי מואטי, ענבר בזק, מיכל שיר ומיכל וולדיגר לקיים דיון בנושא תופעת הפגיעות המיניות בצה""ל. תנועת Me Too שהתפשטה באופן ויראלי בשנת 2017 העלתה למודעות, אם כי עדיין לא מספקת, את תופעת ההטרדות המיניות, הניצול המיני והיחס המשפיל לנשים באשר הן. ",נשים,נשים,0.972856,,,,,,,
"אני חייבת לציין שנופר, בתה, שנמצאת כאן, באמת לקחה על עצמה מהרגע הראשון להנציח את אמה ז""ל בדרך של ""שזה יהיה הרצח האחרון"". אנחנו לא יודעים אם זה יהיה הרצח האחרון, אבל אין ספק שהפעילות סביב מניעת האלימות והקמת ועדת מור-יוסף והמסקנות, שאני מקווה שיוגשו במהרה, ובכלל כל הנושא הזה שנמצא היום בראש סדר העדיפות, אין ספק שימנע פעולות אלימות הבאות, וזה נושא הדיון.",נשים,נשים,0.9723396,,,,,,,
"גם היום הזה נערך בצל קרב מאסף של חלק מהרבנים והפוליטיקאים של פעם, שרואים לנגד עיניהם המשתאות את העולם החופשי המתהווה לנגד עיניהם ובו להט""בים יכולים להקים משפחות, יכולים להיות הורים נפלאים לילדים מאושרים ובו נשים יכולות להיות טייסות מצטיינות ולפעול לשמירה על בטחון ישראל. הסטייה היחידה היא המחשבה המעוותת שניתן יהיה לעצור זאת. ",נשים,נשים,0.9723202,,,,,,,
"אני רוצה קודם כל לברך את הנשים. אנחנו מקיימות את הדיון הזה לכבוד יום האישה הבינלאומי ה-8 במארס ונהוג לברך ונהוג גם להתווכח האם אנחנו מברכות את עצמנו או האם זה יום מאבק. ואני תמיד אומרת, זה שניהם ביחד, זה גם יום מאבק למען המשך הדרך של השגת עוד ועוד קידום של מעמדה של האישה וזכויותיהן של הנשים אבל הוא גם יום שאנחנו מברכות את עצמנו על העמידה האיתנה שלנו על זכויותינו, על המאבק שאנחנו מנהלות ביום יום. ",נשים,נשים,0.9721178,,,,,,,
"מאז הדיון הקודם עלו כאן כל מיני שאלות, גם מצד חברי הכנסת, בעיקר לנושא המועדים, בחלק האחרון של הצעת החוק. בעקבות השאלות שעלו כאן והדברים שדוברו עליהם בוועדה, בתיאום עם הממשלה עשינו כמה שינויים בנוסח ההצעה. זה מופיע לחברי הכנסת בטבלטים. זה עלה גם באתר הוועדה. אני אקרא כמה שינויים בסעיפים. שוב, זה בתיאום עם הממשלה ובעקבות הדברים שעלו בוועדה בישיבה הקודמת.",נשים,בלי,0.97198,,,,,,,
"שלום לכולם, אני פותחת את הישיבה של הוועדה לקידום מעמד האישה ולשוויון מגדרי. היום ה-5 ביוני 2018 ואנחנו בייצוג נשים באקדמיה במסגרת או לציון יום הסטודנט שהוא יום מיוחד ביוזמתה של חברות הכנסת מרב בן ארי ועליזה לביא ואני שמחה לראות שאחת היוזמות, חברת הכנסת עליזה לביא נמצאת איתנו וכהרגלנו אני נותנת לך לפתוח. יש לי המון מה להגיד בנושא אבל זה היום שלכן, אתן יזמתן, בבקשה גברתי. ",נשים,נשים,0.97067225,,,,,,,
"כשאני מסתכל על הכסף שמגיע עבור כל חייל בודד אני לא רואה שום סיבה – אלא אם כן תשכנעו אותי אחרת – למה כל חייל לא יכול להיות זכאי לחדר פרטי משלו במהלך שירותו הצבאי. זה לא שאני ממציא משהו מהחלל. יש גופים שהם לא אל""ח והם לא התנועה הקיבוצית שמסוגלים לעשות את זה. אני רוצה לשאול גם את אל""ח וגם את התנועה הקיבוצית ובעיקר את משרד הביטחון, למה הדבר הזה לא קורה. ",נשים,בטחון,0.97066796,,,,,,,
"בוקר טוב. אני מתכבד לפתוח את ישיבת ועדת הכספים. אנחנו מתחילים בסאגה הבלתי נגמרת הזאת של שכר וגמלאות לנושאי משרה שיפוטית, שיעור ההפרשות לפנסיה. אני חושב שאנחנו מנהלים על זה גם ישיבות פורמליות אבל גם ישיבות לא פורמליות כדי לנסות להגיע לפתרון בעניין הזה. ביקשתי לפני שבועיים לשים את זה על סדר היום ואולי נגיע לפתרון. תכף נשמע, קודם את האוצר ואחר כך את השופטים, הדיינים והקאדים. ",נשים,כלכלי,0.9704272,,,,,,,
"אני מהבוקר בראיונות עם התקשורת והם שואלים אותי על האם יש סיבה לברך בשנה הזו. ואני אומרת שקודם כל, כל עוד אנחנו מצליחות להשאיר את הנושאים שלנו, כמובן אנחנו לא נסתפק בזה, אבל כל עוד אנחנו הנשים מצליחות עדיין לשים את הזכויות שלנו, את הדרישות שלנו, את השאיפה שלנו להיות שוות ומשפיעות בדיוק כמו שמגיע לנו על השולחן, משאירות את זה על השולחן, נאבקות על זה ויכולות לארגן את המאבקים שלנו, יש על מה לברך. ",נשים,נשים,0.96947044,,,,,,,
"יחד עם זאת, בתקופה האחרונה צצו הרבה מאוד בקשות לשינויים במודל הזה, להשגות על דברים שקורים באירופה שלא יכולים להתקיים פה; רק בשבוע האחרון קיבלנו פנייה גם מהאמריקאים וגם מהאירופאים לפתוח אתם בדיונים על המודל הזה. קיבלנו פניות ממשרדי ממשלה נוספים, שרוצים לברר אתנו כל מיני סוגיות. קיבלנו מהתעשיינים.",נשים,בלי,0.9694635,,,,,,,
"תראו, אין מה להוסיף יותר מידי במילים כשאנחנו שומעים שיש מי שבישראל של 2016, אוטוטו 17', לא מייחסים חשיבות כלל וכלל לסמלים שלנוף לזהות שלנו, למורשת, להיסטוריה, התרגלנו כבר שהיום, במציאות של היום, מי שמבזה את הסמלים הוא גיבור תרבות בעוד שמי שמשבח, מהלל אותם ועוטף אותם באהבה הוא פנאט קיצוני. ",נשים,בלי,0.969442,,,,,,,
"בוקר טוב לכולם, מתחילים דיון שלישי בנושא פרק י""ח (תכנון ובנייה), סימן ב' - שימוש במגרשים המיועדים לתעסוקה ושימושים ממשלתיים, מתוך הצעת חוק התוכנית הכלכלית (תיקוני חקיקה ליישום המדיניות הכלכלית לשנות התקציב 2021 ו-2022), התשפ""א-2021 (מ/1443), הכנה לקריאה שנייה ושלישית - הסתייגויות והצבעות. תומר, אתה רוצה להתחיל?",נשים,בלי,0.9690164,,,,,,,
"בוקר טוב לכולם. אנחנו ניסחנו את כל ההסכמות שהוצגו באופן עקרוני בוועדה בישיבות הקודמות וטרם הוקראו, לכן אנחנו מבקשים להקריא בפני הוועדה ולקבל את אישורה לניסוחים שאנחנו ניסחנו לגבי אותן הסכמות. בנוסח שנשלח לקראת הדיון הזה הניסוחים שאנחנו עומדים להקריא מסומנים בצהוב ורעות תקריא אותם לפי סדרם. אם יהיה צורך אנחנו גם נסביר.",נשים,בלי,0.9686162,,,,,,,
