QuoteText,OriginalTopic,Topic,Topic_Prob,,,,,,,
"בביטחון אנושי אנחנו מתמקדים בבני אדם. אנחנו מתמקדים באינדיבידואלים, כאשר בביטחון הלאומי מתמקדים בביטחון המדינה, מה שנקרא ביטחון לאומי כללי. הרצון לחקור ולבדוק עד כמה אזרחי ואזרחיות המדינה מרגישים בטוחים, עד כמה מרגישים שהם מסופקים ולא חוששים בתחומי החיים השונים, גרמו לנו לנסות לבדוק באיזה תחומים אנחנו מדברים. ",קורונה,בטחון,0.8619898,,,,,,,
"אנחנו היום נדבר על תיקון נוסף שהוצע על ידי משרד הבריאות, תיקון לגבי צו בידוד והארכה שלו. אני מבקשת מנציגי משרד הבריאות להציג את מהות התיקון, על מה אנחנו דנים היום ומה אנחנו הולכים לאשר או לא לאשר. בבקשה. ",קורונה,קורונה,0.8618749,,,,,,,
"התשפ""א היום, ה-28 בינואר 2021. אנחנו דנים בשני סעיפים. ראשית, בקשת הממשלה להקדמת הדיון בהצעת חוק סמכויות מיוחדות להתמודדות עם נגיף הקורונה החדש (הוראת שעה)(תיקון מס' 4), התשפ""א-2020 (מ/1371), לפני הקריאה השנייה והשלישית. וסעיף נוסף של פניית יושב-ראש ועדת חוקה חוק ומשפט בדבר טענות נושא חדש שעלו בעת הדיון בהצעת חוק זו. ",קורונה,קורונה,0.86162055,,,,,,,
"בוקר טוב לכולם, אני פותח את הישיבה. אנחנו מדברים על הצעת חוק סמכויות מיוחדות להתמודדות עם נגיף הקורונה החדש (מיקום במקום לבידוד מטעם המדינה וצווי סגירה מנהליים) (הוראת שעה), התש""ף.  ",קורונה,קורונה,0.8614717,,,,,,,
"כשצללנו לתוך הנושא הזה בהכנה לדיון הזה למדתי שהבעיות בנושא הזה בזמן הקורונה זה רק קצה קרחון של תופעה הרבה יותר גדולה של כל מה שקשור בתחום המקוואות בישראל זה שנים רבות. הנתונים שהוצגו בפני הוועדה, למשל, מלמדים ששני שלישים, 67% מהמקוואות בישראל פועלים ללא רישיון עסק בתוקף. אז כשיש היעדר אסדרה של רישיונות זה מוביל לשרשרת כשלים בהיבט של פיקוח תברואתי, תכנוני, בריאותי בלי שום קשר לתו הסגול, אז בוודאי גם בעת בעייתית כל-כך כמו שאנחנו נמצאים בה היום שנושא של חיטוי וסטריליות הוא דבר מאוד חשוב. ואם אין רישיון, אין אכיפה ואין בדיקה – זה בריאות של אנשים. ",קורונה,קורונה,0.86143684,,,,,,,
"מכובדיי, צוהריים טובים לכולם. אני מתנצל על האיחור. אני מתכבד לפתוח את ישיבת ועדת החוקה, חוק ומשפט. על סדר-היום: הצעת צו חדלות פירעון ושיקום כלכלי (הארכת התקופה הקובעת לעניין הגשת בקשה לעיכוב הליכים לשם גיבוש הסדר חוב - נגיף הקורונה החדש), התשפ""ב-2022. ",קורונה,כלכלי,0.8600014,,,,,,,
"השלב הבא היה ההבטחה שלנו אלייך, שנפרסם דיווח על המדדים ושנעשה את זה בשני חלקים. נדווח ב-2017 על 2016, על המדדים המרכזיים, ונדווח ב-2018 על 2017, על כלל המערכת. צריך להגיד, אנחנו מדברים על 2,000 ומשהו מדדים. אם מישהו היה אומר לי: תעשה פיילוט קודם, אז הנה הפיילוט. הממדים המרכזיים הם קודם כול מעבר לכל דבר אחר, מעבר לחשיבות שלהם כשלעצמם, זה ניסוי כלי. לא ידענו איך עושים את זה, ולא הרבה ממשלות עושות את זה. ולכן יש אבל לא הרבה. ומה שיהיה ב-2018 על 2017 לא קיים כמעט באף מדינה. ולכן מדובר במהלך מאוד רחב.",קורונה,בלי,0.8598037,,,,,,,
" אני פותח את ישיבת ועדת החוקה חוק ומשפט. על סדר היום הצעת תקנות סמכויות מיוחדות להתמודדות עם נגיף הקורונה החדש (הוראת שעה) (הגבלת היציאה מישראל) (תיקון), התשפ""ב -2021.",קורונה,קורונה,0.85902935,,,,,,,
"שלום לכולם, אני מתכבד לפתוח את הדיון על הבטחת מלאי מזון לשעת חירום, הדיון פתוח לפי סעיף 120 ב(2). אני מניח שרוב האנשים מבינים למה אני מקיים דיון על מלאי מזון של מדינת ישראל. כדאי שנתחיל מהסוף, מזון בכלל ולשעת חירום בפרט, בטח ובטח במדינת ישראל שמוקפת אויבים, יש לה חשיבות לאומית ביטחונית מהמעלה הראשונה והיא סוגיה מרכזית בביטחון הלאומי של מדינת ישראל. יש לה השלכה ישירה על היכולת של מדינת ישראל לנהל מערכת צבאית בתנאים של מצור ימי ואווירי בהתאם למלאי המזון.   ",קורונה,בטחון,0.8585389,,,,,,,
"שלום, אני מתכבד לפתוח את ישיבת ועדת הכנסת. הנושא שלפנינו:  בקשת יו""ר ועדת העבודה הרווחה והבריאות להקדמת הדיון בהצעת חוק ביטוח בריאות ממלכתי (תיקון מס' 63), התשע""ט-2018 (כ/808), לפני הקריאה השניה והשלישית. מי מנמק?",קורונה,בלי,0.858324,,,,,,,
"אני מתכבד לפתוח את ישיבת ועדת החוץ והביטחון, ישיבה פתוחה לרגל הגשת דוח נציב קבילות חיילים השנתי, דוח מס' 49. כמו שציינתי, הדוח של הנציב איתן דהן, שהוא הדוח השלישי בכהונה שלו. לא קל להיות נציב קבילות חיילים, לא קל להיות סוג של השומר של המערכת של השומרים. לעיתים יש חיכוך מול קולגות שאתה מכיר, לעיתים יש התלבטות אמיתית אל מול מערכת שאתה מוקיר ומכבד, אתה מבין את החיוניות שלה, אתה מבין את דפוס הפעולה הייחודי של צבא ההגנה לישראל כארגון שאמור, בראש ובראשונה, לעמוד במשימתו להגן על ישראל ולנצח במלחמה, אבל גם את אותה משימה צריך לעשות בהתנהלות נאותה, התנהלות נכונה. נציב קבילות חיילים הוא זה שנמצא בליבת צומת הבעייתיות בהפעלת מערכת כה גדולה.  ",קורונה,בטחון,0.8582086,,,,,,,
"שלום רב, אני מתכבדת לפתוח את ישיבת ועדת הבריאות. היום יום שלישי, כ""ו בכסלו התשפ""ב, נר שני של חנוכה, 30 בנובמבר 2021 למניינם, על סדר-היום:הפחתת מינון התרופות האונקולוגיות לחולי סרטן, גם בהתאמה להרבה בקשות שקיבלנו, גם בבקשה לדיון מהיר של חברת הכנסת אתי עטייה – בוקר טוב. טוב לראות אותך כאן, אני שמחה – תבואי יותר. יש לך הרבה נושאים שקשורים לבריאות ואנו שמחים על זה.",קורונה,בריאות,0.8581767,,,,,,,
"בוקר טוב, ועדת כלכלה מתכנסת בפגרה כדי לטפל בסוגיות דחופות שעומדות על סדר היום הציבורי. אנחנו מתחילים עכשיו בסדרת דיונים, הראשון ביניהם: הצעת תקנות סמכויות מיוחדות להתמודדות עם נגיף הקורונה החדש (הוראת שעה) (הגבלות על הפעלת שדות תעופה וטיסות) (תיקון מס' 9), התשפ""ב-2022, שחלק ממנו זה גם פתיחת התיירות הימית וההפלגות. תציגו את הרציונל הכללי, אחרי זה את השינויים. ",קורונה,קורונה,0.8574945,,,,,,,
"ביטוח תאונות אישיות של בתי הספר, שזה גם כן בתשלומי ההורים, ההורים משלמים על זה וזה כשהם לפני כן היו צריכים לשלם עבור ביטוחים, ביטוח תאונות אישיות, בדיוק אותו ביטוח עבור חוג אחד ועל החוג השני ואם הילד באמצע השנה עזב את החוג השני ועבר לשלישי עוד פעם, שלוש פעמים, היה פה כפל ביטוחים ברור, עשינו בערך ממוצע למשפחה בין 500 ל-1,000 ש""ח בחודש ספטמבר שההורים נאלצו לשלם ועד עכשיו מפחידים אותם. ",קורונה,חינוך,0.85747015,,,,,,,
"ישראל הצטרפה רשמית ליוזמה הזאת כבר ב-2011 בהכרזת ראש הממשלה. החלטת הממשלה בעניין 4515 התקבלה ב-2012 והיא חייבה אותנו במספר תכניות פעולה, יש לומר כבר בפתיחה, ועוד רגע רועי פלד יסביר לנו לעומק על היוזמה ומה היא אומרת מבחינת ההחלטות, אבל יש לומר שחלק מהדברים שעליהם חתומה ישראל במסגרת היוזמה הזאת הם דברים שכבר התבצעו לפני כן, ולמעשה רק אושררו מחדש במסגרת היוזמה, ושנית, גם אפשר להגיד שהיה אפשר ללכת הרבה יותר רחוק עם הדרישות בתוך היוזמה הזאת. התכנית היא לא מספיק שאפתנית ולא תואמת את הציפיות ואת הפוטנציאל של ישראל להתקדמות בתחום, כאן גם יש פער בין איך שמתנהלת הממשלה בישראל לבין איך שמתנהלת הכנסת. הכנסת היא הרבה יותר שקופה, גם כאן כמובן יש עדיין מה לשפר, אבל הכנסת כבר מתקדמת במבנים הרבה יותר שקופים ופתוחים לציבור בהרבה. על הממשלה אי אפשר להגיד את הדבר הזה.",קורונה,בלי,0.8562687,,,,,,,
"אנחנו נמצאים בדיון על החלת דין הרציפות, הצעת חוק העונשין (תיקון 140) (עונש מזערי בעבירה של תקיפה או התעללות בקטין או בחסר ישע על ידי האחראי עליו במסגרת חינוכית או טיפולית), התשפ""א – 2020. הצעת החוק הזאת היא הצעת חוק פרטית שהוגשה על ידי חבר הכנסת אופיר כץ. ההצעה הזאת אושרה בקריאה טרומית, נידונה בוועדה, אושרה בקריאה ראשונה ומכאן כשירותה לדיון הזה וסמכותנו להמליץ למליאת הכנסת להחיל עליה דין רציפות. ",קורונה,רווחה,0.8561202,,,,,,,
"הצעת החוקה עוסקת בשטח המחיה לעצורים במתקני שב""כ. ועדת הפנים עוסקת שנים רבות בכל סוגיית מרחב המחיה במתקני הכליאה והמעצר, אנחנו חושבים שזו הוועדה המתאימה לעריכת הדיון המדובר. ",קורונה,בטחון פנים,0.8555139,,,,,,,
"שלום לכולם, אני מתכבד לפתוח את ישיבת ועדת הכלכלה של הכנסת – 13 בדצמבר 2020, כ""ז בכסלו התשפ""א, הנושא: הצעת תקנות סמכויות מיוחדות להתמודדות עם נגיף הקורונה החדש (הוראת שעה) (הגבלות על הפעלת שדות תעופה וטיסות) (תיקון מס' 4), התשפ""א-2020. עורכת דין רננה, בבקשה.",קורונה,קורונה,0.8550168,,,,,,,
"אני פותח את ישיבת ועדת הכנסת, אמנם ישיבה חריגה, היום יום ראשון, י""ז באלול התש""ף, 6 בספטמבר 2020. אנחנו מתכנסים בצורה לא מתוכננת לאור העובדה שוועדת החוקה חוק ומשפט נמצאת בדיונים קדחתניים בהצעת תקנות סמכויות מיוחדות להתמודדות עם נגיף הקורונה החדש (הגבלת פעילות) (תיקון מס' 4) והיא צריכה לאשר את התקנות שאושרו כבר בשבוע שעבר על ידי הממשלה. למעשה יש להם זמן עד היום בלילה לאשר את התקנות כי אחרת הנושא הזה יצטרך לעלות לדיון במליאה. ",קורונה,קורונה,0.85496,,,,,,,
"אנחנו עוסקים בתיקון מס' 6 ותיקון מס' 7 לתקנות הגבלת יציאה מישראל שבעצם מאריכים – ה-6 האריך עד ה-5 באוגוסט וה-7 עד ה-12 באוגוסט – את ההגבלה הכללית על כל המדינות שמופיעות כבר בתקנות. תיקון מס' 6 מוסיף שתי מדינות: קירגיסטן וספרד, ותיקון מס' 7 את: בריטניה, גיאורגיה, קפריסין וטורקיה. ",קורונה,בלי,0.8547763,,,,,,,
"אני רוצה לשאול ראשית בעניין צו המנכ""ל שכולל התייחסות לבדיקות הביתיות למחוסנים - הייתה דרישה ממשרד הבריאות להציג את הנחיית המנהל בנושא הזה שלא הוצגה לציבור. ",קורונה,קורונה,0.8545894,,,,,,,
"בתוקף סמכותה, לפי סעיפים 4, 8, 12, 23, 24, 25 ו-27 לחוק סמכויות מיוחדות להתמודדות עם נגיף הקורונה החדש (הוראת שעה) (להלן – החוק) ובאישור ועדת החוקה חוק ומשפט של הכנסת, מתקינה הממשלה תקנות אלה.",קורונה,קורונה,0.8544765,,,,,,,
"חברי הכנסת, אני מתכבד לפתוח את ישיבת ועדת הכנסת. היום יום רביעי כ""ו תשרי התשפ""א, 14 באוקטובר 2020. על סדר היום בקשת הממשלה להקדמת הדיון בהצעת חוק הביטוח הלאומי (הוראת שעה) (מענק חד-פעמי חלף הגדלת קצבאות הנכות לשנת 2020), התשפ""א-2020, לפני הקריאה הראשונה. ינמק ויציג את הבקשה נציג משרד האוצר מר נתנאל אשרי, רפרנט ביטוח לאומי באגף התקציבים. שלום, אדוני.",קורונה,רווחה,0.85319996,,,,,,,
"בוקר טוב, אני פותח את ישיבת ועדת הכנסת, יום רביעי, ה' באב תשפ""א, 14 ביולי 2021. הנושא הראשון על סדר-היום: קביעת ועדה לדיון בהצעת חוק לסיוע כלכלי (נגיף הקורונה החדש) (הוראת שעה) (תיקון מס' 6), התשפ""א–2021 (מ/1429), לשם הכנתה לקריאה השנייה והשלישית. יש לנו כאן את המלצת הלשכה המשפטית, שההצעה תידון בוועדת העבודה, הרווחה והבריאות. כמו כן, ניתנו הצעות במליאה להעביר את ההצעה לוועדת העבודה, הרווחה והבריאות ולוועדת הכספים.",קורונה,בלי,0.8523592,,,,,,,
"  בוקר טוב ושבוע טוב. היום יום שני בשבוע, ה-29 ביוני 2020, ז' בתמוז התש""ף, אני מתכבד לפתוח את ישיבת ועדת העבודה, הרווחה והבריאות. על סדר-היום: הצעת חוק מענק הסתגלות מיוחד לבני 67 ומעלה (הוראת שעה – נגיף הקורונה החדש), התש""ף-2020.",קורונה,קורונה,0.85125583,,,,,,,
"מובאת פה הצעה להעביר את הסמכות לקבוע את משך הפסקת מסחר קצובה – ואם יהיה צורך, אני גם אסביר אחרי זה מה זה ""הפסקת מסחר קצובה"" – ולהעביר אותה מתקנון הבורסה להנחיות. אגב כך, מה שכבר אושר גם על-ידי דירקטוריון הבורסה ורשות ניירות ערך זה קיצור ההפסקה מ-45 דקות ל-30 דקות.",קורונה,כלכלי,0.8491568,,,,,,,
"כשאני אסיים את תפקידי בכנסת אני אלך לחפש כמה דברים שלא טופלו לפניי ופתאום רק אצלי מטופלים. תירגעו, תנו לנו לעשות גם את השוטף. ",קורונה,בלי,0.84867674,,,,,,,
"לעומת זאת, אוכלוסיית המוגבלים הזאת אינה מיוחדת בנושא זכאות לטיפולים פארא-רפואיים. מבוגרים מוגבלים מעל גיל 21, אין להם כבר חוק חינוך מיוחד, זכאים לטיפולים של מקצועות הבריאות בהתאם למפורט בסל השירותים מתוקף חוק ביטוח בריאות ממלכתי. בקופת חולים מסוימת מבוטחים כרוניים שזוכים ל-12 טיפולים פארא-רפואיים בשנה שמגיעים להם במסגרת הסל, יכולים להיות זכאים לעוד אותה כמות טיפולים במסגרת השב""ן. בסך הכול 24 טיפולים פארא-רפואיים.",קורונה,בריאות,0.8484542,,,,,,,
"צהריים טובים, אנחנו פותחים את הישיבה. אני מקווה שכולם סעדו את לבם ואת רוחם, ובינתיים הספיקו גם להחליף דעות ולתאם דברים. אני מקווה שזה יחסוך לנו הרבה זמן כי חלק ממה שהיה צריך לדבר פה, בטח דיברתם בהפסקה, שלכך היא נועדה כדי לחסוך ולבוא לדברים המסוכמים. אז איפה אנחנו?",קורונה,בלי,0.8481568,,,,,,,
"כמובן שאני לא חושבת שנוכל לכסות הכול, אבל בהחלט נוכל למנוע את האירועים שהיו כאן בתוך הערים אבל לא רק. גם מחוץ לערים. גם אזרחים יהודים שנסעו לאילת, שרפו להם את האוטו, תקפו אותם באבנים ואם לא קיבלו סיוע, כנראה גם הם לא היו כאן איתנו, ולכן האירוע הוא הרבה מעבר. הוא גם ערים מעורבות ברובו, אבל הוא גם מעבר לזה ולכן חשוב לי לדייק את זה, אז זה ממש בשתי דקות הדברים שלי. אני לא רוצה להכביר במילים. אני רוצה להתחיל קודם כל עם המשטרה ולאחר מכן חברי הכנסת. ",קורונה,בטחון,0.84789455,,,,,,,
"בוקר טוב, אנחנו בדיון שגם הוא נוגע לענייני הקורונה, ומכאן קביעתו מחוץ לשגרת הדיונים הרגילה שלנו בפגרה: הצעת הכרזת סמכויות מיוחדות להתמודדות עם נגיף הקורונה החדש (הוראת שעה) (בידוד בפיקוח טכנולוגי) (תיקון מס' 11), התשפ""ב-2022.",קורונה,קורונה,0.8476543,,,,,,,
"אני פותחת מחדש את הדיון בנושא: צו לתיקון ולקיום תוקפן של תקנות שעת חירום (נגיף הקורונה החדש – הגבלת פעילות) (שינוי התוספת לחוק) (מס' 3), התש""ף–2020. אנחנו מקיימם שיח למעשה כבר מסוף הדיון הקודם עם משרד הבריאות, כי בסופו של דבר אנחנו רוצים להגיע לאיזה מתווה שהוא מוסכם, לפחות בחלקים שבהם דנו כאן בדיון.",קורונה,קורונה,0.847623,,,,,,,
"עוד הערה מקדימה. כשמנסים בכנות לסגור פערים שנותרו לא מהיום, ולא מאתמול, יש תמיד סכנה של הסללה, התבדלות, טיפול נקודתי מחוץ למסגרת וכדומה. צריך להישמר מכל משמר מכך. ההתבדלות זו לא הדרך, אנו צריכים למצוא כלים כדי לעשות את המעשה הנכון בתוך המסגרות הקיימות, בתוך כלל החברה הישראלית ולא בנפרד. ההפרדות הן לא בריאות, גם אם הן שיקפו בזמנו כוונות טובות. לא כך עושים כיוון שיש סכנה של הסללה וכדומה.",קורונה,חינוך,0.8470056,,,,,,,
"אנחנו נפתח את הישיבה על אף שאנחנו מחכים לנציגי משרד האוצר. בהמשך לדיון הקודם שעסק בשקיפות בהטרדות מיניות באקדמיה, עכשיו אנחנו נעסוק בשקיפות במל""ג ובמוסדות האקדמיה באופן כללי. המל""ג, הגוף המשפיע ביותר על ההשכלה הגבוהה בישראל, הגוף שאחראי הן על התקצוב של מוסדות ההשכלה הגבוהה, של המחקר, על הכשרת כוח האדם של העתיד, הכוח האקדמי של העתיד, על פיתוח של מחקר ישראלי עצמאי, איכותי, פורץ דרך, על הנגשת האקדמיה לפריפריה ולאוכלוסיות המוחלשות. כלי חשוב ביותר לניידות חברתית בישראל ומשום מה, המל""ג לא פועל בשקיפות שהיינו מצפים ממנו לפעול על פיה. ",קורונה,חינוך,0.8465924,,,,,,,
"בוקר טוב, אני מתכבד לפתוח את ישיבת ועדת הכנסת. היום יום רביעי, י""ח בטבת תשפ""ב, 22 בדצמבר 2021. על סדר-היום: בקשת יושב-ראש ועדת החוץ והביטחון למיזוג הצעות החוק הבאות: ",קורונה,בלי,0.846588,,,,,,,
"שלום לכולם. אני פותחת את ישיבת הוועדה בנושא צו לתיקון ולקיום תוקפן של תקנות שעת חירום (נגיף הקורונה החדש - הגבלת פעילות) (שינוי התוספת לחוק) (מס' 4), התש""ף-2020. אנחנו מקווים שתגיע אלינו גם תוספת לחוק מספר 5 בשבוע הבא, בנושא התרבות. כרגע זו רק משאלת לב. ",קורונה,בלי,0.84597,,,,,,,
"שלום לכולם. אני מתכבד לפתוח את ישיבת ועדת הכלכלה של הכנסת, 30 בדצמבר 2020, ט""ו בטבת תשפ""א. על סדר היום: הצעת תקנות סמכויות מיוחדות להתמודדות עם נגיף הקורונה החדש (הוראת שעה) הגבלת פעילות בתחום התחבורה) (תיקון מס' 6), התשפ""א-2020. משרד התחבורה איתנו? ",קורונה,בלי,0.8459138,,,,,,,
"בוקר טוב, אני מתכבד לפתוח את הישיבה. על סדר-היום: בקשת הממשלה להקדמת הדיון בהצעת חוק התכנון והבנייה, התשע""ז-2017, לפני הקריאה השנייה והשלישית. בבקשה, שתי דקות. יו""ר הוועדה, תציג את הבעיה.",קורונה,בלי,0.8456559,,,,,,,
"הדיון שאני ביקשתי לקיים הוא דיון שבעיניי הוא חשוב מאוד והוא חלק מהמכלול של היום הזה. היום הזה עוסק בנושא של הנגשת אוכלוסיות מכל החברה הישראלית אל המכינות ושנת השירות. אחד הנושאים החשובים בעיניי הוא באמת לקחת את אותם חניכים, בוגרי הפנימיות, פנימיות חינוך ופנימיות רווחה, ולחבר אותם אל העולם הזה של שנת השירות והמכינות. אני לא הגעתי לפה עם דעה מגובשת, אני כבר אומרת, אני אשמח לשמוע את המצב כיום, אני אשמח לשמוע את השיתוף או אם אין שיתוף, אני אשמח לשמוע אפילו ממנהלים לצד חניכים ולהבין את החיבור. אם אנחנו עוסקים באוכלוסיות מפריפריה חברתית וגיאוגרפית, אנחנו חייבים חייבים להתעסק בבוגרי הפנימיות והחיבור שלהם אל העולם. ",קורונה,חינוך,0.8454888,,,,,,,
"בשבועיים נוספים, 14 יום נוספים, כך שהחוקים וההוראות שחלים ושהמדינה התחייבה להם, שזה אומר ארבעה ימי תשלום עבור ארבעה ימי בידוד לחודש ינואר, קצת התחיל בדצמבר אחרי משא ומתן קשה. אז מה-21 בדצמבר, יימשך וימשיך גם במהלך חודש פברואר על השבועיים הראשונים. זוהי מהות הצו, הארכת תקופת הוראת השעה. התייחסות של משרד האוצר? טובה?",קורונה,בלי,0.8448942,,,,,,,
